Specialista pro vývoj interních AI modelů,Středočeský kraj,https://www.jobs.cz/rpd/2001005205/?utm_source=juniorguru,False,2026-03-20 00:00:00,,cs,,,jobscz#2001005205,,,,,,,,,,Praha,Praha,,,,,,,,,,,,,,,,,,,Praha,Praha,,,,,,,,,,,,,,,,,,,fulltime,,,,,,,,,,"<div data-jobad=""body"" data-test=""jd-body-richtext"" class=""RichContent mb-1400""><p class=""typography-body-medium-text-regular text-secondary mb-600"">Pracovní nabídka</p><p class=""typography-body-large-text-regular mb-800""><strong>Specialista / Specialista junior na interní AI řešení</strong></p><p class=""typography-body-large-text-regular mb-800"">(vhodné i pro šikovné juniory, absolventy nebo samouky)</p><p class=""typography-body-large-text-regular mb-800""><strong>O čem je tahle role?</strong></p><p class=""typography-body-large-text-regular mb-800"">Hledáme kolegu nebo kolegyni, který/á nám pomůže postupně budovat a nasazovat interní AI nástroje – takové, které šetří čas, automatizují rutinu a zlepšují práci uživatelům napříč organizací.</p><p class=""typography-body-large-text-regular mb-800"">Nečekáme hotového „<strong>AI guru</strong>“. Důležitější je zájem o AI, chuť zkoušet věci v praxi a učit se. Senioritu si u nás můžeš vybudovat.</p><p class=""typography-body-large-text-regular mb-800""><strong>Co budeš dělat?</strong></p><ul class=""typography-body-large-text-regular""><li>podílet se na návrhu a zavádění interních AI řešení (např. chatboti, práce s dokumenty, automatizace),</li><li>pracovat s jazykovými modely (LLM) a interními daty,</li><li>pomáhat s automatizací procesů a digitalizací (AI + nástroje typu SharePoint, PowerApps, RPA apod.),</li><li>spolupracovat s kolegy z různých týmů a převádět jejich potřeby do praktických řešení,</li><li>postupně se učit, testovat, zlepšovat a ladit existující řešení.</li></ul><p class=""typography-body-large-text-regular mb-800""><strong>Co od tebe opravdu potřebujeme?</strong></p><p class=""typography-body-large-text-regular mb-800"">(minimum, bez kterého se neobejdeme)</p><ul class=""typography-body-large-text-regular""><li>zájem o AI a moderní technologie (nemusíš mít roky praxe),</li><li>základní orientaci v programování (např. Python nebo podobný jazyk),</li><li>chuť učit se nové věci a zkoušet je v praxi,</li><li>schopnost přemýšlet nad tím, jak AI pomůže reálným uživatelům,</li><li>samostatnost a ochotu hledat řešení.</li></ul><p class=""typography-body-large-text-regular mb-800""><strong>Co je výhodou (ale ne podmínkou)?</strong></p><ul class=""typography-body-large-text-regular""><li>zkušenost s AI nástroji, LLM, chatboty nebo NLP,</li><li>povědomí o knihovnách / nástrojích typu Hugging Face, LangChain, RAG apod.</li><li>práce s daty, API nebo automatizací procesů,</li><li>zkušenost z vlastních projektů, studia, hackathonů nebo hobby aktivit,</li><li>základní znalost cloudu (Azure / AWS / GCP).</li></ul><p class=""typography-body-large-text-regular mb-800"">Nemáš všechno? Nevadí. Přihlas se i tak.</p><p class=""typography-body-large-text-regular mb-800""><strong>Koho hledáme ideálně?</strong></p><ul class=""typography-body-large-text-regular""><li>absolventa / juniora se zájmem o AI,</li><li>samouka, který si zkouší AI projekty po večerech,</li><li>IT specialistu, který se chce posunout směrem k AI,</li><li>analyticky smýšlejícího člověka, kterého baví automatizace.</li></ul><p class=""typography-body-large-text-regular mb-800""><strong>Co nabízíme?</strong></p><ul class=""typography-body-large-text-regular""><li>smysluplnou práci na reálných AI projektech, které se skutečně používají</li><li>prostor pro odborný růst</li><li>podporu při učení (čas na studium, testování, experimentování)</li><li>možnost ovlivnit, jak bude AI v organizaci vypadat</li><li>flexibilitu (home office / hybrid dle dohody)</li><li>přátelský tým, kde se AI nehraje, ale používá</li><li>stabilitu zaměstnání,</li><li>příjemné pracovní prostředí v centru Prahy,</li><li>jistotu platu a možnost pravidelného odměňování,</li><li><strong>zaměstnanecké benefity KÚSK:</strong> 25 dnů dovolené, 7 dnů rekondičního volna, možnost dalšího volna pro rodiče dětí do 18 let, stravenky, systém cafeterie, příspěvek na penzijní připojištění</li><li>životní pojištění, příspěvek při narození dítěte, možnost firemní školky, dary při životních výročí, možnost stravování v budově úřadu, posilovna v budově úřadu,</li><li>pružnou pracovní dobu,</li><li>osobní rozvoj a zvyšování kvalifikace,</li><li>mentoring a adaptační plán na pozici.</li></ul><p class=""typography-body-large-text-regular mb-800""><strong>Plat je tvořený několika složkami – jak bude vypadat?</strong></p><p class=""typography-body-large-text-regular mb-800"">1. Základní tarif může být v rozpětí <strong>31 230 Kč – 45 260 Kč</strong>, záleží na Vaší praxi.</p><p class=""typography-body-large-text-regular mb-800"">2. Osobní ohodnocení může být rozpětí <strong>0 – 45 260 Kč</strong> dle Vaší praxe a dosažených výsledků a specializace.</p><p class=""typography-body-large-text-regular mb-800"">3. Kvartální mimořádné odměny<strong> 0–45 %</strong> z Vašeho výdělku.</p><p class=""typography-body-large-text-regular mb-800"">Pokud Vás naše nabídka oslovila, zašlete nám svůj <strong>strukturovaný životopis a motivační dopis nejpozději do 1. 4. 2026</strong> (tlačítko <strong>Odpovědět</strong>).</p><p class=""typography-body-large-text-regular mb-800"">Těšíme se na Vás! 😊</p></div>"
"SQL Developer (MS SQL Server, T-SQL) – interní systémy & data","Omnicom Media Group Czech, s.r.o.",https://www.jobs.cz/rpd/2001106048/?utm_source=juniorguru,False,2026-03-20 00:00:00,,cs,,,jobscz#2001106048,,,,,,,,,,Praha,Praha,,,,,,,,,,,,,,,,,,,Praha,Praha,,,,,,,,,,,,,,,,,,,fulltime,,,,,,,,,,"<div data-jobad=""body"" data-test=""jd-body-richtext"" class=""RichContent mb-1400""><p class=""typography-body-medium-text-regular text-secondary mb-600"">Pracovní nabídka</p><p class=""typography-body-large-text-regular mb-800"">Hledáme SQL Developera, který bude rozvíjet náš interní datový sklad a pracovat s mediálními i finančními daty.</p><p class=""typography-body-large-text-regular mb-800"">Někoho, kdo nechce pracovat v dodavatelském režimu „projekt–deadline–další projekt“, ale hledá dlouhodobou, smysluplnou a klidnější práci v menším stabilním týmu.</p><p class=""typography-body-large-text-regular mb-800"">Technologie: MS SQL Server, T-SQL, ETL, práce s API, JSON/XML, Power BI (výhodou)</p><h2 class=""typography-heading-small-text"">Proč by tě to u nás mohlo bavit</h2><ul class=""typography-body-large-text-regular""><li>baví tě systematická a dlouhodobá práce v jedné oblasti</li><li>chceš být samostatný*á, určovat si priority i tempo</li><li>zvládneš zodpovědnost a nepotřebuješ mikromanagement</li><li>hledáš stabilní prostředí, kde se věci budují postupně a s rozmyslem</li><li>oceníš možná vstřícné prostředí pro rodiče (maminky i tatínky máme rádi!)</li></ul><h2 class=""typography-heading-small-text"">Proč si nás spíš nevybrat</h2><ul class=""typography-body-large-text-regular""><li>chceš pracovat každou chvíli na jiném projektu pro různé firmy</li><li>očekáváš rychlý kariérní růst, vedení lidí nebo velký vývojový tým</li><li>hledáš full remote, IČO nebo extrémně neformální prostředí</li><li>nechceš komunikovat s kolegy nebo dodavateli</li></ul><h2 class=""typography-heading-small-text"">Co budeš dělat</h2><p class=""typography-body-large-text-regular mb-800"">Celý náš byznys je o datech – mediálních i finančních.</p><ul class=""typography-body-large-text-regular""><li>Mediální data - Napojení na různé systémy přes API, sběr dat o výkonu kampaní (online i TV), jejich čištění, ukládání do datového skladu a příprava reportů pro kolegy (PPC specialisty, plannery, nákupčí).</li><li>Finanční data - Příprava dat a reportů pro controlling a reporting do globálního systému skupiny.</li></ul><p class=""typography-body-large-text-regular mb-800"">Není to rutina.</p><p class=""typography-body-large-text-regular mb-800"">Data se vyvíjí, procesy se zlepšují a ty u toho budeš od začátku do konce.<br> Součástí práce je i komunikace s lidmi s různou technickou úrovní.</p><h2 class=""typography-heading-small-text"">Konkrétně tě čeká</h2><ul class=""typography-body-large-text-regular""><li>psaní a optimalizace komplexních SQL dotazů, views a stored procedures</li><li>návrh a správa databázových objektů</li><li>řešení výkonu a integrity dat</li><li>spolupráce na rozvoji nového interního obchodního systému</li></ul><h2 class=""typography-heading-small-text"">Co bys měl*a umět</h2><ul class=""typography-body-large-text-regular""><li>pokročilou znalost SQL a relačních databází (MS SQL Server, výhodou Oracle / MySQL)</li><li>T-SQL (výhodou orientace v .NET)</li><li>query tuning, indexace, optimalizace výkonu</li><li>datové modelování a orientaci v datových skladech (ETL)</li><li>práci s XML/JSON, výhodou BI nástroje (SSIS, Power BI)</li><li>analytické myšlení, pečlivost a smysl pro detail</li><li>češtinu + angličtinu (kvůli mezinárodní spolupráci)</li><li>orientace v účetní terminologii je plus, ne nutnost</li></ul><h2 class=""typography-heading-small-text"">Co ti za to dáme</h2><ul class=""typography-body-large-text-regular""><li>práci s daty, která mají reálný dopad na byznys</li><li>stabilní interní roli – děláš pro sebe, ne pro klienty na hodiny</li><li>kolegy, kteří tě zaučí a nenechají v tom samotného</li><li>prostor pro vzdělávání i mimo IT</li><li>home office po zapracování (min. 3 dny týdně v kanceláři)</li><li>roční odměnu</li><li>4 týdny dovolené + cca 2 týdny placeného volna navíc (v předem dané dny – Vánoce…)</li><li>online psychoterapii Hedepy</li><li>cvičení v budově, firemní školku zdarma</li></ul><p class=""typography-body-large-text-regular mb-800"">Pro lepší představu o našem firemním životě se podívej na náš profil na Tribee (Profil společnosti - Omnicom Media | TRIBEE - Humans After All | Employer Branding s lidskou tváří) nebo Instagramový profil (hledej OmnicomMediaGroup.cz). Nebo si třeba poslechni náš OMG podcast (https://open.spotify.com/show/6Zc8MFOfOWCsPfpGmfdaq2).</p></div>"
DevOps Engineer,JISTU recruitment s.r.o.,https://www.jobs.cz/rpd/2001120085/?utm_source=juniorguru,False,2026-03-20 00:00:00,,cs,,,jobscz#2001120085,,,,,,,,,,Brno,,,,,,,,,,,,,,,,,,,,Brno,,,,,,,,,,,,,,,,,,,,fulltime,,,,,,,,,,"<div data-jobad=""body"" data-test=""jd-body-richtext"" class=""RichContent mb-1400""><p class=""typography-body-medium-text-regular text-secondary mb-600"">Pracovní nabídka</p><p class=""typography-body-large-text-regular mb-800""><strong>Náplň práce:</strong></p><p class=""typography-body-large-text-regular mb-800"">Vaším úkolem bude především automatizace, provoz a rozvoj infrastruktury a deployment procesů pro produkt založený na mikroservisní architektuře.</p><p class=""typography-body-large-text-regular mb-800""><strong>Konkrétně budete:</strong></p><ul class=""typography-body-large-text-regular""><li>automatizovat proces buildů, deployment a release managementu (např. nightly buildy, staging)</li><li>navrhovat a testovat nové způsoby nasazení a správy infrastruktury</li><li>integrovat nové technologie a komponenty do produktového řešení</li><li>spravovat staging a demo prostředí pro vývojáře i prezentace zákazníkům</li><li>spolupracovat s vývojáři na zlepšování logování, metrik a architektury systému</li><li>podílet se na tvorbě technické dokumentace a konfiguraci zákaznických řešení</li><li>prosazovat princip Infrastructure as Code.</li></ul><p class=""typography-body-large-text-regular mb-800""><strong>Koho hledáme</strong><br>N<strong>adšence, který má silné analytické a problem-solving schopnosti, dokáže pracovat v dynamickém prostředí, dobře prioritizuje a je otevřený novým technologiím. Důležitá je také orientace na zákazníka a týmová spolupráce.</strong></p><p class=""typography-body-large-text-regular mb-800""><strong>Součástí týmu jsou další DevOps specialisté (senior a junior), proto je zkušenost s mentoringem výhodou. Oceníme nápady na zlepšení a kreativitu. Každý ve firmě dostává prostor přijít se zlepšením.</strong></p><p class=""typography-body-large-text-regular mb-800""><strong>Požadujeme</strong></p><ul class=""typography-body-large-text-regular""><li>velmi dobrou znalost Linux (hlavní pracovní prostředí), výhodou i znalost Windows</li></ul><p class=""typography-body-large-text-regular mb-800""><strong>Nabízíme</strong></p><ul class=""typography-body-large-text-regular""><li>práci na technologicky zajímavém produktu využívajícím AI a neuronové sítě,</li><li>spolupráci v přátelském týmu – odpolední společné kávy, snídaně, obědy, hraní fotbálku</li><li>vysoká odbornost kolegů, kteří rádi pomůžou</li><li>tří týdenní sprinty – 3. týden se pomáhá s nedodělky</li><li>čtyřdenní pracovní týden, z toho možný home office 2 dny z týdne</li><li>pravidelně si sdílíme know how napříč odborností ve firmě</li><li>budget 25 000 Kč ročně na rozvoj schopností a well-beingu, produkty dle výběru pracovníka</li><li>pružná pracovní doba, priorita je plnění úkolů</li><li>společně sportujeme a soutěžíme – běh, kolo, padel, výlety</li></ul></div>"
C# Developer junior/medior (50% Home Office),HR PROfi,https://www.jobs.cz/rpd/2000748035/?utm_source=juniorguru,False,2026-03-20 00:00:00,,cs,,,jobscz#2000748035,,,,,,,,,,Praha,,,,,,,,,,,,,,,,,,,,Praha,,,,,,,,,,,,,,,,,,,,fulltime,parttime,,,,,,,,,"<div data-jobad=""body"" data-test=""jd-body-richtext"" class=""RichContent mb-1400""><p class=""typography-body-medium-text-regular text-secondary mb-600"">Pracovní nabídka</p><p class=""typography-body-large-text-regular mb-800"">Rozšiřujeme náš vývojový tým, do kterého hledáme kolegu nebo kolegyni na pozici C# Developera - junior/medior.</p><p class=""typography-body-large-text-regular mb-800"">Nabízíme práci v zázemí firmy se stabilním týmem a významnými referencemi. Přidejte se k nám a buďte součástí projektů, které vás posunou dále.</p><p class=""typography-body-large-text-regular mb-800""><strong>Podmínkou je technická VŠ - student posledního ročníku nebo absolvent minimálně s titulem Bc.</strong></p><p class=""typography-body-large-text-regular mb-800""><strong>Co vám můžeme nabídnout:</strong><br>• Pružná pracovní doba a Home Office 50%<br>• Stabilní zázemí se zkušenými kolegy, kteří vám pomůžou profesně růst<br>• Dobře dostupné kanceláře v Praze</p><p class=""typography-body-large-text-regular mb-800""><strong>Co očekáváme:</strong><br>• Dobrá znalost C#<br>• Student posledního ročníku nebo absolvent technické VŠ<br>• Základní znalost AJ<br><br></p></div>"
PHP programátor,Janoshik s.r.o.,https://www.jobs.cz/rpd/2001119633/?utm_source=juniorguru,False,2026-03-20 00:00:00,,cs,,,jobscz#2001119633,,,,,,,,,,Praha,Praha,,,,,,,,,,,,,,,,,,,Praha,Praha,,,,,,,,,,,,,,,,,,,fulltime,,,,,,,,,,"<div data-jobad=""body"" data-test=""jd-body-richtext"" class=""RichContent mb-1400""><p class=""typography-body-medium-text-regular text-secondary mb-600"">Pracovní nabídka</p><p class=""typography-body-large-text-regular mb-800"">Jsme laboratoř v Mníšku pod Brdy (20 min z Prahy směrem na Příbram), která se specializuje na chemickou analýzu zakázaných látek ve sportu, poskytující harm reduction pro jejich uživatele po celém světě. Nabízíme testovací služby pro širokou škálu látek, včetně anabolických steroidů, peptidů, selektivních modulátorů androgenních receptorů (SARM), lidského růstového hormonu (HGH) a dalších podobných látek.</p><p class=""typography-body-large-text-regular mb-800"">Naším cílem je poskytovat transparentní a objektivní informace o složení a kvalitě testovaných produktů. Vzhledem k našemu nezávislému postavení nejsme spojeni s žádnými výrobci ani distributory, což nám umožňuje zachovat naprostou nestrannost a důvěryhodnost našich výsledků. Díky důvěře klientů jsme se stali stabilně rostoucí společností a zároveň jsme největší laboratoř na světě poskytující harm reduction v této oblasti.</p><p class=""typography-body-large-text-regular mb-800"">Používáme analytické metody:<br>LC-MS (SQ);<br>GC-MS (SQ + NIST, headspace);<br>HPLC-DAD (SEC-HPLC; RP-HPLC);<br>EDX;<br>CHNS Elementární analýza; LAL test</p><p class=""typography-body-large-text-regular mb-800""><br>..a mnoho dalších abychom zajistili přesnost a spolehlivost našich výsledků.</p><p class=""typography-body-large-text-regular mb-800""><strong>Místo výkonu práce: </strong>Areál ÚVR, Pražská 600, 25210 Mníšek pod Brdy</p><p class=""typography-body-large-text-regular mb-800""><strong>Co budete dělat:</strong></p><p class=""typography-body-large-text-regular mb-800"">Podílet se na rozvoji interního IT systému (PHP a MySQL)<br>Podilet se na integraci interního systému a eshopu</p><p class=""typography-body-large-text-regular mb-800""><strong>Co od Vás očekáváme:</strong></p><p class=""typography-body-large-text-regular mb-800"">Znalost PHP a SQL databáze<br>Schopnost efektivně využívat LLM<br>Zkušenosti s platformou WordPress výhodou<br>MS Office – uživatelská znalost<br>Anglický jazyk – minimálně na úrovni B2<br>Český / Slovenský jazyk na komunikativní úrovni<br>Kritické a analytické myšlení<br>Čistý trestní rejstřík</p><p class=""typography-body-large-text-regular mb-800""><strong>Co Vám nabízíme:</strong></p><p class=""typography-body-large-text-regular mb-800"">Mzda 43 000 – 48 000 Kč<br>Odměny - 10% ze základní mzdy dle dosažených výkonů<br>13. plat v závislosti na hospodářských výsledcích firmy<br>Multisport karta – plně hrazená zaměstnavatelem<br>Stravenkový paušál<br>Možnost občasného home office - ad hoc - dle dohody<br>Přátelské pracovní prostředí v menším kolektivu<br>Možnost HPP nebo IČO</p></div>"
"Výzva: ERP Developer / IT Systems Specialist – POHODA, SQL, automatizace",WETRA ČR a.s.,https://www.jobs.cz/rpd/2001119568/?utm_source=juniorguru,False,2026-03-20 00:00:00,,cs,,,jobscz#2001119568,,,,,,,,,,Praha,Praha,,,,,,,,,,,,,,,,,,,Praha,Praha,,,,,,,,,,,,,,,,,,,fulltime,,,,,,,,,,"<div data-jobad=""body"" data-test=""jd-body-richtext"" class=""RichContent mb-1400""><p class=""typography-body-medium-text-regular text-secondary mb-600"">Pracovní nabídka</p><p class=""typography-body-large-text-regular mb-800""><strong>Výzva: ERP Developer / IT Systems Specialist – POHODA, SQL, automatizace</strong></p><p class=""typography-body-large-text-regular mb-800""><strong>WETRA / Gigamat.cz – full time</strong></p><p class=""typography-body-large-text-regular mb-800""></p><p class=""typography-body-large-text-regular mb-800"">Do našeho týmu hledáme silného a samostatného člověka, který bude <strong>prakticky rozvíjet naše ERP a systémové prostředí</strong>, zejména kolem <strong>POHODA E1,</strong> SQL databází, automatizací, integrací a interních procesů.</p><p class=""typography-body-large-text-regular mb-800"">Dnes fungujeme tak, že <strong>účetnictví vedeme v systému POHODA</strong> a zároveň máme <strong>vlastní custom řešení budované od roku 2001 na SQL databázi</strong>, které je orientované více na logistiku, sklady a obchodní procesy než na účetnictví.</p><p class=""typography-body-large-text-regular mb-800"">Naším cílem je opustit custom řešení ERP a POHODU E1 integrovat do naší skupiny, kde dojde k plné provázanosti: ERP, účetnictví, logistika, obchod a data fungovaly jako jeden celek. Jako hlavní směr nyní vnímáme <strong>rozvoj a implementaci</strong> POHODA E1 nejen jako účetního systému, ale jako širšího ERP řešení pro firmu.</p><p class=""typography-body-large-text-regular mb-800"">Hledáme proto člověka, který nebude pouze zadávat práci dál, ale který bude <strong>sám aktivně tvořit, upravovat a zlepšovat systémové prostředí firmy.</strong></p><p class=""typography-body-large-text-regular mb-800""><strong>Co budeš dělat</strong></p><ul class=""typography-body-large-text-regular""><li>budeš se přímo podílet na <strong>implementaci a rozvoji POHODA E1</strong> jako budoucího ERP řešení firmy,</li><li>budeš <strong>sám navrhovat a realizovat automatizace, úpravy a systémová vylepšení</strong> nad POHODOU a navazujícími systémy,</li><li>budeš propojovat <strong>POHODU, náš vlastní SQL systém, e-shop, sklady, logistiku a další nástroje,</strong></li><li>budeš vytvářet a upravovat <strong>importy, exporty, datové převody, workflow a integrační můstky,</strong></li><li>budeš pracovat s <strong>SQL databází</strong>, datovou strukturou a systémovou logikou,</li><li>budeš pomáhat převádět naše historické procesy a know-how do modernějšího ERP prostředí,</li><li>budeš aktivně hledat, co lze zjednodušit, propojit nebo automatizovat,</li><li>budeš součástí budování interní IT divize, která má do budoucna podporovat naše firmy i další subjekty.</li></ul><p class=""typography-body-large-text-regular mb-800""><strong>Koho hledáme</strong></p><p class=""typography-body-large-text-regular mb-800"">Hledáme člověka, který <strong>umí věci nejen vymyslet, ale i udělat.</strong></p><p class=""typography-body-large-text-regular mb-800"">Ne někoho, kdo bude pouze:</p><ul class=""typography-body-large-text-regular""><li>sbírat zadání,</li><li>komunikovat s dodavateli,</li><li>a posílat práci externistům.</li></ul><p class=""typography-body-large-text-regular mb-800"">Chceme člověka, který má chuť si systém „vzít za svůj“ a bude v něm <strong>reálně stavět, upravovat a programově / datově posouvat věci dopředu.</strong></p><p class=""typography-body-large-text-regular mb-800""><strong>Co od tebe čekáme</strong></p><ul class=""typography-body-large-text-regular""><li>zkušenost s ERP systémy a jejich praktickým rozvojem,</li><li>ideálně zkušenost s<strong> POHODA E1 / POHODA SQL,</strong></li><li>dobrou orientaci v<strong> SQL,</strong> databázích, datových strukturách a logice podnikových systémů,</li><li>schopnost samostatně řešit <strong>automatizace, integrace, importy, exporty a systémové úpravy,</strong></li><li>přesah do účetnictví, skladu, logistiky, obchodu nebo e-commerce,</li><li>schopnost chápat procesy a převádět je do funkčních systémových řešení,</li><li>samostatnost, odpovědnost a chuť věci dotahovat.</li></ul><p class=""typography-body-large-text-regular mb-800""><strong>Velkou výhodou je</strong></p><ul class=""typography-body-large-text-regular""><li>zkušenost s <strong>XML, API, SQL procedurami, datovými převody a automatizací procesů,</strong></li><li>zkušenost s e-commerce nebo skladovým provozem,</li><li>zkušenost s napojením ERP na e-shop, WMS, marketplace nebo PIM,</li><li>schopnost upravovat systém tak, aby odpovídal reálnému provozu firmy.</li></ul><p class=""typography-body-large-text-regular mb-800""><strong>Co nabízíme</strong></p><ul class=""typography-body-large-text-regular""><li>dlouhodobou spolupráci a klíčovou roli při sjednocení účetnictví, ERP, logistiky a obchodu,</li><li>možnost přímo vytvářet a ovlivňovat budoucí podobu firemního systému,</li><li>práci, kde budeš mít <strong>reálný vliv a reálný výstup,</strong> ne jen koordinační roli,</li><li>přímou spolupráci s vedením firmy,</li><li>dlouhodobou full-time spolupráci,</li><li>zázemí stabilní firmy s vlastním e-commerce, značkami a sklady,</li><li>prostor budovat interní IT a časem i širší technologickou divizi.</li></ul><p class=""typography-body-large-text-regular mb-800""><strong>O nás</strong></p><p class=""typography-body-large-text-regular mb-800"">Jsme firma, která spojuje e-commerce, distribuci, retail, vlastní značky a logistiku. Máme za sebou silné obchodní a provozní know-how, historicky vybudované vlastní systémové řešení a zároveň stojíme před důležitým krokem: propojit účetnictví, ERP, procesy a data do modernějšího a dlouhodobě udržitelného celku.</p><p class=""typography-body-large-text-regular mb-800"">Hledáme člověka, který bude u toho prakticky od začátku a pomůže to celé opravdu postavit.</p><p class=""typography-body-large-text-regular mb-800""><strong>Pokud tě role zaujala</strong></p><p class=""typography-body-large-text-regular mb-800"">Pošli nám pár vět o sobě, na jakých systémech jsi pracoval(a), co jsi reálně automatizoval(a), upravil(a) nebo propojil(a), a co jsi firmě pomohl(a) zlepšit po praktické stránce.</p><p class=""typography-body-large-text-regular mb-800""></p><p class=""typography-body-large-text-regular mb-800""></p></div>"
