(QA) Test analytik/tester,"CENDIS, s.p.",https://www.jobs.cz/rpd/2000699950/,False,2025-08-24 00:00:00,,cs,,,jobscz#2000699950,,,,,,,,,,Praha,Praha,,,,,,,,,,,,,,,,,,,Praha,Praha,,,,,,,,,,,,,,,,,,,fulltime,,,,,,,,,,"<div data-jobad=""body"" data-test=""jd-body-richtext"" class=""RichContent mb-1400""><p class=""typography-body-medium-text-regular text-secondary mb-600"">Pracovní nabídka</p><h2 class=""typography-heading-small-text"">Co bude náplní Tvé práce?</h2><ul class=""typography-body-large-text-regular""><li>Manuální testování,</li><li>příprava a provádění systémových integrovaných testů,</li><li>identifikace a prioritizace softwarových chyb,</li><li>psaní a údržba automatických testů v jazycích JavaScript, Python s využitím frameworku Cypress,</li><li>práce v nástroji Postman,</li><li>správa a exekuce testů v Zephyru,</li><li>reportování chyb v systému JIRA,</li><li>týmová spolupráce na přípravě testovacích scénářů a strategie celého QA týmu,</li><li>aktivně spolupracovat s architekty, analytiky, vývojáři a ostatními testery,</li><li>každodenní zdokonalování se v automatizaci a testování BE.</li></ul><h2 class=""typography-heading-small-text"">Bez čeho se neobejdeš?</h2><ul class=""typography-body-large-text-regular""><li>Velmi dobré analytické a technické myšlení,</li><li>dobrá znalost MS Office (Word, Excel),</li><li>znalost SQL,</li><li>znalost Dev tools (nástroje pro vývojáře) ve webových prohlížečích,</li><li>znalost programovacích a skriptovacích jazyků (JavaScript, Python),</li><li>znalost principů vývoje software,</li><li>všeobecné znalosti v oblasti IT technologií,</li><li>chuť učit se novým věcem, pečlivost, spolehlivost a zodpovědnost.</li></ul><h2 class=""typography-heading-small-text"">Co by bylo ještě fajn mít?</h2><ul class=""typography-body-large-text-regular""><li>Znalost alespoň jednoho frameworku - Cypress,</li><li>znalost principů agilního vývoje (SCRUM),</li><li>znalost nástroje JIRA, Zephyr a Confluence,</li><li>znalost a využití AI.</li></ul><h2 class=""typography-heading-small-text"">Co Ti nabídneme?</h2><ul class=""typography-body-large-text-regular""><li>Práci, která dává smysl a má reálný dopad na každodenní život mnoha lidí,</li><li>prostor pro seberealizaci a získání nových zkušeností,</li><li>možnost částečné práce z domova,</li><li>individuální rozvržení pracovní doby,</li><li>práci v mladém kolektivu,</li><li>příjemnou atmosféru v přátelském prostředí,</li><li>skvělou firemní kulturu,</li><li>mobilní telefon a notebook,</li><li>příspěvek na penzijní připojištění,</li><li>příspěvek na stravování,</li><li>dovolená 5 týdnů, 5 sickdays a další velmi zajímavé benefity,</li><li>firemní akce a teambuildings.</li></ul><h2 class=""typography-heading-small-text"">Chceš se k nám přidat?</h2><ul class=""typography-body-large-text-regular""><li>Pak nám pošli odpověď a CV prostřednictvím tohoto portálu nebo zavolej na uvedené telefonní číslo.</li><li>Těšíme se na Tebe!</li></ul></div>"
Junior C# Developer,Veeam Software (Czech Republic) s.r.o.,https://www.jobs.cz/rpd/2000119745/,False,2025-08-24 00:00:00,,en,,,jobscz#2000119745,,,,,,,,,,Praha,Praha,,,,,,,,,,,,,,,,,,,Praha,Praha,,,,,,,,,,,,,,,,,,,fulltime,,,,,,,,,,"<div data-jobad=""body"" data-test=""jd-body-richtext"" class=""RichContent mb-1400""><p class=""typography-body-medium-text-regular text-secondary mb-600"">Pracovní nabídka</p><p class=""typography-body-large-text-regular mb-800"">Now we are looking for a <strong>Junior C# Developer </strong>to join the team that works on Veeam Backup and Replication.</p><p class=""typography-body-large-text-regular mb-800""><strong>Your tasks will include:</strong></p><ul class=""typography-body-large-text-regular""><li>Development of business logic for Veeam Backup and Replication</li><li>Development of new products and support of existing functionality</li><li>Participation and individual development of components and the whole architecture of the product</li></ul><p class=""typography-body-large-text-regular mb-800""><strong>Technologies we work with:<br></strong><br>C#, .Net 8, Windows/Linux, MS SQL, PostgreSQL, Multithreading</p><p class=""typography-body-large-text-regular mb-800""><strong>What we expect from you:</strong></p><ul class=""typography-body-large-text-regular""><li>Good knowledge of C# language</li><li>A deep understanding of .NET platform, data structures and algorithms</li><li>Possession of the principles of software design and development</li><li>English proficiency sufficient to communicate with international teams</li><li>Experience in basic AWS concepts and services such as VPC, EC2, RDS, etc. (or Azure equivalents) will be a plus</li></ul><p class=""typography-body-large-text-regular mb-800""><strong>We offer:</strong></p><ul class=""typography-body-large-text-regular""><li>Premium healthcare program for you and your children</li><li>Sick days and additional payments for sick leave</li><li>Meal allowance</li><li>Full cover of public transport pass, cell phone contract and MultiSport card</li><li>Cafeteria Benefit Plan – an additional annual budget that you can spend on a variety of benefits such as travel, sport, wellness, education and many more</li><li>Flexible working hours and home office/hybrid mode</li><li>Veeam Care Days – additional 24 hours for your volunteering activities</li><li>Professional training and education, including courses and conferences, internal meetups, and unlimited access to online libraries (Percipio, Athena LMS, O’Reilly)</li><li>Tailored onboarding, buddy, and mentor programs so getting started is hassle-free</li></ul><p class=""typography-body-large-text-regular mb-800""><strong>Please note:</strong> If the applicant is permanently present outside of the Czech Republic, Veeam reserves the right to refuse to consider the application for a job. Remote job is only possible in case the employee is located in the Czech Republic.</p></div>"
"Client Integration Engineer - junior (polština, angličtina)",VIVnetworks.com s.r.o.,https://www.jobs.cz/rpd/2000673326/,False,2025-08-24 00:00:00,,cs,,,jobscz#2000673326,,,,,,,,,,Nova Praha,Praha,,,,,,,,,,,,,,,,,,,Ukrajina,Praha,,,,,,,,,,,,,,,,,,,fulltime,,,,,,,,,,"<div data-jobad=""body"" data-test=""jd-body-richtext"" class=""RichContent mb-1400""><p class=""typography-body-medium-text-regular text-secondary mb-600"">Pracovní nabídka</p><p class=""typography-body-large-text-regular mb-800""><strong>Client Integration Engineer - junior</strong><br>Jsme VIVnetworks, jednička v oblasti affiliate marketingu a člen Publicis Groupe - největší mediální skupiny na světě. Aktuálně hledáme pro náš pražský tým nového kolegu na pozici <strong>Associate Client Integration Engineer</strong>.</p><p class=""typography-body-large-text-regular mb-800"">Ve VIVnetworks pracujeme jako tým a společně dosahujeme skvělých výsledků. Základem je přátelské, neformální a otevřené prostředí, princip důvěry a odpovědnosti za svěřenou agendu. Jsme ambiciózní a dokážeme flexibilně reagovat na potřeby našich partnerů, mezi které patří například AboutYou, Notino, OBI, MAGU a stovky dalších. Působíme v České republice a v dalších zemích střední a východní Evropy.</p><p class=""typography-body-large-text-regular mb-800""><strong>Přidejte se k nám…</strong></p><p class=""typography-body-large-text-regular mb-800""><br> <strong>Co na dané pozici budete dělat:</strong></p><p class=""typography-body-large-text-regular mb-800"">· Testování funkčnosti měření konverzí a validace měřících kódů na webových stránkách našich klientů<br>· Identifikace a řešení chyb v implementaci měřících kódů<br>· Dokumentace testů a výsledků do interního systému<br>· Kontrola produktových feedů<br>· Sestavování a import CSV souborů na základě technické dokumentace</p><p class=""typography-body-large-text-regular mb-800""><strong>Co by měl ideální kandidát splňovat:</strong></p><p class=""typography-body-large-text-regular mb-800"">· Analytické myšlení, pečlivost, odpovědnost<br>· Jazyková vybavenost: angličtina a polština na dobré úrovni (C1) - komunikace s klienty, čeština pro komunikaci v týmu (min. B2)<br>· Základní uživatelské a technické dovednosti v oblasti IT<br>· Zkušenosti s prací s tabulkovými editory, CSV soubory<br>· Středně pokročilá znalost HTML a JavaScriptu<br>· Ochota k dalšímu profesnímu růstu a zdokonalování<br>· Schopnost pracovat s technickou dokumentací<br>· Zkušenost na oddělení technické nebo zákaznické podpory výhodou<br>· Schopnost používat vývojářské nástroje (devtools) v prohlížeči</p><p class=""typography-body-large-text-regular mb-800""><strong>Co nabízíme?</strong></p><p class=""typography-body-large-text-regular mb-800"">· Platové ohodnocení podle dosavadních zkušeností<br>· Pracovní smlouva na dobu neurčitou<br>· Zázemí silné nadnárodní společnosti<br>· Přátelské, stabilní a otevřené pracovní prostředí<br>· Zaškolení na pozici a podpora v začátcích<br>· Možnost práce z domova: pondělí až středa se potkáváme v kanceláři, ve čtvrtek a pátek pracujeme z domu<br>· Flexibilní začátek / konec pracovní doby<br>· V létě volné pátky (po odpracovaném roce)<br>· Dovolená 5 týdnů<br>· Stravenkový paušál<br>· Klientské slevy<br>· Firemní akce – teambuildingy<br>· Vzdělávání – odborné a další školení<br>· Kanceláře v centru Prahy</p></div>"
SW integrátor/tester,Saab Czech s.r.o.,https://www.jobs.cz/rpd/2000658753/,False,2025-08-24 00:00:00,,cs,,,jobscz#2000658753,,,,,,,,,,Slavkov u Brna,Slavkov u Brna,,,,,,,,,,,,,,,,,,,Brno,Brno,,,,,,,,,,,,,,,,,,,fulltime,,,,,,,,,,"<div data-jobad=""body"" data-test=""jd-body-richtext"" class=""RichContent mb-1400""><p class=""typography-body-medium-text-regular text-secondary mb-600"">Pracovní nabídka</p><p class=""typography-body-large-text-regular mb-800"">Hledáme do SW týmu kolegu na pozici SW tester/integrátor.</p><p class=""typography-body-large-text-regular mb-800"">Budeš se podílet na vývoji, testování, integraci, a demonstracích našich simulátorů vojenské techniky. Oceníme zálibu ve zbraních a počítačových hrách. Rádi bychom našli kolegu s hlubokým zájmem o technologie, který náš tým obohatí o nové znalosti.</p><p class=""typography-body-large-text-regular mb-800"">📌 Co tě u nás čeká?</p><ul class=""typography-body-large-text-regular""><li>spolupráce na návrhu a vývoji střeleckých simulátorů</li><li>testování a integrace simulátorů vojenské techniky a to zejména střeleckých simulátorů</li><li>aktivní účast na zlepšování procesů testování a integrace</li><li>zaškolování koncových uživatelů (u nás ve firmě i v zahraničí)</li><li>prezentace našich systémů zákazníkům (u nás ve firmě i v zahraničí)</li></ul><p class=""typography-body-large-text-regular mb-800"">✅ Co by Ti nemělo chybět?</p><ul class=""typography-body-large-text-regular""><li>máš administrátorskou znalost prostředí Windows</li><li>znáš procesy testování komplexních systémů zahrnující SW</li><li>máš zkušenosti s distribuovanými systémy správy revizí (zejména GIT)</li><li>samostatnost, pečlivost, důslednost, a ochota se učit novým dovednostem</li><li>domluvíš se bez problémů anglicky a jsi komunikativní</li></ul><p class=""typography-body-large-text-regular mb-800"">➕ Co může být výhodou?</p><ul class=""typography-body-large-text-regular""><li>orientace ve zbraňových systémech</li><li>záliba v počítačových hrách</li><li>znalost PowerShell skriptování</li><li>schopnost vytvářet automatické testovací procedury</li><li>znalost Azure DevOps a YAML</li></ul><p class=""typography-body-large-text-regular mb-800"">💼 Co nabízíme my?</p><ul class=""typography-body-large-text-regular""><li>práci na inovativních projektech výcvikových systémů s moderními technologiemi</li><li>odborný i osobní růst v mezinárodní firmě</li><li>spoluúčast na formování technických standardů</li><li>přátelský a profesionální tým zkušených kolegů</li><li>mzdové ohodnocení odpovídající znalostem, zkušenostem a výkonu</li><li>širokou nabídku benefitů (25 dní dovolené, 3 sick days, Multisport karta, Pluxee karta, kurzy angličtiny a široká podpora odborného rozvoje, příspěvky na penzijní a životní pojištění, firemní akce, parkování zdarma, dotované obědy přímo ve firmě, možnost získat zbrojní průkaz za výhodných podmínek a další)</li></ul><p class=""typography-body-large-text-regular mb-800"">Pokud se chceš podílet na vývoji smysluplného produktu a stát se členem našeho skvělého týmu, ozvi se!</p><p class=""typography-body-large-text-regular mb-800"">Více informací o nás najdeš na: https://www.saab.com</p></div>"
Softwarový tester/ka (junior),ESSENS EUROPE SE,https://www.jobs.cz/rpd/2000717486/,False,2025-08-24 00:00:00,,cs,,,jobscz#2000717486,,,,,,,,,,Brno,Brno,,,,,,,,,,,,,,,,,,,Brno,Brno,,,,,,,,,,,,,,,,,,,fulltime,,,,,,,,,,"<div data-jobad=""body"" data-test=""jd-body-richtext"" class=""RichContent mb-1400""><p class=""typography-body-medium-text-regular text-secondary mb-600"">Pracovní nabídka</p><p class=""typography-body-large-text-regular mb-800"">Chceš pracovat na zajímavých projektech v pohodové firmě?</p><p class=""typography-body-large-text-regular mb-800"">Hledáme softwarového testera/testerku, který se nezalekne testování webů ani mobilní aplikace a posune naše produkty zase o kus dál. Čeká tě manuální testování, psaní testovacích scénářů a postupné kroky k automatizaci. Baví tě hledat chyby, zkoušet, co aplikace zvládne a rád/a se učíš nové věci? Tak hledáme právě tebe!</p><p class=""typography-body-large-text-regular mb-800"">ESSENS je jedna z nejdynamičtějších MLM společností s mezinárodním přesahem a od roku 2011 se zabývá výrobou <strong>kosmetiky, parfémů a potravinových doplňků.</strong> Působí také v oblasti gastronomie (Restaurant ESSENS &amp; Chateau Petit), cestovního ruchu (Chateau de Frontiere) a v neposlední řadě i v on-line prostoru formou webinářů a tuzemských i zahraničních eventů. Od roku 2022 jsme i hrdým majitelem značky <strong>Miss Universe Czechia&amp;Slovakia.</strong> U nás to prostě ani zdaleka není jen o parfémech.</p><p class=""typography-body-large-text-regular mb-800"">Máme malý přátelský tým, žádné zdlouhavé korporátní procesy – vývoj, projekty i testování řešíme přímo mezi sebou.</p><p class=""typography-body-large-text-regular mb-800""><strong>Pracoviště</strong>: Brno, Líšeň<br> <strong>Nástup:</strong> ihned</p><p class=""typography-body-large-text-regular mb-800""><strong>Co budeš dělat:</strong></p><ul class=""typography-body-large-text-regular""><li><strong>Manuálně testovat</strong> nové i existující funkce v mobilní aplikaci a na webu</li><li>Zapisovat a sledovat chyby v <strong>Jira</strong></li><li>Postupně zavádět automatické testy pro web (Playwright, Cypress apod.)</li><li>Podílet se na psaní dokumentace</li><li>Úzce spolupracovat napříč celým týmem</li><li>Pomáhat nám chytit chyby dřív, než je najdou zákazníci</li></ul><p class=""typography-body-large-text-regular mb-800""><strong>Co očekáváme:</strong></p><ul class=""typography-body-large-text-regular""><li>Víš, co je to softwarové testování (nemusíš mít roky praxe)</li><li>Ochotu učit se nové věci (hlavně v oblasti automatizace)</li><li>Máš smysl pro detaily a nevzdáš to, když se něco chová jinak, než má</li><li>Dokážeš jasně a otevřeně komunikovat s týmem</li></ul><p class=""typography-body-large-text-regular mb-800""><strong>Co ti můžeme nabídnout:</strong></p><ul class=""typography-body-large-text-regular""><li>Práci, která má smysl a rozhodně není nuda</li><li>Pohodlnou pracovní židli ve velmi moderní centrále mezinárodní společnosti v Brně – Líšni</li><li>Kromě rozmanitých zaměstnaneckých benefitů i rozmanitý pracovní kolektiv (benefity představíme na pohovoru)</li><li>a daleko víc, ale to si řekneme osobně.</li></ul></div>"
Data analyst,MND Energie a.s.,https://www.jobs.cz/rpd/2000709462/,False,2025-08-24 00:00:00,,cs,,,jobscz#2000709462,,,,,,,,,,Praha,Praha,,,,,,,,,,,,,,,,,,,Praha,Praha,,,,,,,,,,,,,,,,,,,fulltime,,,,,,,,,,"<div data-jobad=""body"" data-test=""jd-body-richtext"" class=""RichContent mb-1400""><p class=""typography-body-medium-text-regular text-secondary mb-600"">Pracovní nabídka</p><p class=""typography-body-large-text-regular mb-800""><strong>Data analyst </strong></p><p class=""typography-body-large-text-regular mb-800""><strong>Co bude náplní Tvé práce? </strong></p><ul class=""typography-body-large-text-regular""><li>Identifikace relevantních datových zdrojů</li><li>Používání statistických metod a analytických nástrojů k objevování trendů, vzorců a anomálií v datech</li><li>Vytváření vizualizací</li><li>Interpretace a prezentace výsledků</li><li>Úzká spolupráce s různými odděleními (marketing, obchod, finance, IT) pro pochopení jejich potřeb a poskytování datové podpory</li><li>Programování v SQL</li><li>Nastavování kontrolních mechanismů</li></ul><p class=""typography-body-large-text-regular mb-800""><strong>Co od Tebe očekáváme? </strong></p><ul class=""typography-body-large-text-regular""><li>Znalost SQL jazyka (znalost dalšího programovacího jazyka výhodou – Python, VBA, …)</li><li>Zkušenost s vizualizačními nástroji (GoodData a Power BI)</li><li>Pokročilejší znalost práce s MS Excel</li><li>Analytické myšlení, chuť vzdělávat a rozvíjet se v oboru energetiky</li><li>Schopnost efektivně komunikovat složité informace</li><li>Aktivní přístup a chuť hledat zlepšení</li><li>Znalost statistických metod výhodou</li><li>Pozornost k detailům a přesnost</li><li>Základní znalost angličtiny</li></ul><p class=""typography-body-large-text-regular mb-800""><strong>Proč se Ti u nás bude líbit? </strong></p><ul class=""typography-body-large-text-regular""><li>Přátelský tým, který se rád potkává i po pracovní době</li><li>Zaškolení – hledáme nadšence, kteří se nebojí učit nové věci</li><li>Motivující mzdové ohodnocení</li><li>Jedinečnou příležitost seberealizace a osobního růstu</li></ul><p class=""typography-body-large-text-regular mb-800""><strong>+ nadstandardní systém zaměstnaneckých benefitů </strong></p><ul class=""typography-body-large-text-regular""><li>Zkrácená pracovní doba (37,5 hod/týdně)</li><li>Týden dovolené navíc a k tomu 4 sick days</li><li>Flexibilní pracovní podmínky</li><li>Moderně a nadstandardně vybavené kanceláře v centru Bořislavka (skvělá káva, relax zóny a firemní fitko)</li><li>Za příznivého počasí možnost pracovat z terasy s nezapomenutelným výhledem</li><li>Možnost stravování v naší restauraci (s bohatou nabídkou světové kuchyně) za zvýhodněné ceny</li><li>Příspěvek na stravování v podobě stravenkového paušálu</li><li>Roční příspěvek v hodnotě 15.000 Kč na Cafeterii od společnosti Benefit Plus</li><li>Příspěvek na penzijní připojištění</li><li>Zvýhodněný mobilní tarif pro tebe i tvé blízké</li><li>Možnost osobního rozvoje v podobě školení a kurzů</li><li>Další zajímavé skupinové benefity a zázemí stabilní skupiny KKCG</li></ul><p class=""typography-body-large-text-regular mb-800"">Místo výkonu práce: Praha</p><p class=""typography-body-large-text-regular mb-800"">Termín nástupu: Dle dohody</p><p class=""typography-body-large-text-regular mb-800""><strong>Těšíme se na tvůj životopis!</strong></p></div>"
Technický specialista pro monitorovací a bezpečnostní systémy,České Radiokomunikace a.s.,https://www.jobs.cz/rpd/2000645779/,False,2025-08-24 00:00:00,,cs,,,jobscz#2000645779,,,,,,,,,,Praha,Praha,,,,,,,,,,,,,,,,,,,Praha,Praha,,,,,,,,,,,,,,,,,,,fulltime,,,,,,,,,,"<div data-jobad=""body"" data-test=""jd-body-richtext"" class=""RichContent mb-1400""><p class=""typography-body-medium-text-regular text-secondary mb-600"">Pracovní nabídka</p><p class=""typography-body-large-text-regular mb-800"">Jsme CRA - technologický lídr v oblasti mediálních a telekomunikačních služeb. Vytváříme inovativní síťová a bezpečnostní řešení, spravujeme datacentra, poskytujeme cloudové služby a chráníme naše klienty před kybernetickými hrozbami. A právě finišujeme jeden z nejambicióznějších projektů v oblasti digitální infrastruktury v České republice. V lokalitě Praha - Zbraslav vznikne do dvou let jedno z největších datových center v Evropě, které bude mít kapacitu přes 2 500 serverových racků a příkon 26 megawattů.</p><p class=""typography-body-large-text-regular mb-800"">Budťe u toho s námi! Hledáme nového kolegu či kolegyní pro nově zaváděné systémy:</p><h2 class=""typography-heading-small-text""><strong>Jaká práce Vás čeká:</strong></h2><ul class=""typography-body-large-text-regular""><li>Budete součástí týmu, který je klíčovým článkem v zajištění hladkého chodu našich moderních datových center.</li><li>Vaším hlavním úkolem bude správa a rozvoj systémů BMS a DCIM – tedy nástrojů, které monitorují a řídí infrastrukturu, prostředí i bezpečnost datových center.</li><li>Budete instalovat a konfigurovat systémy pro monitoring technologií, prostředí a přístupových práv.</li><li>Zajistíte provoz a administraci těchto systémů – správa aplikací, konfigurace dohledových automatů a přístupových oprávnění.</li><li>Budete mít pod dohledem infrastrukturu datového centra a aktivně se podílet na její optimalizaci a údržbě.</li><li>Při výskytu závad nebo nestandardních situací provedete analýzu a případný servisní zásah.</li><li>Spolupracujete s dalšími technickými týmy na zlepšování provozu a realizaci projektů.</li><li>Udržujete aktuální provozní dokumentaci a poskytujete technickou podporu i školení zákazníkům.</li></ul><h2 class=""typography-heading-small-text""><strong>Co od Vás potřebujeme:</strong></h2><ul class=""typography-body-large-text-regular""><li>SŠ/VŠ elektrotechnického zaměření</li><li>Všeobecná znalost IT infrastruktury a komunikačních protokolů.</li><li>Zájem či zkušenost v oblasti automatizace (PLC programování).</li><li>Základy programování (např. C++, C#, Visual Studio) a schopnost orientace v technické dokumentaci.</li><li>Angličtinu na úrovni porozumění manuálům a komunikace se zahraničními partnery.</li><li>Zodpovědnost, schopnost komunikovat s externím dodavatelem, reagovat na změny.</li><li>Schopnost práce s technickou dokumentací.</li><li>Základní znalost připojení periferií, převodníků a logiky komponent v oblasti monitoringu a zabezpečení.</li><li>Zkušenost s DCIM nebo BMS systémy je výhodou - pokud ji nemáte, rádi vás zaučíme.</li><li>Znalost komunikačních protokolů jako OPC UA nebo MQTT - výhodou. </li><li>Po kompletním zaučení ochotu držet 1x za měsíc víkendovou pohotovost (na telefonu).</li></ul><h2 class=""typography-heading-small-text""><strong>Co jsme v CRA připravili pro Vás:</strong></h2><ul class=""typography-body-large-text-regular""><li>Jedinečná role, ve které po kompletním zaučení budete předávat know-how ostatním členům týmu.</li><li>Školení v rámci implementace systémů. Na dalším rozvoji se domluvíme individuálně. </li><li>Budete součástí implementace nových systémů v oblasti dohledů a bezpečnosti, můžete spoustu věcí ovlivnit a zanecháte v CRA stopu. </li><li>Pracovní smlouva na dobu neurčitou – férové podmínky a dlouhodobá jistota.</li><li>Flexibilní lokalita – pracoviště na Strahově nebo v Jílovišti (Praha-západ) + možnost částečného home office.</li><li>Motivační bonusový systém – vaše práce bude vidět a bude oceněna.</li><li>Služební automobil i pro osobní užití, notebook, mobil s firemním tarifem a vše, co potřebujete k práci.</li><li>Stravenkový paušál a systém volitelných benefitů – vyberete si, co vám sedí.</li><li>5 týdnů dovolené + 5 dní zdravotního volna – protože odpočinek je důležitý.</li></ul></div>"
