Junior konzultant PKI,SEFIRA spol. s r.o.,https://www.jobs.cz/rpd/2000882854/?utm_source=juniorguru,False,2025-12-13 00:00:00,,cs,,,jobscz#2000882854,,,,,,,,,,Praha,Praha,,,,,,,,,,,,,,,,,,,Praha,Praha,,,,,,,,,,,,,,,,,,,fulltime,parttime,,,,,,,,,"<div data-jobad=""body"" data-test=""jd-body-richtext"" class=""RichContent mb-1400""><p class=""typography-body-medium-text-regular text-secondary mb-600"">Pracovní nabídka</p><p class=""typography-body-large-text-regular mb-800"">Buďte součástí týmu poskytovatelů služeb v oblasti elektronické identity, budování infrastruktury veřejných klíčů (PKI) a implementace HSM technologií.</p><p class=""typography-body-large-text-regular mb-800"">Pracujte s námi pro zajímavé organizace z různých odvětví, jako je energetika, finanční sektor, automobilový průmysl a bezpečnostní složky. Náš tým PKI odborníků poskytuje komplexní řešení správy, distribuce a ochrany klíčů pro elektronický podpis a šifrování, i rozšířené služby při zavádění a provozu HSM.</p><p class=""typography-body-large-text-regular mb-800""><strong>Co vás čeká</strong></p><ul class=""typography-body-large-text-regular""><li>účast na projektech v oblasti informační bezpečnosti (PKI, HSM, elektronický podpis)</li><li>konzultace, implementace a podpora dodávaných řešení</li><li>spolupráce na návrhu technického řešení</li><li>možnost spolupráce na přípravě nabídek</li><li>práce v týmu</li><li>sledování trendů v oboru</li></ul><p class=""typography-body-large-text-regular mb-800""><strong>Co od vás očekáváme my</strong></p><ul class=""typography-body-large-text-regular""><li>zájem o oblasti PKI a digitální důvěry</li><li>samostatnost a iniciativní přístup</li><li>znalost anglického jazyka alespoň na technické úrovni</li><li>ochotu a schopnost učit se a poznávat</li></ul><p class=""typography-body-large-text-regular mb-800""><strong>Milé bude, když přidáte</strong></p><ul class=""typography-body-large-text-regular""><li>znalosti správy OS Linux a Windows Server</li><li>znalosti správy sítí</li></ul><p class=""typography-body-large-text-regular mb-800""><strong>Co vám nabízíme</strong></p><ul class=""typography-body-large-text-regular""><li>flexibilní pracovní dobu s možností občasné práce z domova</li><li>práci v české společnosti na řešeních pro zajímavé zákazníky</li><li>práci se vstřícnými kolegy ochotnými poradit</li><li>prostor pro vlastní rozvoj</li><li>klidné a příjemné pracovní prostředí přímo u metra C – stanice Budějovická</li></ul></div>"
Vývojář – C#/.NET / Delphi,RSM CZ a.s.,https://www.jobs.cz/rpd/2000909947/?utm_source=juniorguru,False,2025-12-13 00:00:00,,cs,,,jobscz#2000909947,,,,,,,,,,Praha,,,,,,,,,,,,,,,,,,,,Praha,,,,,,,,,,,,,,,,,,,,fulltime,,,,,,,,,,"<div data-jobad=""body"" data-test=""jd-body-richtext"" class=""RichContent mb-1400""><p class=""typography-body-medium-text-regular text-secondary mb-600"">Pracovní nabídka</p><p class=""typography-body-large-text-regular mb-800"">Vyvíjíme úspěšný a široce rozšířený mzdový systém AVENSIO. Naší ambicí je stát se leadrem trhu, a proto hledáme další kolegy, kteří nám pomohou s dalším vývojem a rozšiřováním našeho systému.</p><p class=""typography-body-large-text-regular mb-800""><strong>CO BUDE TVÝM ÚKOLEM:</strong></p><ul class=""typography-body-large-text-regular""><li>Vývoj a programování v prostředí Delphi a případně C#/.NET</li><li>Implementace nových funkčností</li><li>Spolupráce na interním testování</li></ul><p class=""typography-body-large-text-regular mb-800""><strong>CO OD TEBE ČEKÁME:</strong></p><ul class=""typography-body-large-text-regular""><li>Znalosti programování v prostředí Delphi</li><li>Znalosti programování v prostředí C#/.NET velkou výhodou</li><li>Zkušenost s mzdovou problematikou zásadní výhodou</li><li>Spolehlivost a odpovědnost za odvedenou práci</li></ul><p class=""typography-body-large-text-regular mb-800""><strong>CO ZA TO NABÍZÍME:</strong></p><ul class=""typography-body-large-text-regular""><li>Flexibilní pracovní dobu, možnost home office</li><li>Dlouhodobou spolupráci v oboru, který je mimořádně stabilní</li><li>Konkurenční finanční podmínky</li><li>Roční bonusy při splnění plánu oddělení</li><li>Stravenkový paušál</li><li>Cafeterie – až 14 000 ročně můžeš utratit v rámci volnočasových aktivit nebo třeba v lékárně</li><li>Multisport karta s příspěvkem</li><li>Zvýhodněný mobilní tarif pro sebe a rodinu</li><li>Bezúročná zaměstnanecká půjčka</li></ul></div>"
Tester ERP systému IS KARAT,KARAT Software a.s.,https://www.jobs.cz/rpd/2000491947/?utm_source=juniorguru,False,2025-12-13 00:00:00,,cs,,,jobscz#2000491947,,,,,,,,,,Přerov,Přerov,,,,,,,,,,,,,,,,,,,Olomouc,Olomouc,,,,,,,,,,,,,,,,,,,fulltime,,,,,,,,,,"<div data-jobad=""body"" data-test=""jd-body-richtext"" class=""RichContent mb-1400""><p class=""typography-body-medium-text-regular text-secondary mb-600"">Pracovní nabídka</p><p class=""typography-body-large-text-regular mb-800""><strong>Hledáme parťáka do týmu testerů!</strong></p><p class=""typography-body-large-text-regular mb-800""><strong>Proč my</strong></p><ul class=""typography-body-large-text-regular""><li>Jsme česká firma, která má drive</li><li>Máme přes 850 spokojených zákazníků (a pořád rosteme!)</li><li>Nejsme korporát - jsme parta lidí, co se v práci i zasměje</li><li>Děláme věci, které mají smysl</li></ul><p class=""typography-body-large-text-regular mb-800""><strong>Co u nás budeš dělat</strong></p><p class=""typography-body-large-text-regular mb-800"">Budeš náš systémový detektiv! Tvým úkolem bude:</p><ul class=""typography-body-large-text-regular""><li>Proklepnout každý kout našeho systému a najít případné mouchy</li><li>Spolupracovat s našimi vývojáři na tom, jak udělat IS KARAT ještě lepší</li><li>Testovat a debuggovat systém IS KARAT v prostředí Visual Studia</li><li>Přicházet s nápady, jak věci dělat jinak a lépe</li></ul><p class=""typography-body-large-text-regular mb-800""><strong>Co by se ti mohlo hodit</strong></p><ul class=""typography-body-large-text-regular""><li>Znalost C#, SQL , TypeScript nebo webových technologií</li><li>Oko pro detail a logické myšlení</li><li>Chuť být součástí týmu, kde jeden druhému pomáhá</li></ul><p class=""typography-body-large-text-regular mb-800""><strong>Co ti za to nabídneme</strong></p><ul class=""typography-body-large-text-regular""><li>Svobodu v práci – flexibilní pracovní doba a možnost občasné práce z domova</li><li>Prostor pro růst – máme rádi lidi, co se chtějí posouvat dál</li><li>Skvělou partu – nejsme jen kolegové, jsme tým</li><li>Smysluplnou práci – přispěješ k dalšímu rozvoji systému díky tvé konstruktivní zpětné vazbě</li></ul><p class=""typography-body-large-text-regular mb-800""><strong>Jak to u nás chodí</strong></p><p class=""typography-body-large-text-regular mb-800"">Nejdřív si nezávazně popovídáme (klidně u dobré kávy ), poznáme se a zjistíme, jestli si sedíme. Žádné složité pohovory – jde nám o tvoje nápady a přístup, nejen o položky v životopise.</p><p class=""typography-body-large-text-regular mb-800"">Tak se ozvi! Rádi ti ukážeme, jak to u nás chodí, a popovídáme si o tom, co od práce očekáváš ty.</p></div>"
Tester/ka – Škoda Connect,IXPERTA s.r.o.,https://www.jobs.cz/rpd/2000894723/?utm_source=juniorguru,False,2025-12-13 00:00:00,,cs,,,jobscz#2000894723,,,,,,,,,,Mladá Boleslav,Mladá Boleslav,,,,,,,,,,,,,,,,,,,Praha,Praha,,,,,,,,,,,,,,,,,,,fulltime,,,,,,,,,,"<div data-jobad=""body"" data-test=""jd-body-richtext"" class=""RichContent mb-1400""><p class=""typography-body-medium-text-regular text-secondary mb-600"">Pracovní nabídka</p><p class=""typography-body-large-text-regular mb-800""><strong>Hledáme spolehlivého a technicky orientovaného kolegu/kolegyni na pozici Tester/ky</strong>, který/á bude ověřovat funkcionality Škoda Connect (MOD) v moderních vozech Škoda. Čeká vás kombinace práce v terénu i v kanceláři, analytické úkoly i reálné testovací jízdy.</p><p class=""typography-body-large-text-regular mb-800""><strong>Náplň práce</strong></p><ul class=""typography-body-large-text-regular""><li>Testování v terénu i kanceláři– účast na jízdách v ČR i zahraničí, provádění Quick Testů, práce s test cases v JIRA a hledání chyb v nestandardních situacích.</li><li>Práce s vozy &amp; bug tracking – kontrola zkouškových vozů, zadávání a sumarizace chyb (JIRA/KPM, Street Worker) a ověřování oprav.</li><li>Reporting &amp; komunikace – spolupráce s Feature Ownery a garanty, pravidelné reporty v JIRA/Excelu a účast na meetingách MOD testerů.</li></ul><p class=""typography-body-large-text-regular mb-800""><strong>Co byste měli mít</strong></p><ul class=""typography-body-large-text-regular""><li>SŠ/VŠ technického směru (elektro, IT, telekomunikace nebo automotive).</li><li>Řidičský průkaz skupiny B – aktivní řidič.</li><li>Analytické myšlení, schopnost hledat souvislosti a příčiny chyb.</li><li>Znalost JIRA (nebo podobného nástroje) a pokročilejší práce v Excelu.</li><li>Komunikativní angličtina nebo němčina (čtení dokumentace, zadávání chyb).</li><li>Ochota cestovat po ČR i zahraničí.</li><li>Výhodou: praxe s testováním infotainmentu nebo konektivity, znalost diagnostických nástrojů VW Group, certifikace ISTQB Foundation.</li></ul><p class=""typography-body-large-text-regular mb-800""><strong>Co vám můžeme nabídnout</strong></p><ul class=""typography-body-large-text-regular""><li>Pracovní zázemí v prostorách vývojového centra Škoda Auta (Mladá Boleslav).</li><li>Práci na moderních technologiích v oblasti digitálních služeb pro automotive.</li><li>Stabilní zázemí, dlouhodobou spolupráci a přátelský kolektiv.</li><li>Zajímavé firemní benefity.</li></ul><p class=""typography-body-large-text-regular mb-800"">(NAB-1656)</p></div>"
Tester (QA Engineer),NAVITEL s.r.o.,https://www.jobs.cz/rpd/2000874975/?utm_source=juniorguru,False,2025-12-13 00:00:00,,en,,,jobscz#2000874975,,,,,,,,,,Praha,Praha,,,,,,,,,,,,,,,,,,,Praha,Praha,,,,,,,,,,,,,,,,,,,fulltime,,,,,,,,,,"<div data-jobad=""body"" data-test=""jd-body-richtext"" class=""RichContent mb-1400""><p class=""typography-body-medium-text-regular text-secondary mb-600"">Pracovní nabídka</p><p class=""typography-body-large-text-regular mb-800""><strong>Tester (QA Engineer) for Navitel DVR Center Mobile Application</strong></p><p class=""typography-body-large-text-regular mb-800""><strong>At Team NAVITEL, we are looking for a passionate QA engineer for manual testing of our Navitel DVR Center mobile application and its interaction with dash cams. Your work will directly impact the quality of a product used daily by thousands of drivers.</strong></p><p class=""typography-body-large-text-regular mb-800""><strong>What you will be doing:</strong></p><p class=""typography-body-large-text-regular mb-800"">* Conduct comprehensive functional testing of the mobile application on iOS and Android</p><p class=""typography-body-large-text-regular mb-800"">* Test the integration and interaction between the mobile application and Navitel dash cams (live video viewing, recording downloads, settings management)</p><p class=""typography-body-large-text-regular mb-800"">* Create and maintain test documentation: checklists, test cases, bug reports</p><p class=""typography-body-large-text-regular mb-800"">* Work closely with the development team and product managers to analyze defects and improve functionality</p><p class=""typography-body-large-text-regular mb-800""><strong>Required qualifications:</strong></p><p class=""typography-body-large-text-regular mb-800"">* Know software testing theory (types, methods, bug life cycle)</p><p class=""typography-body-large-text-regular mb-800"">* Have at least one year of experience in manual testing of mobile applications (iOS/Android)</p><p class=""typography-body-large-text-regular mb-800"">* Be able to write clear and competent test documentation (checklists, test cases) and bug reports</p><p class=""typography-body-large-text-regular mb-800"">* Have experience testing hardware+software solutions (e.g., mobile application + external device)</p><p class=""typography-body-large-text-regular mb-800"">* Understand the specifics of mobile platforms and related types of testing (compatibility, memory management, connection drops)</p><p class=""typography-body-large-text-regular mb-800""><strong>Nice to have:</strong></p><p class=""typography-body-large-text-regular mb-800"">* Experience testing automotive products or dash cams</p><p class=""typography-body-large-text-regular mb-800"">* Possession of a Category B driver's license and a car for conducting testing in real road conditions</p><p class=""typography-body-large-text-regular mb-800"">* Knowledge of auxiliary tools (ADB, Charles/Fiddler, DevTools) and experience testing Bluetooth/Wi-Fi connections</p><p class=""typography-body-large-text-regular mb-800""><strong>We offer:</strong></p><p class=""typography-body-large-text-regular mb-800"">* Interesting tasks and real influence on the quality of a key product</p><p class=""typography-body-large-text-regular mb-800"">* Work in a stable and experienced team</p><p class=""typography-body-large-text-regular mb-800"">* A modern technology stack and adequate management</p><p class=""typography-body-large-text-regular mb-800""><strong>Ready to become our quality guide? We look forward to your resume!</strong></p></div>"
Tester pro Bezrealitky,RSM CZ a.s.,https://www.jobs.cz/rpd/2000915820/?utm_source=juniorguru,False,2025-12-13 00:00:00,,cs,,,jobscz#2000915820,,,,,,,,,,Praha,Praha,,,,,,,,,,,,,,,,,,,Praha,Praha,,,,,,,,,,,,,,,,,,,fulltime,,,,,,,,,,"<div data-jobad=""body"" data-test=""jd-body-richtext"" class=""RichContent mb-1400""><p class=""typography-body-medium-text-regular text-secondary mb-600"">Pracovní nabídka</p><p class=""typography-body-large-text-regular mb-800""><strong>Hledáme manuálního frontendového testera, který bude mít na starosti testování funkcionalit našeho webu</strong> 🚀</p><p class=""typography-body-large-text-regular mb-800"">Přidej se k Bezrealitky, největší online realitní službě s přesahem do zahraničí, a pomoz nám rozvíjet naše služby. Pokud máš zkušenosti se softwarovým testováním, angličtinu na komunikativní úrovni a rád/a pracuješ v dynamickém prostředí, ozvi se nám!</p><p class=""typography-body-large-text-regular mb-800""><strong>Co Tě u nás čeká?</strong> </p><p class=""typography-body-large-text-regular mb-800"">✔ Manuální testování webových aplikací ve všech jazykových mutacích (CZ/SK/EN)</p><p class=""typography-body-large-text-regular mb-800"">✔ Tvorba a exekuce testovacích scénářů</p><p class=""typography-body-large-text-regular mb-800"">✔ Bug reporting a defect management</p><p class=""typography-body-large-text-regular mb-800"">✔ Analýza chyb</p><p class=""typography-body-large-text-regular mb-800"">✔ Psaní projektové dokumentace</p><p class=""typography-body-large-text-regular mb-800"">✔ Technická podpora našemu klientskému centru</p><p class=""typography-body-large-text-regular mb-800"">✔ Spoluúčast při vývoji a blízká komunikace s vývojáři</p><p class=""typography-body-large-text-regular mb-800"">✔ Budování značky Bezrealitky</p><p class=""typography-body-large-text-regular mb-800"">✔ Spolupráce s interními i externími partnery v ČR i v zahraničí<br><br></p><p class=""typography-body-large-text-regular mb-800""><strong>Koho hledáme?</strong></p><p class=""typography-body-large-text-regular mb-800"">🔹Máš zkušenost v testingu (alespoň 1 rok)</p><p class=""typography-body-large-text-regular mb-800"">🔹Češtinu máš na perfektní úrovni (slovem i písmem)</p><p class=""typography-body-large-text-regular mb-800"">🔹Angličtinu ovládáš na komunikativní úrovni (slovem i písmem) – budeš komunikovat s německým týmem</p><p class=""typography-body-large-text-regular mb-800"">🔹Schopnost organizovat a prioritizovat úkoly je pro tebe zásadní. Budeš pracovat na více projektech a testovacích úkolech současně.</p><p class=""typography-body-large-text-regular mb-800"">🔹Máš zkušenost s nástroji – např. Jira, Asana, Redmine, Figma a další</p><p class=""typography-body-large-text-regular mb-800"">🔹Umíš pracovat s operačními systémy (Windows, macOS), běžnými kancelářskými aplikacemi (Microsoft Office, Google Docs) a webovými prohlížeči (Chrome, Firefox, Safari, Edge)</p><p class=""typography-body-large-text-regular mb-800""><strong>Co nabízíme?</strong></p><p class=""typography-body-large-text-regular mb-800"">💼 Práci na zajímavých projektech s reálným dopadem</p><p class=""typography-body-large-text-regular mb-800"">🏡 Možnost částečného Home office</p><p class=""typography-body-large-text-regular mb-800"">👥 Přátelský tým a neformální firemní kultura</p><p class=""typography-body-large-text-regular mb-800"">🌴 5 týdnů dovolené</p><p class=""typography-body-large-text-regular mb-800"">🍕 Stravenkový paušál</p><p class=""typography-body-large-text-regular mb-800"">📖 Kurzy angličtiny</p><p class=""typography-body-large-text-regular mb-800"">📊 Transparentně zadané KPIs</p><p class=""typography-body-large-text-regular mb-800"">📍 Místo: Praha Václavské náměstí</p><p class=""typography-body-large-text-regular mb-800"">📆 Nástup ihned</p><p class=""typography-body-large-text-regular mb-800"">📄 Typ úvazku: Plný úvazek</p></div>"
VÝVOJÁŘ/KA PRO CLOUDOVÝ DOCHÁZKOVÝ SYSTÉM (ASP.NET),IRESOFT s.r.o.,https://www.jobs.cz/rpd/2000896192/?utm_source=juniorguru,False,2025-12-13 00:00:00,,cs,,,jobscz#2000896192,,,,,,,,,,Brno,Brno,,,,,,,,,,,,,,,,,,,Brno,Brno,,,,,,,,,,,,,,,,,,,fulltime,,,,,,,,,,"<div data-jobad=""body"" data-test=""jd-body-richtext"" class=""RichContent mb-1400""><p class=""typography-body-medium-text-regular text-secondary mb-600"">Pracovní nabídka</p><p class=""typography-body-large-text-regular mb-800"">Alveno je <strong>moderní cloudový docházkový systém</strong>, který používají stovky firem po celé republice. Stavíme produkt, který je rychlý, spolehlivý, intuitivní a doplněný o vlastní biometrické čtečky. Nahrazujeme docházky z devadesátek a posouváme je na úroveň, která odpovídá roku 2025. Postupně přecházíme na <strong>.NET Core</strong> a máme vlastní <strong>mobilní aplikaci v Reactu</strong>.</p><p class=""typography-body-large-text-regular mb-800"">Hledáme vývojáře, který chce tvořit software, na kterém skutečně záleží, a který umí přemýšlet v souvislostech, spolupracovat a posouvat produkt i sebe.</p><p class=""typography-body-large-text-regular mb-800""><strong>PROČ O NAŠÍ NABÍDCE PŘEMÝŠLET?</strong></p><ul class=""typography-body-large-text-regular""><li><strong>Stabilní a ověřený produkt</strong> – více než 150 000 uživatelů, mezi naše zákazníky patří např. Zásilkovna, Brainmarket, Footshop a další.</li><li><strong>Technologický stack</strong> – C#, .NET Framework 4.8, ASP MVC, REST API, NHibernate, MS SQL, Git, JavaScript, jQuery, CSS a práce s moderním HW běžícím na Windows.</li><li><strong>Smysluplná práce</strong> – budeš vyvíjet nové funkce i zlepšovat ty stávající. Produkt reálně roste, má jasnou roadmapu a dlouhodobý směr.</li><li><strong>Agilní prostředí</strong> – jedeme v Kanbanu, sdílíme, děláme pravidelné retrospektivy, zlepšujeme se.</li><li><strong>Zkušený tým</strong> – 1 product owner, obchod, konzultanti, marketing a 3–5 vývojářů, kteří táhnou za jeden provaz.</li><li><strong>Mentoring &amp; onboarding</strong> – od prvního dne máš mentora, který ti pomáhá růst a dává pravidelnou zpětnou vazbu.</li><li><strong>Flexibilita a důvěra</strong> – po zapracování 2–3 dny týdně z domu, podle tvé potřeby.</li><li><strong>Firemní kultura</strong> – svobodná firma, otevřenost, férové vztahy, spolupráce namísto mikromanagementu.</li><li><strong>Benefity</strong> – 6 týdnů dovolené, home office, promakaný well-being program (koučink, terapie, masáže), jazykové i odborné vzdělávání, stravenkový paušál, skvělá káva, dobroty, akce a příjemné kanceláře na Purkyňově.<strong><br></strong></li></ul><p class=""typography-body-large-text-regular mb-800""><strong>TVOJE KLÍČOVÉ DOVEDNOSTI:</strong></p><p class=""typography-body-large-text-regular mb-800""><strong>(záleží nám na tom co umíš, ne jak dlouho to děláš)</strong></p><p class=""typography-body-large-text-regular mb-800""><strong>Tvorba webových aplikací v .NET</strong> – rozumíš C#, .NET technologiím a dokážeš si upravit i část frontendu.<br><strong>Kvalita kódu</strong> – přemýšlíš nad architekturou, píšeš čistý a udržitelný kód, umíš navrhnout řešení.<br><strong>Práce s daty</strong> – MS SQL nebo jiná relační DB je pro tebe přirozená součást práce.<br><strong>API komunikace</strong> – REST zvládáš bez zaváhání.<br><strong>Týmová spolupráce</strong> – sdílíš, nasloucháš, dáš i přijmeš zpětnou vazbu.<br><strong>Agilní mindset</strong> – iterativní vývoj, otevřenost a chuť zlepšovat se.</p><p class=""typography-body-large-text-regular mb-800"">(<em>Znalost Reactu je výhodou, ne nutností.</em>)</p><p class=""typography-body-large-text-regular mb-800""><strong>CO TI NABÍZÍME?</strong></p><p class=""typography-body-large-text-regular mb-800""><strong>Mentoring a vedení</strong></p><p class=""typography-body-large-text-regular mb-800"">Od prvního dne na to nebudeš sám/sama. Po boku ti bude senior vývojář Tom a další lidi z týmu, kteří tě provedou tvými začátky a pomůžou ti se v nové roli pohodlně usadit. A velmi brzy poznáš i ostatní iresofťáky, kteří ti rádi pomůžou, kdykoli budeš potřebovat.  </p><p class=""typography-body-large-text-regular mb-800""><strong>Tým, který drží spolu</strong></p><p class=""typography-body-large-text-regular mb-800"">Alveno je tým, který si pomáhá a mluví spolu otevřeně. Máme různé názory, ale společný cíl - dodávat zákazníkům ty nejlepší produkty. Když něco nefunguje, hledáme cestu společně.</p><p class=""typography-body-large-text-regular mb-800""><strong>Smysluplnou práci</strong></p><p class=""typography-body-large-text-regular mb-800"">V Alvenu vyvíjíme něco, co lidem reálně pomáhá. Každá funkce, kterou navrhneš nebo vylepšíš, má přímý dopad na to, jak firmy plánují směny, řeší příchody, odchody i docházkové rituály, které ovlivňují celé týmy. Místo „dalšího interního systému“ stavíš produkt, který denně používá přes sto padesát tisíc lidí. Vidíš výsledky své práce v praxi rychle, konkrétně a bez zbytečných vrstev mezi tebou a uživatelem. A když přijdeš s lepším nápadem, zapadne do roadmapy, ne do šuplíku.</p><p class=""typography-body-large-text-regular mb-800""><strong>NAVÍC SE MŮŽEŠ TĚŠIT NA:</strong></p><ul class=""typography-body-large-text-regular""><li>Prostředí, kde se hodně staví <strong>na důvěře, vztazích a otevřené komunikaci.</strong></li><li>Reálná <strong>možnost ovlivnit produkt</strong>, který používají tisíce lidí každý den.</li><li>Můžeš se podívat na Atmoskop a ověřit si, co o nás <strong>bez cenzury</strong> říkají naši zaměstnanci.<strong><br></strong></li><li>Úspěchy umíme jako tým samozřejmě i pořádně <strong>oslavit.</strong></li></ul><p class=""typography-body-large-text-regular mb-800""><strong>JAK PROBÍHÁ VÝBĚRKO</strong>:</p><p class=""typography-body-large-text-regular mb-800"">(Výběrko držíme <strong>rychlé, férové a s jasnou zpětnou vazbou</strong>.)</p><ul class=""typography-body-large-text-regular""><li>1. kolo (30 min) probíhá přes Teams, potkáš se se seniorním programátorem, zpětnou vazbu dostaneš do tří dnů. Pokud postoupíš, zadáme ti úkol.</li><li>2. kolo (1 hodina) - osobně nebo online, předem pošleš úkol, na 2. kole dostáváš kvalitní feedback na zpracování. Rozhodnutí dostaneš do tří dnů.</li><li>Pokud postoupíš, dostaneš příležitost poznat celý tým i jeho CEO, tak abys měl všechny potřebné informace pro své rozhodnutí.</li></ul><p class=""typography-body-large-text-regular mb-800""><strong>CHCEŠ SE PŘIDAT?</strong></p><p class=""typography-body-large-text-regular mb-800"">Hledáme vývojáře, který chce<strong> tvořit software, na kterém skutečně záleží</strong>. Parťáka, který umí přemýšlet v souvislostech, spolupracovat a bude posouvat produkt i sebe.</p><p class=""typography-body-large-text-regular mb-800"">Hledáme člověka, <strong>ne odrážky v životopisu.</strong></p><p class=""typography-body-large-text-regular mb-800"">Napiš nám <strong>něco o sobě, třeba co tě baví na vývoji a proč tě láká právě naše Alveno.</strong></p><p class=""typography-body-large-text-regular mb-800""><strong>Rádi se s tebou potkáme!</strong></p></div>"
