VÝVOJÁŘ/KA PRO CLOUDOVÝ DOCHÁZKOVÝ SYSTÉM (ASP.NET),IRESOFT s.r.o.,https://www.jobs.cz/rpd/2000896192/?utm_source=juniorguru,False,2025-12-06 00:00:00,,cs,,,jobscz#2000896192,,,,,,,,,,Brno,Brno,,,,,,,,,,,,,,,,,,,Brno,Brno,,,,,,,,,,,,,,,,,,,fulltime,,,,,,,,,,"<div data-jobad=""body"" data-test=""jd-body-richtext"" class=""RichContent mb-1400""><p class=""typography-body-medium-text-regular text-secondary mb-600"">Pracovní nabídka</p><p class=""typography-body-large-text-regular mb-800"">Alveno je <strong>moderní cloudový docházkový systém</strong>, který používají stovky firem po celé republice. Stavíme produkt, který je rychlý, spolehlivý, intuitivní a doplněný o vlastní biometrické čtečky. Nahrazujeme docházky z devadesátek a posouváme je na úroveň, která odpovídá roku 2025. Postupně přecházíme na <strong>.NET Core</strong> a máme vlastní <strong>mobilní aplikaci v Reactu</strong>.</p><p class=""typography-body-large-text-regular mb-800"">Hledáme vývojáře, který chce tvořit software, na kterém skutečně záleží, a který umí přemýšlet v souvislostech, spolupracovat a posouvat produkt i sebe.</p><p class=""typography-body-large-text-regular mb-800""><strong>PROČ O NAŠÍ NABÍDCE PŘEMÝŠLET?</strong></p><ul class=""typography-body-large-text-regular""><li><strong>Stabilní a ověřený produkt</strong> – více než 150 000 uživatelů, mezi naše zákazníky patří např. Zásilkovna, Brainmarket, Footshop a další.</li><li><strong>Technologický stack</strong> – C#, .NET Framework 4.8, ASP MVC, REST API, NHibernate, MS SQL, Git, JavaScript, jQuery, CSS a práce s moderním HW běžícím na Windows.</li><li><strong>Smysluplná práce</strong> – budeš vyvíjet nové funkce i zlepšovat ty stávající. Produkt reálně roste, má jasnou roadmapu a dlouhodobý směr.</li><li><strong>Agilní prostředí</strong> – jedeme v Kanbanu, sdílíme, děláme pravidelné retrospektivy, zlepšujeme se.</li><li><strong>Zkušený tým</strong> – 1 product owner, obchod, konzultanti, marketing a 3–5 vývojářů, kteří táhnou za jeden provaz.</li><li><strong>Mentoring &amp; onboarding</strong> – od prvního dne máš mentora, který ti pomáhá růst a dává pravidelnou zpětnou vazbu.</li><li><strong>Flexibilita a důvěra</strong> – po zapracování 2–3 dny týdně z domu, podle tvé potřeby.</li><li><strong>Firemní kultura</strong> – svobodná firma, otevřenost, férové vztahy, spolupráce namísto mikromanagementu.</li><li><strong>Benefity</strong> – 6 týdnů dovolené, home office, promakaný well-being program (koučink, terapie, masáže), jazykové i odborné vzdělávání, stravenkový paušál, skvělá káva, dobroty, akce a příjemné kanceláře na Purkyňově.<strong><br></strong></li></ul><p class=""typography-body-large-text-regular mb-800""><strong>TVOJE KLÍČOVÉ DOVEDNOSTI:</strong></p><p class=""typography-body-large-text-regular mb-800""><strong>(záleží nám na tom co umíš, ne jak dlouho to děláš)</strong></p><p class=""typography-body-large-text-regular mb-800""><strong>Tvorba webových aplikací v .NET</strong> – rozumíš C#, .NET technologiím a dokážeš si upravit i část frontendu.<br><strong>Kvalita kódu</strong> – přemýšlíš nad architekturou, píšeš čistý a udržitelný kód, umíš navrhnout řešení.<br><strong>Práce s daty</strong> – MS SQL nebo jiná relační DB je pro tebe přirozená součást práce.<br><strong>API komunikace</strong> – REST zvládáš bez zaváhání.<br><strong>Týmová spolupráce</strong> – sdílíš, nasloucháš, dáš i přijmeš zpětnou vazbu.<br><strong>Agilní mindset</strong> – iterativní vývoj, otevřenost a chuť zlepšovat se.</p><p class=""typography-body-large-text-regular mb-800"">(<em>Znalost Reactu je výhodou, ne nutností.</em>)</p><p class=""typography-body-large-text-regular mb-800""><strong>CO TI NABÍZÍME?</strong></p><p class=""typography-body-large-text-regular mb-800""><strong>Mentoring a vedení</strong></p><p class=""typography-body-large-text-regular mb-800"">Od prvního dne na to nebudeš sám/sama. Po boku ti bude senior vývojář Tom a další lidi z týmu, kteří tě provedou tvými začátky a pomůžou ti se v nové roli pohodlně usadit. A velmi brzy poznáš i ostatní iresofťáky, kteří ti rádi pomůžou, kdykoli budeš potřebovat.  </p><p class=""typography-body-large-text-regular mb-800""><strong>Tým, který drží spolu</strong></p><p class=""typography-body-large-text-regular mb-800"">Alveno je tým, který si pomáhá a mluví spolu otevřeně. Máme různé názory, ale společný cíl - dodávat zákazníkům ty nejlepší produkty. Když něco nefunguje, hledáme cestu společně.</p><p class=""typography-body-large-text-regular mb-800""><strong>Smysluplnou práci</strong></p><p class=""typography-body-large-text-regular mb-800"">V Alvenu vyvíjíme něco, co lidem reálně pomáhá. Každá funkce, kterou navrhneš nebo vylepšíš, má přímý dopad na to, jak firmy plánují směny, řeší příchody, odchody i docházkové rituály, které ovlivňují celé týmy. Místo „dalšího interního systému“ stavíš produkt, který denně používá přes sto padesát tisíc lidí. Vidíš výsledky své práce v praxi rychle, konkrétně a bez zbytečných vrstev mezi tebou a uživatelem. A když přijdeš s lepším nápadem, zapadne do roadmapy, ne do šuplíku.</p><p class=""typography-body-large-text-regular mb-800""><strong>NAVÍC SE MŮŽEŠ TĚŠIT NA:</strong></p><ul class=""typography-body-large-text-regular""><li>Prostředí, kde se hodně staví <strong>na důvěře, vztazích a otevřené komunikaci.</strong></li><li>Reálná <strong>možnost ovlivnit produkt</strong>, který používají tisíce lidí každý den.</li><li>Můžeš se podívat na Atmoskop a ověřit si, co o nás <strong>bez cenzury</strong> říkají naši zaměstnanci.<strong><br></strong></li><li>Úspěchy umíme jako tým samozřejmě i pořádně <strong>oslavit.</strong></li></ul><p class=""typography-body-large-text-regular mb-800""><strong>JAK PROBÍHÁ VÝBĚRKO</strong>:</p><p class=""typography-body-large-text-regular mb-800"">(Výběrko držíme <strong>rychlé, férové a s jasnou zpětnou vazbou</strong>.)</p><ul class=""typography-body-large-text-regular""><li>1. kolo (30 min) probíhá přes Teams, potkáš se se seniorním programátorem, zpětnou vazbu dostaneš do tří dnů. Pokud postoupíš, zadáme ti úkol.</li><li>2. kolo (1 hodina) - osobně nebo online, předem pošleš úkol, na 2. kole dostáváš kvalitní feedback na zpracování. Rozhodnutí dostaneš do tří dnů.</li><li>Pokud postoupíš, dostaneš příležitost poznat celý tým i jeho CEO, tak abys měl všechny potřebné informace pro své rozhodnutí.</li></ul><p class=""typography-body-large-text-regular mb-800""><strong>CHCEŠ SE PŘIDAT?</strong></p><p class=""typography-body-large-text-regular mb-800"">Hledáme vývojáře, který chce<strong> tvořit software, na kterém skutečně záleží</strong>. Parťáka, který umí přemýšlet v souvislostech, spolupracovat a bude posouvat produkt i sebe.</p><p class=""typography-body-large-text-regular mb-800"">Hledáme člověka, <strong>ne odrážky v životopisu.</strong></p><p class=""typography-body-large-text-regular mb-800"">Napiš nám <strong>něco o sobě, třeba co tě baví na vývoji a proč tě láká právě naše Alveno.</strong></p><p class=""typography-body-large-text-regular mb-800""><strong>Rádi se s tebou potkáme!</strong></p></div>"
IT Analytik junior,OLTIS Group a.s.,https://www.jobs.cz/rpd/2000904258/?utm_source=juniorguru,False,2025-12-06 00:00:00,,cs,,,jobscz#2000904258,,,,,,,,,,Olomouc,Olomouc,,,,,,,,,,,,,,,,,,,Olomouc,Olomouc,,,,,,,,,,,,,,,,,,,fulltime,,,,,,,,,,"<div data-jobad=""body"" data-test=""jd-body-richtext"" class=""RichContent mb-1400""><p class=""typography-body-medium-text-regular text-secondary mb-600"">Pracovní nabídka</p><p class=""typography-body-large-text-regular mb-800""><em>Analytik u nás propojuje požadavky zákazníků z oblasti železniční dopravy a vývojovým týmem. K této roli proto potřebujeme člověka, který rozumí nejen IT, ale umí také jasně komunikovat a dokáže si stát za svým návrhem. Máš tyto dovednosti? Pak u nás můžeš vyrůst na skvělého analytika!</em></p><h2 class=""typography-heading-small-text"">Co u nás budeš mít na starost:</h2><ul class=""typography-body-large-text-regular""><li>Budeš se podílet na tom,<strong> jak naše aplikace vznikají a jak se dál rozvíjejí.</strong></li><li>Zjistíš, <strong>co zákazníci opravdu potřebují</strong>, a budeš s nimi i s vývojáři v pravidelném kontaktu.</li><li><strong>Pomůžeš navrhovat, jak má systém fungovat</strong> – od procesů přes datový model až po samotnou logiku aplikace.</li><li><strong>Připravíš srozumitelnou dokumentaci</strong>, aby se v ní vyznali jak kolegové, tak i koncoví uživatelé.</li></ul><h2 class=""typography-heading-small-text"">Co u tebe oceníme:</h2><ul class=""typography-body-large-text-regular""><li>Umíš se dívat na věci do hloubky, <strong>přemýšlet v souvislostech a hledat řešení.</strong></li><li><strong>Máš základní představu o objektové analýze</strong> (UML nebo zkušenost s Enterprise Architect je super bonus).</li><li>Pokud znáš<strong> SQL</strong>, určitě se ti to bude hodit.</li><li>Výhodou je i přehled o železniční či jiné dopravě, ale není to nutnost – rádi tě vše naučíme.</li><li>Dokážeš<strong> srozumitelně komunikovat</strong>, a to jak mluvené, tak písemné formě.</li><li>Jsi <strong>týmový hráč</strong>, který je ochotný spolupracovat a společně posouvat vývoj dál.</li></ul><h2 class=""typography-heading-small-text"">Co ti za to nabízíme:</h2><ul class=""typography-body-large-text-regular""><li>Možnost podílet se na <strong>klíčových informačních systémech</strong>, které ovlivňují fungování železniční dopravy.</li><li>Zázemí <strong>stabilní společnosti</strong> s mezinárodním přesahem, ale bez korporátních manýrů – u nás je prostředí přátelské, neformální a férové.</li><li>Práci v <strong>moderním a pohodlném prostředí</strong> naší vlastní budovy v <strong>Olomouci</strong>.</li><li><strong>Tým zkušených kolegů</strong>, kteří ti pomohou odborně i osobnostně růst.</li><li><strong>Spravedlivé finanční ohodnocení</strong> odpovídající tvým schopnostem, nasazení a zkušenostem + cílové odměny.</li><li><strong>Flexibilní pracovní dobu</strong> a možnost domluvit se na <strong>home office</strong> – na všem se domluvíme.</li><li>A k tomu <strong>balíček výhod,</strong> který potěší: 5 týdnů dovolené, 3 sick days, MultiSport karta, vlastní posilovna, masáže, příspěvek na stravování, jazykové/odborné kurzy, výhody u T-Mobile i zvýhodněná InKarta.</li></ul><p class=""typography-body-large-text-regular mb-800"">Více informací najdeš na <strong>https://kariera.oltis.cz/</strong></p><p class=""typography-body-large-text-regular mb-800""><strong>Těšíme se na Tebe!</strong></p></div>"
Tester/ Junior Tester - Jihlava - i absolventi,QUICKSOURCE spol. s r. o.,https://www.jobs.cz/rpd/2000906167/?utm_source=juniorguru,False,2025-12-06 00:00:00,,cs,,,jobscz#2000906167,,,,,,,,,,České Budějovice,,,,,,,,,,,,,,,,,,,,České Budějovice,,,,,,,,,,,,,,,,,,,,fulltime,parttime,,,,,,,,,"<div data-jobad=""body"" data-test=""jd-body-richtext"" class=""RichContent mb-1400""><p class=""typography-body-medium-text-regular text-secondary mb-600"">Pracovní nabídka</p><p class=""typography-body-large-text-regular mb-800""><strong>Baví tě hledání chyb</strong> a jejich opravování a chceš pracovat v Jihlavě?</p><p class=""typography-body-large-text-regular mb-800"">Jsi na správném místě!</p><p class=""typography-body-large-text-regular mb-800"">My<strong> hledáme několik testerů a junior testerů</strong> pro doplnění testovacího týmu.</p><p class=""typography-body-large-text-regular mb-800"">Příležitost i pro juniory po škole.</p><p class=""typography-body-large-text-regular mb-800"">Tým vede zkušený manažer.</p><p class=""typography-body-large-text-regular mb-800"">Příjemné kanceláře v centru Jihlavy.</p><p class=""typography-body-large-text-regular mb-800"">Chcete začít s testováním nebo získat další zkušenosti v oblasti testování?</p><p class=""typography-body-large-text-regular mb-800"">Máte angličtinu na úrovni porozumění psanému technickému textu?</p><p class=""typography-body-large-text-regular mb-800"">Napište nám!</p><p class=""typography-body-large-text-regular mb-800""><strong>Co vám nabízíme:</strong></p><ul class=""typography-body-large-text-regular""><li>Získání nových zkušeností v oblasti testování</li><li>Začátek spolupráce možný ihned.</li><li>Dlouhodobá spolupráce.</li><li>Spolupráce na IČO nebo DPP.</li><li>Možnost práce na částečný úvazek (min. 6h denně).</li><li>Ohodnocení podle vašich zkušeností v oblasti testování.</li></ul><p class=""typography-body-large-text-regular mb-800""><strong>Náplň práce:</strong></p><ul class=""typography-body-large-text-regular""><li>Provádění testů</li><li>Reporting o stavu a průběhu testů s využitím test management nástroje</li><li>Spolupráce s koncovými uživateli, analytiky, vývojem atd.</li><li>Sestavování testovacích scénářů na základě business analýzy</li></ul><p class=""typography-body-large-text-regular mb-800""><strong>Co očekáváme od vás:</strong></p><ul class=""typography-body-large-text-regular""><li>Vzdělání v oblasti IT nebo technické oblasti</li><li>Zkušenost s testováním a nástroji na podporu testování jsou velkou výhodou</li><li>Angličtina na úrovni porozumění psanému textu (studium dokumentace, písemná komunikace)</li><li>Výhodou je znalost SQL</li></ul><p class=""typography-body-large-text-regular mb-800"">Jakékoliv další zkušenosti jsou velkým plusem.</p><p class=""typography-body-large-text-regular mb-800"">V případě zájmu prosím zašlete své CV co nejdříve. Děkujeme.</p></div>"
Vývojář JAVA,ORTEX spol. s r.o.,https://www.jobs.cz/rpd/2000904968/?utm_source=juniorguru,False,2025-12-06 00:00:00,,cs,,,jobscz#2000904968,,,,,,,,,,Hradec Králové,Hradec Králové,,,,,,,,,,,,,,,,,,,Hradec Králové,Hradec Králové,,,,,,,,,,,,,,,,,,,fulltime,,,,,,,,,,"<div data-jobad=""body"" data-test=""jd-body-richtext"" class=""RichContent mb-1400""><p class=""typography-body-medium-text-regular text-secondary mb-600"">Pracovní nabídka</p><p class=""typography-body-large-text-regular mb-800""><strong>ORTEX hledá nové kolegy pro rozšíření svého týmu v oblasti tvorby moderních business aplikací. Nejsme korporát, spíše rodinná firma, kde najdete smysl a osobní přístup.</strong></p><h2 class=""typography-heading-small-text"">Vývojář Java</h2><p class=""typography-body-large-text-regular mb-800"">Hledáme posilu do týmu, který vyvíjí originální řešení pro automatizaci procesů obchodu, výroby, financí i řízení lidských zdrojů.</p><h2 class=""typography-heading-small-text"">Co budete dělat:</h2><ul class=""typography-body-large-text-regular""><li>Vývoj a podpora podnikových informačních systémů. Využíváme převážně jazyk Java.</li><li>Návrh řešení konkrétních úloh na základě vstupů od analytiků a požadavků zákazníků.</li><li>Vývoj, optimalizaci kódu, dokumentaci.</li><li>Testování výsledků své práce, hledání a odstraňování chyb.</li><li>Podpora konzultantů, řešení složitějších problémů zákazníků.</li></ul><h2 class=""typography-heading-small-text"">Co od vás očekáváme nebo co se budete muset naučit?</h2><ul class=""typography-body-large-text-regular""><li>Praktickou znalost některého objektového programovacího jazyka (Java, C#, …) a SQL.</li><li>Vzdělání SŠ nebo VŠ.</li><li>Analytické myšlení, houževnatost a vytrvalost, iniciativu.</li><li>Schopnost práce v týmu, dodržování standardů, best practices.</li><li>Java, Hibernate, Enterprise Architect, DB: ORACLE, MS SQL Server.</li><li>Vítána je také alespoň dílčí znalost podnikových procesů.</li><li>Schopnost práce v týmu, tvorba a dodržování standardů, best practices.</li><li>Soulad s firemními hodnotami otevřené přátelské komunikace, spolehlivé a aktivní spolupráce.</li></ul><h2 class=""typography-heading-small-text"">Co nabízíme?</h2><ul class=""typography-body-large-text-regular""><li>Hlavní pracovní poměr – 40tihodinový týdenní úvazek. Možno ale začít i částečným úvazkem od 50%.</li><li>Příležitost ke startu kariéry i k odbornému rozvoji.</li><li>Získání praktických zkušeností od seniorních kolegů i zpětné vazby od zákazníků z řady oborů, z celé České republiky.</li><li>Přátelské, stabilní prostředí a smysluplná činnost pro reálné zákazníky.</li><li>Přístup k aktuálním technologiím a systémům – používáme nejmodernější informační technologie (Microsoft Office 365, CRM, cloud, sociální sítě, AI nástroje), využíváme benefity Microsoft partnerství.</li><li>Rostoucí platové ohodnocení na základě výsledků a přínosů pro firmu a zákazníky.</li><li>Pracoviště v centru Hradce Králové s pružnou pracovní dobou.</li><li>5 týdnů dovolené, stravenková karta, možnost home office.</li><li>Školení a certifikace, kurz angličtiny v pracovní době.</li></ul></div>"
Backend Developer,"MoroSystems, s.r.o.",https://www.jobs.cz/rpd/2000479393/?utm_source=juniorguru,False,2025-12-06 00:00:00,,cs,,,jobscz#2000479393,,,,,,,,,,Hradec Králové,Hradec Králové,,,,,,,,,,,,,,,,,,,Hradec Králové,Hradec Králové,,,,,,,,,,,,,,,,,,,fulltime,,,,,,,,,,"<div data-jobad=""body"" data-test=""jd-body-richtext"" class=""RichContent mb-1400""><p class=""typography-body-medium-text-regular text-secondary mb-600"">Pracovní nabídka</p><p class=""typography-body-large-text-regular mb-800"">Ať už ti vyhovuje práce na dlouhodobém projektu nebo spíš preferuješ variabilitu, máme ti co nabídnout. Momentálně se věnujeme hlavně <strong>vývoji řešení na zakázku</strong> pro různé typy klientů, <strong>nadnárodní korporace</strong> i <strong>české startupy,</strong> ale umíme zákazníkům pomoci i s jejich <strong>nestandardními požadavky</strong>. Důležité je, aby nám fungovala <strong>vzájemná spolupráce</strong>. Primárně se potkáváme v kancelářích (Brno, Hradec nebo Praha), ale pokud potřebuješ, můžeš občas pracovat i z domu.</p><p class=""typography-body-large-text-regular mb-800"">V současné chvíli rozjíždíme také menší projekty, které jsou různorodé a kde budeš moci zastřešit různé pozice,<strong> stereotyp ti rozhodně nehrozí</strong>. Může tě čekat <strong>občasné vedení týmu</strong>, na jiném projektu můžeš <strong>psát kód</strong>, na dalším budeš zase zodpovědný za <strong>rozjezd projektu</strong> jako takového. Pokud chceš být u těchto zajímavých projektů s námi, pak jsi tady správně!</p><h2 class=""typography-heading-small-text""><strong>S JAKÝMI TECHNOLOGIEMI SE U NÁS POTKÁŠ?</strong></h2><p class=""typography-body-large-text-regular mb-800"">Pracujeme s technologiemi, které opravdu dobře známe, zároveň sledujeme trendy a technologický stack tak stavíme na míru projektu. Jsme experti na jazyk Java/Kotlin, všechny jeho možnosti a prostředky. Potkáš se hlavně s následujícím:</p><ul class=""typography-body-large-text-regular""><li><strong>Java, Kotlin, Spring a Spring Boot, Hibernate, MyBatis nebo jOOQ, Rest, JUnit/Kotest, WebFlux, Liquibase a Swagger</strong> pro vývoj.</li><li><strong>Gradle a Maven</strong> k buildování.</li><li><strong>GIT a GitLab</strong> pro verzování a code review.</li><li><strong>GitLab Pipelines</strong> pro CI/CD.</li><li><strong>Detekt nebo Sonar</strong> pro statickou analýzu kódu.</li><li>Z databází nejčastěji <strong>PostgreSQL, ale taky Oracle, MySQL, MS SQL nebo MongoDB.</strong></li><li>Potkáš se u nás s cloud řešeními jako je <strong>AWS, Microsoft Azure a Google Cloud</strong>, včetně podpůrných nástrojů (<strong>Kubernetes, Pulumi, Terraform</strong>). Na kontejnerizaci máme <strong>Docker</strong>. Používáme taky stack <strong>Atlassian nástrojů</strong> – Jira a Confluence a další, což nám dost usnadňuje práci. Baví nás <strong>agilní přístup a spolupráce</strong> s kolegy i zákazníkem.</li></ul><p class=""typography-body-large-text-regular mb-800"">Pokud bys chtěl/a nahlédnout i do frontendového světa, najdeš u nás hlavně React, Redux + Immutable.js, Redux-form, Redux-saga/RTK Query, Reselect, Eslint</p><p class=""typography-body-large-text-regular mb-800""><strong>Vůbec nevadí, pokud jsi s některou z technologií nepracoval/a</strong>. Základem pro nás je, že máš komerční zkušenosti s vývojem v <strong>Javě/Kotlinu</strong>, jsi samostatný/á, nevadí ti <strong>občasné cestování</strong> a jsi otevřený pro <strong>práci u zákazníka</strong>. Oceníme, pokud sleduješ nové technologie a trendy a třeba nám přineseš i nový pohled na věc. Zásadní je tvá <strong>chuť věci posouvat, zlepšovat se a odvádět kvalitní práci – k tomu rozhodně dostaneš prostor.</strong></p><h2 class=""typography-heading-small-text""><strong>LÍBIT SE TI U NÁS BUDE, POKUD TI VYHOVUJE</strong></h2><ul class=""typography-body-large-text-regular""><li><strong>Pracovat ve firmě se silnou vizí</strong> – chceme, aby se náš způsob spolupráce stal zcela novým standardem, který bude chtít aplikovat každá firma na světě.</li><li><strong>Komunikovat otevřeně</strong> – máš nápad na zlepšení? Řekni ho klidně Tomovi (CEO) třeba u kafe v kuchyňce.</li><li><strong>Učit se od ostatních</strong> – učíme se navzájem a učí se od nás i ostatní. Nové znalosti, novinky z projektů či konferencí sdílíme napříč firmou, přednášíme na MeetUpech, natáčíme podcasty, píšeme články…</li><li><strong>Sdílet své koníčky</strong> a objevovat nové – standardně pořádáme turnaje v badmintonu nebo Buláncích, hackathony, deskovky, běháme pro Světlušku, jezdíme na kole, chodíme po horách, trénujeme na Spartan race… a tím seznam nekončí.</li><li><strong>Mít možnost výběru – Lenovo nebo Mac</strong>; macOS, Windows nebo Linux, IDEA, Eclipse nebo NetBeans... – je to na tobě.</li><li><strong>Mít flexibilní pracovní dobu</strong> – potřebuješ skončit dřív nebo si ráno hodinu (nebo čtyři) přispat? Pokud nemáš žádné meetingy a nečeká na tebe zákazník, tak proč ne?</li><li>Pracovat z home-office – rádi se potkáváme v kancelářích, ale pokud občas potřebuješ pracovat z domu, nebude to problém.</li></ul><h2 class=""typography-heading-small-text""><br><strong>JAKÉ TO JE V HRADECKÉ KANCELÁŘI?<br></strong></h2><ul class=""typography-body-large-text-regular""><li>Office v centru Hradce má opravdu rodinnou atmosféru. Je nás tu asi 40 a většina lidí tu s námi je hezkých pár let.</li><li>Pákový kávovar a kvalitní káva, kterou měníme na kód, je samozřejmostí.</li><li>Letní grilovačky pořádáme na dvorku u kanceláře.</li><li>Sednou ti kolegové a chcete se potkávat i mimo kancelář? Možností je spousta! Jarní návštěva pivovaru, na podzim Svatomartinská husa, squashový turnaj, společné běžecké závody/štafety, Spartan Race, zářijová chalupa s rodinami, kde se dlabou dýně nebo střílí ze vzduchovky. A v prosinci chodí Mikuláš!</li><li>Těšit se můžeš na talentované, kreativní a vtipné kolegy. Vše pochopíš, až uvidíš fotky z akcí, naše výtvory na chytré zdi nebo sérii memes na Slacku.</li></ul><h2 class=""typography-heading-small-text""><strong>MÁŠ POCIT, ŽE BY NÁM TO SPOLEČNĚ MOHLO FUNGOVAT?</strong></h2><p class=""typography-body-large-text-regular mb-800"">Ozvi se, rádi si o tom popovídáme. Pro začátek nám bude stačit tvé CV nebo LinkedIn profil. Těšíme se na setkání!</p></div>"
