title,company_name,url,remote,first_seen_at,last_seen_at,lang,juniority_score,source,external_ids_0,external_ids_1,external_ids_2,external_ids_3,external_ids_4,external_ids_5,external_ids_6,external_ids_7,external_ids_8,external_ids_9,locations_0_name,locations_1_name,locations_2_name,locations_3_name,locations_4_name,locations_5_name,locations_6_name,locations_7_name,locations_8_name,locations_9_name,locations_10_name,locations_11_name,locations_12_name,locations_13_name,locations_14_name,locations_15_name,locations_16_name,locations_17_name,locations_18_name,locations_19_name,locations_0_region,locations_1_region,locations_2_region,locations_3_region,locations_4_region,locations_5_region,locations_6_region,locations_7_region,locations_8_region,locations_9_region,locations_10_region,locations_11_region,locations_12_region,locations_13_region,locations_14_region,locations_15_region,locations_16_region,locations_17_region,locations_18_region,locations_19_region,employment_types_0,employment_types_1,employment_types_2,employment_types_3,employment_types_4,employment_types_5,employment_types_6,employment_types_7,employment_types_8,employment_types_9,description_html
Zajímá Tě kyber bezpečnost? Doplňujeme tým o nové CYBER SECURITY OPERATORy,NEXT GENERATION SECURITY SOLUTIONS s.r.o.,https://www.jobs.cz/rpd/2000604054/,False,2025-06-07 00:00:00,,cs,,,jobscz#2000604054,,,,,,,,,,Praha,Praha,,,,,,,,,,,,,,,,,,,Praha,Praha,,,,,,,,,,,,,,,,,,,fulltime,,,,,,,,,,"<div data-jobad=""body"" data-test=""jd-body-richtext"" class=""RichContent mb-1400""><p class=""typography-body-medium-text-regular text-secondary mb-600"">Pracovní nabídka</p><p class=""typography-body-large-text-regular mb-800""><strong>Jsme tým NESTOR Security Operations Centre a řešíme zabezpečení dat a systémů našich zákazníků v oblasti kybernetické bezpečnosti.</strong></p><p class=""typography-body-large-text-regular mb-800""><strong>Naši zákazníci jsou především z oblasti státní sféry, ale také z komerčního sektoru. </strong><br><strong>Vytváříme a optimalizujeme metodiky detekce a řešení kybernetických událostí k potřebám zákazníků tak, abychom dokázali zajistit nejlepší způsob ochrany v oblasti kybernetické bezpečnosti.</strong></p><p class=""typography-body-large-text-regular mb-800"">Posilujeme tým Nestor Security Operations Centre v oddělení IT Security a aktuálně rozšiřujeme tým a máme volná místa pro uchazeče na pozice</p><h2 class=""typography-heading-small-text"">SPECIALISTA BEZPEČNOSTI / CYBER SECURITY OPERATOR</h2><p class=""typography-body-large-text-regular mb-800""><strong>* Tato pozice je vhodná JAK pro absolventy středních škol IT zaměření, TAK pro zkušené matadory v oblasti analýzy bezpečnostních incidentů - ty po zaškolení posuneme na seniornější pozici.</strong></p><p class=""typography-body-large-text-regular mb-800""><strong>* Pozici Vám dle míry Vašich znalostí a zkušeností ušijeme na míru!</strong></p><p class=""typography-body-large-text-regular mb-800""><strong>Co Vás čeká na této pozici?</strong></p><ul class=""typography-body-large-text-regular""><li>Aktivní <strong>monitoring a řešení bezpečnostních událostí</strong> v SIEM</li><li>Aktivní <strong>spolupráce s analytiky</strong> při šetření bezpečnostních událostí a incidentů</li><li>Příprava podkladů pro <strong>reporting</strong> z bezpečnostních nástrojů</li><li><strong>Sledování trendů</strong> v oblasti kybernetické bezpečnosti</li><li><strong>Testování</strong> nových pravidel pro detekci kybernetických hrozeb</li></ul><p class=""typography-body-large-text-regular mb-800""><strong>Co umí ideální uchazeč/ka?</strong></p><ul class=""typography-body-large-text-regular""><li>Má (ideálně) <strong>technické vzdělání</strong> se zaměřením na informační technologie - velkou výhodou je praxe v oboru (i při studiu)</li><li>Má základní znalost v informačních technologií a prokazatelný <strong>zájem o oblast kybernetické bezpečnosti</strong></li><li>Má základní znalosti Windows server, OS Win, OS Linux/UNIX, Firewall, TCP/IP, LAN/WAN</li><li>Je <strong>týmovým hráčem</strong></li><li>Zvládne <strong>efektivně komunikovat</strong></li><li>Porozumí technické angličtině (v níž jsou komplet výukové materiály) - na <strong>angličtině můžete zamakat v rámci firemní výuky</strong>. <br>Nebo vám přispějeme na výuku jiného jazyka.</li><li>Na této pozici to zvládnete i bez řidičáku</li></ul><p class=""typography-body-large-text-regular mb-800""><strong>Co Vám nabízíme na této pozici?</strong></p><ul class=""typography-body-large-text-regular""><li>Příjemné kanceláře v širším centru Prahy</li><li><strong>Zázemí stabilní české společnosti</strong> s množstvím rozmanitých zákazníků</li><li>Práce v přátelském týmu v rámci oddělení</li><li>Pomoc zkušených kolegů nejen v rámci technické a bezpečnostní divize</li><li><strong>Neustálý profesní rozvoj</strong> - během prvních 2 let se budete pyšnit několika <strong>certifikacemi renomovaných vendorů (IBM, Comptia Security+</strong> aj.)</li><li><strong>Zapojení do zajímavých a různorodých projektů</strong></li><li>Balíček <strong>zaměstnaneckých benefitů</strong></li><li>Férovou mzdu, <strong>ocenění práce nad rámec</strong></li><li>Nástup ihned nebo dohodou</li></ul><p class=""typography-body-large-text-regular mb-800"">Pokud Vás naše nabídka zaujala, prosíme o zaslání Vašeho strukturovaného životopisu <strong>v českém jazyce (podmínkou)</strong> prostřednictvím odpovědního formuláře.</p><p class=""typography-body-large-text-regular mb-800"">Vámi zaslané podklady zpracujeme a ozveme se Vám co nejdříve.</p></div>"
Data analytik (datový sklad) – částečný úvazek,JOBSTART s.r.o.,https://www.jobs.cz/rpd/2000609979/,False,2025-06-07 00:00:00,,cs,,,jobscz#2000609979,,,,,,,,,,Praha,,,,,,,,,,,,,,,,,,,,Praha,,,,,,,,,,,,,,,,,,,,parttime,,,,,,,,,,"<div data-jobad=""body"" data-test=""jd-body-richtext"" class=""RichContent mb-1400""><p class=""typography-body-medium-text-regular text-secondary mb-600"">Pracovní nabídka</p><h2 class=""typography-heading-small-text""><strong>📊 Data analytik (datový sklad) – částečný úvazek</strong></h2><p class=""typography-body-large-text-regular mb-800""><br>Chceš mít volnější pracovní režim, ale zároveň tě láká smysluplná práce s daty? Máme pro tebe příležitost stát se součástí týmu, který rozvíjí stabilní datový sklad a posouvá firemní práci s daty na vyšší úroveň. Hledáme komunikativního člověka, který umí propojovat svět byznysu a IT, rád se v datech „šťourá“ a dotahuje věci do konce.</p><p class=""typography-body-large-text-regular mb-800"">Tato pozice je ideální pro někoho, kdo hledá <strong>částečný úvazek a oceňuje možnost určité flexibility.</strong></p><p class=""typography-body-large-text-regular mb-800""><br><strong>Co tě u nás čeká?</strong></p><ul class=""typography-body-large-text-regular""><li>Analýza požadavků a komunikace s kolegy napříč firmou – od obchodních týmů po vývojáře</li><li>Spolupráce na návrhu systémových řešení a určování priorit v rámci jednotlivých požadavků</li><li>Podpora testování a automatizace – včetně tvorby a údržby testovacích scénářů</li><li>Zapojení do spolupráce s externími partnery, včetně zahraničních týmů</li><li>Péče o dokumentaci a hledání způsobů, jak zefektivnit stávající řešení</li></ul><p class=""typography-body-large-text-regular mb-800""><br><strong>Jaké nástroje ti přijdou vhod?</strong></p><ul class=""typography-body-large-text-regular""><li>MS SQL (pokročilé znalosti dotazů, tvorby tabulek, funkcí atd.)</li><li>Enterprise Architect, Jira, Power BI</li><li>Zkušenost s datovými sklady (DWH), relačními databázemi, orientace v architektuře</li></ul><p class=""typography-body-large-text-regular mb-800""><br><strong>Jak si tě představujeme?</strong></p><ul class=""typography-body-large-text-regular""><li>Umíš komunikovat napříč týmy, máš tah na branku a v datech se cítíš jako doma</li><li>Máš zkušenost s analytickou prací, SQL tě nerozhází a orientace v DWH je pro tebe samozřejmostí</li><li>Zvládneš prioritizaci a organizaci své práce, i když na stole leží víc úkolů najednou</li><li>Výhodou je, pokud máš zkušenosti s UML, modelováním procesů nebo nástroji typu EA</li></ul><p class=""typography-body-large-text-regular mb-800""><br><strong>Co ti nabídneme?</strong></p><ul class=""typography-body-large-text-regular""><li>Zázemí silné a stabilní firmy, která hraje prim v oblasti mobility</li><li>Skvělý tým datových specialistů, kteří si navzájem kryjí záda</li><li>Moderní a dostupné kanceláře (včetně výhledu na Prahu 😉)</li><li>Možnost pracovat z domova až 2 dny v týdnu</li></ul><p class=""typography-body-large-text-regular mb-800""><br><strong>A navíc:</strong></p><ul class=""typography-body-large-text-regular""><li>5 týdnů dovolené + 5 dní extra volna (MyFreeDays)</li><li>Stravenkový paušál 130 Kč/den</li><li>Příspěvek na penzijní spoření nebo DIP (3 % z hrubé mzdy)</li><li>Bonusy, vzdělávací kurzy a přístup k rozvojovým programům</li><li>Výhodný operativní leasing, Multisport, zvýhodněný mobilní tarif</li></ul><p class=""typography-body-large-text-regular mb-800""><br>🎯 Zní to jako něco pro tebe? Dej nám o sobě vědět – i částečný úvazek může znamenat velký přínos.</p></div>"
Frontend developer,Tender systems s.r.o.,https://www.jobs.cz/rpd/2000610051/,False,2025-06-07 00:00:00,,cs,,,jobscz#2000610051,,,,,,,,,,Praha,Praha,,,,,,,,,,,,,,,,,,,Praha,Praha,,,,,,,,,,,,,,,,,,,fulltime,,,,,,,,,,"<div data-jobad=""body"" data-test=""jd-body-richtext"" class=""RichContent mb-1400""><p class=""typography-body-medium-text-regular text-secondary mb-600"">Pracovní nabídka</p><p class=""typography-body-large-text-regular mb-800""><strong>KOHO HLEDÁME</strong></p><p class=""typography-body-large-text-regular mb-800"">Hledáme nového kolegu nebo kolegyni na pozici frontend vývojář na dlouhodobou spolupráci, který/á by rozšířil náš tým. Zároveň hledáme někoho, kdo se nebojí využít příležitost a chce se podílet na významných projektech pro státní a veřejnou správu.</p><p class=""typography-body-large-text-regular mb-800""><strong>CO VÁS ČEKÁ</strong></p><p class=""typography-body-large-text-regular mb-800"">Vývoj frontend cloudových aplikací pro státní a veřejnou správu, jejich rozvoj a úprava dle požadavků klientů. Náš tým funguje agilně a práce je plánována do scrum sprintů za účasti všech členů týmu.</p><p class=""typography-body-large-text-regular mb-800"">Jsme menší tým s neformálním pracovním prostředím bez zdlouhavých procesů, naším cílem je vývoj.</p><p class=""typography-body-large-text-regular mb-800""><strong>S ČÍM PRACUJEME</strong></p><p class=""typography-body-large-text-regular mb-800"">Angular, Java, Go, Jira, Linux, Microservices, PostgreSQL, REST API, Mongo DB</p><p class=""typography-body-large-text-regular mb-800""><strong>POŽADUJEME</strong></p><p class=""typography-body-large-text-regular mb-800"">SŠ/VŠ (vhodné i pro absolventy), znalost českého jazyka, základní orientaci v technologiích pro vývoj internetových aplikací, čistý trestní rejstřík, ochota učit se novým věcem, znalost frontendových technologií výhodou</p><p class=""typography-body-large-text-regular mb-800""><strong>CO NABÍZÍME</strong></p><p class=""typography-body-large-text-regular mb-800"">Nabízíme práci v kolektivu mladých lidí v klidném prostředí Prahy 6 (výborná dostupnost MHD), získání zajímavých zkušeností z oboru, flexibilní pracovní dobu, motivační ohodnocení, sickdays, stravenkový paušál, jazykové kurzy. Kancelář na příjemném místě v Praze Střešovicích.</p></div>"
Webmaster a informatik !PŘÍLEŽITOST ZÍSKAT ZKUŠENOSTI/STABILITA PRO ZKUŠENÉ!,PŘEDVÝBĚR.CZ a.s.,https://www.jobs.cz/rpd/2000601524/,False,2025-06-07 00:00:00,,cs,,,jobscz#2000601524,,,,,,,,,,Jindřichův Hradec,,,,,,,,,,,,,,,,,,,,České Budějovice,,,,,,,,,,,,,,,,,,,,fulltime,,,,,,,,,,"<div data-jobad=""body"" data-test=""jd-body-richtext"" class=""RichContent mb-1400""><p class=""typography-body-medium-text-regular text-secondary mb-600"">Pracovní nabídka</p><p class=""typography-body-large-text-regular mb-800"">Pro našeho významného klienta, územní samosprávný celek, hledáme novou kolegyni či kolegu na pozici <strong>Webmaster a informatik</strong>.</p><p class=""typography-body-large-text-regular mb-800"">Pracovní pozice je vhodná jak pro absolventa, kde dáme šanci a pomůžeme vše naučit, tak i pro zkušeného kandidáta, kde znalosti oceníme.</p><h2 class=""typography-heading-small-text"">Náplň práce:</h2><ul class=""typography-body-large-text-regular""><li>zajišťování správy a rozvoje internetových stránek města (veřejné i neveřejné části), publikačních informačních systémů, datového skladu a intranetových stránek úřadu (SharePoint)</li><li>rozvoj cloudové platformy Microsoft 365 v prostředí úřadu – správa uživatelských oprávnění, tvorba aplikací, metodická činnost</li><li>dále pak podpora při správě interaktivních map, mobilních aplikací a podíl na správě/metodické podpoře ostatních informačních systémů (zejm. IS VERA)</li><li>bude skvělé, když se zapojíte do projektů jako realizace portálu občana, chatbota či nasazování RPA</li><li>v přípravě je projekt v oblasti kyberbezpečnosti</li></ul><h2 class=""typography-heading-small-text"">Požadavky:</h2><ul class=""typography-body-large-text-regular""><li>vysokoškolské, př. středoškolské nebo vyšší odborné vzdělání, ideálně v oboru informačních technologií</li><li>bezúhonnost (výpis z Rejstříku trestů bez záznamu), zdravotní způsobilost</li><li>řidičské oprávnění skupiny B výhodou</li><li>praktické zkušenosti z oblasti tvorby, správy a rozvoje internetových stránek, publikačních IS, datových skladů, mobilních aplikací a grafických výstupů výhodou, základní znalost síťových pojmů rovněž výhodou</li><li>administrátorská znalost (architektury) platformy Microsoft 365 (SharePoint, Power Automate, Power Apps, MS Teams a OneDrive) vítána</li><li>dále komunikační dovednosti, úroveň vystupování a jednání s lidmi, důslednost, kvalifikované a včasné plnění úkolů, schopnost dotahovat „ajťácké“ výzvy do konce, flexibilita (přizpůsobení se změnám stylu a obsahové náplně práce)</li><li>také schopnost a ochota dále se vzdělávat, zájem o svůj obor a zavádění inovací</li></ul><h2 class=""typography-heading-small-text"">Nabízíme:</h2><ul class=""typography-body-large-text-regular""><li>STABILITU a JISTOTU - stabilní zaměstnání a pracovní poměr na dobu neurčitou</li><li>MOŽNOST získat zkušenosti a možnost profesního růstu</li><li>OHODNOCENÍ již nabraných zkušeností</li><li>dobré, stabilní a rostoucí mzdové ohodnocení, nyní bez odměn v rozmezí 40 000 – 50 000 Kč, po zaškolení možný nárůst</li><li>pololetní odměny: v létě 5 000 – 10 000 Kč, v zimě 10 000 – 15 000 Kč</li><li>odměny za realizaci projektů – to je na vás!, zde je však možné další odměny až v řádech desítek tisíc Kč</li><li>k tomu výborné zaměstnanecké benefity: stravenkový paušál 120 Kč/den, přibližně 2 400 Kč/měsíc do mzdy, příspěvek na penzijní pojištění 700 Kč/měsíc, flexi passy v hodnotě 5 000 Kč, 5 sick days/rok, 5 týdnů dovolené</li><li>dále: podpoříme vás v oblasti vzdělávání – akreditované kurzy, příprava k získání certifikátů v oblasti IT či projektového řízení, a to vše možné i v hodnotě několika desítek tisíc Kč</li><li>pružnou pracovní dobu a práci z domova (Home office) dle domluvy</li><li>místem výkonu práce je územní obvod města <strong>Jindřichův Hradec</strong></li></ul><p class=""typography-body-large-text-regular mb-800"">Pokud Vás tato nabídka zaujala, zašlete nám Váš strukturovaný životopis. Budeme Vás v nejbližší době kontaktovat.</p><p class=""typography-body-large-text-regular mb-800"">Společnost PŘEDVÝBĚR.CZ s.r.o. si vyhrazuje právo nekontaktovat kandidáty, kteří nebudou splňovat výše uvedené požadavky.<br> <br> Výhodou spolupráce s námi je rychlost! S našimi konzultanty absolvujete pouze telefonický pohovor!</p><p class=""typography-body-large-text-regular mb-800"">Odpovědí na tento inzerát souhlasím, aby společnost PŘEDVÝBĚR.CZ s.r.o., sídlem Na Kozačce 1289/7, Praha 2, zpracovávala mé osobní údaje pro účely zprostředkování práce v souladu se zákonem č. 110/2019 Sb., a to až do odvolání písemnou formou.</p></div>"
Tester/ka ekonomického software,"Twin Soft, s.r.o.",https://www.jobs.cz/rpd/2000607826/,False,2025-06-07 00:00:00,,cs,,,jobscz#2000607826,,,,,,,,,,Brno,Staré Hobzí,,,,,,,,,,,,,,,,,,,Brno,České Budějovice,,,,,,,,,,,,,,,,,,,fulltime,,,,,,,,,,"<div data-jobad=""body"" data-test=""jd-body-richtext"" class=""RichContent mb-1400""><p class=""typography-body-medium-text-regular text-secondary mb-600"">Pracovní nabídka</p><p class=""typography-body-large-text-regular mb-800"">Jsme stabilní brněnská firma s 30-ti letou historií se zaměřením na ekonomický SW pro zemědělské podniky. Začínali jsme jako rodinná firma, a jako rodinná firma fungujeme stále, přestože se pomalu rozrůstáme.</p><p class=""typography-body-large-text-regular mb-800"">Máš zkušenosti s účetnictvím nebo jsi přímo účetní? Chceš se podívat na software z druhé strany a podílet se na jeho rozšiřování? Hledáš přátelské prostředí, kde si Tvé práce budou vážit? Pak jsi tu správně.</p><p class=""typography-body-large-text-regular mb-800""><strong>Co bude Tvojí pracovní náplní:</strong></p><p class=""typography-body-large-text-regular mb-800"">· práce s ekonomickým SW</p><p class=""typography-body-large-text-regular mb-800"">· testování nových funkcí a jejich předávání uživateli</p><p class=""typography-body-large-text-regular mb-800"">· pomoc zemědělským podnikům s používáním našeho SW</p><p class=""typography-body-large-text-regular mb-800""><strong>Co vyžadujeme</strong>:</p><p class=""typography-body-large-text-regular mb-800"">· znalost principů fungování ekonomického SW</p><p class=""typography-body-large-text-regular mb-800"">· znalost principů účetnictví</p><p class=""typography-body-large-text-regular mb-800"">· znalost práce s MS Office</p><p class=""typography-body-large-text-regular mb-800"">· týmového ducha</p><p class=""typography-body-large-text-regular mb-800"">· chuť učit se novým věcem a ochotu na sobě pracovat</p><p class=""typography-body-large-text-regular mb-800""><strong>Výhodou může být (není podmínkou</strong>):</p><p class=""typography-body-large-text-regular mb-800"">· zkušenost z oblasti zemědělství</p><p class=""typography-body-large-text-regular mb-800"">· analytický způsob myšlení</p><p class=""typography-body-large-text-regular mb-800"">· cit pro detail</p><p class=""typography-body-large-text-regular mb-800"">· předchozí zkušenost s testováním</p><p class=""typography-body-large-text-regular mb-800"">· základní znalost SQL</p><p class=""typography-body-large-text-regular mb-800""><strong>Co nabízíme:</strong></p><p class=""typography-body-large-text-regular mb-800"">· plný či částečný pracovní úvazek</p><p class=""typography-body-large-text-regular mb-800"">· flexibilní pracovní dobu s možností práce z domova</p><p class=""typography-body-large-text-regular mb-800"">· 25 dní dovolené</p><p class=""typography-body-large-text-regular mb-800"">· přátelské a vstřícné pracovní prostředí</p><p class=""typography-body-large-text-regular mb-800"">· moderní kanceláře v centru Brna</p><p class=""typography-body-large-text-regular mb-800"">· kafeterii a příspěvky na stravování</p><p class=""typography-body-large-text-regular mb-800"">· firemní akce</p><p class=""typography-body-large-text-regular mb-800"">· jazykové kurzy přímo na pracovišti</p><p class=""typography-body-large-text-regular mb-800"">Napiš nám o sobě i pokud nesplňuješ některý z požadavků. Rádi se s tebou potkáme osobně u nás v kanceláři nebo na online meetingu.</p></div>"
Analytik Security Operations Center (SOC),Thein Security s.r.o,https://www.jobs.cz/rpd/1622789154/,False,2025-06-07 00:00:00,,cs,,,jobscz#1622789154,,,,,,,,,,Praha,Praha,,,,,,,,,,,,,,,,,,,Praha,Praha,,,,,,,,,,,,,,,,,,,fulltime,,,,,,,,,,"<div data-jobad=""body"" data-test=""jd-body-richtext"" class=""RichContent mb-1400""><p class=""typography-body-medium-text-regular text-secondary mb-600"">Pracovní nabídka</p><p class=""typography-body-large-text-regular mb-800""><strong>Thein Security</strong> hledá vášnivé jedince, kteří nám pomohou chránit naše zákazníky před kybernetickými hrozbami. Hledáme posily bez ohledu na úroveň zkušeností a vzdělání.</p><p class=""typography-body-large-text-regular mb-800""><strong>Co Vás čeká v Thein Security?</strong></p><ul class=""typography-body-large-text-regular""><li>Základní analýza kybernetických událostí a jejich vyhodnocování</li><li>Sledování aktivity v bezpečnostních nástrojích SIEM a SOAR</li><li>Vytváření a optimalizace pracovních postupů (playbooků)</li><li>Studium a prohlubování Vašich vědomostí</li></ul><p class=""typography-body-large-text-regular mb-800""><strong>Co očekáváme od ideálního kandidáta?</strong></p><ul class=""typography-body-large-text-regular""><li>Analytické myšlení a dovednosti</li><li>Ochotu přispět našemu týmu a podílet se na ochraně našich klientů</li><li>Ochotu pracovat ve směnném provozu</li><li>Znalost technické angličtiny</li></ul><p class=""typography-body-large-text-regular mb-800""><strong>Oceníme, pokud budete mít:</strong></p><ul class=""typography-body-large-text-regular""><li>Praktické zkušenosti s bezpečnostními nástroji (ArcSight, Elastic, QRadar, Microsoft Sentinel, XSOAR, Tenable Nessus, OpenVAS, …)</li><li>Praktické zkušenosti s ticketovacími nástroji (Jira, ServiceNow, …)</li><li>Základní znalost principů fungování IT infrastruktury, operačních systémů Windows/Linux a síťových protokolů</li><li>Základní znalost MITRE ATT&amp;CK framework a bezpečnostních principů (CIA triad)</li><li>Certifikace dokládající Vaše zkušenosti kupř. CompTIA Security+, Blue Team Level 1</li></ul><p class=""typography-body-large-text-regular mb-800""><strong>Co naopak nabízíme my?</strong></p><ul class=""typography-body-large-text-regular""><li>Příležitost odstartovat kariéru v oblasti IT security</li><li>Rozvoj v oboru s možností učit se od dlouholetých profesionálů v oboru cybersecurity</li><li>Přístup ke špičkovým bezpečnostním technologiím</li><li>Příjemné prostředí v moderních prostorách na Pankráci, zaměstnanecké benefity (5 týdnů dovolené, sick days, stravenková karta Sodexo a další)</li></ul><p class=""typography-body-large-text-regular mb-800""><strong>Jestli Vás naše pozice oslovila, dejte nám o sobě vědět a pošlete nám CV nebo odkaz na LinkedIn.</strong></p><p class=""typography-body-large-text-regular mb-800""><strong>Těšíme se!</strong>  </p></div>"
