title,company_name,url,remote,first_seen_at,last_seen_at,lang,juniority_score,source,external_ids_0,external_ids_1,external_ids_2,external_ids_3,external_ids_4,external_ids_5,external_ids_6,external_ids_7,external_ids_8,external_ids_9,locations_0_name,locations_1_name,locations_2_name,locations_3_name,locations_4_name,locations_5_name,locations_6_name,locations_7_name,locations_8_name,locations_9_name,locations_10_name,locations_11_name,locations_12_name,locations_13_name,locations_14_name,locations_15_name,locations_16_name,locations_17_name,locations_18_name,locations_19_name,locations_0_region,locations_1_region,locations_2_region,locations_3_region,locations_4_region,locations_5_region,locations_6_region,locations_7_region,locations_8_region,locations_9_region,locations_10_region,locations_11_region,locations_12_region,locations_13_region,locations_14_region,locations_15_region,locations_16_region,locations_17_region,locations_18_region,locations_19_region,employment_types_0,employment_types_1,employment_types_2,employment_types_3,employment_types_4,employment_types_5,employment_types_6,employment_types_7,employment_types_8,employment_types_9,description_html
Junior Software Engineer (Node.js / React),OAK'S LAB,https://www.startupjobs.cz/nabidka/82923/junior-software-engineer-node-js-react?utm_source=juniorguru&utm_medium=cpc&utm_campaign=juniorguru,False,2025-02-11 00:00:00,,cs,,,startupjobs#82923,,,,,,,,,,Praha,,,,,,,,,,,,,,,,,,,,Praha,,,,,,,,,,,,,,,,,,,,fulltime,,,,,,,,,,"<h3 id=""isPasted"">POZICE</h3><p id=""isPasted"">Do našeho vývojářského týmu hledáme juniorního softwarového engineera, který přinese kreativní myšlení, schopnosti řešit problémy a proaktivní přístup, s cílem vytvořit výjimečné webové a mobilní aplikace pro naše startupové klienty. Produkt, na kterém budeš pracovat, je již dlouhodobě velmi úspěšný fintech produkt se sídlem v USA, který mezi svými klienty má Goldman Sachs, Morgan Stanley a Bank of America, a již zpracoval transakce v hodnotě přes 50 miliard USD.&nbsp;</p><p>Přidáš se k vysoce profesionálnímu týmu, který se skládá z Tech Leada, Product Managera, designérů a dalších zkušených engineers, a budeš součástí širšího týmu o cca 50 lidech v Praze. Budeš se podílet na vývoji jak front-endu tak back-endu, a pomáhat budovat softwarové řešení pro naše klienty, které je posunou o krok blíž k jejich cíli. Tato role nabízí skvělou příležitost učit se nové technologie a vyvíjet své znalosti v inovativním prostředí po boku zkušených lídrů.. Pokud máš nadšení pro technologie a inovace, máš rád technologické výzvy a chceš pracovat na různorodých projektech s širokým dopadem, tak tohle je právě ta možnost jak nastartovat svou kariéru v IT.</p><h3>CO TĚ ČEKÁ</h3><ul><li>Spolupráce se seniorními vývojáři na navrhování, vývoji a údržbě webových aplikací</li><li>Podílet se na vývoji front-endu (React) i back-endu (Node.js)</li><li>Implementace funkcí na základě user stories a technických specifikací</li><li>Účast na revizích kódu, týmových meetingů a plánování projektu</li><li>Aktivně se rozvíjet a objevovat nové technologie a frameworky</li><li>Analyzovat, řešit problémy a proaktivně pracovat na jejich řešení</li></ul><h3>DOVEDNOSTI A POŽADAVKY</h3><ul><li>Komunikativní úroveň angličtiny</li><li>Zkušenost s JavaScriptem - Znalost React pro front-end nebo Node.js pro back-end, získaná prostřednictvím projektů, stáží nebo během studia</li><li>Základní znalost TypeScriptu a CSS</li><li>Schopnost pochopit a navrhnout řešení pro jednoduché algoritmické problémy</li><li>Zvídavý přístup s touhou učit se nové technologie</li><li>Analytické a kritické myšlení, a být schopen uchopit problémy a proaktivně navrhnout možná řešení</li><li>Motivace být v kanceláři alespoň třikrát týdně a pracovat po boku více seniorních kolegů</li></ul><h3>TECH STACK</h3><ul><li>TypeScript</li><li>Node.js</li><li>React + Next.js</li><li>React Native</li><li>GraphQL, tRPC</li><li>Material UI</li><li>Playwright</li><li>Google Cloud Platform</li><li>HuggingFace, OpenAI API, RAG</li></ul><p>Poznámka: Není nutné mít zkušenosti se všemi výše uvedenými technologiemi, rádi tě zaškolíme v určitých oblastech. Pro podrobný přehled technologií, které používáme, navštiv tento <a href=""https://radar.thoughtworks.com/?documentId=https%3A%2F%2Fdocs.google.com%2Fspreadsheets%2Fd%2F1F8vIUPO1VzGNjB9_ho16zOypv5-4Q4eOuXtRKWH6Jeo%2Fedit%23gid%3D0&sheetName=Sheet1"" target=""_blank"" rel=""noopener"">odkaz</a>.</p><h3>NAŠE PROJEKTY</h3><p>Vybudovali jsme přes 40 úspěšných produktů. Zde je několik z našeho portfolia:</p><ul><li><a href=""https://www.nasdaqprivatemarket.com/"" target=""_blank"" rel=""noopener"">Nasdaq Private Market</a></li><li><a href=""https://www.oakslab.com/case-studies/plextrac"" target=""_blank"" rel=""noopener"">PlexTrac</a></li><li><a href=""https://www.oakslab.com/case-studies/vette"" target=""_blank"" rel=""noopener"">Vette</a></li><li><a href=""https://www.oakslab.com/case-studies/plotify"" target=""_blank"" rel=""noopener"">Plotify</a></li></ul><h3>BENEFITY</h3><ul><li>Flexibilní pracovní doba</li><li>Hybridní pracovní prostředí</li><li>25 dní dovolené + 1 den volna na narozeniny + 1 den navíc za každý rok práce v OAK’S LAB (maximálně 30 dní)</li><li>Špičkový MacBook a budget na hardware</li><li>Budget na osobní rozvoj (knihy, kurzy, konference)</li><li>Bezplatné lekce angličtiny</li><li>Možnost získat bonus z investic do našich startupových partnerů</li><li>Teambuildingové akce, happy hours, online hry, každoroční offsite výlety</li><li>Volnočasové kluby (jóga, cestování, fotbal, tenis atd.)</li><li>Občerstvení a nápoje v kanceláři, páteční pizza &amp; letní závitky, měsíční snídaně</li><li>Kancelář přímo na Staroměstském náměstí (dog-friendly)</li></ul><p>---</p><h3 id=""isPasted""><strong>O NÁS</strong></h3><p id=""isPasted"">OAK’S LAB je technologický partner, který pomáhá startupům, scaleupům a velkým firmám budovat softwarová řešení nasazením holistických produktových týmů. Naše inovativní řešení vybudovala lídry na trhu v několika sektorech, s důrazem na trh v USA.</p><ul><li>Založeno v roce 2016</li><li>Vyvinuto a spuštěno 48 produktů</li><li>Kombinovaná hodnota našich klientů činí 1,7 miliardy USD</li></ul>"
Junior QA Engineer,Eyeball s.r.o.,https://www.startupjobs.cz/nabidka/87941/junior-qa-engineer?utm_source=juniorguru&utm_medium=cpc&utm_campaign=juniorguru,False,2025-02-11 00:00:00,,en,,,startupjobs#87941,,,,,,,,,,Praha,,,,,,,,,,,,,,,,,,,,Praha,,,,,,,,,,,,,,,,,,,,fulltime,,,,,,,,,,"<p id=""isPasted""><strong>About Us</strong></p><p>At <strong>Eyeball</strong>, we're revolutionizing football talent scouting from our base in Prague. Leveraging cutting-edge technology like video analysis and artificial intelligence, we’ve moved beyond traditional scouting methods. Our platform captures and analyzes every moment of the game, tracking 48 different events to discover the next big talent. With a database of over 200,000 young players and partnerships with top clubs in the Premier League, Serie A, Bundesliga, and La Liga, Eyeball is setting new standards in football scouting. Join our innovative, collaborative team and be part of the change in football scouting.</p><p><strong>Job Summary</strong></p><p>As a Junior QA Engineer, you will support our mission by executing and managing tests to ensure the quality of our software products. Working closely with our developers and Product Managers, you’ll help identify issues, verify fixes, and learn to advocate for quality throughout the development lifecycle. This is a great opportunity to grow your skills in a dynamic and innovative environment.</p><p><strong>Key responsibilities</strong></p><ul type=""disc""><li>Execute test plans, scenarios, and scripts to ensure our products meet quality standards.</li><li>Document and report bugs, errors, and inconsistencies in software applications.</li><li>Work with the development team to reproduce issues and verify fixes.</li><li>Review system specifications and requirements to ensure thorough testing coverage.</li><li>Participate in product reviews and provide input on potential problems.</li><li>Learn and apply industry trends and advancements in QA testing.</li><li>Assist in improving QA workflows and processes.</li></ul><p><strong>We need:</strong></p><ul type=""disc""><li>1–2 years of experience in a QA or testing role, with a basic understanding of QA principles and methodologies.</li><li>Familiarity with SQL and related databases, including basic querying.</li><li>Comfortable working in English, with solid communication skills to collaborate effectively in meetings and documentation.</li><li>Basic experience with version control systems (e.g., GitLab, GitHub, or Bitbucket).</li><li>Familiarity with tools like Postman for endpoint testing.</li><li>Strong attention to detail, eagerness to learn, and ability to work both independently and in a team.</li></ul><p><strong>Bonus skills</strong></p><ul type=""disc""><li>Exposure to mobile app testing or knowledge of unique challenges in testing mobile applications.</li><li>Interest in or initial experience with automated testing tools and techniques.</li></ul><p><strong>Why Eyeball?</strong></p><ul type=""disc""><li>Shape the future of football technology. Your work will be seen by clubs, players, and fans worldwide.🌍</li><li>Join a fast-growing, passionate team driven by innovation and impact.</li><li>Flexible working environment.</li><li>Opportunities for growth and personal development.</li><li>Be part of a movement to level the playing field for grassroots football. </li><li>Corresponding remuneration. 💰</li><li>Possibility to work as employee/contractor.</li><li>Flexible working hours. 🕜</li><li>Possibility to work remotely fully</li><li>Home office. 🛋️</li><li>5 weeks of paid relax+ 2 sicks days. 🌴</li><li>Team of friendly, open-minded high achievers. 🤝</li></ul><p>Apply today via this linke: https://jobs.sloneek.com/ats-v2/eyeball/f7d2bdc2-945a-42f7-9cbe-a047618a90d4</p>"
Node.js Engineer (Web Automation team),Apify,https://www.startupjobs.cz/nabidka/79809/node-js-engineer-web-automation-team?utm_source=juniorguru&utm_medium=cpc&utm_campaign=juniorguru,False,2025-02-07 00:00:00,,en,,,startupjobs#79809,,,,,,,,,,Praha,,,,,,,,,,,,,,,,,,,,Praha,,,,,,,,,,,,,,,,,,,,fulltime,,,,,,,,,,"<p id=""isPasted"">Apify's mission is to make the web more programmable. Why? Because we believe that humans have better things to do than fill information into internet forms, compile Excel sheets of copy-pasted data, or watch thousands of videos to determine whether they include a specific brand logo. Those are jobs for a machine. And just as in the real world we have tools that make our lives easier, we should have tools to make our lives easier on the web.</p><p>Web automation can be anything. We robotize unsubscribe flows to save people money and we collect billions of rows of data from all over the world for science, market research, or finding lost children. Fortune 500 companies and small startups alike need this power to make great business decisions.</p><p>To support our mission, we're looking for talented and experienced engineers to help us build the next generation of the web, where machines talk to machines and humans do creative work that drives progress. Will you join us ?</p><p>Please be aware that we are currently looking only for full-time candidates living in the Czech Republic!</p><p>Who are we looking for?</p><ul><li>You have a good knowledge of JavaScript & TypeScript (Node.js) and Web technologies</li><li>You are an avid learner and looking to grow your expertise in the web scraping domain and in general</li><li>You have a problem-solving mindset</li><li>You're able to write and speak English well</li><li>You have empathy and patience to understand customers and their needs</li><li>At minimum 1 year of programming experience (school and self-learning counts)</li><li>Currently, we are only looking for a full-time commitment</li><li>You live in the Czech Republic and are able to come to our Prague office at least once a month</li><li>Even better if you:<ul><li>Have contributed to a non-trivial user-facing product</li><li>Have experience fine-tuning products for UX/DX</li><li>Like to write and share experience - tutorials, technical support, tooling, etc.</li></ul></li></ul><p>What you will learn with us?</p><ul><li>How websites work behind the curtain</li><li>How to write beautiful code that reads like a novel</li><li>How to write efficient cloud programs that process hundreds of millions of pages monthly</li><li>How to contribute to collaborative open and closed source projects and design great APIs that other devs will love to use</li><li>And potentially, how to build your own team and start your own projects inside the company</li></ul><p>Our tech stack:</p><ul><li>Development: Node.js (with Typescript), Chrome Dev Tools, Crawlee, Apify SDK, Puppeteer, Playwright, JQuery/Cheerio + many other specialized libraries. We also released Python SDK lately and are acquiring expertise in Python scraping tools.</li><li>Environment: Local IDE for development & testing. Then deploy to the Apify Platform via GitHub for production</li><li>Tools: GitHub, ZenHub, Notion, GSuite, GitHub Copilot license</li><li>Process: in-depth onboarding, code reviews, tests, automating whatever we can, using common sense over strict processes</li></ul><p>Why should you work for Apify?</p><ul><li>Full-time position in Prague at our amazing office located in Lucerna Palace, Prague, Czech Republic 🏰</li><li>Option to work remotely 🛋️</li><li>Flexible working hours (perfect for both night owls 🦉 and early birds 🐥)</li><li>Zero bullshit policy – No Jira, no Okta, no Confluence, no Certified™ScrumMasters®, no quarterly estimates. Just GitHub, GSuite, Notion, Slack, and shipping stuff to production</li><li>Nobody counts holidays as long as the work gets done 💪</li><li>Stock options and profit sharing 💰</li><li>We welcome pets, kids, and bikes at the office 🐕👨‍👧🚲</li><li>Epic team buildings and offsites 🚢 with biking, canoeing, and other adventures 🪂</li><li>Solid education and training budget, conference tickets, internal “Eat & Learn” sessions, and the possibility to work across teams 👩🏼‍💻👨🏽‍💻</li><li>Generous hardware budget 💻</li><li>Free lunches every day 🌮🍱🍜🍕🥡</li><li>Unlimited supply of ☕ & 🍺 and snacks</li><li>Free entry to the wonderful Prague Zoo 🐘</li><li>Ping-pong, chess, PS5, lightsabers, foosball league after lunch, free Multisport card, and so on</li></ul><p><br /></p>"
CRM Integration Developer with .NET.,Kentico Software,https://www.startupjobs.cz/nabidka/84057/crm-integration-developer-with-net?utm_source=juniorguru&utm_medium=cpc&utm_campaign=juniorguru,False,2025-02-07 00:00:00,,cs,,,startupjobs#84057,,,,,,,,,,Brno,,,,,,,,,,,,,,,,,,,,Brno,,,,,,,,,,,,,,,,,,,,fulltime,,,,,,,,,,"<p id=""isPasted""><strong>CRM Integration Developer with .NET.&nbsp;</strong></p><p>Staňte se součástí vývojového týmu, který má na starosti interní aplikační development. Jsme jeden tým, který si obhospodařuje celý software lifecycle, takže nabízí prostor na práci na frontendu, backendu nebo i DevOps. Máme integrace s řadou profesionálních nástrojů jako e-sign apod., nabídneme vhled do businessové roviny řízení firmy a hlavně nesekáme jeden projekt za druhým jako implementátor, takže je větší prostor jít do hloubky, kvality a věcem se věnovat komplexně. A to vše s nejmodrnějšími technologiemi. Pokud vám to dává smysl, doporučujeme číst dál.&nbsp;</p><p><strong>Co budete dělat?&nbsp;</strong></p><ul><li><p>Jádrem naší práce je vývoj různorodych aplikací na platformě .NET. Nejčastěji za účelem customizace našeho CRM (MS Dynamics CRM) a jeho propojení s externími službami.&nbsp;</p></li><li><p>Pomáháme ale také rozvíjet i naše webové stránky a portály, které využívají naše firemní CMS, Kentico Xperience. &nbsp;</p></li><li><p>Většinu času budete věnovat vývoji, zbytek správě systému a odbavování menších uživatelských požadavků.&nbsp;</p></li><li><p>Pustíme vás do opravdu hodně dílčích obastí. Jednou můžete implementovat vyhledávací řešení nad incidenty v CRM, jindy se zaměřit na integraci mezi Kentico Xperience a Dynamics CRM nebo se zabývat implementací single sign-on na webu Kentico. Teď například pracujeme na integraci našeho CRM s elektronickým podepisováním pomocí PandaDoc. Integrační úkoly často vyžadují seznámit se samostatně s externím nástrojem, pochopit jeho fungování, navrhnout způsob integrace a ten následně implemenotvat.&nbsp;</p></li><li><p>Jak už jsme psali, snažíme se jít po věcech do detailu, vyvíjíme vše koneckonců sami pro sebe, takže cílem není rozhodně nic jiného než opravdu kvalitní práce v každém ohledu. K tomu se snažíme používat ty nejmodernější technologie - viz níže. Jsme v mnoha ohledech jedinečný tým, bez kterého se firma neobejde. &nbsp;</p></li><li><p>Nehledáme nutně hotového člověka a tato práce je vhodná i pro juniornější kandidáty, kteří se chtějí především učit. Práci tak vždy přizpůsobíme vašim zkušenostem a tomu, co se chcete naučit, protože možnosti je u nás spoustu. &nbsp;</p></li></ul><p><strong>Jaký je náš tým?&nbsp;</strong></p><ul><li><p>Pětičlenný, zkušený a férový. Každý, kdo má chuť zkoušet nové věci, nebýt v rutině a posouvat svůj záběr, by se u nás mohl najít.&nbsp;</p></li><li><p>Jinak také úzce spolupracujeme s Product Ownery, kteří sbírají požadavky od našich interních zákazníků a při vývoji samotném se chceme držet průmyslových standardů, takže:&nbsp;</p></li><li><p>Kvalita kódu je pro nás hodně důležitá, proto tlačíme na jeho čistotu a pravidelné reviews.&nbsp;</p></li><li><p>Kód máme pokrytý automatickými testy, přičemž funkčnost a splnění akceptačních kritérií ověřuje náš QA Engineer.&nbsp;</p></li><li><p>Chceme mít co nejvíce aplikací automaticky nasaditelných.&nbsp;</p></li><li><p>Monitorujeme naše systémy pomocí nástroje Graylog a Application Insights.&nbsp;</p></li></ul><p><strong>Proč se vám u nás bude líbit? &nbsp;</strong></p><ul><li><p>Můžete se soustředit na to, co vás zajímá – od webu až po back-endové integrační systémy.&nbsp;</p></li><li><p>Budete se učit přímo od Michala Vrány. Tenhle Technical Lead je v Kentico už 15 let. Začínal jako vývojář a rychle se vypracoval na vedoucí pozici. Dnes má co předat a rád vám pomůže profesně vyrůst.&nbsp;</p></li><li><p>Neřídíme se dogmaticky zadáním. Když to dává smysl, přicházíme s vlastní iniciativou, jak vylepšit procesy ve firmě.&nbsp;</p></li><li><p>Chceme být nejlepší, ale nejdeme přes mrtvoly. Naším cílem je najít ideální balanc mezi dobrým a kvalitním výkonem a zároveň dobrými vztahy.&nbsp;</p></li><li><p>V Kenticu budeš mít klid na práci v tom nejlepším slova smyslu. Není to u nás až tak extrémně dynamické, ale to neznamená, že se k nám jdeš flákat a odpočnout si. Nehrozí u nás pozdní cally, jelikož celý department vývoje sedí v rámci ČR. &nbsp;</p></li><li><p>Je tu fantasticky nastavený work-life balanc. Kentico respektuje, že lidé mají rodinu, že musí odpočívat atd. Ta firma tímto mindsetem opravdu žije – není cílem lidi vyždímat.&nbsp;</p></li></ul><p><strong>Benefity:&nbsp;</strong></p><ul><li><p>Innovation time je hodně unikátní benefit, který v sobě mixuje náš přístup k důvěře, svobodě, inovacím a potřebě rozvoje. Je to čas, který je dedikován tvému rozvoji. Umožňuje 20 % tvého času věnovat inovacím a dalšímu vzdělávání, které je pro firmu smysluplné.&nbsp;</p></li><li><p>Neomezená dovolená: pokud nevyčerpáváš svých 5 týdnů, máš nárok na extra volno navíc. Chceme, aby se lidé u nás cítili dobře a nebyly na pokraji vyhoření. Pokud potřebuješ další volno nad základní rámec, domluv se se svým TL a pokud on schválí, že to dává smysl, klidně si placené volno rozšiř tak, jak bude potřeba.&nbsp;</p></li><li><p>Máme také neomezený počet sick days. Opět je za tím podobná myšlenka jako výše. Nechceme, abys na sílu přeházel nemoci a táhl si zdravotní problémy x týdnů.&nbsp;</p></li><li><p>Máme také extra finanční odměny ke svatbě, narození dítěte a extra otcovskou dovolenou.&nbsp;</p></li><li><p>Kromě toho máme možnost udělat si různé certifikace, které jsou plně hrazené Kenticem, máme intermí cvičení no o a pak máme samozřejmě nezbytné klasiky z trhu, jako jsou stravenky, multisportku, hodně bohaté občerstvení v kancelářích, příspěvek na HO, mnoho firemních akcí atd. &nbsp;</p></li></ul><p><strong>Budeme si rozumět? &nbsp;</strong></p><ul><li><p>Dobře znáte C#, případně máte zkušenost i s jiným objektově orientovaným jazykem.&nbsp;</p></li><li><p>Používáme moderní technologie jako je Dynamics 365 online, PowerApps, Javascript, React, Git, NUnit, Selenium, Azure, Azure Devops, Bicep, AWS. Pokud znáte jen některé, rádi vás zbytek doučíme.&nbsp;</p></li><li><p>Pokud máte zkušenosti s vývojem většího informačního systému, napíšeme si k vám velké plus, není to ale nutná podmínka.&nbsp;</p></li><li><p>Anglicky se domluvíte, především písmem, alespoň na úrovni B2.&nbsp;</p></li><li><p>Do kanceláří fyzicky chodíme alespoň 2 dny v týdnu. Rádi se potkáváme a takto nám to funguje.&nbsp;</p></li></ul><p>Budeme rádi, když k nám nastoupíte na plný úvazek. Případně se můžeme domluvit i na částečném. &nbsp;</p>"
"JavaScript vývojář – full remote, IT startup (junior/medior)",Rascasone - weby & mobilní appky,https://www.startupjobs.cz/nabidka/87713/javascript-vyvojar-full-remote-it-startup-junior-medior?utm_source=juniorguru&utm_medium=cpc&utm_campaign=juniorguru,True,2025-02-06 00:00:00,,cs,,,startupjobs#87713,,,,,,,,,,Praha,,,,,,,,,,,,,,,,,,,,Praha,,,,,,,,,,,,,,,,,,,,fulltime,parttime,,,,,,,,,"<p id=""isPasted"">Ahoj,<br><br>jsem <a href=""https://www.linkedin.com/in/martin-andrt/"" target=""_blank"" rel=""noopener""><strong>Martin</strong></a> ze software housu <a href=""https://www.rascasone.com/cs"" target=""_blank"" rel=""noopener""><strong>Rascasone</strong></a>, ve kterém máme hlavní focus na vývoj webových a mobilních appek. Poohlížíme se po někom (junior-medior), kdo je šikovný ve <strong>fullstack JavaScriptu</strong> (Node.js + React/Vue/Svelte/… a klidně i další).&nbsp;</p><p>Makat u nás budeš na vícero projektech, díky tomu se&nbsp;<strong>naučíš&nbsp;</strong><strong>spoustu nových technologií a to všechno z gauče nebo pláže 🤗</strong><br><br><strong>Co bys měl/a vědět, než nám napíšeš?&nbsp;</strong><br>Hledáme někoho, kdo má zápal a chuť se posouvat, ne jen nabušené CV. Pokud jsi junior nadšený do technologií a tvůj přístup to dokazuje, rádi tě přivítáme!<br><br></p><p><strong>Co u nás budeš dělat: &nbsp;🔧</strong></p><ul id=""isPasted""><li id=""isPasted"">Vývoj a údržba frontendu (React, Vue/Nuxt, Svelte, Next.js, Solid.js)</li><li id=""isPasted"">Práce na backendu (Node.js se Strapi, Directus, Express, případně PHP Symfony)</li><li id=""isPasted"">Propojování aplikací přes REST, tRPC nebo GraphQL</li><li>Odhady při kalkulaci zakázek (dle tvých zkušeností)</li><li>Samostatné řešení svěřených úkolů&nbsp;</li><li>Komunikace s klientem</li><li id=""isPasted"">Aktivní spolupráce s týmem (code review, řešení úkolů, když se něco zastaví, umíš to posunout dál)</li></ul><p><strong>Co by ti nemělo chybět: 💻</strong></p><ul><li>Praktické zkušenosti s programováním v&nbsp;JavaScriptu a TypeScriptu</li><li id=""isPasted"">Zkušenosti s React/Vue/Svelte (React/Vue jsou nutné, Svelte velké plus!)</li><li id=""isPasted"">Základy Tailwind CSS a Shadcn/ui nebo chuť se to rychle doučit</li><li>Zkušenosti s použitím REST API, tRPC nebo GraphQL&nbsp;</li><li id=""isPasted"">Proaktivní přístup – posouváš projekty i tým, pokud něco stojí, hlásíš se</li><li>AJ na komunikační úrovni (call s klientem, čtení dokumentace)</li><li><strong>Bonus:&nbsp;</strong>znalost PHP Symfony, Flutter, Ruby on Rails&nbsp;nebo jiné technologie</li></ul><p><strong>Co najdeš u nás:&nbsp;</strong></p><ul><li><strong>Full remote práci</strong> (kdekoliv se ti dobře tvoří)</li><li>Časově flexibilní práci dle dohody (žádný mikromanagement)</li><li>Různorodé projekty - spoustu nových technologií</li><li>Multisportku!</li></ul><p>Nečekej u nás korporátní prostředí. <strong>Jsme parta nadšenců, co to mají podobně jako ty!</strong> U nás se můžeš přímo podílet na budování firmy (tvorba firemních pravidel, postupů, know-how atp.).</p><p id=""isPasted"">Pokud preferuješ jen frontend (cca 80 h měsíčně) nebo chceš raději fulltime jako fullstack, umíme se domluvit. Zajímá nás, jak si představuješ ideální firmu, co tě baví na vývoji a jak se chceš dál posouvat.</p><p>Pošli prosím své CV a napiš, co tě na inzerátu zaujalo. Pak si dáme krátký call a probereme detaily 🤗</p><p><strong>Těším se,<br>Martin z Rascasone</strong></p>"
