"Developer .NET - C#, ASP.NET, .NET Core",BSSHOP s.r.o.,https://www.jobs.cz/rpd/2000819597/,False,2025-10-30 00:00:00,,cs,,,jobscz#2000819597,,,,,,,,,,Trutnov,Trutnov,,,,,,,,,,,,,,,,,,,Hradec Králové,Hradec Králové,,,,,,,,,,,,,,,,,,,fulltime,,,,,,,,,,"<div data-jobad=""body"" data-test=""jd-body-richtext"" class=""RichContent mb-1400""><p class=""typography-body-medium-text-regular text-secondary mb-600"">Pracovní nabídka</p><p class=""typography-body-large-text-regular mb-800""><em>Staňte se součástí týmu programátorů, kteří pracují na tvorbě a rozvoji e-shopové platformy BSSHOP. Řešení BSSHOP je na trhu jedinečné zejména svým napojením na IS Pohoda, který patří mezi nejrozšířenější systémy na českém a slovenském trhu.</em></p><p class=""typography-body-large-text-regular mb-800""><strong>Co u nás budeš dělat?</strong></p><ul class=""typography-body-large-text-regular""><li>na vývoji e-shopové platformy BSSHOP (implementace nových funkčností, inovace a vylepšování současných funkčností)</li><li>na vývoji jednotlivých e-shopů (grafika, speciální funkce a úpravy na míru)</li><li>na vývoji interních nástrojů</li><li>… a další dle aktuální potřeby</li></ul><p class=""typography-body-large-text-regular mb-800""><strong>Co bys asi tak měl/a umět?</strong></p><ul class=""typography-body-large-text-regular""><li>znalost programování v prostředí .NET - C#</li><li>výhodou znalost ASP.NET</li><li>výhodou znalost HTML a CSS</li><li>chuť učit se novým věcem a pracovat na sobě</li><li>pozice je vhodná i pro <strong>schopné absolventy</strong></li></ul><p class=""typography-body-large-text-regular mb-800""><strong>Proč pracovat právě u nás?</strong></p><ul class=""typography-body-large-text-regular""><li>Přijdeš do kontaktu se zajímavými projekty.</li><li>Práce u nás je hodně rozmanitá.</li><li>Nudit se nebudeš ani pro práci (společně jezdíme na kola, rafty, grilujeme, sportujeme, slavíme ...).</li><li>Získáš nové zkušenosti, načerpáš nové znalosti, budeš moct realizovat své nápady.</li><li>Věrní zaměstnanci mají více dovolené pro své blízké, koníčky atd.</li><li>Kvalitní káva i další nápoje volně k dispozici na pracovišti.</li><li>Stalo se již tradicí, že každý při svých narozeninách nebo svátku připraví drobné pohoštění, takže Tě u nás občas překvapí chlebíčky, zákusky nebo jiné pochoutky.</li><li>Výhodné datové i mobilní tarify pro zaměstnance i rodinné příslušníky.</li><li>Nové a moderně vybavené kanceláře máme v centru Trutnova, takže to je všude kousek.</li><li><strong>Bezbariérový přístup</strong> na pracoviště.</li></ul><p class=""typography-body-large-text-regular mb-800""><strong>... a co ještě nabízíme?</strong></p><ul class=""typography-body-large-text-regular""><li>Free zóna - někdy si musí mozek odpočinout, aby mohl zase běžet na 200% a k tomu slouží naše free zóna, kde si můžeš zahrát stolení tenis, šipky, kulečník nebo fotbálek. Po práci si pak můžeš zalenošit u oblíbeného filmu, jen tak relaxovat při kvalitní hudbě vybláznit se s virtuální realitou nebo zapařit na play station.</li><li>Posilovna – umístěna přímo v budově BSSHOP a je k dispozici 24/7 (běžecká pás, cyklo trenažér, silový trénink ....)</li><li>Letní terasa s grilem - grilování na terase namísto klasického oběda? Skvělý nápad!</li><li>Dovolená – za každý odpracovaný rok přidáme den navíc</li><li>Příspěvek na stravování</li><li>Příspěvek na životní pojištění.</li><li>Sick days.</li></ul></div>"
Frontend Developer -React,EASYCON Solution s.r.o.,https://www.jobs.cz/rpd/2000818782/,False,2025-10-30 00:00:00,,cs,,,jobscz#2000818782,,,,,,,,,,Brno,Brno,,,,,,,,,,,,,,,,,,,Brno,Brno,,,,,,,,,,,,,,,,,,,fulltime,parttime,,,,,,,,,"<div data-jobad=""body"" data-test=""jd-body-richtext"" class=""RichContent mb-1400""><p class=""typography-body-medium-text-regular text-secondary mb-600"">Pracovní nabídka</p><p class=""typography-body-large-text-regular mb-800""><strong>EASYCON</strong> je mladá dynamicky rostoucí společnost, která se specializuje na moderní IT řešení a digitalizaci procesů převážně v energetice a výrobních podnicích.</p><p class=""typography-body-large-text-regular mb-800"">Věnujeme se těmto oblastem:</p><ul class=""typography-body-large-text-regular""><li>SVR - online řízení elektráren za účelem vyrovnávání energetické sítě ČR</li><li>Optimalizace výrobních linek a procesů u výrobních firem</li><li>Predikce energií a jiných kontinuálních veličin s pomocí umělé inteligence</li><li>Obchodní flexibilita a obchodování na VDT</li></ul><p class=""typography-body-large-text-regular mb-800""><strong>Do našeho týmu hledáme kolegu, který s námi bude vyvíjet naši aplikaci a posouvat ji vpřed. Hledáme někoho, kdo se nebojí přinášet nápady a hledat nová řešení.</strong></p><h2 class=""typography-heading-small-text""><strong>Co budeš dělat?</strong></h2><ul class=""typography-body-large-text-regular""><li>Pracovat na projektech s našimi partnery</li><li>Vytvářet a optimalizovat naši aplikaci a s tím spojené služby</li><li>Review kódu - svých kolegů</li><li>Vytváření dokumentace</li></ul><h2 class=""typography-heading-small-text""><strong>Co od tebe očekáváme?</strong></h2><ul class=""typography-body-large-text-regular""><li>React - základní znalosti</li><li>HTML/CSS - pokročilá znalost</li><li>Javascript - základní znalost</li><li>Znalost Gitu výhodou</li><li>Máš smysl a cit pro detail</li><li>Nebojíš se diskutovat o nových nápadech, ale i vzniklých problémech</li><li>Chceš posouvat a rozvíjet sebe i tým</li><li>Práce převážně z kanceláře (onsite)</li><li>V případě zkráceného úvazku odpracovat min. 25hod./týdně</li></ul><h2 class=""typography-heading-small-text""><strong>Co nabízíme?</strong></h2><ul class=""typography-body-large-text-regular""><li>Neformální firemní kultura</li><li>Multisport</li><li>Káva a občerstvení na pracovišti</li><li>Pravidelné akce a teambuilding</li><li>Možnost kariérního růstu</li><li>Prostor pro nové nápady</li><li>Možnost občasné práce z domova</li><li>Firemní notebook</li><li>Možnost účastnit se vzdělávacích kurzů</li><li>Pet friendly office</li></ul><p class=""typography-body-large-text-regular mb-800""><br><strong>Pokud se chceš stát součástí EASYCONu, ozvi se nám!</strong></p></div>"
Web Developer,"VŠB - TUO, IT4Innovations národní superpočítačové centrum",https://www.jobs.cz/rpd/2000791164/,False,2025-10-30 00:00:00,,cs,,,jobscz#2000791164,,,,,,,,,,Ostrava,Ostrava,,,,,,,,,,,,,,,,,,,Ostrava,Ostrava,,,,,,,,,,,,,,,,,,,fulltime,,,,,,,,,,"<div data-jobad=""body"" data-test=""jd-body-richtext"" class=""RichContent mb-1400""><p class=""typography-body-medium-text-regular text-secondary mb-600"">Pracovní nabídka</p><p class=""typography-body-large-text-regular mb-800""><strong>IT4Innovations</strong> je předním výzkumným, vývojovým a inovačním centrem v oblasti vysoce výkonného počítání (HPC), datových analýz (HPDA), umělé inteligence (AI), kvantového počítání (QC) a jejich aplikací do dalších vědeckých, průmyslových i společenských oborů. Má silné mezinárodní vazby a zaměstnává více než 180 vědeckých, technických i administrativních zaměstnanců. V současné době IT4Innovations provozuje dva superpočítače: Karolina (15,7 PFlop/s, instalovaný v létě 2021) a Barbora (849 TFlop/s, instalovaný na podzim 2019) a je členem konsorcia provozujícího jeden z nejvýkonnějších evropských superpočítačů LUMI. Nově je v IT4Innovations také první český kvantový počítač pojmenovaný VLQ. Pro více informací navštivte www.it4i.cz <br>V současné chvíli hledáme na pozice <strong>HPC System Specialist: Web Developer/ DevOps Specialista </strong><br> <br><strong>Popis pracovních činností:</strong></p><ul class=""typography-body-large-text-regular""><li>vývoj a správa in-house informačního systému (na bázi frameworku pro vývoj webových aplikací),</li><li>vývoj nové funkcionality systému a řešení existujících bugu,</li><li>správa Git repozitáře,</li><li>operativní generování reportů,</li><li>automatizace činností dostupnými nástroji i vlastními skripty, programovaní (Python, Bash),</li><li>možnost zapojení do národních i mezinárodních výzkumných projektů,</li><li>možnost publikační činnosti včetně prezentace výsledku na konferencích.</li></ul><p class=""typography-body-large-text-regular mb-800"">Výše úvazku: 1,0<br>Forma úvazku: pracovní smlouva na dobu určitou s možností prodloužení<br>Předpokládaný nástup: 1. 11. 2025 a nebo dle dohody<br>Dlouhodobější spolupráce se studenty možná. <br> <br><strong>Požadavky na kandidáta/tku:</strong></p><ul class=""typography-body-large-text-regular""><li>VŠ vzdělání,</li><li>základní znalost a praxe v programování,</li><li>znalost skriptování v jazycích Bash nebo Python,</li><li>aktivní, zodpovědný a komunikativní člověk s analytickými dovednostmi,</li><li>anglický jazyk,</li><li>ochota se dále aktivně a samostatně vzdělávat.</li></ul><p class=""typography-body-large-text-regular mb-800""><strong> Výhodou kandidáta/tky:</strong></p><ul class=""typography-body-large-text-regular""><li>zkušenost s technickou implementací všech aspektů DevOps, CI/CD, automatizace, kontejnerizace, infrastruktura a konfigurace jako kód,</li><li>znalost práce s db (ideálně MySQL/Mariadb),</li><li>znalost z automatizačními nástroji (Ansible, etc).</li></ul><p class=""typography-body-large-text-regular mb-800""><strong> Nabízíme:</strong></p><ul class=""typography-body-large-text-regular""><li>menší pracovní tým rodinného typu, žádný nekonečný korporát,</li><li>práci v prestižní stabilní organizaci s mezinárodním a moderním prostředím,</li><li>mzda podle kvalifikace a zkušeností kandidáta,</li><li>možnost magisterského nebo doktorského studia v oblasti IT,</li><li>hlavní a nebo částečný pracovní poměr,</li><li>jazykové vzdělávání a odborná školení,</li><li>možnost parkování přímo na pracovišti,</li><li>6 týdnů dovolené,</li><li>pružná pracovní doba a možnost částečně pracovat z domu,</li><li>univerzitní mateřská školka,</li><li>příspěvek na penzijní připojištění,</li><li>závodní stravování v menze,</li><li>MultiSport karta,</li><li>otevřenost všemu novému. Od nápadu k realizaci je u nás jenom krůček. To, co umíte, využijete a hodně dalšího se toho naučíte. Profesně porostete v různých IT oblastech s tím, jak pomůžete nasazovat nové věci a udržovat ty běžící a rozhodně se u nás nebudete nudit.</li></ul><p class=""typography-body-large-text-regular mb-800""><br>Osobní údaje uchazeče budou zpracovány v rozsahu nezbytném pro realizaci výběrového řízení v souladu s Nařízením EU 2016/679. <br>https://www.vsb.cz/export/sites/vsb/cs/.content/galerie-souboru/Informace-pro-uchazece-o-zamestnani.pdf <br> <br>Přihlášky doložené životopisem a motivačním dopisem zasílejte odpovědí na tento inzerát do 26. 10. 2025.<br>Do předmětu zprávy uvádějte prosím „Web Developer/ DevOps Specialista“.</p></div>"
Linux Administrátor se zájmem o AI,"VŠB - TUO, IT4Innovations národní superpočítačové centrum",https://www.jobs.cz/rpd/2000790898/,False,2025-10-30 00:00:00,,cs,,,jobscz#2000790898,,,,,,,,,,Ostrava,Ostrava,,,,,,,,,,,,,,,,,,,Ostrava,Ostrava,,,,,,,,,,,,,,,,,,,fulltime,,,,,,,,,,"<div data-jobad=""body"" data-test=""jd-body-richtext"" class=""RichContent mb-1400""><p class=""typography-body-medium-text-regular text-secondary mb-600"">Pracovní nabídka</p><p class=""typography-body-large-text-regular mb-800""><strong>IT4Innovations</strong> je předním výzkumným, vývojovým a inovačním centrem v oblasti vysoce výkonného počítání (HPC), datových analýz (HPDA), umělé inteligence (AI), kvantového počítání (QC) a jejich aplikací do dalších vědeckých, průmyslových i společenských oborů. Má silné mezinárodní vazby a zaměstnává více než 180 vědeckých, technických i administrativních zaměstnanců. V současné době IT4Innovations provozuje dva superpočítače: Karolina (15,7 PFlop/s, instalovaný v létě 2021) a Barbora (849 TFlop/s, instalovaný na podzim 2019) a je členem konsorcia provozujícího jeden z nejvýkonnějších evropských superpočítačů LUMI. Nově je v IT4Innovations také první český kvantový počítač pojmenovaný VLQ. Pro více informací navštivte www.it4i.cz <br>V současné chvíli hledáme na pozice HPC System Specialist: Linux Administrátor <br> <br><strong>Popis pracovních činností:</strong></p><ul class=""typography-body-large-text-regular""><li>technická implementace všech aspektů DevOps, CI/CD, automatizace, kontejnerizace, infrastruktura a konfigurace jako kód,</li><li>správa Linux serverů na platformách VMware, Openstack, Kubernetes,</li><li>instalace serveru od OS až po aplikace, dle požadavků uživatelů,</li><li>řešení incidentů v produkci, provádění analýzy příčin a zajištění rychlého odstranění problémů,</li><li>automatizace činností dostupnými nástroji i vlastními skripty, programovaní (Python, Bash),</li><li>možnost zapojení do národních i mezinárodních výzkumných projektů,</li><li>možnost publikační činnosti včetně prezentace výsledku na konferencích.</li></ul><p class=""typography-body-large-text-regular mb-800""><br>Výše úvazku: 1,0<br>Forma úvazku: pracovní smlouva na dobu určitou s možností prodloužení<br>Předpokládaný nástup: 1. 11. 2025 a nebo dle dohody<br>Dlouhodobější spolupráce se studenty možná. <br> <br><strong>Požadavky na kandidáta/tku:</strong></p><ul class=""typography-body-large-text-regular""><li>VŠ vzdělání,</li><li>znalost OS Linux,</li><li>znalost skriptování v jazycích Bash nebo Python,</li><li>zkušenosti z některými z následujících technologií Kubernetes, Openstack, Rancher, Helm, Terraforms, Ansible, GitLab, GitHub, Docker,</li><li>aktivní, zodpovědný a komunikativní člověk s analytickými dovednostmi,</li><li>anglický jazyk,</li><li>ochota se dále aktivně a samostatně vzdělávat.</li></ul><p class=""typography-body-large-text-regular mb-800""><br><strong>Výhodou kandidáta/tky:</strong></p><ul class=""typography-body-large-text-regular""><li>základní znalost a praxe v programování,</li><li>zkušenosti s vývojem, implementací a údržbou CI/CD pipeline pro automatizaci procesu budování, testování a nasazování aplikací,</li><li>znalost práce s automatizačními nástroji (Ansible).</li></ul><p class=""typography-body-large-text-regular mb-800""><br><strong>Nabízíme:</strong></p><ul class=""typography-body-large-text-regular""><li>menší pracovní tým rodinného typu, žádný nekonečný korporát,</li><li>práci v prestižní stabilní organizaci s mezinárodním a moderním prostředím,</li><li>mzda podle kvalifikace a zkušeností kandidáta,</li><li>možnost magisterského nebo doktorského studia v oblasti IT,</li><li>hlavní a nebo částečný pracovní poměr,</li><li>jazykové vzdělávání a odborná školení,</li><li>možnost parkování přímo na pracovišti,</li><li>6 týdnů dovolené,</li><li>pružná pracovní doba a možnost částečně pracovat z domu,</li><li>univerzitní mateřská školka,</li><li>příspěvek na penzijní připojištění,</li><li>závodní stravování v menze,</li><li>MultiSport karta,</li><li>otevřenost všemu novému. Od nápadu k realizaci je u nás jenom krůček. To, co umíte, využijete a hodně dalšího se toho naučíte. Profesně porostete v různých IT oblastech s tím, jak pomůžete nasazovat nové věci a udržovat ty běžící a rozhodně se u nás nebudete nudit.</li></ul><p class=""typography-body-large-text-regular mb-800""><br>Osobní údaje uchazeče budou zpracovány v rozsahu nezbytném pro realizaci výběrového řízení v souladu s Nařízením EU 2016/679. <br>https://www.vsb.cz/export/sites/vsb/cs/.content/galerie-souboru/Informace-pro-uchazece-o-zamestnani.pdf <br> <br>Přihlášky doložené životopisem a motivačním dopisem zasílejte odpovědí na tento inzerát do 26. 10. 2025.<br>Do předmětu zprávy uvádějte prosím „Linux Administrátor se zájmem o AI“.</p></div>"
Junior Technical Consultant (Remote + Travelling),NonStop Consulting s.r.o.,https://www.jobs.cz/rpd/2000809306/,False,2025-10-30 00:00:00,,cs,,,jobscz#2000809306,,,,,,,,,,Brno,,,,,,,,,,,,,,,,,,,,Brno,,,,,,,,,,,,,,,,,,,,fulltime,,,,,,,,,,"<div data-jobad=""body"" data-test=""jd-body-richtext"" class=""RichContent mb-1400""><p class=""typography-body-medium-text-regular text-secondary mb-600"">Pracovní nabídka</p><p class=""typography-body-large-text-regular mb-800""><strong>Junior Technical Consultant – CEE (Česko, Slovensko, Polsko)</strong></p><p class=""typography-body-large-text-regular mb-800""><br>Hledáš první práci v IT nebo technické podpoře, kde využiješ logické myšlení a komunikaci s lidmi?<br>Přidej se k mezinárodnímu týmu, který pomáhá lékařům a pacientům s používáním moderních digitálních řešení ve zdravotnictví.</p><p class=""typography-body-large-text-regular mb-800""><br><strong>Co budeš dělat</strong></p><ul class=""typography-body-large-text-regular""><li>Pomáhat uživatelům s přihlášením, nastavením a základním řešením technických problémů</li><li>Poskytovat podporu online i osobně (školení, konzultace, troubleshooting)</li><li>Spolupracovat s mezinárodním týmem v Německu</li><li>Zajišťovat správné a bezpečné nakládání s uživatelskými daty (GDPR)</li><li>Cestovat cca 20–40 % času (hlavně Česko a Slovensko, minimálně Polsko) – zbytek práce z domova</li></ul><p class=""typography-body-large-text-regular mb-800""><strong>Koho hledáme</strong></p><ul class=""typography-body-large-text-regular""><li>Jsi technicky zdatný (umíš si poradit s běžnými IT situacemi, rád hledáš řešení)</li><li>Máš komunikační schopnosti a trpělivost – rád pomáháš lidem</li><li>Můžeš být student, čerstvý absolvent IT školy nebo kdokoliv se zájmem o technologii</li><li>Umíš anglicky (denní komunikace s centrálou v zahraničí)</li><li>Jsi samostatný, zodpovědný a ochotný občas cestovat</li></ul><p class=""typography-body-large-text-regular mb-800""><strong>Co nabízíme</strong></p><ul class=""typography-body-large-text-regular""><li>Spolupráci na IČO (freelance)</li><li>Proplácené cestovní náklady</li><li>Firemní automobil</li><li>Flexibilní práci z domova</li><li>Možnost získat zkušenosti v oblasti digitalizace zdravotnictví a kariérně růst</li></ul></div>"
Analytik Security Operations Center (SOC),Thein Security s.r.o,https://www.jobs.cz/rpd/1622789154/,False,2025-10-30 00:00:00,,cs,,,jobscz#1622789154,,,,,,,,,,Praha,Praha,,,,,,,,,,,,,,,,,,,Praha,Praha,,,,,,,,,,,,,,,,,,,fulltime,,,,,,,,,,"<div data-jobad=""body"" data-test=""jd-body-richtext"" class=""RichContent mb-1400""><p class=""typography-body-medium-text-regular text-secondary mb-600"">Pracovní nabídka</p><p class=""typography-body-large-text-regular mb-800""><strong>Thein Security</strong> hledá vášnivé jedince, kteří nám pomohou chránit naše zákazníky před kybernetickými hrozbami. Hledáme posily bez ohledu na úroveň zkušeností a vzdělání.</p><p class=""typography-body-large-text-regular mb-800""><strong>Co Vás čeká v Thein Security?</strong></p><ul class=""typography-body-large-text-regular""><li>Základní analýza kybernetických událostí a jejich vyhodnocování</li><li>Sledování aktivity v bezpečnostních nástrojích SIEM a SOAR</li><li>Vytváření a optimalizace pracovních postupů (playbooků)</li><li>Studium a prohlubování Vašich vědomostí</li></ul><p class=""typography-body-large-text-regular mb-800""><strong>Co očekáváme od ideálního kandidáta?</strong></p><ul class=""typography-body-large-text-regular""><li>Analytické myšlení a dovednosti</li><li>Ochotu přispět našemu týmu a podílet se na ochraně našich klientů</li><li>Ochotu pracovat ve směnném provozu</li><li>Znalost technické angličtiny</li></ul><p class=""typography-body-large-text-regular mb-800""><strong>Oceníme, pokud budete mít:</strong></p><ul class=""typography-body-large-text-regular""><li>Praktické zkušenosti s bezpečnostními nástroji (ArcSight, Elastic, QRadar, Microsoft Sentinel, XSOAR, Tenable Nessus, OpenVAS, …)</li><li>Praktické zkušenosti s ticketovacími nástroji (Jira, ServiceNow, …)</li><li>Základní znalost principů fungování IT infrastruktury, operačních systémů Windows/Linux a síťových protokolů</li><li>Základní znalost MITRE ATT&amp;CK framework a bezpečnostních principů (CIA triad)</li><li>Certifikace dokládající Vaše zkušenosti kupř. CompTIA Security+, Blue Team Level 1</li></ul><p class=""typography-body-large-text-regular mb-800""><strong>Co naopak nabízíme my?</strong></p><ul class=""typography-body-large-text-regular""><li>Příležitost odstartovat kariéru v oblasti IT security</li><li>Rozvoj v oboru s možností učit se od dlouholetých profesionálů v oboru cybersecurity</li><li>Přístup ke špičkovým bezpečnostním technologiím</li><li>Příjemné prostředí v moderních prostorách na Pankráci, zaměstnanecké benefity (5 týdnů dovolené, sick days, stravenková karta Sodexo a další)</li></ul><p class=""typography-body-large-text-regular mb-800""><strong>Jestli Vás naše pozice oslovila, dejte nám o sobě vědět a pošlete nám CV nebo odkaz na LinkedIn.</strong></p><p class=""typography-body-large-text-regular mb-800""><strong>Těšíme se!</strong>  </p></div>"
