Junior Test Analyst,Deckard & Penfield s.r.o.,https://www.jobs.cz/rpd/2000553115/,False,2025-04-11 00:00:00,,cs,,,jobscz#2000553115,,,,,,,,,,Hradec Králové,Hradec Králové,,,,,,,,,,,,,,,,,,,Hradec Králové,Hradec Králové,,,,,,,,,,,,,,,,,,,fulltime,,,,,,,,,,"<div data-jobad=""body"" data-test=""jd-body-richtext"" class=""RichContent mb-1400""><p class=""typography-body-medium-text-regular text-secondary mb-600"">Pracovní nabídka</p><p class=""typography-body-large-text-regular mb-800"">Rozšiřujeme náš tým a na pozici <strong>Junior Test Analyst</strong> hledáme někoho, kdo se s námi rád ponoří do světa technologií a přinese do projektu chytrá řešení. Je analýza tvou silnou stránkou a orientuješ se v základních SQL dotazech? Tato pozice může být právě tvou novou kariérní příležitostí!</p><p class=""typography-body-large-text-regular mb-800"">Zpočátku se <strong>zapojíš do revize výstupů našich vývojářů</strong>. Jakmile budeš mít přehled, postupně přejdeš k <strong>analýze potřeb</strong> zákazníků a <strong>tvorbě inovativních návrhů</strong>.</p><p class=""typography-body-large-text-regular mb-800"">Přidej se k nám a podílej se s námi na zajímavých projektech v energetice!</p><h2 class=""typography-heading-small-text"">Co u nás budeš dělat?</h2><ul class=""typography-body-large-text-regular""><li><strong>analyzovat požadavky zákazníků a aktivně navrhovat možnosti řešení</strong></li><li><strong>revidovat výstupy vývojářů a ověřovat jejich kvalitu vůči analytickým výstupům</strong></li><li>spolupracovat na přípravě testovacích scénářů a testování nových funkcionalit</li><li>prezentovat výsledky dodaných funkčností business uživatelům</li><li>vytvářet projektovou dokumentaci</li></ul><h2 class=""typography-heading-small-text"">Jak si tě představujeme?</h2><ul class=""typography-body-large-text-regular""><li>máš <strong>výborné analytické schopnosti a aktivní přístup k řešení problémů</strong></li><li>nabídneš nám <strong>základní znalost objektově orientovaného programování</strong></li><li>nechybí ti <strong>orientace v základních SQL dotazech</strong></li><li>budou se ti hodit komunikační a organizační schopnosti</li><li>angličtina na komunikativní úrovni – minimálně pro čtení a psaní technické dokumentace</li></ul><p class=""typography-body-large-text-regular mb-800""><strong>Za výhodu považujeme</strong>:</p><ul class=""typography-body-large-text-regular""><li>znalost nástrojů a metodiky pro IT Analýzu (Enterprise Architekt, MS Visio, UML)</li></ul><h2 class=""typography-heading-small-text"">Které plusy ti u nás usnadní a zpříjemní život?</h2><ul class=""typography-body-large-text-regular""><li><strong>příspěvek na dovolenou</strong> v Chorvatsku, Řecku nebo na českých horách</li><li>finanční příspěvek pro novomanžele, <strong>vouchery na studium kurzů </strong>Red Monster pro děti</li><li>výhodný <strong>datový tarif +4U Mobile</strong> pro tebe a tvé blízké</li><li>tradiční plusy: 5 dnů rekondičního volna navíc ke 4 týdnům dovolené, MultiSport karta, stravování, penzijní připojištění a další </li></ul><p class=""typography-body-large-text-regular mb-800"">Využij své analytické schopnosti naplno! Pošli své CV nebo LinkedIn profil a připoj i nějaké své předchozí úspěchy, klidně i neúspěchy. Vše s tebou rádi probereme.</p></div>"
SW DEVELOPER - diagnostické aplikace pro jadernou technologii,TES s.r.o.,https://www.jobs.cz/rpd/2000499045/,False,2025-04-11 00:00:00,,cs,,,jobscz#2000499045,,,,,,,,,,Třebíč,Třebíč,,,,,,,,,,,,,,,,,,,Jihlava,Jihlava,,,,,,,,,,,,,,,,,,,fulltime,,,,,,,,,,"<div data-jobad=""body"" data-test=""jd-body-richtext"" class=""RichContent mb-1400""><p class=""typography-body-medium-text-regular text-secondary mb-600"">Pracovní nabídka</p><p class=""typography-body-large-text-regular mb-800"">Společnost TES s.r.o. je již více než 32 let prověřeným dodavatelem inženýrských služeb a technické podpory pro klíčové hráče v jaderné energetice jako je ČEZ, a.s. a další české i zahraniční partnery. Zaměstnancům nabízíme zázemí finančně stabilní firmy a přátelské prostředí. Čeká Vás zajímavá práce s moderní technologií a možnost dalšího odborného růstu. Vyvíjíme diagnostické systémy, monitorujeme elektrozařízení na jaderné elektrárně a analyzujeme naměřená data.</p><p class=""typography-body-large-text-regular mb-800""><strong>Pro náš vývojářský tým hledáme kolegu, který bude spolupracovat na vývoji a testování aplikací a systémů určených pro diagnostiku elektrozařízení a také sběr a zpracování technologických dat z provozu zařízení jaderné elektrárny. Orientace v elektrotechnice může být Vaší výhodou.</strong></p><p class=""typography-body-large-text-regular mb-800""><strong>PRACOVNÍ PODMÍNKY:</strong></p><p class=""typography-body-large-text-regular mb-800"">Pracoviště: TES s.r.o. – TŘEBÍČ<br>Pracovní poměr: pracovní smlouva na dobu neurčitou<br>Nástup: ihned nebo dle dohody</p><p class=""typography-body-large-text-regular mb-800""><strong>NÁPLŇ PRÁCE:</strong></p><ul class=""typography-body-large-text-regular""><li>Rozvoj našich aplikací pro sběr a vyhodnocování technologických dat.</li><li>Možnost podílet se na tvorbě nových projektů/aplikací.</li><li>Testování aplikací.</li><li>Budete součástí týmu zkušených programátorů.</li></ul><p class=""typography-body-large-text-regular mb-800""><strong>CO POŽADUJEME:</strong></p><ul class=""typography-body-large-text-regular""><li>Dobrá znalost programování v jazyku C/C++.</li><li>SŠ nebo VŠ vzdělání technického směru.</li><li>Schopnost analyzovat a optimalizovat kód.</li><li>Dobrá znalost lineární algebry, datových struktur, algoritmů.</li><li>Aktivní přístup a komunikativnost.</li><li>Schopnost číst technickou literaturu v angličtině.</li></ul><p class=""typography-body-large-text-regular mb-800""><strong>VÝHODOU MŮŽE BÝT:</strong></p><ul class=""typography-body-large-text-regular""><li>Zkušenosti s OS LINUX.</li><li>Znalost dalších programovacích jazyků (např. Ruby, Perl, Go, C#, PHP).</li><li>Základní znalost databází (např. PostgreSQL, InfluxDB, Redis).</li></ul><p class=""typography-body-large-text-regular mb-800""><strong>NABÍZÍME VÁM:</strong></p><ul class=""typography-body-large-text-regular""><li>5 týdnů dovolené na zotavenou,</li><li>3 dny na čerpání zdravotního volna (Sick-Days),</li><li>zkrácená pracovní doba (7,5 hod./den),</li><li>pružný začátek a konec pracovní doby,</li><li>přátelské prostředí,</li><li>firemní počítač a telefon + zvýhodněné rodinné tarify,</li><li>příspěvek na stravování,</li><li>stimulační fond,</li><li>příspěvek na penzijní připojištění a investiční produkty ve stáří,</li><li>odměny za hospodářský výsledek,</li><li>odměny k životnímu výročí a k odchodu do důchodu,</li><li>hrazené jazykové vzdělávání,</li><li>hrazené očkování na chřipku,</li><li>mimopracovní akce pro zaměstnance.</li></ul></div>"
Junior SAP Developer,NESS Czech,https://www.jobs.cz/rpd/2000395161/,False,2025-04-11 00:00:00,,cs,,,jobscz#2000395161,,,,,,,,,,Praha,,,,,,,,,,,,,,,,,,,,Praha,,,,,,,,,,,,,,,,,,,,fulltime,,,,,,,,,,"<div data-jobad=""body"" data-test=""jd-body-richtext"" class=""RichContent mb-1400""><p class=""typography-body-medium-text-regular text-secondary mb-600"">Pracovní nabídka</p><p class=""typography-body-large-text-regular mb-800"">Přidej se k našemu 30člennému SAP týmu a buď součástí inovativních projektů pro řízení podnikových procesů v reálném čase. Pracujeme na různorodých projektech převážně v oblasti utility a výroby. Dostaneš se k nejnovějším SAP technologiím, Cloud nevyjímaje. Těšit se na tebe budeme v Praze, Brně či Ostravě.</p><h2 class=""typography-heading-small-text"">Co by Tě v nové roli čekalo?</h2><ul class=""typography-body-large-text-regular""><li>Práce s nejnovějšími SAP technologiemi (SAP S/4 HANA, SAP Fiori, SAP Cloud Platform, SAP BTP a další),</li><li>programování v ABAPu či SAPUI5, kde Tě čeká vývoj nových funkcionalit</li><li>budeš se také podílet na rozvoji a zlepšování již implementovaného řešení, včetně návrhů a realizace.</li></ul><h2 class=""typography-heading-small-text""><br>Jak si my představujeme našeho nového parťáka?</h2><ul class=""typography-body-large-text-regular""><li>Máš alespoň základní zkušenost s jednou z těchto technologií FIORI/SAPUI5/ABAP/BTP či z oblasti webových technologií</li><li>co je pro nás nesmírně důležité je zvídavost a ochota učit se novým věcem,</li><li>byli bychom rádi, kdyby naším společným cílem bylo tě postupně posunout na takovou úroveň, kde bys uměl převzít vlastní zodpovědnost a jednat samostatně v přiřazených úkolech.</li></ul><h2 class=""typography-heading-small-text""><br>Na co se u nás můžeš těšit?</h2><ul class=""typography-body-large-text-regular""><li>na soudržný tým kolegů – vývojářů a konzultantů, kteří Ti kdykoliv pomůžou,</li><li>řadu projektů pro zákazníky z různých sektorů, které můžeš po čase měnit,</li><li>podporu osobního rozvoje (hard-skills, soft-skills, jazykové kurzy) a získávání certifikací,</li><li>formální i neformální akce, protože se chceme se svými kolegy i bavit – setkání kompetencí, sportovní závody, teambuildingy, cestovatelské večery, akce pro děti a rodinu.</li></ul><h2 class=""typography-heading-small-text""><br>No a taky na klasiku:</h2><ul class=""typography-body-large-text-regular""><li>nad rámec zákonné dovolené 5 Ness dnů a čím déle u nás jsi, tím víc jich máš</li><li>3 Sick day,</li><li>příspěvek na Multisport kartu,</li><li>mobilní telefon s neomezeným tarifem a 25 GB dat i pro soukromé účely,</li><li>partnerské benefity – tyto benefity a slevy můžeš čerpat stále a neomezeně (od sportu, přes kulturu, wellness až po slevu na nové auto),</li><li>příspěvek na penzijní připojištění,</li><li>stravenkový paušál.</li></ul><p class=""typography-body-large-text-regular mb-800""><br>Zaujala tě tato pracovní nabídka? Pošlete svůj životopis přes odpovědní formulář.</p></div>"
HELPDESK SPECIALIST / DATOVÝ ANALYTIK JUNIOR,"Austro-Bohemia,s.r.o.",https://www.jobs.cz/rpd/2000535484/,False,2025-04-11 00:00:00,,cs,,,jobscz#2000535484,,,,,,,,,,České Budějovice,České Budějovice,,,,,,,,,,,,,,,,,,,České Budějovice,České Budějovice,,,,,,,,,,,,,,,,,,,fulltime,,,,,,,,,,"<div data-jobad=""body"" data-test=""jd-body-richtext"" class=""RichContent mb-1400""><p class=""typography-body-medium-text-regular text-secondary mb-600"">Pracovní nabídka</p><p class=""typography-body-large-text-regular mb-800""><strong>Jsme úspěšnou českou IT firmou působící na trhu již od roku 2002, která se zabývá implementací CRM systému a analytických služeb, v rámci farmaceutického a FMCG segmentu.</strong></p><p class=""typography-body-large-text-regular mb-800"">Naše firma v roce 2025 velmi rychle roste a my potřebujeme dalšího člověka do našeho support týmu na pozici:</p><p class=""typography-body-large-text-regular mb-800""><strong>HELPDESK SPECIALIST / DATOVÝ ANALYTIK JUNIOR</strong></p><p class=""typography-body-large-text-regular mb-800"">Pokud miluješ práci s daty, tak jsme ti praví!</p><p class=""typography-body-large-text-regular mb-800""><strong>Co Tě určitě čeká:</strong></p><ul class=""typography-body-large-text-regular""><li><strong>Analýza a řešení požadavků klientů k jejich plné spokojenosti</strong></li><li>Příprava a zpracování dat pro datové analýzy klientů</li><li>Každodenní komunikace a online podpora stávajících a nových klientů</li><li>Vedení evidence klientských požadavků ve formě tiketů a jejich prioritizace</li><li>Nastavování systému a administrátorských oprav</li><li>Příprava zadání a spolupráce s našimi programátory a seniorními datovými analytiky</li></ul><p class=""typography-body-large-text-regular mb-800""><strong>Jaké znalosti a dovednosti bys měl/a mít:</strong></p><ul class=""typography-body-large-text-regular""><li><strong>Zákaznicky orientovaný a zodpovědný přístup k převzatým úkolům a termínům vyhotovení</strong></li><li>Pokročilou znalost MS EXCEL a základní povědomí o MS SQL a MS Power BI</li><li>Analytické myšlení s orientací na výběr nejefektivnějšího řešení</li><li>Dobré komunikační a organizační schopnosti</li><li>Výbornou češtinu nebo slovenštinu a mírně pokročilou angličtinu</li><li>Týmovost, pečlivost a smysl pro detail</li><li>SŠ/VŠ vzdělání</li></ul><p class=""typography-body-large-text-regular mb-800""><strong>Co Ti za to můžeme nabídnout:</strong></p><ul class=""typography-body-large-text-regular""><li><strong>Být součástí interního helpdesk týmu v jedné z nejúspěšnějších společností ve svém oboru</strong></li><li>Skvělou příležitost pro osobní rozvoj a progresivní posun svých dovedností a znalostí (až na pozici datový analytik senior nebo vedoucí helpdesk týmu)</li><li>Do budoucna možnost školení nových i stávajících klientů a přípravy manuálů a video tutoriálů</li><li>Další zajímavé projekty a výzvy s ohledem na růst společnosti</li><li>Pružnou pracovní dobu</li><li>Přímý vliv na dění ve společnosti</li><li>Neomezená konzumace kvalitní kávy</li><li>Mobilní telefon, notebook a možnost zapůjčení služebního auta k soukromým účelům</li><li>Přátelské a neformální pracovní prostředí</li><li>Přístup k moderním technologiím</li><li>Práci na HPP/IČO</li><li>Stabilní 100% českou firmu</li><li>Zázemí v našich kancelářích v centru Českých Budějovic</li></ul><p class=""typography-body-large-text-regular mb-800""><strong>Zaujala Tě tato pozice? Nebo víš, komu ji předat dál? Stojíme o relevantní kontakt a těšíme se!</strong></p><p class=""typography-body-large-text-regular mb-800""><strong>Jsme přátelská firma a chceme si plácnout s dalším člověkem, kterého baví stejné věci. Náš tým zkušených a přátelských kolegů se Tě už nemůže dočkat!</strong></p></div>"
"Front End Developer - animace, zvuky, grafika",DEVIRE s.r.o.,https://www.jobs.cz/rpd/2000559206/,False,2025-04-11 00:00:00,,cs,,,jobscz#2000559206,,,,,,,,,,Praha,,,,,,,,,,,,,,,,,,,,Praha,,,,,,,,,,,,,,,,,,,,fulltime,,,,,,,,,,"<div data-jobad=""body"" data-test=""jd-body-richtext"" class=""RichContent mb-1400""><p class=""typography-body-medium-text-regular text-secondary mb-600"">Pracovní nabídka</p><p class=""typography-body-large-text-regular mb-800"">Hledáme FE TypeScript/JavaScript vývojáře se znalostí Node.js a npm pro vývoj her a online aplikací (i na mobilní zařízení). Součástí práce je podílení se na vývoji interního Pixi.js frameworku.</p><p class=""typography-body-large-text-regular mb-800"">Hledáme někoho s grafickým cítěním.</p><p class=""typography-body-large-text-regular mb-800"">Ve firmě je nízká fluktuace a oceníme někoho, koho bude vývoj naší platformy opravdu bavit a bude s námi nejen pracovat :) déle. Budem rádi, pokud budeš mít chuť se vyvíjet ve svých znalostech a oceníš podporu týmu případně také rád poradíš kolegovi. </p><p class=""typography-body-large-text-regular mb-800"">Ve tvém týmu budou další 2 FE a 2 BE programátoři. Wireframy pro ně připravují 3 UX kolegové ve Figmě.</p><p class=""typography-body-large-text-regular mb-800""><strong>Jaké znalosti a dovednosti byste měli mít</strong></p><p class=""typography-body-large-text-regular mb-800"">- JavaScript</p><p class=""typography-body-large-text-regular mb-800"">- TypeScript</p><p class=""typography-body-large-text-regular mb-800"">- React</p><p class=""typography-body-large-text-regular mb-800""><strong>Výhodou bude, pokud budete umět</strong></p><p class=""typography-body-large-text-regular mb-800"">- PixiJS</p><p class=""typography-body-large-text-regular mb-800""><strong>Co vám můžeme nabídnout</strong></p><p class=""typography-body-large-text-regular mb-800"">- menší firma s rodinnou a přátelskou atmosférou</p><p class=""typography-body-large-text-regular mb-800"">- kanceláře v centru Prahy s možností parkování</p><p class=""typography-body-large-text-regular mb-800"">- možnost pracovat na HPP i IČ</p><p class=""typography-body-large-text-regular mb-800"">- HO po zapracování až 4 dny v týdnu</p><p class=""typography-body-large-text-regular mb-800"">- na HPP poskytujeme klasické benefity a rádi je s tebou probereme osobně</p><p class=""typography-body-large-text-regular mb-800"">Oceníme možnost ukázek tvé současné práce. </p></div>"
Datový analytik,Lékárna.cz,https://www.jobs.cz/rpd/2000542254/,False,2025-04-11 00:00:00,,cs,,,jobscz#2000542254,,,,,,,,,,Chrudim,Chrudim,,,,,,,,,,,,,,,,,,,Pardubice,Pardubice,,,,,,,,,,,,,,,,,,,fulltime,parttime,,,,,,,,,"<div data-jobad=""body"" data-test=""jd-body-richtext"" class=""RichContent mb-1400""><p class=""typography-body-medium-text-regular text-secondary mb-600"">Pracovní nabídka</p><h2 class=""typography-heading-small-text"">Datový analytik/BI analytik pro Lékárna.cz</h2><p class=""typography-body-large-text-regular mb-800"">Baví tě práce s daty? Jsi kreativní a máš chuť navrhovat nová řešení?</p><p class=""typography-body-large-text-regular mb-800"">Pak je tato práce určená pro tebe. Hlavní data, která budeš analyzovat jsou z našich eshopů www.lekarna.cz a www.mojalekaren.sk.</p><p class=""typography-body-large-text-regular mb-800""><strong>Náplň práce:</strong></p><ul class=""typography-body-large-text-regular""><li>Práce s datovým skladem nad platformou Keboola</li><li>Vytváření reportů od začátku do konce, od specifikace zadání po finální dodávku v Power BI</li><li>Segmentace dat, hledání závislostí v datech, pravidelný reporting</li><li>Úzká spolupráce s managementem nad daty</li><li>Pomoc s hodnocením přínosu projektů</li></ul><p class=""typography-body-large-text-regular mb-800""><strong>Požadavky:</strong></p><ul class=""typography-body-large-text-regular""><li>SŠ/VŠ vzdělání</li><li>znalost SQL na úrovni psaní dotazů</li><li>analytické myšlení</li><li>zodpovědnost, samostatnost a spolehlivost</li></ul><p class=""typography-body-large-text-regular mb-800""><strong>Nabízíme:</strong></p><ul class=""typography-body-large-text-regular""><li>prostor pro osobní rozvoj, pravidelná školení od odborníků v oboru</li><li>nadstandardní platové podmínky</li><li>práci ve stabilní společnosti - 25 let na trhu!</li><li>rozsáhlý bonusový systém, který ocení i tvoje samostudium, nové nápady apod.</li><li>možnost home office, notebook, telefon, stravenky, teambuilding, dovolená navíc.</li></ul><p class=""typography-body-large-text-regular mb-800"">Možnost práce na ŽL nebo HPP.</p><p class=""typography-body-large-text-regular mb-800"">Úvazek poloviční nebo plný.</p><p class=""typography-body-large-text-regular mb-800"">Místo výkonu práce: Chrudim/Praha + home office</p><p class=""typography-body-large-text-regular mb-800"">Nástup možný: ihned, dohodou</p></div>"
Typescript Developer,Papirfly,https://www.startupjobs.cz/nabidka/90705/typescript-developer?utm_source=juniorguru&utm_medium=cpc&utm_campaign=juniorguru,False,2025-04-10 00:00:00,,cs,,,startupjobs#90705,,,,,,,,,,Brno,,,,,,,,,,,,,,,,,,,,Brno,,,,,,,,,,,,,,,,,,,,fulltime,,,,,,,,,,"<p id=""isPasted"">🌍 Do naší české pobočky v Brně.</p><p>📅 Klidně hned, na plný úvazek.</p><p>🧠 Typescript, komunikativnost, angličtina, kreativita, chuť rozvíjet sebe i svůj tým.</p><p><span contenteditable=""false"" draggable=""true"" class=""fr-video fr-deletable fr-fvc fr-dvb fr-draggable""><iframe width=""640"" height=""360"" src=""https://www.youtube.com/embed/7omzTXar0A0?&amp;embeds_referring_euri=https%3A%2F%2Fwww.startupjobs.cz%2F&amp;source_ve_path=MjM4NTE&amp;wmode=opaque&amp;rel=0"" frameborder=""0"" allowfullscreen="""" class=""fr-draggable""><span class=""fr-mk"" style=""display: none;"">&nbsp;</span><span class=""fr-mk"" style=""display: none;"">&nbsp;</span><span class=""fr-mk"" style=""display: none;"">&nbsp;</span><span class=""fr-mk"" style=""display: none;"">&nbsp;</span><span class=""fr-mk"" style=""display: none;"">&nbsp;</span></iframe></span></p><p id=""isPasted"">Do týmu hledáme nadšeného či nadšenou Typescript Developera/ku pro práci na úspěšných a smysluplných interních produktech. Přidáš se k nám?</p><p><strong>Kdo jsme?</strong></p><p>Jsme norsko-česká společnost Papirfly (dříve BrandMaster). Spolu s 320 zaměstnanci po celém světě vyvíjíme inovativní nástroje pro digitalizaci marketingu a pomáháme s efektivní správou značky firmám jako BMW, Helly Hansen, PepsiCo a více než 1.500 dalším. Každý den používá naše nástroje přes milion marketérů a designérů.</p><p>Vývoj našich unikátních produktů letos posílily také investice norského venture kapitálového fondu Verdane. Toto silné spojení podstatně urychlí rozvoj naší firmy působící v několika evropských zemích i v Severní Americe. Budeme tak potřebovat další chytré a kreativní hlavy, které nám pomůžou dobýt svět. 😊</p><p><strong>Co bude tvým denním chlebem?</strong></p><p>Na pozici se ti bude líbit, pokud je front-end tvou srdcovou záležitostí. Pracovat budeš s naším již existujícím nástrojem, ve kterém budeš pro klienty vytvářet a upravovat bannery, e-mailové templaty i celé landing pages.</p><p><strong>Jak poznáš, že je Papirfly pro tebe to pravé?&nbsp;</strong></p><ul><li id=""isPasted"">Ve tvém srdci tepe TypeScript.</li><li id=""isPasted"">Máš za sebou už alespoň půlroční zkušenost s prací na projektech.</li><li id=""isPasted"">Cit pro design i vytrvalost při rutinních úkolech ti nejsou cizí.</li><li id=""isPasted"">Snažíš se věci dělat pořádně a myslíš analyticky.</li><li id=""isPasted"">Máš chuť se neustále zlepšovat a pracovat na sobě.</li><li id=""isPasted"">Domluvíš se anglicky - komunikovat budeš denně, jelikož tvůj tým je globální.</li></ul><p><strong>Bude se hodit, když se pro začátek budeš vyznačovat:</strong></p><ul><li id=""isPasted"">Znalostí některého z OOP jazyků, ideálně JavaScriptu.</li><li>Základní znalostí datových struktur a algoritmů.</li><li>Citem pro detail a schopností plynule komunikovat nejen v angličtině, ale i v češtině.</li></ul><p id=""isPasted""><strong>Poznal/a ses? Pak si přečti, co ti u nás nabídneme:</strong></p><ul><li>Perspektivní a atraktivní práci na pracovní smlouvu v kancelářích v centru Brna.</li><li>Férové a přinejmenším zajímavé finanční ohodnocení a příjemné čtvrtletní prémie k tomu.</li><li>Zázemí stabilní mezinárodní firmy, která vytváří smysluplné nástroje pro světoznámé klienty.</li><li>25 dní dovolené, možnost částečně kombinovat práci z kanceláře s prací z domova.</li><li>Spolupráci na velkých projektech, a pokud se chytneš příležitosti, můžeš růst a posouvat se v rámci skupiny.</li><li>Individuální přístup, důkladné zaškolení i kvalifikovaný a motivující feedback.</li><li>Otevřené jednání a pohodovou atmosféru v přátelském kolektivu.</li><li>Počítač nebo notebook (Windows, Linux nebo Mac) a veškeré další vybavení, které pro práci potřebuješ.</li><li>Dynamiku a rychlý růst – jen za poslední rok jsme náš tým rozšířili o 100 nových kolegů.</li><li>Možnost pracovních stáží, zahraničních konferencí i služebních cest do našich evropských i zámořských kanceláří.</li><li>Snažíme se neustále vzdělávat a zlepšovat. I proto k nám zveme české i zahraniční experty, kteří se s námi dělí o své know-how, ty budeš samozřejmě u toho.</li><li>Přispějeme ti na obědy, na sport i dovolenou, nabídneme ti teplé kafe a studené freshe, čerstvé ovoce a pozveme tě na naše legendární grilovačky.</li></ul><p id=""isPasted""><strong>Líbí? To máme radost! Co dál?</strong></p><p>Dej nám o sobě vědět! Pošli nám prosím svoje CV nebo odkaz na LinkedIn profil. Budeme se těšit na naše první společné kafe či čaj. 😊</p>"
