title,company_name,url,remote,first_seen_at,last_seen_at,lang,juniority_score,source,external_ids_0,external_ids_1,external_ids_2,external_ids_3,external_ids_4,external_ids_5,external_ids_6,external_ids_7,external_ids_8,external_ids_9,locations_0_name,locations_1_name,locations_2_name,locations_3_name,locations_4_name,locations_5_name,locations_6_name,locations_7_name,locations_8_name,locations_9_name,locations_10_name,locations_11_name,locations_12_name,locations_13_name,locations_14_name,locations_15_name,locations_16_name,locations_17_name,locations_18_name,locations_19_name,locations_0_region,locations_1_region,locations_2_region,locations_3_region,locations_4_region,locations_5_region,locations_6_region,locations_7_region,locations_8_region,locations_9_region,locations_10_region,locations_11_region,locations_12_region,locations_13_region,locations_14_region,locations_15_region,locations_16_region,locations_17_region,locations_18_region,locations_19_region,employment_types_0,employment_types_1,employment_types_2,employment_types_3,employment_types_4,employment_types_5,employment_types_6,employment_types_7,employment_types_8,employment_types_9,description_html
DATOVÝ ANALYTIK OTEVŘENÝCH ZDROJŮ,Bezpečnostní informační služba,https://www.jobs.cz/rpd/2000457426/?utm_source=juniorguru,False,2025-12-06 00:00:00,,cs,,,jobscz#2000457426,,,,,,,,,,Praha,Praha,,,,,,,,,,,,,,,,,,,Praha,Praha,,,,,,,,,,,,,,,,,,,fulltime,,,,,,,,,,"<div data-jobad=""body"" data-test=""jd-body-richtext"" class=""RichContent mb-1400""><p class=""typography-body-medium-text-regular text-secondary mb-600"">Pracovní nabídka</p><h2 class=""typography-heading-small-text"">Datový analytik otevřených zdrojů</h2><p class=""typography-body-large-text-regular mb-800""><strong>Náplň práce:</strong></p><ul class=""typography-body-large-text-regular""><li>Spolupráce na rozvoji a údržbě datového skladu</li><li>Extrakce, transformace a načítání (ETL) dar z různých datových zdrojů</li><li>Analýza a příprava dat pro koncové uživatele</li><li>Technické zabezpečení systémů pro získávání a zpracování dat z otevřených zdrojů</li><li>Práce s T-SQL, Python a SQL, Server Integration Service (SSIS)</li></ul><p class=""typography-body-large-text-regular mb-800""><strong>Ideální uchazeč by měl mít: </strong></p><ul class=""typography-body-large-text-regular""><li>VŠ vzdělání (min. Bakalářský titul);</li><li>Zájem o oblast zpracování dat, chuť učit se novým věcem, rozvíjet se a růst</li><li>Analytické myšlení, samostatná a proaktivní přístup</li><li>Základní znalost SQL - databáze, dotazy, funkce</li><li>Základní zkušenosti se systémy pro správu datových skladů (MS SQL server, SSIS)</li><li>Znalost AJ minimálně na úrovní státní maturity</li><li>Státní občanství ČR.</li></ul><p class=""typography-body-large-text-regular mb-800""><strong>Uvítáme zkušenosti alespoň v jedné z oblastí:</strong></p><ul class=""typography-body-large-text-regular""><li>Základy programování, skriptování (např. Python/Shell)</li><li>Znalosti v oblasti ETL procesů</li><li>Zkušenosti s relačními databázemi a základní znalost SQL</li></ul><p class=""typography-body-large-text-regular mb-800""><strong>Nabízíme:</strong></p><ul class=""typography-body-large-text-regular""><li>Jedinečnost zaměstnavatele - zpravodajské služby;</li><li>Možnost podílet se na bezpečnosti České republiky;</li><li>Zajímavou a samostatnou práci v oblasti technické analýzy;</li><li>Osobní růst a vzdělávání v oboru;</li><li>Zázemí a perspektivu státní organizace;</li><li>Náborový příspěvek;</li><li>Místo výkonu: Praha 5</li></ul><p class=""typography-body-large-text-regular mb-800""><em>Uchazeči budou přijímáni na základě výsledků přijímacího řízení podle zákona č.361/2003 Sb. o služebním poměru příslušníků bezpečnostních sborů (délka přijímacího řízení min. 9 měsíců).</em></p><p class=""typography-body-large-text-regular mb-800""><strong><em>V případě Vašeho zájmu o nabízenou pozici vyplňte dotazník pro uchazeče na webu www.bis.cz/kariera a přiložte strukturovaný životopis a motivační dopis. Zašlete k rukám Jitky Jánské<br></em></strong></p></div>"
ERP Support & Training Specialist,"VAFO PRAHA, s.r.o.",https://www.jobs.cz/rpd/2000904820/?utm_source=juniorguru,False,2025-12-06 00:00:00,,cs,,,jobscz#2000904820,,,,,,,,,,Chrášťany,Chrášťany,,,,,,,,,,,,,,,,,,,Praha,Praha,,,,,,,,,,,,,,,,,,,fulltime,,,,,,,,,,"<div data-jobad=""body"" data-test=""jd-body-richtext"" class=""RichContent mb-1400""><p class=""typography-body-medium-text-regular text-secondary mb-600"">Pracovní nabídka</p><p class=""typography-body-large-text-regular mb-800"">Chcete být tím člověkem, který ostatním opravdu usnadňuje práci? Líbí se vám, když systém funguje chytře, přehledně a bez zbytečných kliků? A baví vás kombinace práce s lidmi, testování, zlepšování a školení?<br> Pokud ano – tahle role je přesně pro vás.</p><p class=""typography-body-large-text-regular mb-800""><strong>Co budete dělat?</strong></p><p class=""typography-body-large-text-regular mb-800"">Stanete se klíčovým uživatelem Microsoft Dynamics 365 Business Central a parťákem pro všechny, kteří se systémem pracují.<br> Vaším posláním bude, aby Business Central ve firmě fungoval co nejlépe – prakticky, intuitivně a efektivně.</p><p class=""typography-body-large-text-regular mb-800""><strong>Konkrétně to znamená:</strong></p><ul class=""typography-body-large-text-regular""><li>Být interním superuserem a prvním kontaktem pro kolegy napříč firmou.</li><li>Testovat nové funkce a úpravy, než se pustí do produkce.</li><li>Překlápět potřeby uživatelů do srozumitelných zadání pro IT a dodavatele.</li><li>Školit nové i stávající uživatele – jednoduše, prakticky a srozumitelně.</li><li>Tvořit návody, tipy a materiály, které lidem opravdu pomohou.</li><li>Zlepšovat dashboardy, přehledy a reporty tak, aby dávaly smysl a šetřily čas.</li><li>Hledat neefektivní postupy a navrhovat, jak je dělat lépe.</li><li>Spolupracovat s IT i klíčovými uživateli na tom, aby systém byl ergonomický a uživatelsky přívětivý.</li></ul><p class=""typography-body-large-text-regular mb-800""><br><strong>Kdo jste?</strong></p><p class=""typography-body-large-text-regular mb-800"">Jestli máte zkušenost s Business Central nebo jiným ERP, jste napůl IT nadšenec a napůl člověk do lidí – budete jako doma.</p><p class=""typography-body-large-text-regular mb-800""><strong>Hodit se vám bude:</strong></p><ul class=""typography-body-large-text-regular""><li>Praxe s MS Dynamics 365 Business Central nebo jiným ERP.</li><li>Schopnost vidět systém očima uživatelů.</li><li>Skvělé komunikační a prezentační dovednosti.</li><li>Schopnost psát jasná zadání pro IT/dodavatele a ověřovat jejich výstupy.</li><li>Výhodou je orientace v datech a reportingu.</li><li>Znalost češtiny nebo slovenštiny na komunikativní úrovni.</li></ul><p class=""typography-body-large-text-regular mb-800""><br><strong>Jaká osobnost k nám zapadne?</strong></p><ul class=""typography-body-large-text-regular""><li>Empatická – rádi pomáháte a máte trpělivost vysvětlovat.</li><li>Praktická – umíte přemýšlet nad procesy a hledat lepší řešení.</li><li>Samostatná a systematická – vidíte, co je potřeba, a dotahujete věci do konce.</li><li>S nadhledem – protože občas jsou situace náročnější (a vy je zvládnete).</li></ul><p class=""typography-body-large-text-regular mb-800""><br><strong> Co vám nabízíme?</strong></p><p class=""typography-body-large-text-regular mb-800"">Příležitost</p><ul class=""typography-body-large-text-regular""><li>Klíčovou roli v tom, jak naše firma používá Business Central.</li><li>Přímý vliv na rozvoj systému i jeho každodenní fungování.</li><li>Spolupráci s IT, financemi i externími odborníky.</li><li>Prostředí stabilní české společnosti s rostoucí mezinárodní skupiny.</li></ul><p class=""typography-body-large-text-regular mb-800""><br>Prostředí</p><ul class=""typography-body-large-text-regular""><li>Práce v Chrášťanech (Praha – západ) v týmu, který si opravdu rozumí</li><li>Možnost vzít si do kanceláře svého psa (opravdu!)</li><li>Dva pytle prémiového krmiva měsíčně pro vaše chlupaté členy rodiny</li><li>Konkurenční mzda a standardní balíček benefitů</li><li>Flexibilní pracovní režim – soustředíme se na výsledky, ne na kancelářský čas</li></ul><p class=""typography-body-large-text-regular mb-800"">Kultura</p><ul class=""typography-body-large-text-regular""><li>Rodinná atmosféra s profesionálními ambicemi</li><li>Svoboda a autonomie pro to nejlepší, co ve vás je</li><li>Přímý přístup k zakladatelům a vedení</li><li>Mezinárodní kolegové, kteří se stali přáteli</li><li>Místo, kde férovost, respekt a zdravý rozum vedou rozhodování</li></ul><p class=""typography-body-large-text-regular mb-800""><strong>Náš závazek</strong></p><p class=""typography-body-large-text-regular mb-800"">Jsme odhodlaní k udržitelnosti: míříme na 95 % recyklovatelného obalu, snižování emisí CO₂ a větší podíl udržitelných surovin. Věříme v respekt k lidem, zvířatům i planetě. Náš úspěch stojí na oddanosti našeho týmu – a nikdy to nebereme jako samozřejmost.</p><p class=""typography-body-large-text-regular mb-800""><strong>Připravení přidat se ke smečce?</strong></p><p class=""typography-body-large-text-regular mb-800"">Pokud vás láká pomoci dynamické firmě založené na hodnotách růst, aniž by ztratila svou duši, chceme o vás slyšet. Budete u nás důležitou součástí digitálního zlepšování a modernizace firmy.</p><p class=""typography-body-large-text-regular mb-800""><strong>Přihlaste se a staňte se součástí rodiny VAFO.</strong></p><p class=""typography-body-large-text-regular mb-800"">VAFO je zaměstnavatel s rovnými příležitostmi. Oslavujeme rozmanitost a jsme odhodláni vytvářet inkluzivní prostředí pro všechny zaměstnance. Ať už máte raději psy, kočky nebo milujete všechna zvířata stejně, u nás najdete své místo.</p><p class=""typography-body-large-text-regular mb-800"">Pošlete nám svůj životopis a napište, proč je pro vás VAFO jako domov.</p></div>"
ISIT Power-Platform Developer (ITD),TOYOTA MATERIAL HANDLING CZ,https://www.jobs.cz/rpd/2000883361/?utm_source=juniorguru,False,2025-12-06 00:00:00,,cs,,,jobscz#2000883361,,,,,,,,,,Zdice,,,,,,,,,,,,,,,,,,,,Praha,,,,,,,,,,,,,,,,,,,,fulltime,,,,,,,,,,"<div data-jobad=""body"" data-test=""jd-body-richtext"" class=""RichContent mb-1400""><p class=""typography-body-medium-text-regular text-secondary mb-600"">Pracovní nabídka</p><p class=""typography-body-large-text-regular mb-800"">Toyota Material Handling, jako součást skupiny Toyota Industries Corporation, je považována za globálního lídra v manipulační technice. Pečlivě dbáme na dodržování principů Toyota Way, které jsou založeny na dvou základních pilířích – respektu k lidem a soustavném zlepšování. Naši zaměstnanci uplatňují tyto hodnoty na všech úrovních při své každodenní práci, a i proto je značka Toyota zárukou nejvyšší kvality a spolehlivosti. Pokud jste nadšencem pro technologie a oblast logistiky jako my, pak čtěte dál, protože právě nabíráme nové posily.</p><p class=""typography-body-large-text-regular mb-800""><strong>Aktivity / úkoly</strong></p><p class=""typography-body-large-text-regular mb-800""><strong>Hlavní činnosti:</strong></p><ul class=""typography-body-large-text-regular""><li>Aktivně participuje na projektech, které jsou definovány vedením společnosti</li><li>Programuje aplikace v MS Power Platform, MS Sharepoint a případně na dalších platformách, výsledky reportuje svému nadřízenému</li><li>Zajišťuje správu a podporu naprogramovaných aplikací spolu s odpovědnou osobou za danou aplikaci </li></ul><p class=""typography-body-large-text-regular mb-800""><br><strong>Další činnosti:</strong></p><ul class=""typography-body-large-text-regular""><li>Podílí se na instalaci, konfiguraci, správě stanic a serverů na platformě Windows, počítačové sítě</li><li>Podílí se na antivirové ochraně dat a zálohování</li><li>Podílí se na školení zaměstnanců</li><li>Podílí se na plnění úkolů v IS/IT oddělení</li><li>Řeší interní incidenty a podporuje uživatele - HELPDESK</li><li>Komunikuje se zahraničními kolegy</li><li>Spolurozhoduje o nákupu softwaru, hardwaru a ostatní kancelářské techniky.</li><li>Spoluzodpovídá za bezproblémový chod a údržbu počítačové sítě, počítačů, softwaru, hardwaru, pevných, mobilních telefonů, internetových připojení.</li><li>Spolupracuje na tvorbě vnitropodnikových manuálů</li><li>Administruje přístupová práva uživatelům</li><li>Asistuje ISIT Manažerovi v každodenních činnostech, případně pomáhá s úkoly IT Administrátorovi</li></ul><p class=""typography-body-large-text-regular mb-800""><strong>Profil vhodného kandidáta</strong></p><ul class=""typography-body-large-text-regular""><li>SŠ vzdělání lépe se zaměřením na IT (není podmínkou).</li><li>Výborná orientace v MS Office, Windows 11, MS Power Platform, MS Sharepoint </li><li>Orientace ve WINDOWS SERVER výhodou.</li><li>Dobrý problem solver.</li><li>Znalost anglického jazyka na střední úrovni.</li><li>Schopnost jednání s lidmi, komunikativní.</li><li>Zodpovědnost, spolehlivost, důslednost.</li></ul><p class=""typography-body-large-text-regular mb-800""><strong>Co vám můžeme nabídnout</strong></p><ul class=""typography-body-large-text-regular""><li>nástup ideálně ihned</li><li>samozřejmosti je notebook s firemním software, mobilní telefon</li><li>místo výkonu práce Rudná, od 02_2025 Zdice, home office možný 1x týdně po zapracování</li><li>získaní zkušeností v mezinárodní společnosti</li><li>příjemné pracovní prostředí</li><li>přátelský kolektiv</li><li>5 týdnů dovolené a 5 dnů sick days</li><li>příspěvek na dopravu, stravné</li><li>benefitní kafeterie</li><li>nápoje na pracovišti zdarma</li><li>roční bonusy</li><li>a další dle aktuální nabídky</li></ul></div>"
VÝBĚROVÉ ŘÍZENÍ na obsazení místa informatika/informatičky ICT,"CRI ameba.eu, s.r.o.",https://www.jobs.cz/rpd/2000909954/?utm_source=juniorguru,False,2025-12-06 00:00:00,,cs,,,jobscz#2000909954,,,,,,,,,,Plzeň,Plzeň,,,,,,,,,,,,,,,,,,,Plzeň,Plzeň,,,,,,,,,,,,,,,,,,,fulltime,,,,,,,,,,"<div data-jobad=""body"" data-test=""jd-body-richtext"" class=""RichContent mb-1400""><p class=""typography-body-medium-text-regular text-secondary mb-600"">Pracovní nabídka</p><p class=""typography-body-large-text-regular mb-800""><strong>KRAJSKÝ SOUD V PLZNI</strong><br>Veleslavínova 40, 306 17 Plzeň<br>tel.: 377 868 888, fax: 377 868 000, IDDS: yaraba4</p><p class=""typography-body-large-text-regular mb-800""><strong>Předpoklady a požadavky:</strong><br>• vysokoškolské vzdělání v magisterském nebo bakalářském studijním programu (případně vzdělání nižší, pokud nebude k dispozici uchazeč s předepsaným vzděláním), zaměření na ICT je výhodou<br>• trestní bezúhonnost<br>• základní znalost angličtiny na úrovni čtení technické dokumentace<br>• základní znalost Active Directory, Windows Server, Windows 11, MS Office<br>• základní znalost TCP/IP protokolů a technologie počítačových sítí LAN<br>• výhodou znalost technologií LINUX, Oracle DB, Cisco, VMware<br>• ochota se dále rozvíjet a učit se novým věcem<br>• analytické a systémové myšlení<br>• zodpovědný přístup k řešení problémů<br>• dobré vystupování, komunikativnost<br>• zvládání zátěžových situací<br>• samostatnost, spolehlivost<br>• výkon práce v Chebu a v případě potřeby Plzeňský a Karlovarský kraj (řidičský průkaz není požadován)<br>• pozice vhodná i pro absolventy, zaučení do technologií podle potřeby</p><p class=""typography-body-large-text-regular mb-800""><br><strong>Hlavní náplň práce:</strong><br>• nasazování, správa, údržba a aktualizace operačních systémů MS Windows a obecně ICT systémů organizace<br>• podpora koncových uživatelů<br>• zajištění dostupnosti služeb počítačové sítě<br>• instalace nového HW a SW vybavení<br>• správa a údržba zálohovacích plánů ICT</p><p class=""typography-body-large-text-regular mb-800""><strong>Nabízíme:</strong><br>• zajímavou a kvalifikovanou práci na plný úvazek<br>• pracovní poměr na dobu určitou s čtyřměsíční zkušební dobou s perspektivou uzavření pracovního poměru na dobu neurčitou<br>• možnost průběžného kvalifikovaného vzdělávání<br>• platové ohodnocení ve 12. platové třídě dle nařízení vlády č. 341/2017 Sb. o platových poměrech zaměstnanců ve veřejných službách a správě, ve znění pozdějších předpisů (33 280 Kč až 41 520 Kč dle praxe) (již zohledněna výše doplatku do nejnižšího zaručeného platu dle sdělení MPSV č. 286/2024 Sb.)<br>• možnost přiznání osobního příplatku po zapracování<br>• zvláštní příplatek 500 Kč<br>• možnost čtvrtletního vyplácení odměn<br>• pracovní mobilní telefon a notebook<br>• práce na zajímavých projektech<br>• seznámení s novými technologiemi<br>• 5 týdnů dovolené<br>• 6 dnů indispozičního volna ročně<br>• příspěvek na stravování, důchodové připojištění</p><p class=""typography-body-large-text-regular mb-800""><br>• Informace pro účastníky výběrových řízení Krajského soudu v Plzni o zpracování osobních údajů jsou k dispozici na internetových stránkách KS v Plzni https://www.justice.cz/web/krajsky-soud-v-plzni/volna-mista.</p><p class=""typography-body-large-text-regular mb-800"">• Nástup dohodou.</p><p class=""typography-body-large-text-regular mb-800"">• Lhůta pro přihlášení do výběrového řízení je stanovena do <strong>29. prosince 2025 (včetně).</strong></p><p class=""typography-body-large-text-regular mb-800"">• V uvedené lhůtě je nutné<strong> doručit strukturovaný profesní životopis</strong> Krajskému soudu v Plzni, personálnímu oddělení, Veleslavínova 40, 306 17 Plzeň v listinné podobě</p><p class=""typography-body-large-text-regular mb-800"">• Doplňující informace podá vedoucí personálního oddělení Mgr. Lubomír Volter, tel. čís. 377 868 256,  příp. vedoucí oddělení informatiky Ing. Václav Šůcha, tel. č. 377 868 358</p><p class=""typography-body-large-text-regular mb-800"">• Předsedkyně Krajského soudu v Plzni si vyhrazuje právo žádného z uchazečů na požadovanou pozici nevybrat či výběrové řízení zrušit.</p><p class=""typography-body-large-text-regular mb-800"">JUDr. Věra Oravcová, Ph.D.<br>předsedkyně Krajského soudu v Plzni</p></div>"
Junior Platform Executive,IPSOS s.r.o.,https://www.jobs.cz/rpd/2000893107/?utm_source=juniorguru,False,2025-12-06 00:00:00,,cs,,,jobscz#2000893107,,,,,,,,,,Praha,Praha,,,,,,,,,,,,,,,,,,,Praha,Praha,,,,,,,,,,,,,,,,,,,parttime,,,,,,,,,,"<div data-jobad=""body"" data-test=""jd-body-richtext"" class=""RichContent mb-1400""><p class=""typography-body-medium-text-regular text-secondary mb-600"">Pracovní nabídka</p><p class=""typography-body-large-text-regular mb-800"">Jsme mezinárodní společnost zaměřující se nejen na marketingový výzkum a nové technologie, ale i na trénink a konzultační činnost. Snažíme se být zvídaví, inovativní a neustále usilujeme o nejlepší možná řešení pro naše klienty.</p><p class=""typography-body-large-text-regular mb-800"">Zaměstnáváme mladé talenty a zkušené profesionály, kterým zabezpečujeme profesionální zázemí a možnost růstu v naší společnosti. Dáváme možnost každému jedinci vyniknout a zaměřit se na oblast, v které se cítí nejlépe.</p><p class=""typography-body-large-text-regular mb-800"">Momentálně hledáme nového člena týmu, jenž bude součástí našeho globálního Mystery Shopping Platform oddělení v Praze, ve Slovanském domě.</p><p class=""typography-body-large-text-regular mb-800"">A co je vlastně Mystery Shopping? Mystery Shopping je výzkumná metoda, která nám pomáhá lépe pochopit zákaznickou zkušenost. Výzkum může být prováděn například jako mystery návštěva, mystery call atd. Mystery Shopper poté své zkušenosti zapíše do dotazníku, jenž je následně zpracováván.</p><p class=""typography-body-large-text-regular mb-800"">Aktuálně hledáme novou posilu do týmu na pozici:</p><h2 class=""typography-heading-small-text"">Junior Platform Executive</h2><p class=""typography-body-large-text-regular mb-800""><strong>Co Vás čeká?</strong></p><ul class=""typography-body-large-text-regular""><li>Správa webové aplikace používané pro sběr dat v Mystery Shoppingu;</li><li>nastavování projektů a skriptování dotazníků ve firemní aplikaci;</li><li>spolupráce a podpora více jak 40 zemí;</li><li>každodenní písemná komunikace v anglickém jazyce (MS TEAMS, e-mail).</li></ul><p class=""typography-body-large-text-regular mb-800""><strong>Co požadujeme?</strong></p><ul class=""typography-body-large-text-regular""><li>Znalost anglického jazyka minimálně na úrovni B2 (slovem i písmem);</li><li>orientace v datech a schopnost jejich interpretace;</li><li>pečlivost, organizační schopnosti a aktivní přístup k řešení problémů;</li><li>uživatelská znalost balíčku MS Office (zejména Excel a PowerPoint).</li></ul><p class=""typography-body-large-text-regular mb-800""><strong>Co Vám nabízíme?</strong></p><ul class=""typography-body-large-text-regular""><li>Spolupráci na DPP/DPČ v největší výzkumné a technologické agentuře v ČR;</li><li>možnost podílet se na zajímavých projektech pro nejznámější mezinárodní klienty;</li><li>know how jedné z největších agentur, práci s využitím nástrojů a best-in-class metodologií vyvinutých v Ipsosu;</li><li>pracoviště v centru Prahy v moderně vybavených kancelářích Slovanského domu;</li><li>možnost osobního i profesního růstu a dlouhodobé spolupráce;</li><li>nástup možný ihned.</li></ul><p class=""typography-body-large-text-regular mb-800"">Chceš nás lépe poznat a podívat se jak se u nás žije a pracuje? Pak mrkni na náš Tribee profil!</p></div>"
