title,company_name,url,remote,first_seen_at,last_seen_at,lang,juniority_score,source,external_ids_0,external_ids_1,external_ids_2,external_ids_3,external_ids_4,external_ids_5,external_ids_6,external_ids_7,external_ids_8,external_ids_9,locations_0_name,locations_1_name,locations_2_name,locations_3_name,locations_4_name,locations_5_name,locations_6_name,locations_7_name,locations_8_name,locations_9_name,locations_10_name,locations_11_name,locations_12_name,locations_13_name,locations_14_name,locations_15_name,locations_16_name,locations_17_name,locations_18_name,locations_19_name,locations_0_region,locations_1_region,locations_2_region,locations_3_region,locations_4_region,locations_5_region,locations_6_region,locations_7_region,locations_8_region,locations_9_region,locations_10_region,locations_11_region,locations_12_region,locations_13_region,locations_14_region,locations_15_region,locations_16_region,locations_17_region,locations_18_region,locations_19_region,employment_types_0,employment_types_1,employment_types_2,employment_types_3,employment_types_4,employment_types_5,employment_types_6,employment_types_7,employment_types_8,employment_types_9,description_html
IT Support Engineer (L1),"KODYS, spol. s r.o.",https://www.jobs.cz/rpd/2000890296/?utm_source=juniorguru,False,2025-11-28 00:00:00,,cs,,,jobscz#2000890296,,,,,,,,,,Praha,Praha,,,,,,,,,,,,,,,,,,,Praha,Praha,,,,,,,,,,,,,,,,,,,fulltime,,,,,,,,,,"<div data-jobad=""body"" data-test=""jd-body-richtext"" class=""RichContent mb-1400""><p class=""typography-body-medium-text-regular text-secondary mb-600"">Pracovní nabídka</p><p class=""typography-body-large-text-regular mb-800"">Jsme KODYS – společnost s tradicí od roku 1991. Naše specializace? Logistika a také výroba a distribuce. Vyvíjíme a dodáváme komplexní SW řešení pro řízení skladu (WMS) jsme jedním z nejvýznamnějších hráčů na trhu řešení využívajících automatickou identifikaci.</p><p class=""typography-body-large-text-regular mb-800"">Naše projekty jsou dlouhodobé a spolupracujeme s významnými hráči jako DR MAX, Mountfield, NET4GAS, Globus, Nutrend, Dermacol a dalšími. Více o nás najdete na www.kodys.cz</p><p class=""typography-body-large-text-regular mb-800"">A protože stále rosteme, hledáme novou posilu na pozici:</p><p class=""typography-body-large-text-regular mb-800"">IT Support Engineer (L1), který se stane první kontaktní osobou pro naše zákazníky a pomůže jim vyřešit technické potíže. Pokud tě baví technologie, rád komunikuješ a chceš se posouvat dál, jsi náš člověk! ✨</p><p class=""typography-body-large-text-regular mb-800""><strong>Co budeš mít na starosti?</strong></p><ul class=""typography-body-large-text-regular""><li>Přijímat a zapisovat požadavky od zákazníků do ServiceDesk Plus</li><li>Aktivně komunikovat se zákazníky i L2 týmem</li><li>Dělat základní analýzu problémů a hledat příčiny</li><li>Pracovat s MS SQL databázemi a Windows servery</li><li>Instalovat a nastavovat naše WMS a majetkové systémy</li><li>Školit klíčové uživatele a poskytovat podporu u zákazníka</li><li>Testovat naše systémy před nasazením</li><li>Po zaškolení držet telefonické pohotovosti</li></ul><p class=""typography-body-large-text-regular mb-800""><strong>Koho hledáme?</strong></p><ul class=""typography-body-large-text-regular""><li>Máš alespoň 1 rok zkušeností v IT podpoře</li><li>Jsi zodpovědný/á, komunikativní a týmový hráč</li><li>Dokážeš si organizovat práci a dotahovat věci do konce</li><li>Zvládáš základy angličtiny pro práce s dokumentací</li><li>Umíš pracovat s MS SQL na základní úrovni</li><li>Někoho kdo se chce učit a posouvat své technické dovednosti</li></ul><p class=""typography-body-large-text-regular mb-800""><strong> Výhodou je, pokud:</strong></p><ul class=""typography-body-large-text-regular""><li>Máš technicky zaměřenou SŠ</li><li>Znáš tiketovací systémy</li><li>Máš zkušenost z retailu nebo logistiky</li></ul><p class=""typography-body-large-text-regular mb-800""><strong>A co nabízíme my?</strong> 🤝</p><ul class=""typography-body-large-text-regular""><li>Přátelský tým a prostředí, kde si pomáháme</li><li>Stabilní a zavedená firma s možností osobního i profesního růstu</li><li>Práce na HPP</li><li>Kanceláře v moderním prostředí blízko metra</li><li>Skvělá káva a výběr čajů každý den</li><li>Možnost částečného home office</li><li>Sick Days</li><li>Příspěvek na stravné</li><li>Kvartální odměny a roční prémie</li><li>5 týdnů dovolené</li><li>Baby &amp; Dog friendly office</li></ul><p class=""typography-body-large-text-regular mb-800"">Zní to jako práce pro Tebe? Napiš nám, pošli životopis a v případě, že jsi ten koho hledáme, rádi Tě u nás uvidíme i na šálku skvělé kávy ☕</p></div>"
Junior/Medior Tester,EI SERVICES s.r.o.,https://www.jobs.cz/rpd/2000763836/?utm_source=juniorguru,False,2025-11-28 00:00:00,,cs,,,jobscz#2000763836,,,,,,,,,,Praha,,,,,,,,,,,,,,,,,,,,Praha,,,,,,,,,,,,,,,,,,,,fulltime,,,,,,,,,,"<div data-jobad=""body"" data-test=""jd-body-richtext"" class=""RichContent mb-1400""><p class=""typography-body-medium-text-regular text-secondary mb-600"">Pracovní nabídka</p><p class=""typography-body-large-text-regular mb-800"">Hledáme junior/medior testera, který se stane součástí týmu zodpovědného za testování našeho inovativního produktu PlasmaStream https://plasmastream.eu/.</p><p class=""typography-body-large-text-regular mb-800""><strong>Co budeš dělat?</strong></p><p class=""typography-body-large-text-regular mb-800"">Psát test cases a provádět manuální testování našich aplikací.<br>Identifikovat a hlásit chyby, navrhovat zlepšení a kontrolovat opravy.<br>Přemýšlet nad testováním a zajišťovat, že produkt bude plně odpovídat požadavkům a specifikacím.<br>Aktivně se podílet na analýze a předvídání možných problémů v aplikacích.<br>Udržovat přehled o testovaných funkcionalitách a dokumentovat výsledky testů.<br>Pracovat v úzké spolupráci s vývojovým a produktovým týmem, abyste zajistili, že všechny chyby budou včas opraveny.</p><p class=""typography-body-large-text-regular mb-800""><strong>Co očekáváme?</strong></p><p class=""typography-body-large-text-regular mb-800"">Zkušenost s psaním test cases a manuálním testováním aplikací.<br>Samostatnost a schopnost převzít odpovědnost za kvalitu testování.<br>Ochotu přemýšlet nad projektem a testováním, hledat potenciální problémy a přicházet s nápady na zlepšení.<br>Vysoké nároky na pravidelnou a důslednou dokumentaci výsledků testování.<br>Zkušenosti s bug tracking systémy (např. JIRA) a komunikativní znalost angličtiny.<br>Pečlivost, zodpovědný přístup k práci.</p><p class=""typography-body-large-text-regular mb-800""><strong>Co nabízíme?</strong></p><p class=""typography-body-large-text-regular mb-800"">Práci na vývoji špičkového a inovativního produktu.<br>Možnost profesního růstu a zlepšení tvých testovacích dovedností.<br>Flexibilní pracovní dobu a možnost práce na dálku.<br>Odpovídající finanční ohodnocení.<br>Příležitost podílet se na zajímavých a náročných projektech.<br>Místo výkonu práce: Praha 5, Anděl.</p><p class=""typography-body-large-text-regular mb-800""><strong>Zaujala tě tato příležitost?</strong></p><p class=""typography-body-large-text-regular mb-800"">Těšíme se na tvoji odpověď! Staň se součástí týmu, který se stará o kvalitní a inovativní produkty pro naše klienty.</p></div>"
QA Tester S W,KAJOT,https://www.jobs.cz/rpd/2000880291/?utm_source=juniorguru,False,2025-11-28 00:00:00,,cs,,,jobscz#2000880291,,,,,,,,,,Brno,Brno,,,,,,,,,,,,,,,,,,,Brno,Brno,,,,,,,,,,,,,,,,,,,fulltime,,,,,,,,,,"<div data-jobad=""body"" data-test=""jd-body-richtext"" class=""RichContent mb-1400""><p class=""typography-body-medium-text-regular text-secondary mb-600"">Pracovní nabídka</p><p class=""typography-body-large-text-regular mb-800"">Naší motivací je vývoj co nejefektivnějších a nejspolehlivějších softwarových řešení s ohledem na potřeby a přání našich zákazníků. Zaměřujeme se na videoloterijní systémy a výherní hrací přístroje. Vyvíjíme vlastní herní software a provozujeme herny, casina a pokerové kluby. <br>Pokud Tě baví odhalovat chyby a hledat cesty k jejich napravení, jsi náš člověk.</p><p class=""typography-body-large-text-regular mb-800"">Právě totiž obsazujeme pozici <strong>QA Tester SW/HW</strong>.<strong> </strong></p><p class=""typography-body-large-text-regular mb-800""><br><strong>Náplní Tvé práce bude: </strong></p><ul class=""typography-body-large-text-regular""><li>Manuální testování a reportování chyb v interním bug trackeru </li><li>Tvorba, úprava a údržba testovacích scénářů </li><li>Spolupráce s odděleními napříč celou firmou </li><li>Aktivní zapojení do dokumentace a procesů </li><li>Podílení se na rozvoji a inovacích oddělení QA </li></ul><p class=""typography-body-large-text-regular mb-800""><br><strong>Jak si Tě představujeme? Jako někoho, komu nechybí: </strong></p><ul class=""typography-body-large-text-regular""><li>SŠ vzdělání s maturitou </li><li>Ideálně 2 rok praxe v IT, není však podmínkou </li><li>Pečlivost, samostatnost a komunikační dovednosti </li><li>Analytické myšlení </li><li>Pasivní znalost AJ </li></ul><p class=""typography-body-large-text-regular mb-800""><br><strong>Co se u nás můžeš naučit?</strong></p><ul class=""typography-body-large-text-regular""><li>Skriptování a automatizace testování </li><li>Hlubší porozumění počítačovým technologiím </li><li>Technický rozhled v oblasti gamingu </li><li>Práce s produkty Atlassian (Jira + Xray a Confluence) </li><li>Práce s bug trackerem TestRail </li></ul><p class=""typography-body-large-text-regular mb-800""><br><strong>Na co se můžeš těšit?</strong></p><ul class=""typography-body-large-text-regular""><li>Stravenkový paušál v maximální výši</li><li>Pružná pracovní doba </li><li>6 dní sick days</li><li>Občerstvení na pracovišti – káva, čaj, ovocné dny </li><li>Teambuildingy (týmové i celofiremní)</li><li>Výhodný bowling v Olympii </li><li>Narozeninový a vánoční dárek</li><li>Přátelské prostředí</li></ul><p class=""typography-body-large-text-regular mb-800"">Baví vás hledat chyby a máte radost, když všechno perfektně funguje? Ozvěte se nám! Rádi vás poznáme a ukážeme vám, jak to u nás chodí. </p></div>"
.NET vývojář - budoucí inovátor/ka Cadet ERP,ProXIV s.r.o.,https://www.linkedin.com/jobs/view/4339277996/?utm_source=juniorguru,False,2025-11-28 00:00:00,,cs,,,linkedin#4339277996,,,,,,,,,,Kladno,,,,,,,,,,,,,,,,,,,,Praha,,,,,,,,,,,,,,,,,,,,fulltime,,,,,,,,,,"<p>Full-time | on-site Kladno |&nbsp;čeština&nbsp;nutná&nbsp;</p>Kdo&nbsp;jsme&nbsp;(ProXIV)&nbsp;<p>Jsme malá firma existující od roku 2003. Vyvíjíme software pro výrobní podniky, hlavně v kabelářském průmyslu, a naším cílem je dodávat profesionální, kvalitní a uživatelsky přívětivý produkt, který zákazníci opravdu používají a mají rádi.</p><p>Dlouhodobě pomáháme výrobním firmám řídit jejich procesy chytře a jednoduše (plánování, výrobu, materiál, sklady). Rozumíme tomu, co zákazníci reálně potřebují, a podle toho náš produkt vyvíjíme.</p><p>Naším cílem je mít nejlepší řešení pro výrobce kabelů.</p>Jak se u&nbsp;nás&nbsp;pracuje&nbsp;<p>Nejsme&nbsp;korporát.&nbsp;</p><ul><li>U&nbsp;nás&nbsp;se&nbsp;věci&nbsp;nevlečou&nbsp;–&nbsp;jsme&nbsp;flexibilní&nbsp;a&nbsp;efektivní.&nbsp;</li><li>Neutápíme&nbsp;se v&nbsp;procesech&nbsp;a&nbsp;byrokracii.&nbsp;</li><li>Komunikace&nbsp;je&nbsp;rychlá,&nbsp;přímá&nbsp;a&nbsp;může&nbsp;mluvit&nbsp;každý.&nbsp;Žádné&nbsp;“musíš&nbsp;to&nbsp;říct&nbsp;přes&nbsp;tři&nbsp;manažery”.&nbsp;</li><li>Držíme&nbsp;spolu.&nbsp;Pomáháme&nbsp;si.&nbsp;Jsme&nbsp;féroví.&nbsp;</li><li>Když&nbsp;je&nbsp;problém,&nbsp;řekneme&nbsp;si&nbsp;to&nbsp;na&nbsp;rovinu&nbsp;a&nbsp;řešíme&nbsp;ho,&nbsp;nehrajeme&nbsp;tichou&nbsp;poštu.&nbsp;</li><li>Baví&nbsp;nás&nbsp;dělat&nbsp;práci,&nbsp;která&nbsp;má&nbsp;smysl&nbsp;a&nbsp;viditelný&nbsp;dopad.&nbsp;</li><li>Máme&nbsp;svobodu&nbsp;dělat&nbsp;věci&nbsp;efektivně&nbsp;a&nbsp;jednoduše.&nbsp;</li><li>Práce&nbsp;v&nbsp;týmu&nbsp;je pro&nbsp;nás&nbsp;benefit, ne&nbsp;nutné&nbsp;zlo. Home-office je&nbsp;spíš&nbsp;výjimka&nbsp;než&nbsp;standard –&nbsp;nechceme&nbsp;izolované&nbsp;“remote&nbsp;solitéry”.&nbsp;</li><li>Nikdo&nbsp;se u&nbsp;nás&nbsp;jen&nbsp;“neveze”.&nbsp;Každý&nbsp;bere&nbsp;zodpovědnost&nbsp;za 100%&nbsp;odevzdanou&nbsp;práci.&nbsp;</li></ul><p>Jestli&nbsp;hledáš&nbsp;místo,&nbsp;kde&nbsp;“nějak&nbsp;přežít&nbsp;osm&nbsp;hodin”,&nbsp;tohle&nbsp;nebude&nbsp;ono.&nbsp;</p><p>Jestli&nbsp;chceš&nbsp;místo,&nbsp;kde&nbsp;se&nbsp;fakt&nbsp;něco&nbsp;naučíš&nbsp;a&nbsp;tvoje&nbsp;práce&nbsp;má&nbsp;okamžitý&nbsp;dopad&nbsp;u&nbsp;reálného&nbsp;zákazníka&nbsp;–&nbsp;čti&nbsp;dál.&nbsp;</p>Co&nbsp;budeš&nbsp;dělat&nbsp;<p>Hledáme&nbsp;člověka&nbsp;na&nbsp;pozici&nbsp;.NET&nbsp;vývojář&nbsp;/ junior&nbsp;programátor&nbsp;/&nbsp;konzultant,&nbsp;který&nbsp;nám&nbsp;pomůže&nbsp;vyvíjet&nbsp;a&nbsp;ladit&nbsp;náš&nbsp;produkt&nbsp;pro&nbsp;řízení&nbsp;výroby.&nbsp;</p><p>Tvoje&nbsp;práce&nbsp;kombinuje&nbsp;vývoj,&nbsp;pochopení&nbsp;procesu&nbsp;výroby&nbsp;a&nbsp;přemýšlení&nbsp;nad&nbsp;tím, jak&nbsp;věci&nbsp;dělat&nbsp;líp.&nbsp;Není&nbsp;to&nbsp;čistě&nbsp;“zavřít&nbsp;se a&nbsp;psát&nbsp;kód”, ale ani&nbsp;čistě&nbsp;konzultantské&nbsp;“mluvit&nbsp;a&nbsp;nic&nbsp;neudělat”. Je to&nbsp;celý&nbsp;balík.&nbsp;</p><p>Běžný&nbsp;den&nbsp;může&nbsp;vypadat&nbsp;takhle:&nbsp;</p><ul><li>Ráno&nbsp;v&nbsp;kanceláři&nbsp;(Kladno),&nbsp;klasicky&nbsp;kolem&nbsp;8–16.&nbsp;</li><li>Krátká&nbsp;týmová&nbsp;schůzka: co se&nbsp;řešilo&nbsp;včera, co&nbsp;řešíme&nbsp;dnes,&nbsp;kde&nbsp;kdo&nbsp;potřebuje&nbsp;pomoct.&nbsp;</li><li>Dostaneš&nbsp;konkrétní&nbsp;úkol&nbsp;(např.&nbsp;nová&nbsp;funkce&nbsp;ve&nbsp;výrobním&nbsp;modulu&nbsp;nebo&nbsp;úprava&nbsp;existující&nbsp;logiky).&nbsp;</li><li>Přemýšlíš&nbsp;nad&nbsp;tím, jak to&nbsp;navrhnout&nbsp;technicky&nbsp;i&nbsp;procesně, aby to&nbsp;zákazníkovi&nbsp;fakt&nbsp;pomohlo.&nbsp;</li><li>Programuješ&nbsp;v C# / .NET,&nbsp;pracuješ&nbsp;s&nbsp;databází&nbsp;MS SQL Server.&nbsp;</li><li>Připravíš&nbsp;popis&nbsp;nové&nbsp;funkce&nbsp;pro&nbsp;testera,&nbsp;vysvětlíš, co&nbsp;má&nbsp;otestovat.&nbsp;</li><li>Spolu&nbsp;s&nbsp;testerem&nbsp;doladíte&nbsp;chyby&nbsp;a&nbsp;předáte&nbsp;k&nbsp;nasazení.&nbsp;</li><li>Oběd&nbsp;(často&nbsp;společně,&nbsp;není&nbsp;povinný, ale je to&nbsp;příjemná&nbsp;pauza).&nbsp;</li><li>Průběžně&nbsp;konzultuješ&nbsp;s&nbsp;kolegy&nbsp;i&nbsp;se&nbsp;zákazníkem&nbsp;–&nbsp;občas&nbsp;ukážeš&nbsp;rozpracované&nbsp;řešení,&nbsp;občas&nbsp;si&nbsp;vyjasníš&nbsp;požadavky.&nbsp;</li><li>Jednou&nbsp;týdně&nbsp;děláme&nbsp;větší&nbsp;přehled&nbsp;projektů:&nbsp;interní&nbsp;vývoj, co se&nbsp;děje&nbsp;u&nbsp;zákazníků, co se&nbsp;chystá&nbsp;dál.&nbsp;</li><li>Pracuješ&nbsp;na&nbsp;výkonném&nbsp;počítači&nbsp;připraveném&nbsp;na&nbsp;vývoj, ne&nbsp;na&nbsp;deset&nbsp;let&nbsp;starém&nbsp;šrotu.&nbsp;</li></ul><p>Home office&nbsp;máme&nbsp;jen&nbsp;výjimečně&nbsp;–&nbsp;jsme&nbsp;tým,&nbsp;který&nbsp;pracuje&nbsp;spolu&nbsp;na&nbsp;místě,&nbsp;protože&nbsp;to je&nbsp;rychlé&nbsp;a&nbsp;funkční.&nbsp;</p>Co&nbsp;konkrétně&nbsp;bude&nbsp;tvoje&nbsp;práce&nbsp;<ul><li>Programování&nbsp;v&nbsp;C# / .NET.&nbsp;</li><li>Práce&nbsp;s&nbsp;Microsoft SQL&nbsp;Serverem&nbsp;/ T-SQL&nbsp;(čtení&nbsp;a&nbsp;úprava&nbsp;dat,&nbsp;dotazy,&nbsp;ladění).&nbsp;</li><li>Úpravy&nbsp;a&nbsp;rozvoj&nbsp;desktopových&nbsp;aplikací&nbsp;(Windows Forms, DevExpress).&nbsp;</li><li>Návrh&nbsp;logiky&nbsp;a&nbsp;procesů: jak by&nbsp;funkce&nbsp;měla&nbsp;fungovat, aby&nbsp;dávala&nbsp;smysl&nbsp;ve&nbsp;výrobě&nbsp;(ne&nbsp;jen&nbsp;“nějak&nbsp;to&nbsp;naklikej”).&nbsp;</li><li>Diskuze s&nbsp;týmem&nbsp;o&nbsp;řešení&nbsp;požadavků&nbsp;zákazníka&nbsp;(nová&nbsp;funkce,&nbsp;úprava&nbsp;stávající&nbsp;funkce).&nbsp;</li><li>Příprava&nbsp;podkladů&nbsp;pro&nbsp;testování&nbsp;(co se&nbsp;změnilo, co&nbsp;má&nbsp;fungovat&nbsp;jak).&nbsp;</li><li>Spoluúčast&nbsp;na&nbsp;ladění&nbsp;chyb&nbsp;a&nbsp;finalizaci&nbsp;před&nbsp;nasazením.&nbsp;</li></ul><p>Plus&nbsp;výhoda&nbsp;(není&nbsp;povinné, ale&nbsp;hodí&nbsp;se):&nbsp;</p><ul><li>Prezentace&nbsp;výsledku&nbsp;zákazníkovi&nbsp;(umět&nbsp;ukázat: “Tady je to&nbsp;hotové,&nbsp;funguje&nbsp;to&nbsp;takhle…”).&nbsp;</li><li>Naslouchat&nbsp;zákazníkovi&nbsp;a&nbsp;přeložit&nbsp;“jejich&nbsp;problém” do&nbsp;technického&nbsp;řešení.&nbsp;</li></ul>Jaký&nbsp;člověk&nbsp;nám&nbsp;sedne&nbsp;<p>Nebudeme&nbsp;hrát&nbsp;buzzword bingo.&nbsp;Tohle&nbsp;je&nbsp;fakt&nbsp;důležité:&nbsp;</p><p>1.&nbsp;Baví&nbsp;tě&nbsp;řešit&nbsp;problémy&nbsp;</p><p>Rád/a&nbsp;hledáš&nbsp;technické&nbsp;řešení&nbsp;konkrétního&nbsp;problému.&nbsp;Nesypeš&nbsp;kód&nbsp;bez&nbsp;rozmyslu, ale&nbsp;chápeš,&nbsp;proč&nbsp;to&nbsp;děláš.&nbsp;Nejsi&nbsp;horká&nbsp;hlava&nbsp;–&nbsp;když&nbsp;je&nbsp;problém,&nbsp;řešíš,&nbsp;nepanikaříš.&nbsp;</p><p>2.&nbsp;Máš&nbsp;rád/a&nbsp;různorodost&nbsp;</p><p>Nejsme&nbsp;pás.&nbsp;Úkoly&nbsp;se&nbsp;liší&nbsp;den ode&nbsp;dne.&nbsp;Jednou&nbsp;řešíš&nbsp;logiku&nbsp;plánování&nbsp;výroby,&nbsp;podruhé&nbsp;tisk&nbsp;štítků&nbsp;na&nbsp;materiál,&nbsp;potřetí&nbsp;výkon&nbsp;SQL&nbsp;dotazu.&nbsp;Pokud&nbsp;potřebuješ&nbsp;přesně&nbsp;danou&nbsp;rutinu&nbsp;“každý&nbsp;den to&nbsp;samé”,&nbsp;tohle&nbsp;tě&nbsp;spíš&nbsp;vyčerpá.&nbsp;</p><p>3.&nbsp;Chceš&nbsp;pomáhat&nbsp;lidem&nbsp;</p><p>Ne v&nbsp;abstrakci, ale&nbsp;fakticky:&nbsp;díky&nbsp;tvému&nbsp;řešení&nbsp;ušetří&nbsp;někdo&nbsp;ve&nbsp;výrobě&nbsp;čas,&nbsp;vyhne&nbsp;se&nbsp;chybám,&nbsp;zrychlí&nbsp;zakázku. Je to&nbsp;vidět&nbsp;prakticky&nbsp;hned.&nbsp;</p><p>4.&nbsp;Chceš&nbsp;vidět&nbsp;dopad&nbsp;svojí&nbsp;práce&nbsp;</p><p>U&nbsp;nás&nbsp;vidíš&nbsp;reálné&nbsp;nasazení&nbsp;u&nbsp;zákazníků.&nbsp;Nejsme&nbsp;tým,&nbsp;který&nbsp;rok&nbsp;vyvíjí&nbsp;a&nbsp;nic&nbsp;se&nbsp;nenasadí.&nbsp;</p><p>5.&nbsp;Chceš&nbsp;být&nbsp;u toho od&nbsp;začátku&nbsp;do&nbsp;konce&nbsp;</p><p>Nejsme&nbsp;továrna&nbsp;“tady&nbsp;máš&nbsp;ticket,&nbsp;nic&nbsp;se&nbsp;neptej”.&nbsp;Můžeš&nbsp;být&nbsp;u&nbsp;analýzy&nbsp;požadavku,&nbsp;návrhu&nbsp;řešení,&nbsp;implementace,&nbsp;testování&nbsp;i&nbsp;doručení.&nbsp;</p><p>6.&nbsp;Máš&nbsp;chuť&nbsp;se&nbsp;učit&nbsp;</p><p>Jsi&nbsp;zvídavý/á.&nbsp;Bereš&nbsp;info od&nbsp;zkušenějších,&nbsp;ptáš&nbsp;se,&nbsp;posouváš&nbsp;se. A&nbsp;zároveň&nbsp;se&nbsp;rád/a&nbsp;podělíš&nbsp;o to, co&nbsp;už&nbsp;znáš.&nbsp;</p><p>&nbsp;Chceme&nbsp;někoho,&nbsp;kdo&nbsp;nechce&nbsp;ustrnout.&nbsp;</p><p>7.&nbsp;Přemýšlíš&nbsp;systémově&nbsp;</p><p>Vidíš&nbsp;souvislosti&nbsp;procesů&nbsp;(“když&nbsp;změníme&nbsp;A,&nbsp;má&nbsp;to&nbsp;dopad&nbsp;na&nbsp;B a C”).&nbsp;Dokážeš&nbsp;převést&nbsp;chaos z&nbsp;výroby&nbsp;do&nbsp;logického&nbsp;workflow a&nbsp;pak&nbsp;do&nbsp;kódu.&nbsp;</p><p>Tohle&nbsp;je&nbsp;ideální, ale&nbsp;stačí&nbsp;základ:&nbsp;</p><ul><li>už&nbsp;jsi&nbsp;něco&nbsp;psal/a v&nbsp;C#&nbsp;(škola,&nbsp;vlastní&nbsp;projekt,&nbsp;malý&nbsp;tool),&nbsp;</li><li>umíš&nbsp;pracovat&nbsp;s&nbsp;počítačem&nbsp;na&nbsp;pokročilé&nbsp;úrovni&nbsp;(Windows),&nbsp;</li><li>rozumíš&nbsp;základům&nbsp;SQL&nbsp;dotazů,&nbsp;</li><li>a&nbsp;chceš&nbsp;se v tom&nbsp;zlepšovat.&nbsp;</li></ul><p>Velké plus (ale&nbsp;není&nbsp;podmínka):&nbsp;</p><ul><li>zkušenost&nbsp;z&nbsp;výrobního&nbsp;podniku&nbsp;/&nbsp;průmyslu,&nbsp;</li><li>Windows Forms / DevExpress,&nbsp;</li><li>Git / GitLab,&nbsp;</li><li>Flutter (desktop/web/mobile),&nbsp;</li><li>schopnost&nbsp;mluvit&nbsp;se&nbsp;zákazníkem&nbsp;bez&nbsp;stresu&nbsp;</li></ul><p>8.&nbsp;Jsi&nbsp;aktivní&nbsp;a&nbsp;zodpovědný/á&nbsp;</p><p>Nejsi&nbsp;typ&nbsp;“odevzdám&nbsp;první&nbsp;věc, co&nbsp;projde&nbsp;kompilací&nbsp;a&nbsp;tím&nbsp;to pro&nbsp;mě&nbsp;končí”.&nbsp;</p><p>&nbsp;Chceme&nbsp;někoho,&nbsp;kdo&nbsp;si&nbsp;po&nbsp;sobě&nbsp;práci&nbsp;zkontroluje, je&nbsp;pečlivý,&nbsp;dotahuje&nbsp;úkoly&nbsp;a&nbsp;přemýšlí&nbsp;i&nbsp;nad&nbsp;rámec&nbsp;zadání.&nbsp;</p><p>9.&nbsp;Umíš&nbsp;komunikovat&nbsp;</p><ul><li>Umíš&nbsp;normálně&nbsp;mluvit&nbsp;s&nbsp;kolegy,&nbsp;ptát&nbsp;se,&nbsp;říct&nbsp;si&nbsp;o&nbsp;pomoc.&nbsp;</li><li>Nebojíš&nbsp;se&nbsp;zákazníka&nbsp;(to je&nbsp;výhoda, ne&nbsp;nutnost&nbsp;–&nbsp;naučíme&nbsp;tě&nbsp;to).&nbsp;</li><li>Jazykově:&nbsp;</li><li>Čeština/slovenština:&nbsp;plynně&nbsp;(C2 /&nbsp;rodilý&nbsp;mluvčí) –&nbsp;interní&nbsp;komunikace&nbsp;a&nbsp;zákazníci&nbsp;v ČR.&nbsp;</li><li>Angličtina:&nbsp;aspoň&nbsp;B1 –&nbsp;čtení&nbsp;dokumentace,&nbsp;jednoduché&nbsp;vysvětlení&nbsp;co&nbsp;děláš.&nbsp;</li><li>Němčina:&nbsp;výhoda, ne&nbsp;podmínka.&nbsp;</li><li>Polština:&nbsp;výhoda, ne&nbsp;podmínka.&nbsp;</li></ul>Co od&nbsp;tebe&nbsp;minimálně&nbsp;potřebujeme&nbsp;hned&nbsp;na&nbsp;start&nbsp;<p>Tohle&nbsp;je “must”:&nbsp;</p><ul><li>Základní&nbsp;znalost&nbsp;C# / .NET.&nbsp;</li><li>Schopnost&nbsp;psát&nbsp;jednoduché&nbsp;SQL&nbsp;dotazy&nbsp;pro&nbsp;Microsoft SQL Server&nbsp;(SELECT, JOIN, UPDATE…).&nbsp;</li><li>Chuť&nbsp;být&nbsp;fyzicky&nbsp;každý&nbsp;pracovní&nbsp;den v&nbsp;kanceláři&nbsp;v&nbsp;Kladně&nbsp;(full-time on-site).&nbsp;</li><li>Ochotu&nbsp;učit&nbsp;se&nbsp;nové&nbsp;věci&nbsp;a&nbsp;posouvat&nbsp;se.&nbsp;</li></ul><p>Tohle&nbsp;je “nice to have”:&nbsp;</p><ul><li>Windows Forms.&nbsp;</li><li>DevExpress.&nbsp;</li><li>T-SQL.&nbsp;</li><li>Flutter.&nbsp;</li><li>Zkušenosti&nbsp;z&nbsp;výroby&nbsp;/&nbsp;logistiky&nbsp;/&nbsp;průmyslu.&nbsp;</li></ul>Co&nbsp;tě&nbsp;u&nbsp;nás&nbsp;naučíme&nbsp;<p>Nečekáme&nbsp;hotového&nbsp;seniora.&nbsp;Pokud&nbsp;máš&nbsp;základy&nbsp;a&nbsp;hlavu&nbsp;nastavenou&nbsp;správně,&nbsp;zbytek&nbsp;tě&nbsp;naučíme:&nbsp;</p><ul><li>Jak&nbsp;náš&nbsp;software&nbsp;řídí&nbsp;a&nbsp;podporuje&nbsp;procesy&nbsp;našich&nbsp;zákazníků&nbsp;(výroba,&nbsp;plánování,&nbsp;nákup,&nbsp;sklady,&nbsp;prodej…).&nbsp;</li><li>Vývoj&nbsp;desktopových&nbsp;aplikací&nbsp;nad&nbsp;Windows Forms&nbsp;a&nbsp;DevExpress.&nbsp;</li><li>Práci&nbsp;s&nbsp;repozitáři&nbsp;(Git, GitLab).&nbsp;</li><li>Návrh&nbsp;funkcí&nbsp;tak, aby&nbsp;dávaly&nbsp;smysl&nbsp;nejen&nbsp;technicky, ale&nbsp;i&nbsp;ve&nbsp;výrobním&nbsp;provozu.&nbsp;</li><li>Zlepšení&nbsp;v C# .NET, SQL, a&nbsp;případně&nbsp;Flutteru&nbsp;(desktop / web /&nbsp;mobil).&nbsp;</li><li>Komunikaci&nbsp;se&nbsp;zákazníky&nbsp;z&nbsp;výrobních&nbsp;firem&nbsp;– jak&nbsp;si&nbsp;s&nbsp;nimi&nbsp;vyjasnit&nbsp;zadání&nbsp;a jak&nbsp;jim&nbsp;ukázat&nbsp;hotové&nbsp;řešení.&nbsp;</li><li>Angličtinu&nbsp;v&nbsp;praxi&nbsp;(čtení&nbsp;a&nbsp;používání&nbsp;technických&nbsp;podkladů).&nbsp;</li></ul>Shrnutí&nbsp;<p>Hledáme&nbsp;někoho,&nbsp;kdo:&nbsp;</p><ul><li>má&nbsp;základ&nbsp;v C# a SQL,&nbsp;</li><li>chce&nbsp;být&nbsp;v&nbsp;kanceláři&nbsp;v&nbsp;Kladně&nbsp;a&nbsp;fungovat&nbsp;v&nbsp;týmu, ne v&nbsp;izolaci,&nbsp;</li><li>chce&nbsp;vidět&nbsp;okamžitý&nbsp;dopad&nbsp;svojí&nbsp;práce&nbsp;u&nbsp;reálných&nbsp;zákazníků,&nbsp;</li><li>chce&nbsp;se&nbsp;zlepšovat&nbsp;a&nbsp;mít&nbsp;možnost&nbsp;růst.&nbsp;</li></ul><p>Nenabízíme&nbsp;“teplé&nbsp;místo,&nbsp;kde&nbsp;tě&nbsp;nikdo&nbsp;nebude&nbsp;rušit”.&nbsp;</p><p>Nabízíme&nbsp;smysluplnou&nbsp;práci&nbsp;s&nbsp;reálným&nbsp;vlivem,&nbsp;normální&nbsp;tým&nbsp;a&nbsp;upřímné&nbsp;jednání.&nbsp;&nbsp;</p>Zaujalo&nbsp;tě&nbsp;to?&nbsp;<p>Pošli&nbsp;nám&nbsp;krátce:&nbsp;</p><ul><li>co&nbsp;už&nbsp;jsi&nbsp;dělal&nbsp;v C# / .NET (klidně&nbsp;školní&nbsp;projekt&nbsp;nebo&nbsp;něco, co sis&nbsp;napsal&nbsp;pro&nbsp;sebe),&nbsp;</li><li>jestli&nbsp;máš&nbsp;zkušenost&nbsp;s SQL&nbsp;Serverem,&nbsp;</li><li>odkud&nbsp;dojíždíš.&nbsp;</li><li>Ozveme&nbsp;se&nbsp;ti&nbsp;zpátky&nbsp;a&nbsp;domluvíme&nbsp;si&nbsp;krátký&nbsp;call /&nbsp;osobní&nbsp;setkání&nbsp;u&nbsp;nás&nbsp;v&nbsp;kanceláři&nbsp;na&nbsp;Kladně.&nbsp;</li></ul>"
