title,company_name,url,remote,first_seen_at,last_seen_at,lang,juniority_score,source,external_ids_0,external_ids_1,external_ids_2,external_ids_3,external_ids_4,external_ids_5,external_ids_6,external_ids_7,external_ids_8,external_ids_9,locations_0_name,locations_1_name,locations_2_name,locations_3_name,locations_4_name,locations_5_name,locations_6_name,locations_7_name,locations_8_name,locations_9_name,locations_10_name,locations_11_name,locations_12_name,locations_13_name,locations_14_name,locations_15_name,locations_16_name,locations_17_name,locations_18_name,locations_19_name,locations_0_region,locations_1_region,locations_2_region,locations_3_region,locations_4_region,locations_5_region,locations_6_region,locations_7_region,locations_8_region,locations_9_region,locations_10_region,locations_11_region,locations_12_region,locations_13_region,locations_14_region,locations_15_region,locations_16_region,locations_17_region,locations_18_region,locations_19_region,employment_types_0,employment_types_1,employment_types_2,employment_types_3,employment_types_4,employment_types_5,employment_types_6,employment_types_7,employment_types_8,employment_types_9,description_html
Datový analytik Magistrátu města Jihlavy,Statutární město Jihlava,https://www.jobs.cz/rpd/2000700184/,False,2025-08-24 00:00:00,,cs,,,jobscz#2000700184,,,,,,,,,,Jihlava,Jihlava,,,,,,,,,,,,,,,,,,,Jihlava,Jihlava,,,,,,,,,,,,,,,,,,,fulltime,parttime,,,,,,,,,"<div data-jobad=""body"" data-test=""jd-body-richtext"" class=""RichContent mb-1400""><p class=""typography-body-medium-text-regular text-secondary mb-600"">Pracovní nabídka</p><p class=""typography-body-large-text-regular mb-800""><strong>☀️Hledáme dynamického Datového analytika do týmu superhrdinů z odboru strategie a architektury Magistrátu města Jihlavy!</strong> ☀️</p><p class=""typography-body-large-text-regular mb-800""><strong>Ahoj, milovníci čísel a analýz!</strong> 🕵️</p><p class=""typography-body-large-text-regular mb-800"">Chcete se podílet na tvorbě chytrých městských rozhodnutí? Máte rádi data, statistiku a rádi s nimi kouzlíte? Přidejte se k nám a pomáhejte nám vytvářet lepší Jihlavu!</p><p class=""typography-body-large-text-regular mb-800""><strong>Datový analytik</strong> 🦸♂️🦸♀️</p><ul class=""typography-body-large-text-regular""><li>Místo výkonu:<strong> Jihlava</strong></li><li>Pracovní poměr:<strong> na dobu neurčitou</strong></li><li>Předpokládaný termín nástupu:<strong> dle domluvy</strong></li><li><strong>Platová třída 11 </strong>dle platných právních předpisů<strong> + velmi zajímavé osobní ohodnocení</strong></li></ul><p class=""typography-body-large-text-regular mb-800""><strong>C</strong><strong>o budete dělat?</strong></p><p class=""typography-body-large-text-regular mb-800"">🔍 Analyzovat data a hledat z nich užitečné poznatky</p><p class=""typography-body-large-text-regular mb-800"">📊 Třídit, shromažďovat a vizualizovat informace</p><p class=""typography-body-large-text-regular mb-800"">📝 Vytvářet reporty a doporučení pro vedení města</p><p class=""typography-body-large-text-regular mb-800"">💡 Přinášet nové nápady a řešení na základě datových analýz</p><p class=""typography-body-large-text-regular mb-800""><strong>Co od vás očekáváme?</strong></p><p class=""typography-body-large-text-regular mb-800"">✔️ Profi znalosti Excel, SQL, Python</p><p class=""typography-body-large-text-regular mb-800"">✔️ Analytické myšlení a schopnost práce s daty</p><p class=""typography-body-large-text-regular mb-800"">✔️ Znalost statistických metod a umění prezentovat složité věci jednoduše</p><p class=""typography-body-large-text-regular mb-800"">✔️ Týmového ducha, schopnost řešit problémy a spolupracovat s různými odděleními</p><p class=""typography-body-large-text-regular mb-800""><strong>Co nabízíme?</strong></p><p class=""typography-body-large-text-regular mb-800"">🦔 Práci na hlavní pracovní poměr na dobu neurčitou – ať už máte rádi stálost nebo dobrodružství, u nás najdete obojí!</p><p class=""typography-body-large-text-regular mb-800"">🦔 Možnost podílet se na zajímavých projektech a udělat něco opravdu smysluplného.</p><p class=""typography-body-large-text-regular mb-800"">🦔 Mladý a přátelský kolektiv, kde všichni chodí rádi do práce.</p><p class=""typography-body-large-text-regular mb-800""><strong>Pokud chcete být součástí moderního týmu, který má skutečný vliv na rozvoj města, neváhejte a pošlete nám svůj životopis!</strong> 🚀</p></div>"
.NET/C# developer,"MAJAK-SOFTWARE, spol. s r.o.,",https://www.jobs.cz/rpd/2000699399/,False,2025-08-24 00:00:00,,cs,,,jobscz#2000699399,,,,,,,,,,Praha,Praha,,,,,,,,,,,,,,,,,,,Praha,Praha,,,,,,,,,,,,,,,,,,,fulltime,,,,,,,,,,"<div data-jobad=""body"" data-test=""jd-body-richtext"" class=""RichContent mb-1400""><p class=""typography-body-medium-text-regular text-secondary mb-600"">Pracovní nabídka</p><h2 class=""typography-heading-small-text""><strong>O nás</strong></h2><p class=""typography-body-large-text-regular mb-800"">MAJAK-SOFTWARE je dynamická česká společnost specializující se na vývoj softwarových řešení a poskytování komplexních IT služeb. S důrazem na inovace a kvalitu pomáháme našim klientům optimalizovat jejich procesy a dosahovat lepších výsledků. Naším cílem je poskytovat špičková řešení přizpůsobená individuálním potřebám každého zákazníka.</p><h2 class=""typography-heading-small-text""><strong>O pozici</strong></h2><p class=""typography-body-large-text-regular mb-800"">Hledáme talentovaného vývojáře, který se připojí k našemu týmu a bude pracovat na vývoji a údržbě softwarových řešení postavených na Microsoft .NET Framework. Hledáme někoho, kdo má zkušenost s C# a SQL, a kdo má chuť se dále rozvíjet v oblasti webových aplikací a UI technologií. Pokud máte zájem o práci na moderních technologiích a nebojíte se nových výzev, přidejte se k nám!</p><h2 class=""typography-heading-small-text""><strong>Co budete dělat?</strong></h2><ul class=""typography-body-large-text-regular""><li>Vývoj a údržba aplikací postavených na Microsoft .NET Framework.</li><li>Programování v C# a práce s SQL databázemi.</li><li>Implementace a optimalizace řešení v ASP.NET.</li><li>Práce s XML pro konfigurace a integrace.</li><li>Úpravy a vylepšování vzhledu webových aplikací pomocí CSS a JavaScript (jQuery, apod.).</li><li>Spolupráce na redesignu aplikací s využitím toolkitů jako Bootstrap.</li><li>(Volitelné) Vývoj desktopových aplikací v WPF (výhodou, ale není nutné).</li></ul><h2 class=""typography-heading-small-text""><strong>Koho hledáme?</strong></h2><ul class=""typography-body-large-text-regular""><li>Máte zkušenosti s Microsoft .NET Framework a programováním v C#.</li><li>Ovládáte SQL a umíte pracovat s databázemi.</li><li>Máte zkušenosti s prací v Microsoft Visual Studiu</li><li>Máte zkušenosti s ASP.NET pro webové aplikace.</li><li>Ovládáte CSS a základní úpravy vzhledu webu.</li><li>Umíte pracovat s JavaScript/jQuery.</li><li>Znalost Bootstrap nebo jiných UI knihoven je výhodou.</li><li>(Bonus) Pokud znáte WPF, je to výhoda, ale není nutností.</li><li>Jste samostatní, pečliví a máte chuť učit se nové technologie.</li></ul><h2 class=""typography-heading-small-text"">Co nabízíme?</h2><ul class=""typography-body-large-text-regular""><li>Práci na zajímavých projektech s moderními technologiemi.</li><li>Možnost růstu a profesního rozvoje – mentoring, školení, certifikace.</li><li>Hybridní pracovní model – možnost práce z domova i v kanceláři.</li><li>Přátelský tým a neformální firemní kulturu.</li><li>Atraktivní finanční ohodnocení odpovídající zkušenostem.</li><li>Benefity jako personal days, a další.</li></ul><p class=""typography-body-large-text-regular mb-800""><br>Pokud vás pozice zaujala, zašlete nám svůj životopis – těšíme se na vás!</p></div>"
Absolventský program: Tester junior,Foxconn Czech Republic,https://www.jobs.cz/rpd/2000732743/,False,2025-08-24 00:00:00,,cs,,,jobscz#2000732743,,,,,,,,,,Pardubice,Pardubice,,,,,,,,,,,,,,,,,,,Pardubice,Pardubice,,,,,,,,,,,,,,,,,,,fulltime,,,,,,,,,,"<div data-jobad=""body"" data-test=""jd-body-richtext"" class=""RichContent mb-1400""><p class=""typography-body-medium-text-regular text-secondary mb-600"">Pracovní nabídka</p><p class=""typography-body-large-text-regular mb-800""><strong>Začněte svou profesní cestu v oblasti kvality softwaru!</strong><br><br>Jste čerstvým absolventem střední nebo vysoké školy a hledáte cestu do IT? Přihlaste se do našeho absolventského programu zaměřeného na kvalitu softwaru (Quality Assurance)!<br>Nehledáme roky praxe – stačí chuť učit se, zájem o technologie a pečlivé oko.</p><p class=""typography-body-large-text-regular mb-800""><strong>O čem to je?</strong><br>•Pracujete na plný úvazek, získáváte cenné zkušenosti a máte řádnou mzdu.<br>•Dostanete mentora 💪, který vás provede adaptací a podpoří váš rozvoj.<br>•Poznáte, jak fungují různá oddělení – od plánování přes výrobu až po IT.<br>•Čekají vás rozvojové aktivity, školení a teambuilding 🎆.</p><p class=""typography-body-large-text-regular mb-800""><strong>Co budete dělat v kvalitě softwaru?</strong><br>•Testovat aplikace – manuálně i automatizovaně.<br>•Hledat chyby, analyzovat výsledky a navrhovat zlepšení.<br>•Psaní a údržba automatických testů v C# a Selenium (GitLab, Kubernetes).<br>•Spolupráce na tvorbě testovacích scénářů a strategie QA týmu.</p><p class=""typography-body-large-text-regular mb-800""><strong>Podmínky zapojení</strong><br>•Jste čerstvým absolventem (max. 1 rok od ukončení studia) nebo dálkově studujete.<br>•Baví vás nové technologie a chcete růst 🚀.<br>•Výhodou bude znalost C#, GitLabu, Dockeru či testovacích nástrojů.Co získáte?<br>•Smlouvu do konce srpna 2025 (HPP) s možností dalšího uplatnění.<br>•Přátelský tým a spoustu nových zkušeností 💡.<br>•Pravidelná interní školení a možnost účasti na externích kurzech a konferencích.<br>•Firemní fitness 🏋️ přímo v areálu.<br>•Širokou škálu zaměstnaneckých benefitů (25 dní dovolené, MultiSport karta, 3000 Kč na volný čas a zdraví, slevy u partnerů a další).<br><br><strong>👉 Pošlete nám svůj životopis a začněte svou kariéru v oblasti kvality softwaru!</strong></p></div>"
DATA TRAINEE,"PHOENIX lékárenský velkoobchod, s.r.o.",https://www.jobs.cz/rpd/2000702054/,False,2025-08-24 00:00:00,,cs,,,jobscz#2000702054,,,,,,,,,,Praha,Praha,,,,,,,,,,,,,,,,,,,Praha,Praha,,,,,,,,,,,,,,,,,,,parttime,,,,,,,,,,"<div data-jobad=""body"" data-test=""jd-body-richtext"" class=""RichContent mb-1400""><p class=""typography-body-medium-text-regular text-secondary mb-600"">Pracovní nabídka</p><p class=""typography-body-large-text-regular mb-800"">Hledáme nadšeného studenta VŠ, který se chce stát <strong>Junior Data Analytikem</strong>. Pokud máš zájem o analýzu dat, pracoval jsi již s nástroji jako <strong>PowerBI</strong> nebo <strong>SQL</strong>, a chceš získat cenné zkušenosti v oblasti datové analýzy, máme pro tebe ideální příležitost. Pozice je na <strong>part-time, flexibilní</strong> a umožní ti skloubit práci s tvými studijními povinnostmi. Přidej se k nám a získej zkušenosti, které tě posunou v kariéře!</p><h2 class=""typography-heading-small-text"">CO BUDE VAŠÍ NÁPLNÍ PRÁCE?</h2><ul class=""typography-body-large-text-regular""><li>Realizování BI analýz v prostředí reportingových platforem Power BI a Qlik Sense včetně podkladové datové vrstvy a s tím spojené zajišťování potřebné dokumentace</li><li>Spolupráce na rozvoji datového skladu (databáze Vertica)</li><li>Ověřování správnosti dat v analytických řešeních</li><li>Kooperace na úkolech seniornějších kolegů</li><li>Evidence práce na úkolech a projektech dle pokynů nadřízeného (Azure DevOps)</li></ul><h2 class=""typography-heading-small-text"">CO OD VÁS OČEKÁVÁME?</h2><ul class=""typography-body-large-text-regular""><li>Studium vyššího ročníku VŠ se zaměřením na IT</li><li>Znalost SQL a ochota dále se v SQL vzdělávat</li><li>Velmi vítáme zkušenost s PowerBI či databází Vertica a MSSQL</li><li>ČJ na komunikativní úrovni</li><li>Silné analytické myšlení, komunikativnost a prezentační dovednosti</li></ul><h2 class=""typography-heading-small-text"">CO U NÁS ZÍSKÁTE NAVÍC?</h2><ul class=""typography-body-large-text-regular""><li><strong>10.000 Kč</strong>/rok ve slevách na nákup v lékárnách BENU</li><li><strong>3.000 Kč</strong>/rok příspěvek do Cafeterie na volnočasové aktivity</li><li><strong>450 Kč</strong>/měsíc zvýhodněná Multisport karta, možnost doprovodných karet</li><li><strong>150 Kč</strong> hodnota stravenky, kantýna na pracovišti</li><li><strong>5 týdnů dovolené</strong></li><li><strong>3 sick days</strong></li><li>Výhodnější nákup vozů ŠKODA, zvýhodněné volání pro rodinu a blízké</li><li>Tank kartu Benzina – tankování za zvýhodněné ceny v síti Orlen</li><li>Příjemné pracovní prostředí bez open space</li><li>Odměny za doporučení nových kolegů</li><li>Možnost parkování u kanceláří</li><li>Lékařská péče EUC plus</li><li>Notebook, mobilní telefon</li><li>Věrnostní bonus 3.000 Kč měsíčně po 3 odpracovaných letech</li></ul></div>"
(JUNIOR) SERVICENOW DEVELOPER (ITOM / CMDB),BENTELER Business Services CZ,https://www.jobs.cz/rpd/2000709561/,False,2025-08-24 00:00:00,,en,,,jobscz#2000709561,,,,,,,,,,Praha,Praha,,,,,,,,,,,,,,,,,,,Praha,Praha,,,,,,,,,,,,,,,,,,,fulltime,,,,,,,,,,"<div data-jobad=""body"" data-test=""jd-body-richtext"" class=""RichContent mb-1400""><p class=""typography-body-medium-text-regular text-secondary mb-600"">Pracovní nabídka</p><p class=""typography-body-large-text-regular mb-800"">Ready to dive into ServiceNow? We're looking for someone to join us as a ServiceNow ITOM and CMDB Specialist! You'll work closely with others to understand what's needed and then make it happen in ServiceNow. From setting up ITOM to keeping the CMDB in top shape, you'll be the go-to person. Plus, you'll get to work with a great team and learn even more about servers and networks along the way!</p><p class=""typography-body-large-text-regular mb-800""><br><strong>Your chance</strong></p><ul class=""typography-body-large-text-regular""><li>Collaboration with stakeholders to understand requirements and translate them into technical specifications for ServiceNow ITOM and CMDB</li><li>Design, develop and configure ITOM and CMDB including Discovery, Service Mapping and Event Management</li><li>Configure and maintain CMDB data model, ensuring accurate and up-to-date configuration item information</li><li>Integration of ServiceNow with other IT Operational platforms using APIs</li><li>Collaboration with cross-functional IT teams to define and implement ITOM and CMDB best practices, ensuring alignment with ITIL processes</li><li>Provision of ongoing support and maintenance for ServiceNow applications, troubleshooting issues and implementing fixes or enhancements</li><li>Collaboration with other ServiceNow developers and administrators within a virtual team</li></ul><p class=""typography-body-large-text-regular mb-800""><strong>Your personality</strong></p><ul class=""typography-body-large-text-regular""><li>Education: Bachelor's degree in computer science, information technology, or a related field.</li><li>Experience: Basic understanding of the ServiceNow platform and some hands-on experience with ServiceNow development.</li></ul><p class=""typography-body-large-text-regular mb-800""><strong>Skills:</strong></p><ul class=""typography-body-large-text-regular""><li>ServiceNow CMDB and ITOM: Familiarity with CMDB and ITOM functions like Discovery, Service Mapping, and Event Management.</li><li>Development and Configuration: Basic skills in ServiceNow development and configuration, including workflows, business rules, UI policies, and scripting.</li><li>Integration: Some experience with ServiceNow integration using APIs and web services.</li><li>ITIL Processes: Basic understanding of ITIL processes and best practices related to ITOM and CMDB.</li><li>Problem-Solving: Ability to troubleshoot technical issues with guidance.</li><li>Communication: Good communication and interpersonal skills, with the ability to collaborate effectively with stakeholders and technical teams.</li><li>Technical Background: Basic knowledge of server and network architecture is a plus.</li><li>Language: English language proficiency at least at B2 level.</li></ul><p class=""typography-body-large-text-regular mb-800""><strong>What do we offer</strong></p><ul class=""typography-body-large-text-regular""><li>13. wage</li><li>5 weeks of holiday per year</li><li>Sick days</li><li>Home Office / surcharge for home office</li><li>Electronic meal vouchers (200 Kč/per day)</li><li>Monthly contribution to cafeteria</li><li>Language courses, possibility of further education</li><li>Bonus for loyalty</li><li>International working environment</li><li>Discounted mobile tariffs for you and your family &amp; friends (up to 6 phone numbers can be connected)</li><li>Favourable location</li></ul></div>"
Junior/Medior Data Specialist – analytická duše s citem pro detail,elem6 s.r.o.,https://www.jobs.cz/rpd/2000717509/,False,2025-08-24 00:00:00,,cs,,,jobscz#2000717509,,,,,,,,,,Praha,Praha,,,,,,,,,,,,,,,,,,,Praha,Praha,,,,,,,,,,,,,,,,,,,fulltime,,,,,,,,,,"<div data-jobad=""body"" data-test=""jd-body-richtext"" class=""RichContent mb-1400""><p class=""typography-body-medium-text-regular text-secondary mb-600"">Pracovní nabídka</p><p class=""typography-body-large-text-regular mb-800""><strong>Jste typ člověka, který miluje pořádek v datech, má rád Excel a hledá příležitost, kde by mohl/a své analytické myšlení opravdu využít?</strong> Hledáme posilu do našeho týmu – někoho, kdo se nebojí výzev, rád se učí nové věci a dokáže samostatně přemýšlet nad tím, jak věci udělat chytřeji, rychleji a přesněji. <strong>Hledáme někoho, kdo má rád logické myšlení a chce se posouvat dál.</strong> Je schopný se sám učit a pracovat na sobě. Vzdělání a praxe pro nás nejsou prioritou.</p><p class=""typography-body-large-text-regular mb-800""><strong>My jsme elem6 – mladá, rychle rostoucí společnost zaměřená na vývoj a prodej spotřební elektroniky. V našem portfoliu najdete tři silné značky: LAMAX, TrueLife a Lauben.</strong> Nabízíme široké spektrum produktů: od audio zařízení, přes chytré kuchyňské spotřebiče, až po produkty pro péči o zdraví. <strong>Na trhu elektroniky a spotřebního zboží patříme mezi přední hráče a stále expandujeme do nových kategorií.</strong></p><p class=""typography-body-large-text-regular mb-800"">🎯 <strong>Co u nás budete dělat: </strong></p><ul class=""typography-body-large-text-regular""><li>Pracovat s daty – analyzovat, strukturovat, vizualizovat.</li><li>Vytvářet přehledné a funkční reporty v Excelu a Salesforcu.</li><li>Podílet se na rozvoji interních nástrojů.</li><li>Pracovat v CRM programu Salesforce – pokud nemáte zkušenosti nevadí, vše naučíme. Hledáme někoho, kdo bude mít velkou chuť se v něm naučit pracovat.</li></ul><p class=""typography-body-large-text-regular mb-800"">🎯<strong> Co od vás očekáváme: </strong></p><ul class=""typography-body-large-text-regular""><li>Pozitivní vztah k číslům.</li><li>Analytické myšlení – schopnost vidět v datech souvislosti.</li><li>Preciznost.</li><li>Chuť se učit a zlepšovat – data se mění a my s nimi.</li><li>Smysl pro logiku.</li></ul><p class=""typography-body-large-text-regular mb-800""><strong>🎯 Co za to nabízíme: <br></strong></p><ul class=""typography-body-large-text-regular""><li>Práci v kreativním a přátelském týmu.</li><li>Motivující finanční ohodnocení, které bude odpovídat Vašim zkušenostem a výsledkům.</li><li>Příležitost pro osobní i profesní rozvoj.</li><li>Flexibilní pracovní dobu.</li><li>Příspěvek na mobil, Multisport kartu a stravování.</li><li>5 týdnů dovolené a sick days pro Váš pohodový balance mezi prací a životem.</li><li>A samozřejmě naše produkty za zvýhodněné ceny!</li></ul><p class=""typography-body-large-text-regular mb-800"">Pokud Vás tato pozice zaujala stejně jako nás těší možnost poznat Vás, pošlete nám svůj životopis.</p><p class=""typography-body-large-text-regular mb-800"">🎬 Těšíme se, až Vás přivítáme do týmu!</p></div>"
Junior QA Inženýr,Veeam Software (Czech Republic) s.r.o.,https://www.jobs.cz/rpd/2000531693/,False,2025-08-24 00:00:00,,cs,,,jobscz#2000531693,,,,,,,,,,Praha,Praha,,,,,,,,,,,,,,,,,,,Praha,Praha,,,,,,,,,,,,,,,,,,,fulltime,parttime,,,,,,,,,"<div data-jobad=""body"" data-test=""jd-body-richtext"" class=""RichContent mb-1400""><p class=""typography-body-medium-text-regular text-secondary mb-600"">Pracovní nabídka</p><p class=""typography-body-large-text-regular mb-800""><strong>Vaší náplní práce by bylo:</strong></p><ul class=""typography-body-large-text-regular""><li>Ponoření do Veeam produktů a technologií;</li><li>Analyzování požadavků k produktům;</li><li>Testování jednoho nebo více produktů Veeam;</li><li>Komunikace s ostatními účastníky procesu vývoje produktu;</li><li>Vyhodnocování výsledků testů, vedení databáze závad.</li></ul><p class=""typography-body-large-text-regular mb-800""><br><strong>Tato práce je pro Vás, pokud:</strong></p><ul class=""typography-body-large-text-regular""><li>Jste absolvent nebo student vyššího ročníku technické univerzity, který sní o práci v IT;</li><li>Hledáte své první zaměstnání v IT nebo již pracujete jako test inženýr, vývojář softwaru nebo správce systému;</li><li>Chcete se profesně rozvíjet v oblasti testování softwaru;</li><li>Zajímáte se o technologie a máte pokročilé znalosti OS Windows nebo Linux;</li><li>Jste zvědaví, pozorní a všímáte si nedostatků ve všem kolem sebe;</li><li>Máte zdravý selský rozum;</li><li>Rychle se učíte (zájem a nadšení je důležitější než zkušenosti);</li><li>Máte dobrou znalost anglického jazyka alespoň na úrovni B2.</li></ul><p class=""typography-body-large-text-regular mb-800""><strong>Co nabízíme:</strong></p><ul class=""typography-body-large-text-regular""><li>Plat 70.000 - 100.000 CZK/měsíc hrubého (v závislosti na výsledku pohovoru)</li><li>Nadstandardní zdravotní péče pro vás, vašeho manžela/manželku a vaše děti</li><li>Dovolená a sick days</li><li>Stravenky</li><li>Placená lítačka</li><li>Mobilní tarif</li><li>MultiSport</li><li>Cafeteria Benefit Plan - balíček výhod s ročním rozpočtem, který můžete utratit za různé výhody, jako je cestování, sport, wellness a vzdělávání</li><li>Veeam Care Days – dalších 24 hodin pro vaše dobrovolnické aktivity</li><li>Kvalitní vzdělávací systém – kurzy a semináře, konference, IT meetupy, neomezený přístup k online knihovně (Percipio, Athena, O’Reilly) a mentoring prostřednictvím našeho Mentor Lab programu</li></ul></div>"
