Frontend Developer (Angular),LOGEX Solution Center s.r.o.,https://www.startupjobs.cz/nabidka/87715/frontend-developer-angular?utm_source=juniorguru&utm_medium=cpc&utm_campaign=juniorguru,False,2025-02-06 00:00:00,,cs,,,startupjobs#87715,,,,,,,,,,Brno,,,,,,,,,,,,,,,,,,,,Brno,,,,,,,,,,,,,,,,,,,,fulltime,,,,,,,,,,"<p id=""isPasted"">Baví Tě vývoj webu a ideálně chceš dělat vývoj v JavaScriptu s Angularem? Máš zkušenosti s Microsoft technologiemi a agilní metodikou SCRUM? Zároveň chceš, aby práce dávala smysl a výsledný produkt pomáhal? Tak to bychom si mohli rozumět! 😊</p><p>Náš TECH STACK:</p><ul><li>Frontend: Angular, TypeScript</li><li>Backend: C#, .NET</li><li>Database layer: PostgreSQL</li></ul><p><strong>Co budeš dělat? </strong></p><p>LOGEX vyvíjí aplikaci, která pomáhá nemocnicím zefektivnit zdravotní péči pomocí zpracování a vizualizace dat. &nbsp;</p><p>Budeš součástí projektu Codman, který umožňuje uživatelům analyzovat efektivitu a dopady různých léčeb. Tento nástroj vyžaduje precizní zpracování a zobrazování dat aby poskytnul zákazníkovi co nejlepší náhled na momentální stav léčeb a co nejvíc prostoru pro správná rozhodnutí. Protože nástroj zobrazuje komplexní data, vyžaduje rozhraní, které je intuitivní a uživatelsky přívětivé. Naši uživatelé jsou zamětnanci a vedení nemocnic.</p><p><img src=""https://images-assets.startupjobs.cz/DEFAULT_IMAGE/97993/35c99cd1f64f76a3ceb469a29f8fa3b5.png"" style=""width: 726px;"" class=""fr-fic fr-dib"" filename=""35c99cd1f64f76a3ceb469a29f8fa3b5.png"" originalfilename=""image (30).png"" url=""https://www.startupjobs.cz/download/35c99cd1f64f76a3ceb469a29f8fa3b5.png""></p><p><strong>Naše práce:</strong></p><ul><li>Frontend píšeme v nejnovější verzi Angularu.&nbsp;</li><li>Při práci se snažíme dbát na pochopitelný návrh, čistotu kódu, udržitelnost pro budoucí změny a dodržování obecných i interních konvencí. Součástí vývojového procesu jsou také code reviews.</li><li>Používáme sdílenou codebase se společným designem a funkcionalitou, kterou společně udržujeme, takže se můžeš podílet na jejím vylepšování.</li><li>Nabízíme ti ale práci, která nezahrnuje jen samotný vývoj. Vývojář na tvé úrovni přijímá zodpovědnost za svou práci a podílí se na návrhu řešení daného problému.</li><li>Pracujeme v end-to-end teamech různých velikostí, ve kterých jsou zastoupené role jako databázista, backendista, frontendista, systémový analytik, product owner a scrum master. Snažíme se, aby byly jednotlivé týmy i jejich produktové alokace stabilní.</li><li>Celý vývoj je v souladu se SCRUM metodologií. Na všech fázích cyklu spolupracujeme s kolegy z Amsterdamu a jiných evropských městu</li></ul><p><strong>Jak bychom si Tě představovali?</strong></p><ul><li>Pracuješ nebo jsi alespoň v minulosti pracoval s Angularem.</li><li>Nevadí ti sáhnout si na jiné technologie, když je potřeba.</li><li>Výhodou je, pokud máš zkušenosti také s Git, JIRA</li><li>Sedí ti práce v týmu, ale zvládneš to i samostatně.&nbsp;</li><li>Chceš se učit, nebojíš se zeptat a o to, co víš, se rád s kolegy v týmu podělíš.</li><li>Domluvíš se anglicky. Čeká tě spolupráce se zahraničními kolegy, takže bys měl umět anglicky lépe než oni česky.</li></ul><p data-prosemirror-content-type=""node"" data-prosemirror-node-name=""paragraph"" data-prosemirror-node-block=""true"">J<strong>aký bys měl být, aby ses u nás v týmu cítil dobře?</strong></p><ul><li>Chceš se učit, nebojíš se zeptat a o to, co víš, se rád s kolegy v týmu podělíš.</li><li>Jsi komunikativní a nemáš problém se domluvit na požadavcích.</li><li>Nestresuje tě komunikace v angličtině s kolegy ze zahraničí&nbsp;</li><li>Zodpovědnost a schopnost vzít na sebe část projektu v budoucnu by ti nemělo dělat problém.<img src=""https://images-assets.startupjobs.cz/DEFAULT_IMAGE/97993/00862c8b5e16a958165153c63592b5c9.jpg"" style=""width: 694px;"" class=""fr-fic fr-dib"" filename=""00862c8b5e16a958165153c63592b5c9.jpg"" originalfilename=""WhatsApp Image 2024-10-31 at 08.36.47 (1).jpeg"" url=""https://www.startupjobs.cz/download/00862c8b5e16a958165153c63592b5c9.jpg""></li></ul><p><strong>Více o LOGEXu: </strong></p><p><strong>Co můžeme nabídnout?</strong></p><ul><li>Work/life balance - flexibilní pracovní doba, home office, 25 dní dovolené, Ř&nbsp;sick days</li><li>Rozpočet na vzdělávání nebo cestování do Holandska&nbsp;</li><li>Celofiremní a týmové akce (Christmas a summer party, beers, cupping, breakfast, movie night, family day...)</li><li>Penzijní připojištění ve výši 5% měsíční mzdy</li><li>Kuchyňku a ledničku zásobenou skvělým jídlem, ovocem, zeleninou, a sladký šuplík. Spokojení u nás budou i coffee lovers.</li><li>Stravenkový paušál, volnočasové karty (multisport/pluxee)</li><li>Relaxační zónu s masážním křeslem, pravidelné lekce jógy a game room s fotbálkem</li><li>Krásné kanceláře v centru Brna na Nových sadech</li></ul><p><strong>A co říkají kluci a holky u nás?</strong></p><ul><li>Jsem tady pánem svého času.</li><li>Úkoly jsou rozdané jasně. Kdy je udělám, záleží na mně.</li><li>Všichni jsou otevření novým nápadům a myšlenkám.</li><li>Sportovec, knihomol nebo milovník deskovek? V Logexu si každý přijde na své.</li><li>Meetingy se snažíme mít věcné a stručné.</li><li>Je super, že každý má svůj vlastní rozpočet na to, v čem se chce rozvíjet.</li><li>Špilas jako na dlani, Petrov na dosah. Ten výhled z okna je prostě parádní!</li><li>Ze zásob v kuchyňce si dokážu nachystat výbornou snídani, oběd i svačinu.</li></ul><p><strong>Jaká u nás panuje atmosféra?</strong></p><ul><li id=""isPasted"">Přátelská a neformální, oslovujeme se křestními jmény.</li><li>Týmová práce je základní princip – pomáháme si navzájem a nikdo se nebojí požádat o radu.</li><li>Odreagujeme se u stolního fotbalu, hlavolamů nebo při soutěžích v crokinole. Navíc lidé v Logexu tvoří různé skupiny pro aktivity po práci – hrají hry, zpívají s kytarou nebo spolu běhají.</li><li>Tradiční jsou také obědové skupinky s tématy jako asijská, indická, italská, řecká kuchyně nebo burgerové speciality.</li><li>A samozřejmě nechybí občasné společné pivo!</li></ul><p><img src=""https://images-assets.startupjobs.cz/DEFAULT_IMAGE/97993/38e39b036bceb69ac8382cc69230cd66.png"" style=""width: 726px;"" class=""fr-fic fr-dib"" filename=""38e39b036bceb69ac8382cc69230cd66.png"" originalfilename=""1.png"" url=""https://www.startupjobs.cz/download/38e39b036bceb69ac8382cc69230cd66.png""></p><p><br></p>"
Backend Developer,Marketup s.r.o.,https://www.startupjobs.cz/nabidka/84261/backend-developer?utm_source=juniorguru&utm_medium=cpc&utm_campaign=juniorguru,True,2025-02-05 00:00:00,,cs,,,startupjobs#84261,,,,,,,,,,Praha,,,,,,,,,,,,,,,,,,,,Praha,,,,,,,,,,,,,,,,,,,,fulltime,,,,,,,,,,"<p>Aktuálně je nás v Marketupu přes 60 a stále rosteme. Práce je někdy náročná, ale nikde jinde nenajdeš tolik lidí, kteří chtějí posouvat svůj obor a být v něm nejlepší. A pokud to máš stejně, neměl/a bys tu chybět.👇</p><p><strong>Co bude&nbsp;náplní tvojí práce?</strong></p><p id=""isPasted"">Vývoj webové aplikace “Centrální mozek”&nbsp;👇</p><ul><li><p>Vyvíjíme vlastní webovou aplikaci. Backend máme řešený v Pythonu, na frontendu jsme se rozhodli pro React s Typescriptem a data z MySQL na frontend dostáváme přes GraphQL. Roadmapa nových features na následující období je nyní stanovená. Aktuálně aplikaci úspěšně vyvíjíme a adoptujeme interně u nás v Marketupu, ale do budoucna s ní chceme jít i ven.</p></li></ul><p>Budování interních microservices&nbsp;👇</p><ul><li><p>Procesy ve firmě, které se opakují, potřebujeme alespoň částečně zautomatizovat - nejčastěji se jedná o &nbsp;implementaci řešení stojící na API jednotlivých marketingových platforem i dalších nástrojů. Budeme rádi také za tvé vstupy ohledně zabezpečení webových aplikací.</p></li></ul><p>Projekty pro klienty 👇</p><ul><li><p>Klienti nás občas osloví pro intergrace systémů třetích stran, primárně k využítí datových skladů.</p></li></ul><p>Realizace vlastních nápadů a menších projektů 👇</p><ul><li><p>Každý člen týmu má na sobě rozvoj alespoň jednoho nového produktu/projektu, který si sám zvolil. Nápady vítáme a dáme ti prostor na to je realizovat.</p></li></ul><p id=""isPasted"">Co k tomu musíš znát?</p><ul><li id=""isPasted""><p>SQL&nbsp;(my používáme MySQL),&nbsp;GraphQL,&nbsp;Git, HTML, CSS,&nbsp;Python&nbsp;(nebo jiná alternativa), Typescript, Google Cloud Platform (Cloud Functions, App Engine...)</p></li><li><p>Zkušenost s vývojem komplexnější webové aplikace.</p></li><li><p>Baví tě objevování nových technologií, jako jsou AI, cloudové platformy apod.</p></li><li><p>Samostatnost a vlastní motor učit se nové věci.</p></li><li><p>Agilní způsob realizace projektů.</p></li><li><p>Kritické myšlení a selský rozum.</p></li></ul><p>Nice to have</p><ul><li><p>Zkušenost s GitHub Copilot a DevOps nástroji a procesy; schopnost vývoje s využitím Reactu (TypeScriptu, Next.js).</p></li></ul><p><strong>A co ti&nbsp;můžeme nabídnout my?</strong></p><ul id=""isPasted""><li><p>Nabídneme ti jak stabilní&nbsp;dlouhodobé projekty,&nbsp;tak dynamické&nbsp;krátkodobé projekty.</p></li><li><p>Budeš u nás patřit do sekce R&amp;D, kde nejsme přehlceni velkým množstvím klientských projektů. Každý den však budeš zapojen do interních procesů, kde budeš mít volnou ruku co se týče realizace, ale zároveň zodpovědnost za doručené výsledky.</p></li><li><p>Budeme investovat do tvého rozvoje a vzdělávání, k dispozici budeš mít&nbsp;seniorní lidi&nbsp;na externí konzultace.</p></li><li><p>Pravidelně se budeme zajímat o to,&nbsp;co tě baví&nbsp;a jakým směrem se chceš profilovat.</p></li><li><p>Dáme ti svobodu a flexibilitu, kterou potřebuješ pro to, aby se ti pracovalo, co možná nejlépe.</p></li></ul><p><strong>Jak vypadá Data&amp;Tech tým v Marketupu</strong></p><ul id=""isPasted""><li><p>Oddělení Product v Marketup je tým aktuálně složený ze 4 specialistů s různou mírou seniority a zkušeností. Úzce spolupracujeme i s ostatními kolegy v Datově technologickém oddělení, dohromady je nás 10. Najdeš u nás koncentrované know-how z oblasti technologií, webové a datové analytiky, optimalizace webu, automatizace a reportingu.</p></li><li><p>Řešíme výzvy na straně klientů a i u nás v Marketupu.</p></li><li><p>Pracujeme s technologiemi Python, GraphQL, MySQL, BigQuery, Typescript, React a další. Společně stavíme technologické řešení pro Marketup a datové nástroje pro naše klienty na technologiích Google Cloud Platform.</p></li></ul>"
Junior FE Developer / Integrations Specialist,Luigi's Box,https://www.startupjobs.cz/nabidka/87613/junior-fe-developer-integrations-specialist?utm_source=juniorguru&utm_medium=cpc&utm_campaign=juniorguru,True,2025-02-04 00:00:00,,en,,,startupjobs#87613,,,,,,,,,,Bratislava,Praha,Brno,Hradec Králové,Plzeň,Pardubice,Žilina,Banská Bystrica,Nitra,Trnava,,,,,,,,,,,Bratislava,Praha,Brno,Hradec Králové,Plzeň,Pardubice,Žilina,Banská Bystrica,Nitra,Trnava,,,,,,,,,,,fulltime,,,,,,,,,,"<p id=""isPasted""><strong>🔍 Who is Luigi’s Box?</strong><br>At Luigi’s Box, we’re transforming e-commerce with smarter, faster, and more personalized shopping experiences.</p><p>Our AI-powered search &amp; discovery suite includes four main solutions—Search, Analytics, Recommender, and Product Listing—that empower over 3,000 online stores to help their customers find exactly what they’re looking for. Think big names like Alza, Notino, Benu, O2, Acer, Under Armour, and more. 🛍️</p><p>We’re already working with half of the e-shops in the Czech and Slovak markets, and are growing fast in Poland, DACH, the UK, and beyond.As we scale, we’re looking for a talented&nbsp;Junior Frontend Developer / Integrations Specialist&nbsp;to help our clients integrate our solutions seamlessly. 🗺️</p><p><strong>🧑‍💻 About the Role</strong><br>As a Junior Frontend Developer / Integrations Specialist, you will play a key role in ensuring our clients successfully integrate Luigi’s Box products into their e-shops. You’ll work closely with customers, providing technical guidance and support while leveraging your frontend development skills to ensure smooth integration.</p><p><strong>Your responsibilities will include:</strong></p><ul data-spread=""false""><li><p>Implementing Luigi’s Box products into client websites, ensuring seamless integration.</p></li><li><p>Frontend programming in&nbsp;HTML, CSS, JavaScript, and Vue.js&nbsp;(70-80% of the time).</p></li><li><p>Communicating with clients via email and phone to assist with integrations (20-30% of the time).</p></li><li><p>Processing and validating XML or CSV data files using our internal tools.</p></li><li><p>Styling interfaces to match client websites, handling previews, and responding to client requests.</p></li><li><p>Acting as a bridge between technical specifics and client needs.</p></li></ul><p><strong>💻 Tech You’ll Work With</strong></p><ul data-spread=""false""><li><p>Frontend:&nbsp;HTML, CSS, JavaScript, Vue.js</p></li><li><p>Data Processing:&nbsp;XML, CSV</p></li><li><p>Internal Tools:&nbsp;Luigi’s Box integration tools</p></li></ul><p><strong>💫 What Makes You a Great FitMust-haves:</strong></p><ul data-spread=""false""><li><p>Basic knowledge of&nbsp;HTML, CSS, JavaScript, and Vue.js.</p></li><li><p>Ability to write clear, structured emails and explain technical concepts professionally.</p></li><li><p>Strong problem-solving skills and a&nbsp;proactive, client-oriented approach.</p></li><li><p>Self-organization and the ability to prioritize tasks effectively.</p></li></ul><p><strong>Nice-to-haves:</strong></p><ul data-spread=""false""><li><p>Previous experience in frontend development or integrations.</p></li><li><p>Experience working with XML or CSV data.</p></li><li><p>A GitHub portfolio or links to relevant projects.</p></li></ul><p><strong>🥳 What’s in It for You?</strong></p><ul data-spread=""false""><li><p>Flexible working hours&nbsp;to help you create the perfect work-life balance.</p></li><li><p>Hybrid &amp; remote work options&nbsp;– join us in Bratislava or Prague, or work remotely.</p></li><li><p>Regular company events and team-building activities&nbsp;to stay connected.</p></li><li><p>A chance to be part of a growing, innovative company&nbsp;shaping the future of e-commerce.</p></li><li><p>A collaborative environment&nbsp;built on trust, transparency, and open communication.</p></li><li><p>A flat structure&nbsp;– work in smaller, agile teams with minimal bureaucracy.</p></li><li><p>Paid time off &amp; sick days.</p></li><li><p>Competitive pay&nbsp;that reflects your skills and experience.</p></li><li style=""font-weight: bold;""><p><strong>Perks &amp; benefits:</strong></p><ul data-spread=""false"" style=""font-weight: initial;""><li><p>💻&nbsp;Hardware contribution</p></li><li><p>🧘&nbsp;MultiSport card (CZ/SK only) or well-being contribution</p></li><li><p>📚&nbsp;Self-development allowance</p></li><li><p>🥞&nbsp;Team breakfasts</p></li><li><p>☕&nbsp;Office refreshments</p></li><li><p>🍼&nbsp;Parental benefits</p></li><li><p>🎂&nbsp;Birthday surprise</p></li><li><p>🎉&nbsp;And more!</p></li></ul></li></ul><p><strong>🤝 Meet Your Team</strong><br>Luigi’s Box is a fast-growing scale-up in the booming SaaS industry, specializing in cutting-edge solutions for site search &amp; product discovery. With an international team of around 120 experts spanning 10+ countries, we bring deep expertise and passion to everything we do.</p><p>You’ll join our&nbsp;Integrations team, working closely with talented developers and client-facing professionals to deliver the best possible experience for our customers.</p><p>🩵&nbsp;Ready to Join?<br>Join Luigi’s Box and help us continue to shape the future of e-commerce.</p><p><strong>What to Expect Next:</strong></p><p>1️⃣ Introductory call with one of our Talent Partners (online).<br>2️⃣ Interview for the role with the&nbsp;Hiring Manager (online).<br>3️⃣ Technical round &amp; meet the team (online).<br>4️⃣&nbsp;Offer 🎉</p>"
Webflow Developer  (part-time),MeguMethod,https://www.startupjobs.cz/nabidka/87597/webflow-developer-part-time?utm_source=juniorguru&utm_medium=cpc&utm_campaign=juniorguru,False,2025-02-04 00:00:00,,cs,,,startupjobs#87597,,,,,,,,,,Praha,,,,,,,,,,,,,,,,,,,,Praha,,,,,,,,,,,,,,,,,,,,internship,parttime,,,,,,,,,"<p id=""isPasted"">Jsme technologické a inovační studio se startupovým mindsetem. Pro naše klienty designujeme a vyvíjíme digitální produkty, převážně mobilní a webové aplikace. Vytváříme produkty, které uživatelé rádi používají, jsou pro ně užitečné a našim klientům tak dávají požadovanou hodnotu.</p><p>Část jednoho z našich projektů spočívá v kontinuálním vývoji klientského webu na platformě Webflow, kde potřebujeme doplnit kapacity.&nbsp;</p><p><img src=""https://images-assets.startupjobs.cz/DEFAULT_IMAGE/286904/427be26be9eccb9278d6852449ced392.jpg"" style=""width: 726px;"" class=""fr-fic fr-dib"" filename=""427be26be9eccb9278d6852449ced392.jpg"" originalfilename=""20241009-DSCF1005 Large.jpeg"" url=""https://www.startupjobs.cz/download/427be26be9eccb9278d6852449ced392.jpg""></p><p><strong>Je to spolupráce na pár dnů v týdnu a je vhodná například pro studenty vyšších ročníků vysokých škol, kteří mají s Webflow už nějaké zkušenosti.&nbsp;</strong></p><p><strong>🕖 Časová náročnost:</strong> cca 10-15 hodin týdně</p><h3>👉 Co budeš dělat?</h3><p>Hlavní náplň práce spočívá ve vytváření a úpravách webových stránek našeho klienta na platformě Webflow podle předem připraveného designu tak, aby funkčnost odpovídala potřebám uživatele a projektu.&nbsp;</p><ul><li>Budeš mít backlog tasků, podle kterého budeš implementovat webové prvky, tak aby byly přehledné a funkční.</li><li>Důležitá je responsivita webu, takže budeš mít na starosti optimalizaci webových stránek pro různá zařízení (mobil, tablet, desktop).</li><li>Když nastane technický problém, budeš první, kdo se ho pokusí vyřešit. Budeš mít ale vždycky po ruce další kolegy nebo kolegyně, kteří ti pomohou, když se ti to nebude dařit.&nbsp;</li><li>Funkčnost implementovaných prvků a řešení otestuješ a případně navrhneš vylepšení tak, aby uživatelská zkušenost byla co nejlepší.</li><li>Jedenkrát týdně budeš mít pravidelný sync meeting s naším projekťákem a klientem, kde si budete určovat priority a práci na další týden.</li></ul><h3>👉 Jak si tě představujeme?</h3><ul><li>Už za sebou máš pár projektů / práce ve Webflow, kterou nám můžeš ukázat a popsat, jaký byl tvůj přínos.</li><li>Umíš nést zodpovědnost za dodaný výstup – děláš to nejlepší, co umíš a když se něco pokazí, snažíš se najít řešení problému.&nbsp;</li><li>Pracuješ pečlivě. Chceš, aby tvůj výstup obstál a klient byl s výsledkem spokojený.&nbsp;</li><li>Jsi komunikativní. Na schůzkách nemáš problém mluvit o tom, na čem pracuješ, vysvětlit uvažovaní nad tvou prací nebo navrhnout změny a zlepšení.</li></ul><h3>👉 Co ti můžeme nabídnout?</h3><ul><li>Otevřená a přátelská atmosféra v celé firmě (na pozice si moc nepotrpíme, bavíme se všichni otevřeně a neformálně, náš CEO třeba nedávno uspořádal workshop vaření pro celou firmu);</li><li>Flexibilní pracovní hodiny a home office podle domluvy;</li><li>Týmové aktivity a eventy – rádi hrajeme deskovky, v létě zajdeme na pivo / limču na zahrádku do AVU nebo jedeme na pár dní do přírody utužovat vztahy;</li><li>Lekce angličtiny s rodilým mluvčím;</li><li>Dog friendly kanceláře na Letné – máme tu gaučíky, kde běžně odpočíváme a v okolí dostatek podniků a kaváren;</li><li>Multisportku;</li><li>Kafe, čaje, limonády a snacky v officu.</li></ul><p><strong>Zaujalo tě to? 💜 Pošli nám životopis nebo Linkedin společně s pár větami o tom, co tě na nabídce zaujalo a odkazem na web, kde jsi na svoji práci ve Webflow nejvíce hrdý/hrdá.</strong>&nbsp;</p><h3>📬 Jak to pak bude probíhat?</h3><ol><li><strong>Screening call.&nbsp;</strong>Nejdřív si s tebou domluví krátký call naše People &amp; Culture Officerka Peťa Fritsch a pobavíte se o základech pozice, tvé motivaci, plánech a firemní kultuře.&nbsp;</li><li><strong>Interview.&nbsp;</strong>Pak tě pozveme k nám na Letnou na limču nebo kafe. Setkáš se se Speedym (Product Lead) a po druhé s Peťou. Možná se připojí i Anička, která na projektu pracuje teď.&nbsp;Ukážeš nám svou dosavadní práci. </li><li><strong>Final call</strong> si pak dáš s naším CEO Vráťou Zimou, který ti nasdílí vnímání firmy z role foundera.&nbsp;</li></ol><p>A to je vše! Budeme se těšit, až se&nbsp;poznáme.</p>"
