title,company_name,url,remote,first_seen_at,last_seen_at,lang,juniority_score,source,external_ids_0,external_ids_1,external_ids_2,external_ids_3,external_ids_4,external_ids_5,external_ids_6,external_ids_7,external_ids_8,external_ids_9,locations_0_name,locations_1_name,locations_2_name,locations_3_name,locations_4_name,locations_5_name,locations_6_name,locations_7_name,locations_8_name,locations_9_name,locations_10_name,locations_11_name,locations_12_name,locations_13_name,locations_14_name,locations_15_name,locations_16_name,locations_17_name,locations_18_name,locations_19_name,locations_0_region,locations_1_region,locations_2_region,locations_3_region,locations_4_region,locations_5_region,locations_6_region,locations_7_region,locations_8_region,locations_9_region,locations_10_region,locations_11_region,locations_12_region,locations_13_region,locations_14_region,locations_15_region,locations_16_region,locations_17_region,locations_18_region,locations_19_region,employment_types_0,employment_types_1,employment_types_2,employment_types_3,employment_types_4,employment_types_5,employment_types_6,employment_types_7,employment_types_8,employment_types_9,description_html
Projektový administrátor a tester pro e-commerce,SANITINO s.r.o.,https://www.jobs.cz/rpd/2000804001/,False,2025-10-30 00:00:00,,cs,,,jobscz#2000804001,,,,,,,,,,Litomyšl,Litomyšl,,,,,,,,,,,,,,,,,,,Pardubice,Pardubice,,,,,,,,,,,,,,,,,,,fulltime,,,,,,,,,,"<div data-jobad=""body"" data-test=""jd-body-richtext"" class=""RichContent mb-1400""><p class=""typography-body-medium-text-regular text-secondary mb-600"">Pracovní nabídka</p><p class=""typography-body-large-text-regular mb-800"">Přidejte se k nám, pokud Vás baví přemýšlet v souvislostech a pracovat s technologiemi, které mají reálný dopad. Od testování webů po integrace systémů.</p><p class=""typography-body-large-text-regular mb-800"">📍 Litomyšl / on-site / e-commerce</p><p class=""typography-body-large-text-regular mb-800""><br> Hledáme technicky a obchodně smýšlejícího člověka, který se chce stát pravou rukou projektového manažera a podílet se na rozvoji a řízení IT projektů v e-commerce prostředí.</p><p class=""typography-body-large-text-regular mb-800"">Člověka, který chápe, že každý klik v systému má svůj důvod. Který vidí nedokonalosti v procesech a případně se nebojí nahlédnout do kódu. A který chce vidět reálné výsledky své práce – vylepšený e-shop, zrychlené integrace, funkční automatizace, zdokonalené uživatelské zkušenosti.</p><p class=""typography-body-large-text-regular mb-800"">Podle Vašich schopností se můžete profilovat třemi směry:</p><p class=""typography-body-large-text-regular mb-800"">👉 projektová oblast – koordinace IT dodavatelů, plánování, reporting, komunikace<br> 👉 vývojová oblast – práce se systémy, automatizace, testování, samotný vývoj a kódování<br> 👉 oblast testování a analýzy – ověřování webových funkcí, testování, zlepšování kvality dat, práce s různými zařízeními a technologiemi</p><p class=""typography-body-large-text-regular mb-800""><strong>Jaké pracovní výzvy Vás čekají:</strong></p><ul class=""typography-body-large-text-regular""><li>Podpora projektového manažera při realizaci IT a e-commerce projektů</li><li>Koordinace externích dodavatelů a vývojářských týmů</li><li>Spolupráce na integracích mezi systémy (ERP, e-shop, nákupní systémy aj.)</li><li>Testování webů, nových funkcionalit a systémových napojení</li><li>Evidence chyb, příprava přehledů a komunikace s IT dodavateli</li><li>Analýza a optimalizace procesů, reporting vedení</li></ul><p class=""typography-body-large-text-regular mb-800""><br><strong>Co by Vám nemělo chybět:</strong></p><ul class=""typography-body-large-text-regular""><li>Orientace nebo zájem o IT prostředí a nástroje pro řízení projektů (např. Jira)</li><li>Zkušenost s testováním webových funkcionalit nebo e-shop systémů výhodou</li><li>Analytické a procesní myšlení - myslet o krok dále</li><li>Dobrá znalost anglického jazyka</li><li>Proaktivní a zodpovědný přístup</li><li>Ochota učit se a dotahovat věci do konce</li></ul><p class=""typography-body-large-text-regular mb-800""><br><strong>Na co se můžete těšit:</strong></p><ul class=""typography-body-large-text-regular""><li>Spolupráci s projektovým manažerem a vedením společnosti</li><li>Přístup k moderním AI nástrojům a testovacím prostředím</li><li>Školení v oblastech automatizace, datové analýzy a testování</li><li>Možnost profesního růstu – směrem k projektovému řízení, testování nebo vývoji</li><li>Žádná korporátní omezení</li><li>25 dní dovolené</li><li>Příspěvek na stravování 80 Kč/směna</li><li>Jazykové kurzy, posilovna a sauna</li><li>Zaměstnanecké slevy na celý sortiment</li><li>ad.</li></ul><p class=""typography-body-large-text-regular mb-800""><br>📨 Zní to jako práce pro Vás?</p><p class=""typography-body-large-text-regular mb-800""><br>Pošlete nám krátkou zprávu a svůj profil. Více než dokonalé CV nás zajímá váš přístup, způsob uvažování a chuť rozvíjet se v oblasti IT a projektového řízení.</p></div>"
Tester ERP systému IS KARAT,KARAT Software a.s.,https://www.jobs.cz/rpd/2000491947/,False,2025-10-30 00:00:00,,cs,,,jobscz#2000491947,,,,,,,,,,Přerov,Přerov,,,,,,,,,,,,,,,,,,,Olomouc,Olomouc,,,,,,,,,,,,,,,,,,,fulltime,,,,,,,,,,"<div data-jobad=""body"" data-test=""jd-body-richtext"" class=""RichContent mb-1400""><p class=""typography-body-medium-text-regular text-secondary mb-600"">Pracovní nabídka</p><p class=""typography-body-large-text-regular mb-800""><strong>Hledáme parťáka do týmu testerů!</strong></p><p class=""typography-body-large-text-regular mb-800""><strong>Proč my</strong></p><ul class=""typography-body-large-text-regular""><li>Jsme česká firma, která má drive</li><li>Máme přes 850 spokojených zákazníků (a pořád rosteme!)</li><li>Nejsme korporát - jsme parta lidí, co se v práci i zasměje</li><li>Děláme věci, které mají smysl</li></ul><p class=""typography-body-large-text-regular mb-800""><strong>Co u nás budeš dělat</strong></p><p class=""typography-body-large-text-regular mb-800"">Budeš náš systémový detektiv! Tvým úkolem bude:</p><ul class=""typography-body-large-text-regular""><li>Proklepnout každý kout našeho systému a najít případné mouchy</li><li>Spolupracovat s našimi vývojáři na tom, jak udělat IS KARAT ještě lepší</li><li>Testovat a debuggovat systém IS KARAT v prostředí Visual Studia</li><li>Přicházet s nápady, jak věci dělat jinak a lépe</li></ul><p class=""typography-body-large-text-regular mb-800""><strong>Co by se ti mohlo hodit</strong></p><ul class=""typography-body-large-text-regular""><li>Znalost C#, SQL , TypeScript nebo webových technologií</li><li>Oko pro detail a logické myšlení</li><li>Chuť být součástí týmu, kde jeden druhému pomáhá</li></ul><p class=""typography-body-large-text-regular mb-800""><strong>Co ti za to nabídneme</strong></p><ul class=""typography-body-large-text-regular""><li>Svobodu v práci – flexibilní pracovní doba a možnost občasné práce z domova</li><li>Prostor pro růst – máme rádi lidi, co se chtějí posouvat dál</li><li>Skvělou partu – nejsme jen kolegové, jsme tým</li><li>Smysluplnou práci – přispěješ k dalšímu rozvoji systému díky tvé konstruktivní zpětné vazbě</li></ul><p class=""typography-body-large-text-regular mb-800""><strong>Jak to u nás chodí</strong></p><p class=""typography-body-large-text-regular mb-800"">Nejdřív si nezávazně popovídáme (klidně u dobré kávy ), poznáme se a zjistíme, jestli si sedíme. Žádné složité pohovory – jde nám o tvoje nápady a přístup, nejen o položky v životopise.</p><p class=""typography-body-large-text-regular mb-800"">Tak se ozvi! Rádi ti ukážeme, jak to u nás chodí, a popovídáme si o tom, co od práce očekáváš ty.</p></div>"
Backend Developer (Python/C#/Golang),Exact Control System a.s.,https://www.jobs.cz/rpd/2000833664/,False,2025-10-30 00:00:00,,cs,,,jobscz#2000833664,,,,,,,,,,Roztoky,Roztoky,,,,,,,,,,,,,,,,,,,Praha,Praha,,,,,,,,,,,,,,,,,,,fulltime,,,,,,,,,,"<div data-jobad=""body"" data-test=""jd-body-richtext"" class=""RichContent mb-1400""><p class=""typography-body-medium-text-regular text-secondary mb-600"">Pracovní nabídka</p><p class=""typography-body-large-text-regular mb-800""><strong>O nás</strong></p><p class=""typography-body-large-text-regular mb-800"">Exact Control System vyvíjí automatizované řešení pro 3D frézování a pokládku vozovek při rekonstrukcích dopravních staveb. Nabízíme unikátní systém pro řízení silničních fréz Wirtgen a finišerů Vögele spojený s platformou pro sběr a zpracování dat z terénu.</p><p class=""typography-body-large-text-regular mb-800"">Jsme součástí Precio Group (https://preciogroup.se) – švédské skupiny specializující se na digitalizaci stavebnictví.</p><p class=""typography-body-large-text-regular mb-800"">Naše mise je jasná: vytvářet intuitivní software s maximální automatizací pomocí pokročilých algoritmů. Na vývoji vlastního hardware spolupracujeme s firmou Ryston, matematické modely konzultujeme s ÚTIA Akademie věd ČR. Před dvěma lety jsme získali prestižní grant od ESA (European Space Agency). Naše řešení používají zákazníci v ČR, Švédsku a Kanadě.</p><p class=""typography-body-large-text-regular mb-800"">Aktuálně hledáme nového člena týmu na pozici</p><h2 class=""typography-heading-small-text""><strong>Backend Developer (Python/C#/Golang) - </strong>Junior až Mid-level pozice</h2><p class=""typography-body-large-text-regular mb-800""><strong>Co budeš dělat:</strong></p><ul class=""typography-body-large-text-regular""><li>Vývoj backendových microservices v <strong>Pythonu</strong> běžících v Kubernetes clusteru na Azure</li></ul><ul class=""typography-body-large-text-regular""><li>Práce na cloud platformě pro sběr, zpracování a vizualizaci dat z machine control systémů</li></ul><ul class=""typography-body-large-text-regular""><li>Integrace s aplikacemi pro řízení stavebních strojů (silniční frézy Wirtgen, finišery Vögele) a externími systémy</li></ul><ul class=""typography-body-large-text-regular""><li>Návrh API a datových modelů pro real-time komunikaci se stroji v terénu</li></ul><ul class=""typography-body-large-text-regular""><li>Implementace automatizovaných algoritmů pro optimalizaci 3D frézování a pokládky vozovek</li></ul><ul class=""typography-body-large-text-regular""><li>Zpracování dat z GNSS navigace a dalších senzorů používaných v machine control</li></ul><ul class=""typography-body-large-text-regular""><li>Podíl na celém životním cyklu: od návrhu řešení přes implementaci až po deployment, monitoring a testování</li></ul><ul class=""typography-body-large-text-regular""><li>Spolupráce s hardwarovým týmem Ryston na integraci embedded systémů a senzorů</li></ul><p class=""typography-body-large-text-regular mb-800""><strong>Náš tech stack:</strong></p><p class=""typography-body-large-text-regular mb-800""><strong>Backend</strong>: Python (FastAPI), C#, C++, Golang, Node.js<br> <strong>Frontend</strong>: React, TypeScript, Next.js, Vite, Tailwind CSS<br> <strong>Messaging</strong> <strong>&amp; Data</strong>: RabbitMQ, MongoDB<br> <strong>DevOps</strong>: GitLab CI/CD, Docker, Kubernetes (AKS), Sentry<br> <strong>Testing</strong>: Cypress, pytest<br> <strong>Collaboration</strong>: Jira, Slack, MS Teams</p><p class=""typography-body-large-text-regular mb-800""><strong>Architektura</strong>: Microservices v Kubernetes, event-driven komunikace, REST API &amp; WebSockets</p><p class=""typography-body-large-text-regular mb-800""><strong>Co od tebe očekáváme</strong></p><p class=""typography-body-large-text-regular mb-800""><strong>Must have:</strong></p><ul class=""typography-body-large-text-regular""><li>Zkušenost s vývojem backendových aplikací v <strong>Pythonu</strong> (minimálně 1 rok nebo silné portfolio projektů)</li></ul><ul class=""typography-body-large-text-regular""><li>Základní znalost principů <strong>REST API</strong> a HTTP protokolu</li></ul><ul class=""typography-body-large-text-regular""><li>Praktická zkušenost s <strong>Gitem</strong> (branches, commits, základy code review)</li></ul><ul class=""typography-body-large-text-regular""><li>Orientace v <strong>Docker kontejnerech</strong> (alespoň základy)</li></ul><ul class=""typography-body-large-text-regular""><li>Povědomí o <strong>automatizovaném testování</strong></li></ul><ul class=""typography-body-large-text-regular""><li>Základní znalost databází (SQL nebo NoSQL)</li></ul><ul class=""typography-body-large-text-regular""><li>Dobrá angličtina (čtení dokumentace)</li></ul><ul class=""typography-body-large-text-regular""><li>Pro juniory: Chuť učit se, proaktivní přístup a zájem o machine control / embedded systémy</li></ul><p class=""typography-body-large-text-regular mb-800""><strong>Nice to have:</strong></p><ul class=""typography-body-large-text-regular""><li>Zkušenost s <strong>FastAPI</strong> nebo podobným Python frameworkem</li></ul><ul class=""typography-body-large-text-regular""><li>Znalost <strong>C# nebo Golang</strong></li></ul><ul class=""typography-body-large-text-regular""><li>Povědomí o <strong>GNSS navigačních systémech</strong> a principech satelitní navigace</li></ul><ul class=""typography-body-large-text-regular""><li>Orientace v <strong>senzorech používaných v machine control</strong> (IMU, inklinometry, laserové skenery)</li></ul><ul class=""typography-body-large-text-regular""><li>Zkušenost s <strong>microservice architekturou</strong></li></ul><ul class=""typography-body-large-text-regular""><li>Práce s <strong>Kubernetes</strong> a cloud platformami (Azure, AWS)</li></ul><ul class=""typography-body-large-text-regular""><li>Znalost message queue systémů (RabbitMQ, Kafka)</li></ul><ul class=""typography-body-large-text-regular""><li>Práce s <strong>real-time daty</strong> a zpracováním signálů ze senzorů</li></ul><ul class=""typography-body-large-text-regular""><li>Zkušenost s <strong>MongoDB</strong></li></ul><ul class=""typography-body-large-text-regular""><li>Zkušenost s <strong>CI/CD</strong> pipelines</li></ul><p class=""typography-body-large-text-regular mb-800""><strong>Osobnostní vlastnosti:</strong></p><ul class=""typography-body-large-text-regular""><li>Spolehlivost a zodpovědnost k práci</li></ul><ul class=""typography-body-large-text-regular""><li><strong>Silná chuť učit se</strong> nové technologie a postupy</li></ul><ul class=""typography-body-large-text-regular""><li>Schopnost pracovat samostatně i v týmu</li></ul><ul class=""typography-body-large-text-regular""><li>Proaktivní přístup k řešení problémů</li></ul><ul class=""typography-body-large-text-regular""><li>Nebojíš se zeptat, když něčemu nerozumíš</li></ul><ul class=""typography-body-large-text-regular""><li>Pro juniory: Oceníme nadšení pro technologie a ochotu růst</li></ul><p class=""typography-body-large-text-regular mb-800""><strong>Co nabízíme</strong></p><p class=""typography-body-large-text-regular mb-800""><strong>Práce na zajímavém projektu:</strong></p><ul class=""typography-body-large-text-regular""><li>Podíl na vývoji <strong>machine control systémů</strong> s podporou ESA a spolupráce s Akademií věd</li></ul><ul class=""typography-body-large-text-regular""><li>Práce s moderními technologiemi v oblasti <strong>automatizace stavebních strojů</strong>, cloud computingu a strojového učení</li></ul><ul class=""typography-body-large-text-regular""><li>Zpracování dat z <strong>GNSS navigace a přesných senzorů</strong> pro autonomní řízení</li></ul><ul class=""typography-body-large-text-regular""><li>Reálný dopad tvé práce na projekty v ČR, Švédsku a Kanadě</li></ul><p class=""typography-body-large-text-regular mb-800""><strong>Pracovní podmínky a benefity:</strong></p><ul class=""typography-body-large-text-regular""><li><strong>Flexibilní pracovní doba</strong> - home office 2 dny v týdnu</li></ul><ul class=""typography-body-large-text-regular""><li>Kancelář v <strong>Roztokách u Prahy</strong></li></ul><ul class=""typography-body-large-text-regular""><li>Rozpočet na vzdělávání (kurzy, konference, certifikace, knihy)</li></ul><ul class=""typography-body-large-text-regular""><li>Teambuildingy a firemní akce</li></ul><ul class=""typography-body-large-text-regular""><li>Možnost podílet se na výzkumných projektech</li></ul><ul class=""typography-body-large-text-regular""><li>Pro juniory: Strukturovaný onboarding a růstový plán</li></ul><p class=""typography-body-large-text-regular mb-800""><strong>Tým a kultura:</strong></p><ul class=""typography-body-large-text-regular""><li><strong>Malý, sehraný tým</strong> – aktuálně 3 lidé v R&amp;D, každý má významný dopad</li></ul><ul class=""typography-body-large-text-regular""><li><strong>Mentoring a rozvoj</strong> – jako junior dostaneš podporu od zkušenějších kolegů</li></ul><ul class=""typography-body-large-text-regular""><li>Přímá komunikace, plochá hierarchie</li></ul><ul class=""typography-body-large-text-regular""><li>Pravidelné code review a pair programming – ideální pro učení</li></ul><ul class=""typography-body-large-text-regular""><li>Prostor pro vlastní nápady a iniciativu – tvůj hlas bude slyšet</li></ul><ul class=""typography-body-large-text-regular""><li>Kontinuální feedback a možnost růstu</li></ul><ul class=""typography-body-large-text-regular""><li>Podpora z mezinárodní skupiny Precio Group</li></ul><p class=""typography-body-large-text-regular mb-800""><strong>Jak se přihlásit:</strong></p><ul class=""typography-body-large-text-regular""><li>Pošli nám své CV a pár vět o tom, proč tě projekt zaujal. Co nejdříve se ozveme!</li></ul><ul class=""typography-body-large-text-regular""><li>Pro juniory: Rádi uvidíme tvé projekty (GitHub/GitLab), školní práce nebo cokoliv, co ukazuje tvůj zájem o programování. Nemusíš mít roky praxe – důležitější je tvé nadšení a chuť učit se!</li></ul><ul class=""typography-body-large-text-regular""><li>Pro zkušenější: Zajímají nás tvé zajímavé projekty nebo technické výzvy, které jsi řešil/a.</li></ul><p class=""typography-body-large-text-regular mb-800"">Více o nás: www.teamexact.cz</p></div>"
(QA) Test analytik/tester,"CENDIS, s.p.",https://www.jobs.cz/rpd/2000805987/,False,2025-10-30 00:00:00,,cs,,,jobscz#2000805987,,,,,,,,,,Praha,Praha,,,,,,,,,,,,,,,,,,,Praha,Praha,,,,,,,,,,,,,,,,,,,fulltime,,,,,,,,,,"<div data-jobad=""body"" data-test=""jd-body-richtext"" class=""RichContent mb-1400""><p class=""typography-body-medium-text-regular text-secondary mb-600"">Pracovní nabídka</p><h2 class=""typography-heading-small-text"">Co bude náplní Tvé práce?</h2><ul class=""typography-body-large-text-regular""><li>Manuální testování,</li><li>příprava a provádění systémových integrovaných testů,</li><li>identifikace a prioritizace softwarových chyb,</li><li>psaní a údržba automatických testů v jazycích JavaScript, Python s využitím frameworku Cypress,</li><li>práce v nástroji Postman,</li><li>správa a exekuce testů v Zephyru,</li><li>reportování chyb v systému JIRA,</li><li>týmová spolupráce na přípravě testovacích scénářů a strategie celého QA týmu,</li><li>aktivně spolupracovat s architekty, analytiky, vývojáři a ostatními testery,</li><li>každodenní zdokonalování se v automatizaci a testování BE.</li></ul><h2 class=""typography-heading-small-text"">Bez čeho se neobejdeš?</h2><ul class=""typography-body-large-text-regular""><li>Velmi dobré analytické a technické myšlení,</li><li>dobrá znalost MS Office (Word, Excel),</li><li>znalost SQL,</li><li>znalost Dev tools (nástroje pro vývojáře) ve webových prohlížečích,</li><li>znalost programovacích a skriptovacích jazyků (JavaScript, Python),</li><li>znalost principů vývoje software,</li><li>všeobecné znalosti v oblasti IT technologií,</li><li>chuť učit se novým věcem, pečlivost, spolehlivost a zodpovědnost.</li></ul><h2 class=""typography-heading-small-text"">Co by bylo ještě fajn mít?</h2><ul class=""typography-body-large-text-regular""><li>Znalost alespoň jednoho frameworku - Cypress,</li><li>znalost principů agilního vývoje (SCRUM),</li><li>znalost nástroje JIRA, Zephyr a Confluence,</li><li>znalost a využití AI.</li></ul><h2 class=""typography-heading-small-text"">Co Ti nabídneme?</h2><ul class=""typography-body-large-text-regular""><li>Práci, která dává smysl a má reálný dopad na každodenní život mnoha lidí,</li><li>prostor pro seberealizaci a získání nových zkušeností,</li><li>možnost částečné práce z domova,</li><li>individuální rozvržení pracovní doby,</li><li>práci v mladém kolektivu,</li><li>příjemnou atmosféru v přátelském prostředí,</li><li>skvělou firemní kulturu,</li><li>mobilní telefon a notebook,</li><li>příspěvek na penzijní připojištění,</li><li>příspěvek na stravování,</li><li>dovolená 5 týdnů, 5 sickdays a další velmi zajímavé benefity,</li><li>firemní akce a teambuildings.</li></ul><h2 class=""typography-heading-small-text"">Chceš se k nám přidat?</h2><ul class=""typography-body-large-text-regular""><li>Pak nám pošli odpověď a CV prostřednictvím tohoto portálu nebo zavolej na uvedené telefonní číslo.</li><li>Těšíme se na Tebe!</li></ul></div>"
