BACKEN ULL STACK VÝVOJÁŘ,JISTU recruitment s.r.o.,https://www.jobs.cz/rpd/2001011008/?utm_source=juniorguru,False,2026-03-20 00:00:00,,cs,,,jobscz#2001011008,,,,,,,,,,Praha,,,,,,,,,,,,,,,,,,,,Praha,,,,,,,,,,,,,,,,,,,,fulltime,,,,,,,,,,"<div data-jobad=""body"" data-test=""jd-body-richtext"" class=""RichContent mb-1400""><p class=""typography-body-medium-text-regular text-secondary mb-600"">Pracovní nabídka</p><p class=""typography-body-large-text-regular mb-800""><strong>Náplň práce:</strong></p><ul class=""typography-body-large-text-regular""><li>Vývoj backendové (případně full-stack) části webových a desktopových aplikací</li><li>Spolupráce na aplikacích navázaných na embedded produkty</li><li>Práce s databázemi (SQL – MariaDB)</li><li>Automatizace interních procesů (web scraping, data mining, workflow)</li><li>Spolupráce v menším vývojovém týmu (backend, embedded, HW)</li><li>Postupné zapojení do návrhu řešení a architektury dle zkušeností</li><li>Možnost rozvoje směrem k mobilním aplikacím, DevOps nebo AI automatizaci</li></ul><p class=""typography-body-large-text-regular mb-800""><strong>Požadujeme:</strong></p><ul class=""typography-body-large-text-regular""><li>Technické vzdělání (min. Bc.) nebo odpovídající praktické zkušenosti</li><li>Základní až středně pokročilé zkušenosti s backend vývojem</li><li>(např. školní / vlastní projekty, komerční praxe výhodou)</li><li>Zkušenost s vývojem webových nebo desktopových aplikací</li><li>Základní orientaci v SQL databázích (dotazy, práce s daty)</li><li>Základní znalost C++ (orientace v kódu, menší úpravy)</li><li>Chuť učit se nové technologie a zlepšovat se</li><li>Schopnost pracovat samostatně i v týmu</li></ul><p class=""typography-body-large-text-regular mb-800""><strong>Výhodou (není nutností)</strong></p><ul class=""typography-body-large-text-regular""><li>Zkušenosti s Dockerem, Kubernetes nebo OTA službami</li><li>Zkušenost s web scrapingem nebo data miningem</li><li>Základy Linuxu, bash skriptování, cron / Airflow</li><li>Zkušenost s CI/CD nebo nasazováním aplikací</li><li>Zkušenost s messagingem (RabbitMQ, Kafka)</li><li>Zájem o vývoj mobilních aplikací (Android / iOS / multiplatform)</li><li>Zájem o AI nástroje a automatizaci workflow (např. n8n)</li><li>Zkušenost s UI/UX nástroji (Figma, XD</li></ul><p class=""typography-body-large-text-regular mb-800""><strong>Nabízíme:</strong></p><ul class=""typography-body-large-text-regular""><li>Junior/medior pozici s reálným prostorem k růstu</li><li>Práci na nových projektech, nejen údržbu legacy kódu</li><li>Možnost ovlivnit technologický směr projektů</li><li>Otevřenost k open-source technologiím a novým přístupům</li><li>Spolupráci se specialisty na HW, embedded, senzoriku a ML</li><li>Přátelské prostředí menšího vývojového týmu</li><li>Podporu profesního rozvoje dle tvého zaměření</li><li>Flexibilitu, rozumnou míru samostatnosti a prostor pro vlastní nápady</li><li>Místo výkonu práce – Praha</li></ul></div>"
SAP iXp Intern - IT Data & Analytics,SAP,https://www.linkedin.com/jobs/view/4387395566/?utm_campaign=SAP_Linkedin&utm_source=juniorguru,False,2026-03-19 00:00:00,,en,,,linkedin#4387395566,,,,,,,,,,Praha,,,,,,,,,,,,,,,,,,,,Praha,,,,,,,,,,,,,,,,,,,,internship,,,,,,,,,,"<strong>We help the world run better<br><br></strong>At SAP, we keep it simple: you bring your best to us, and we'll bring out the best in you. We're builders touching over 20 industries and 80% of global commerce, and we need your unique talents to help shape what's next. The work is challenging – but it matters. You'll find a place where you can be yourself, prioritize your wellbeing, and truly belong. What's in it for you? Constant learning, skill growth, great benefits, and a team that wants you to grow and succeed.<br><br><strong>What You’ll Build<br><br></strong>The SAP Internship Experience Program is SAP’s global, strategic, paid internship program that provides university students with opportunities to find purpose in their careers. This is more than an internship; it’s the foundation for a career built on connection, creativity, and impact.<br><br><strong>Position title:</strong> SAP iXp Intern – IT Data &amp; Analytics<br><br><strong>Location:</strong> Prague, Czech Republic<br><br><strong>Expected start date: </strong>April/May 2026<br><br>In this role, you'll support our Strategic Data Product Success team in creating and optimizing data models using Databricks and modern analytics tools. You'll work on high-impact projects that directly influence executive decision-making across SAP, helping us close critical data gaps identified at board and leadership level. Beyond data modeling, you'll contribute to dashboards, reports, and data analysis that drive business insights.<br><br>Your work will help us build reusable patterns that serve as blueprints for future analytics initiatives across the company. You'll gain hands-on experience with enterprise-level data challenges while collaborating with colleagues across multiple countries.<br><br><ul><li>You will build data models in Databricks; create and maintain analytics dashboards and reports; perform data analyses; support the analytics team on strategic projects that impact SAP's internal cloud operations.</li><li>Your work will generate unparalleled efficiency and scale data-driven decision-making for SAP employees globally. You'll help democratize data access across our system landscape, empowering leaders at every level to make intelligent decisions based on trusted insights.</li><li>You'll work with our multicultural team in Prague and collaborate with colleagues in Germany, Czech Republic, and the USA. You'll receive mentoring from experienced analytics professionals and contribute to a team that values learning, innovation, and continuous improvement.</li><li>You'll gain hands-on expertise in Databricks, SQL, and SAP analytics tools (SAC, Datasphere). You'll learn enterprise data modeling best practices, develop analytics skills, and understand how data-driven insights shape organizational strategy.<br><br></li></ul><strong>What You’ll Bring<br><br></strong>We're looking for someone who takes initiative, perseveres through challenges, and stays curious. You enjoy working on meaningful projects that solve real business problems and are energized by continuous learning and growth.<br><br><ul><li>Currently enrolled university student in computer science, engineering, business information technologies, or related field with strong interest in data and analytics</li><li>Solid proficiency in SQL with hands-on experience writing queries and working with databases</li><li>Familiarity with data analysis tools or business intelligence concepts</li><li>Quick learner with ability to rapidly acquire new technical skills (Databricks, SAC, Datasphere)</li><li>Strong problem-solving mindset with attention to detail and analytical thinking</li><li>Excellent communication skills and ability to collaborate effectively in international, multicultural teams</li><li>English language proficiency (required)<br><br></li></ul><strong>Where You Belong<br><br></strong>Be part of SAP Next Gen, a global community for students, universities, schools and educational partners, who are passionate about innovation and technology.<br><br><ul><li>Culture of Collaboration: Partner with experienced SAP colleagues and expert mentors who will support your growth. Grow professionally through personalized mentoring, coaching, and career development support.</li><li>Project-driven Experience: Kickstart your career with hands-on learning experience, making an impact from day one by contributing to meaningful projects that help the world run better. You’ll have endless learning resources at your fingertips and gain future-ready skills from a variety of virtual, in-person, and hybrid learning sessions, cultivated just for you, and aligned with our learning approach.</li><li>Gain Visibility: Build relationships with leaders and peers across teams and functions. Showcase your ideas, skills, and creativity in a global, fast-paced environment. Open doors for future career opportunities within SAP and beyond.</li><li>Prague Community: Join a vibrant location community where collaboration and innovation thrive. Work in a multicultural environment with colleagues from across Europe and the world, all united by a passion for data and technology.<br><br></li></ul>Follow @LifeatSAP on Instaqram and don't miss anything about our experiences worldwide!<br><br><br><br>#SAPNextGen<br><br><strong>Bring out your best<br><br></strong>SAP innovations help more than four hundred thousand customers worldwide work together more efficiently and use business insight more effectively. Originally known for leadership in enterprise resource planning (ERP) software, SAP has evolved to become a market leader in end-to-end business application software and related services for database, analytics, intelligent technologies, and experience management. As a cloud company with two hundred million users and more than one hundred thousand employees worldwide, we are purpose-driven and future-focused, with a highly collaborative team ethic and commitment to personal development. Whether connecting global industries, people, or platforms, we help ensure every challenge gets the solution it deserves. At SAP, you can bring out your best.<br><br><strong>We win with inclusion<br><br></strong>SAP’s culture of inclusion, focus on health and well-being, and flexible working models help ensure that everyone – regardless of background – feels included and can run at their best. At SAP, we believe we are made stronger by the unique capabilities and qualities that each person brings to our company, and we invest in our employees to inspire confidence and help everyone realize their full potential. We ultimately believe in unleashing all talent and creating a better world.<br><br>SAP is committed to the values of Equal Employment Opportunity and provides accessibility accommodations to applicants with physical and/or mental disabilities. If you are interested in applying for employment with SAP and are in need of accommodation or special assistance to navigate our website or to complete your application, please send an e-mail with your request to Recruiting Operations Team: Careers@sap.com.<br><br>For SAP employees: Only permanent roles are eligible for the SAP Employee Referral Program, according to the eligibility rules set in the SAP Referral Policy. Specific conditions may apply for roles in Vocational Training.<br><br>Qualified applicants will receive consideration for employment without regard to their age, race, religion, national origin, ethnicity, gender (including pregnancy, childbirth, et al), sexual orientation, gender identity or expression, protected veteran status, or disability, in compliance with applicable federal, state, and local legal requirements.<br><br>Successful candidates might be required to undergo a background verification with an external vendor.<br><br><strong>AI Usage in the Recruitment Process<br><br></strong>For information on the responsible use of AI in our recruitment process, please refer to our Guidelines for Ethical Usage of AI in the Recruiting Process.<br><br>Please note that any violation of these guidelines may result in disqualification from the hiring process.<br><br>Requisition ID: 449185 | Work Area: Information Technology | Expected Travel: 0 - 10% | Career Status: Student | Employment Type: Limited Part Time | Additional Locations:<br><br>"
HR Data & Reporting Specialist,GasNet CZ,https://www.jobs.cz/rpd/2001080636/?utm_source=juniorguru,False,2026-03-19 00:00:00,,cs,,,jobscz#2001080636,linkedin#4387745447,,,,,,,,,Slatina,,,,,,,,,,,,,,,,,,,,Brno,,,,,,,,,,,,,,,,,,,,fulltime,,,,,,,,,,"Proč se přidat ke GasNetu?<br><br><ul><li>Staráme se o největší distribuční plynárenskou síť v České republice.</li><li>Zajišťujeme bezpečné a spolehlivé dodávky plynu pro více než 2,3 miliónu odběratelů.</li><li>Jsme součástí kritické infrastruktury a jsme nepostradatelní pro chod tuzemské ekonomiky.</li><li>Máme silné zázemí v podobě odpovědných akcionářů, kterými jsou Skupina ČEZ, British Columbia Investment Management Corporation (BCI) a Allianz Capital Partners (zastupující pojišťovací společnosti skupiny Allianz).<br><br></li></ul>Chci pracovat v GasNetu<br><br>Do našeho HR týmu hledáme kolegu či kolegyni, který/á nám pomůže rozvíjet práci s HR daty a navrhovat řešení na základě výsledků z rozborů a analýz. Máte vztah k číslům a umíte v nich hledat souvislosti?<br><br>Hlavní náplní práce bude reporting a práce s HR daty, s možností postupného rozšíření do dalších oblastí.<br><br><strong>Vaší Náplní Práce Bude<br><br></strong><ul><li>práce s HR daty – příprava pravidelných i ad-hoc reportů, přehledů a dashboardů,</li><li>analýza HR dat, zpracování návrhů možných řešení, včetně interpretace,</li><li>spolupráce na tvorbě, sledování vývoje a reportingu plánu FTE a personálních nákladů včetně komentování odchylek,</li><li>poskytovat datovou podporu HR Business Partnerům,</li><li>vedení personální a mzdové agendy – příprava podkladů pro mzdové účetnictví a jejich zpracování pro vybranou skupinu zaměstnanců (cca 120),</li><li>postupné zapojení do zlepšování HR procesů a práce s daty, podílet se na projektech v oblasti Comp &amp; Ben, digitalizace HR a optimalizace procesů,</li><li>spolupráce s kolegy napříč HR a dalšími útvary společnosti.<br><br></li></ul><strong>Hledáme Právě Vás, Pokud Máte<br><br></strong><ul><li>máte analytické myšlení a orientujete se v datech,</li><li>umíte pracovat s MS Excel (kontingenční tabulky a pokročilejší funkce),</li><li>dokážete data zpracovat i vysvětlit srozumitelně ostatním,</li><li>jste pečliví, spolehliví a umíte si práci dobře zorganizovat,</li><li>nevadí vám různorodá náplň práce a změna priorit,</li><li>výhodou je zkušenost z HR, controllingu, administrativy nebo reportingu,</li><li>výhodou je znalost BI nástrojů (např. Power BI) nebo HR systémů (SAP HR, SAP SuccessFactors),</li><li>český jazyk (rodilý mluvčí - pro komunikaci s úřady).<br><br></li></ul><strong>Nabízíme Vám<br><br></strong><ul><li>smlouvu na dobu určitou,</li><li>pružnou pracovní dobu s pevným jádrem od 9:00 do 14:00 hod.,</li><li>možnost podílet se na rozvoji HR dat a reportingu ve firmě,</li><li>možnost pracovat s daty, která mají reálný dopad na fungování společnosti,</li><li>práci ve stabilní společnosti, která je součástí kritické infrastruktury ČR,</li><li>benefity, o kterých se dočtete níže.<br><br></li></ul><strong>Jak to u nás chodí můžete vidět na videu na této stránce.<br><br></strong>OdpovědětZpět na volná místa<br><br>Co se hodí vědět<br><br>Typ úvazku<br><br>Práce na plný úvazek<br><br>Délka pracovního poměru<br><br>Na dobu určitou<br><br>Typ smluvního vztahu<br><br>Pracovní smlouva<br><br>Požadované jazyky<br><br>Čeština (výborná)<br><br>Požadované vzdělání<br><br>Středoškolské nebo odborné vyučení s maturitou<br><br>Místo pracoviště<br><br>Prosecká 855/68, 19000 Praha - Prosek, Česká republika, Varenská 2930/30, 70200 Ostrava, Česká republika, Tuřanka 1554/115b, 62700 Brno - Slatina, Česká republika<br><br>Zjistěte, co u nás obnáší práce z kanceláře"
Technical Support Specialist  (EN),Contabo,https://www.linkedin.com/jobs/view/4332242035/?utm_source=juniorguru,False,2026-03-19 00:00:00,,en,,,linkedin#4332242035,,,,,,,,,,Sobůlky,,,,,,,,,,,,,,,,,,,,Brno,,,,,,,,,,,,,,,,,,,,internship,,,,,,,,,,"<strong>YOUR CREATIVE FIELD<br><br></strong>We are looking for a full-time, permanent Technical Support Specialist (all genders) to start as soon as possible, within the Czech Republic.<br><br>As a Technical Support Specialist, you will take on innovative and responsible tasks to ensure smooth 24/7 operation within the framework of technical 3rd level support.<br><br>This includes customer support and communication with our customers in English via the ticket system. You will also be responsible for monitoring and troubleshooting the customer's IT infrastructure. You provide the technical solutions for our customer concerns, such as compromised servers, managed server tasks, website and server migrations or also error analysis on the websites. In addition to a correct documentation collection, server construction or provisioning as well as the proactive monitoring of the internal infrastructure are also part of your versatile tasks.<br><br>You are our all-rounder and in the end it all depends on you: As part of our Operations team, you represent the heart of our company by installing, configuring and administering servers, networks, applications and applications for the benefit of our customers.<br><br>In addition, you will have the opportunity to familiarise yourself with new technologies and we will support you in your professional development through intensive training.<br><br><strong>What Convinces Us<br><br></strong>Your personality, coupled with:<br><br><ul><li>a completed technically oriented vocational training in the IT sector or relevant professional experience in the IT sector</li><li>very good knowledge of administration under Linux (Shell/Terminal)</li><li>service-oriented, independent and responsible action in technical customer support, in dealing with hardware and in Windows server administration</li><li>English language skills (mandatory, as this is our company language)<br><br></li></ul>Also desirable would be<br><br><ul><li>initial knowledge of Bash scripting and basic programming skills</li><li>Experience in dealing with databases (SQL)</li><li>Sound knowledge of German <br><br></li></ul>We know that you may not currently meet all the requirements. But if you come to us with the right amount of commitment and enthusiasm, we can take off together and achieve a lot.<br><br><strong>AWESOME PROSPECTS<br><br></strong>At Contabo, we are constantly evolving. Our growth creates space for new ideas, ownership, and real impact for people who want to make a difference.<br><br>What defines us is trust, direct communication, and an open feedback culture. We believe the best solutions are built together and that everyone has the opportunity to contribute, grow, and leave their own footprint.<br><br>Additionally, we offer:<br><br><ul><li> Work the way that fits your life – Remote or hybrid with flexible hours for a healthy work-life balance and the same technical equipment at home as in the office </li><li> Experience real freedom – Workation across the EU and in our summer office in Mallorca </li><li> Stay active and healthy – Access to the MultiSport Card and a wide range of fitness and wellness facilities </li><li> Enjoy exclusive perks – Attractive discounts on many products and services through our corporate benefits program </li><li> Recharge your energy – 30 days of vacation plus additional days off on Christmas Eve and New Year’s Eve </li><li> Take care of what matters – Meal vouchers to support your daily routine </li><li> Feel supported when it counts – Additional sick pay to give you peace of mind </li><li> Give back – An extra day off to get involved in social activities through our Volunteer Day </li><li> Make an impact – Take ownership and bring your ideas to life with real creative freedom </li><li> Keep growing – Individual professional and personal development opportunities in an innovative tech environment </li><li> Feel comfortable where you work – Modern, conveniently located offices across our European locations </li><li> Be part of a diverse team – Work in an international environment shaped by diversity </li><li> Create lasting memories – Company events and team activities you won’t forget <br><br></li></ul><strong>How To Reach Us<br><br></strong>If you have any questions, you can reach out to Max by email at maximilian.kasemir@contabo.de .<br><br><strong>ABOUT US<br><br></strong><strong> Contabo - High-quality Cloud Hosting Made in Germany! <br><br></strong>As a leading infrastructure service provider in the field of cloud instances and dedicated servers, we have stood for first-class quality, reliability and favorable prices since our foundation in Munich in 2003. Meanwhile, more than 225,000 customers in over 190 countries trust our services.<br><br>We specialize in providing German quality to users worldwide, focusing on the stability and security of our data centers, the optimization of internal processes, and excellent customer support.<br><br>Become a part of our future-oriented company, which plays a significant role in the development of digital cloud hosting, and support us with your ideas and commitment."
Digitization Trainee,Valeo,https://www.linkedin.com/jobs/view/4378028782/?utm_source=juniorguru,False,2026-03-19 00:00:00,,en,,,linkedin#4378028782,,,,,,,,,,Praha,,,,,,,,,,,,,,,,,,,,Praha,,,,,,,,,,,,,,,,,,,,fulltime,,,,,,,,,,"<strong>We’re looking for a motivated graduate who’s excited to dive into the world of industrial digitization. In this exciting role, you’ll be working hands-on with digital tools, data, and cross-functional teams to bring smart solutions to life.<br><br></strong><strong>Your Challenges<br><br></strong><ul><li>Supporting the digitization team in rolling out strategic site priorities and goals</li><li>Collaborating on digitization projects within the plant</li><li>Assisting with testing and implementing standard digital tools</li><li>Analyzing processes, workflows, and technologies to suggest improvement opportunities</li><li>Collecting, analyzing, and visualizing Big Data to gain insights and support decision-making</li><li>Sharing and spreading digital knowledge across departments<br><br></li></ul><strong>About You<br><br></strong><ul><li>A recent high school OR university graduate in a technical or IT-related field (max. 1 year after graduation)</li><li>Advanced English (Czech is a big plus!)</li><li>Interested in Big Data – collection, analysis, visualization, and reporting</li><li>Familiar with cloud platforms and databases</li><li>Comfortable with information and industrial systems</li><li>Confident using or learning programming languages</li><li>Analytical, curious, and eager to solve problems</li><li>A creative team player with positive attitude<br><br></li></ul><strong>We Offer<br><br></strong><ul><li>6 weeks of vacation per year for every employee</li><li>Flexible working hours and home office possibility for selected positions</li><li>A variable bonus of up to 35,000 CZK every 6 months based on company and team results</li><li>Contribution to the pension insurance after the probation period, 5% from the gross salary, max. 4,166 CZK per month</li><li>Vouchers for leisure activities of 500 CZK paid on a Pluxee card</li><li>Contribution to commuting for the first 6 months (up to 10,000 CZK/month)</li><li>Canteen on site with subsidized prices for meals</li><li>Personal development program through technical trainings and language courses</li><li>Discount on car spare parts and accessories</li><li>Assistance program for employees in the field of law, personal finances, psychological help, etc.</li></ul>"
