Full-stack vývojář/ka,PKV BUILD s.r.o.,https://www.jobs.cz/rpd/2000711452/,False,2025-08-24 00:00:00,,cs,,,jobscz#2000711452,,,,,,,,,,Brno,Brno,,,,,,,,,,,,,,,,,,,Brno,Brno,,,,,,,,,,,,,,,,,,,parttime,,,,,,,,,,"<div data-jobad=""body"" data-test=""jd-body-richtext"" class=""RichContent mb-1400""><p class=""typography-body-medium-text-regular text-secondary mb-600"">Pracovní nabídka</p><p class=""typography-body-large-text-regular mb-800""><strong>Máte zkušenosti s Pythonem, orientujete se v PowerApps/PowerAutomate a zároveň vás zajímá oblast datové analýzy? </strong></p><p class=""typography-body-large-text-regular mb-800""><strong>Hledáme posilu, která umí propojovat svět vývoje a dat</strong>. Důležitá je chuť zapojit se do reálných projektů, analyzovat chyby, hledat řešení a posouvat náš interní vývoj kupředu. Nastartujte svou kariéru jako <strong>Full-stack vývojář/ka v PKV!</strong> 💪🏼</p><p class=""typography-body-large-text-regular mb-800""><strong>Co?</strong> Vývoj aplikací, extrakce a analýza dat, správa existujícího portfolia aplikací a dashboardů. <br><strong>Jak?</strong> Zapojíte se do celého vývojového cyklu – budete programovat v Pythonu, pracovat na návrhu, testování a nasazení aplikací.<br><strong>Proč?</strong> Získáte kompletní přehled o vývoji i práci s daty, uvidíte přímý dopad své práce na chod firmy a budete mít prostor pro vlastní nápady i další růst.</p><p class=""typography-body-large-text-regular mb-800""><strong>Jak bude vypadat vaše práce v PKV? </strong></p><ul class=""typography-body-large-text-regular""><li><strong>Vývoj interních aplikací, které zjednoduší práci celé firmě.</strong> Od prvního návrhu, přes samotné programování, až po testování a nasazení. Budete se podílet na celém procesu od začátku do konce, s velkým prostorem pro vlastní kreativitu.</li><li><strong>Přetvářet data na smysluplné výstupy.</strong> Čeká Vás práce s firemními daty, vaším úkolem bude vytvářet přehledné vizualizace, které pomohou kolegům v každodenní práci.</li><li><strong>Dbát na čistý a udržitelný kód</strong> – budete používat verzování na Gitu a pečlivě dokumentovat všechny změny.</li><li><strong>Spolupracovat s Datovým analytikem</strong> – dle požadavků budete tvořit a pomáhat implementovat nové dashboardy a inovace.</li></ul><p class=""typography-body-large-text-regular mb-800""><br><strong>Jak si vás představujeme?</strong></p><ul class=""typography-body-large-text-regular""><li><strong>Máte prostor minimálně 20 hod. týdně nebo hledáte novou výzvu na zkrácený úvazek</strong>.</li><li><strong>Ovládáte Python a nebojíte se ho použít v praxi</strong> – naše interní aplikace jsou postavené právě na Pythonu, takže vás bude čekat jak vývoj, tak správa aktuálních aplikací.</li><li><strong>Máte zkušenost s PowerAutomate/PowerApps</strong> – ideálně jste už zkusil/a sestavit vlastní automatizační tok nebo nějakou jednoduchou aplikaci a víte, jak je použít v praxi.</li><li><strong>Máte zkušenost z firemního prostředí</strong> – víte, co obnáší správa interních nástrojů a tvorba dokumentace.</li><li><strong>Rád/a přemýšlíte nad tím, jak něco udělat líp</strong> – umíte se zorientovat v zadání a hledat řešení, která dávají smysl.</li><li>Když se vyskytne problém, nečekáte, až ho vyřeší někdo jiný – dokážete rychle reagovat.</li><li>Hledáme někoho, kdo se chce zlepšovat a učit se nové věci. Výzvy vás neodradí, ale motivují.</li><li>Výhodou: zkušenost s PowerBI a/nebo SQL, základní přehled o Gitu.</li></ul><p class=""typography-body-large-text-regular mb-800""><br><strong>Co získáte, když se k nám přidáte?   </strong></p><ul class=""typography-body-large-text-regular""><li><strong>Uvidíte celý proces vývoje</strong> – od prvotního zadání, přes návrh a programování, až po testování a nasazení. Nečeká vás jen malý výsek práce, ale kompletní přehled o tom, jak vznikají naše interní nástroje.</li><li><strong>Smysluplnou práci s dopadem</strong> – budete ovlivňovat budoucí směřování klientů a pomáhat jim šetřit miliony korun ročně na energiích.  </li><li><strong>Dáváme důraz na vzdělávání.</strong> Máme například odborná školení, jazykové kurzy, každý zaměstnanec PKV má navíc svůj individuální rozvojový plán.  </li><li><strong>Možnost kariérně vyrůst společně s námi</strong> – firma dynamicky roste, získává nové zajímavé klienty a velké zakázky. A vy budete u nich.  </li><li><strong>Přátelskou firemní kulturu</strong>, která Vám bude dobíjet baterky. Pravidelně pořádáme týmové i celofiremní teambuildingy, legendární vánoční večírky a popracovní akce jako je třeba Chmel Day nebo Lanparty,  </li><li><strong>Moderní pracovní prostředí</strong> – Pracujte v nových kancelářích na Dornychu s krásným výhledem na Brno. </li><li><strong>K práci přistupujeme efektivně</strong>. Nejen proto jsou našimi pracovními nástroji iPhone a MacBook. </li><li><strong>Občerstvení na pracovišti</strong> - neomezené množství výborné kávy a pravidelný přísun vitamínu v podobě fruit days. </li><li><strong>Flexibilní pracovní dobu</strong> – Nastavte si práci tak, aby vám vyhovovala – s flexibilitou s pevným core-timem.  </li><li><strong>Dále pro vás máme celou řadu firemních benefitů</strong> – např. stravenkový paušál, Multisportku, 2 sick days, navýšení dovolené po roce. Navíc nabízíme cestovní pojištění po Evropě, odměnu až 25 000 Kč za doporučení nového kolegy a slevy u partnerů jako iStyle, Orlen tankarta benefit, T-mobile benefit program nebo Alza benefit a další.  </li></ul><p class=""typography-body-large-text-regular mb-800""><strong>Chcete se k nám přidat?</strong> Pošlete nám své CV, brzy se vám ozveme! </p><p class=""typography-body-large-text-regular mb-800"">A mezitím klidně mrkněte na stránky www.pkv.cz, kde objevíte mimo jiné sérii podcastů o našem fungování. Najdete nás také na <strong>LinkedInu a Instagramu – všude pod jménem PKV BUILD.</strong> </p><p class=""typography-body-large-text-regular mb-800""><br>Těšíme se na vás! </p><p class=""typography-body-large-text-regular mb-800""><br>Tým PKV 💚 </p></div>"
FRONTEND DEVELOPER ANGULAR,Allplan Česko s.r.o.,https://www.jobs.cz/rpd/2000697994/,False,2025-08-24 00:00:00,,en,,,jobscz#2000697994,,,,,,,,,,Brno,Brno,,,,,,,,,,,,,,,,,,,Brno,Brno,,,,,,,,,,,,,,,,,,,fulltime,,,,,,,,,,"<div data-jobad=""body"" data-test=""jd-body-richtext"" class=""RichContent mb-1400""><p class=""typography-body-medium-text-regular text-secondary mb-600"">Pracovní nabídka</p><p class=""typography-body-large-text-regular mb-800"">YOUR TASKS</p><ul class=""typography-body-large-text-regular""><li>Collaborate with the front-end development team to design and develop innovative web applications using JavaScript, TypeScript and Angular</li><li>Write clean, maintainable, and efficient code while adhering to industry best practices and coding standards.</li><li>Implement responsive designs and ensure compatibility across different browsers and devices.</li><li>Participate in code reviews and provide constructive feedback to ensure the overall quality of the codebase.</li><li>Work closely with designers, product managers, and backend developers to translate requirements into functional and engaging user interfaces.</li><li>Stay up to date with the latest trends and advancements in front-end technologies and frameworks to drive continuous improvement and innovation within the team.</li><li>Troubleshoot and debug issues that arise during development and address them in a timely manner.</li><li>Collaborate effectively within an Agile/Scrum development environment, contributing to sprint planning, stand-ups, and other</li></ul><p class=""typography-body-large-text-regular mb-800"">YOUR PROFILE</p><ul class=""typography-body-large-text-regular""><li>Bachelor's degree in Computer Science, Software Engineering, or a related field (or equivalent experience).</li><li>Strong proficiency in JavaScript, TypeScript, HTML, and CSS.</li><li>Base experience working with JavaScript framework, preferably Angular</li><li>Solid understanding of frontend web development principles and best practices.</li><li>Familiarity with responsive design principles and experience in building mobile-friendly applications.</li><li>Base knowledge of RESTful APIs and experience in integrating frontend applications with backend services.</li><li>Understanding of version control systems, particularly Git.</li><li>Problem-solving skills and ability to work effectively both independently and as part of a team.</li><li>Strong communication and collaboration skills.</li><li>Preferred Qualifications:</li><li>Familiarity with Agile/Scrum development methodologies.</li><li>Familiarity with testing frameworks and tools for front-end development (Selenium, QUnit).</li><li>Knowledge of UI/UX design principles and ability to work closely with designers to implement pixel-perfect designs.</li></ul><p class=""typography-body-large-text-regular mb-800"">WE OFFER YOU</p><ul class=""typography-body-large-text-regular""><li>Flexible working hours with 5 extra vacation days</li><li>Free access to LinkedIn Learning</li><li>Meal vouchers</li><li>MultiSport card</li><li>Possibility to work from home</li><li>Parking spaces and very good public transport connections</li><li>Modern working environment without dress code</li></ul></div>"
JUNIOR DEVELOPER (ORACLE / PLSQL),"INVESTIKA, investiční společnost, a.s.",https://www.jobs.cz/rpd/2000730988/,False,2025-08-24 00:00:00,,cs,,,jobscz#2000730988,,,,,,,,,,Praha,,,,,,,,,,,,,,,,,,,,Praha,,,,,,,,,,,,,,,,,,,,fulltime,,,,,,,,,,"<div data-jobad=""body"" data-test=""jd-body-richtext"" class=""RichContent mb-1400""><p class=""typography-body-medium-text-regular text-secondary mb-600"">Pracovní nabídka</p><p class=""typography-body-large-text-regular mb-800"">Máte zkušenosti s Oracle databázemi a baví vás ladění aplikací do dokonalosti?<br>Chcete se podílet na vývoji a integraci klíčových systémů, jako jsou Topas/TA od Arbes, a být nepostradatelnou součástí dynamického týmu?</p><p class=""typography-body-large-text-regular mb-800"">Hledáme Oracle/PL SQL Developer(ku)a, který/á se bude podílet na vývoji, optimalizaci a správě našich databázových systémů.<br>Pozice je vhodná pro tester(k)y, kteří se chtějí věnovat developmentu nebo pro všechny, kteří v programování začínají a chtějí se v této oblasti i nadále zdokonalovat.<br><br><strong>Co Vás čeká? </strong></p><ul class=""typography-body-large-text-regular""><li>Návrh a vývoj Oracle databází</li><li>Integrace a vývoj systémů Topas/TA od Arbes</li><li>Optimalizace a ladění stávajících aplikací v Oracle</li><li>Spolupráce s týmem na identifikaci a řešení technických problémů</li><li>Aktualizace a údržba databázových systémů a API</li><li>Zajištění bezpečnosti a integrity dat</li><li>Zpracování dokumentace</li></ul><p class=""typography-body-large-text-regular mb-800""><strong>Co očekáváme? </strong></p><ul class=""typography-body-large-text-regular""><li>Zkušenosti s vývojem v Oracle SQL a PL/SQL</li><li>Znalost návrhu databázových schémat a optimalizace výkonu</li><li>Zkušenosti s integrací systémů, ideálně Topas/TA, výhodou</li><li>Analytické myšlení a schopnost efektivně řešit technické problémy</li><li>Týmového ducha a pečlivost při práci s dokumentací</li></ul><p class=""typography-body-large-text-regular mb-800""><strong>Benefity:</strong></p><ul class=""typography-body-large-text-regular""><li>1 týden dovolené navíc (tj. 5 týdnů dovolené / rok)</li><li>2 dny osobního volna</li><li>Bonusy (vypláceny 1x ročně)</li><li>Stravenkový paušál (přibližně 1500 Kč / měsíc)</li><li>Multisport karta (dotovaná společností)</li><li>Možnost investování bez vstupních poplatků pro zaměstnance, jejich rodiny a přátele</li><li>Pojištění odpovědnosti zaměstnance za škodu způsobenou zaměstnavateli (dotované společností)</li><li>Referral bonus (odměna za doporučení zaměstnanců ve výši 20 000 Kč)</li><li>Individuální budget na vzdělávání</li><li>Pravidelné firemní brunche (1x měsíčně)</li><li>Občerstvení na pracovišti (káva a jiné nápoje) a ovocné úterky</li><li>Teambuildingové akce</li><li>Zaměstnanecké slevy u Alzy a Datartu</li></ul></div>"
Tester embedded systémů,METEL s.r.o.,https://www.jobs.cz/rpd/2000720946/,False,2025-08-24 00:00:00,,cs,,,jobscz#2000720946,,,,,,,,,,Česká Skalice,Česká Skalice,,,,,,,,,,,,,,,,,,,Hradec Králové,Hradec Králové,,,,,,,,,,,,,,,,,,,fulltime,,,,,,,,,,"<div data-jobad=""body"" data-test=""jd-body-richtext"" class=""RichContent mb-1400""><p class=""typography-body-medium-text-regular text-secondary mb-600"">Pracovní nabídka</p><p class=""typography-body-large-text-regular mb-800""><strong>Co vás čeká<br></strong>Hledáme kolegu pro testování firmwaru a hardwaru L2 switchů a PLC zařízení. <br>Testování probíhá přes interní webovou aplikaci, kde se spouští testovací skripty a výsledky se ukládají do databáze pro další analýzu. <br>Budeš součástí týmu, který aktivně spolupracuje s vývojem (R&amp;D) a ovlivňuje výsledný produkt.</p><p class=""typography-body-large-text-regular mb-800""><strong>Co budeš u nás dělat?</strong></p><ul class=""typography-body-large-text-regular""><li>Navrhovat a vyvíjet testovací skripty v Bash</li><li>Hledat chyby, reportovat je přímo do vývoje a aktivně se podílet na jejich řešení</li><li>Dokumentovat nové funkcionality a testovací scénáře</li><li>Pracovat v prostředí Linuxu, kde máme velký prostor pro automatizaci a zlepšování procesů</li></ul><p class=""typography-body-large-text-regular mb-800""><strong>Jaké znalosti a dovednosti byste měli mít<br></strong>Výhodou bude, pokud budete mít zkušenosti alespoň s některými z uvedených dovedností:</p><ul class=""typography-body-large-text-regular""><li>Znalost psaní skriptů v Bash</li><li>Oceníme základní znalost PHP, HTML a MySQL</li><li>Znalost programování v C/C# je výhodou (lze uplatnění při dopravě zjištěných chyb a jejich odlaďování)</li><li>Zkušenosti s OS Linux</li><li>IT gramotnost</li><li>Znalost anglického jazyka</li></ul><p class=""typography-body-large-text-regular mb-800""><strong>Co vám nabízíme</strong></p><ul class=""typography-body-large-text-regular""><li>Nabízíme pracovní příležitosti ve firmě s více než 25letou historií</li><li>Výborný kolektiv s minimální fluktuací zaměstnanců.</li><li>Podporu osobního i profesním růstu</li><li>Odborná školení a teambuildingové akce</li><li>Pružnou pracovní dobu</li><li>Jednosměnný provoz</li><li>Kafeterii a příspěvky na stravování</li></ul><p class=""typography-body-large-text-regular mb-800"">Talentovaným a motivovaným zaměstnancům nabízíme možnost:</p><ul class=""typography-body-large-text-regular""><li>Kariérního posunu – například do technické podpory, vývoje hardwaru či softwaru, nebo na jiné odborné pozice podle jejich dovedností a ambicí</li><li>Studia VŠ při zaměstnání</li></ul></div>"
Asistent/ka Scrum Mastera,IPSOS s.r.o.,https://www.jobs.cz/rpd/2000700939/,False,2025-08-24 00:00:00,,cs,,,jobscz#2000700939,,,,,,,,,,Nova Praha,Praha,,,,,,,,,,,,,,,,,,,Ukrajina,Praha,,,,,,,,,,,,,,,,,,,parttime,,,,,,,,,,"<div data-jobad=""body"" data-test=""jd-body-richtext"" class=""RichContent mb-1400""><p class=""typography-body-medium-text-regular text-secondary mb-600"">Pracovní nabídka</p><p class=""typography-body-large-text-regular mb-800"">Jsme mezinárodní společnost zaměřující se nejen na marketingový výzkum a nové technologie, ale i na trénink a konzultační činnost. Snažíme se být zvídaví, inovativní a neustále usilujeme o nejlepší možná řešení pro naše klienty.</p><p class=""typography-body-large-text-regular mb-800"">Zaměstnáváme mladé talenty a zkušené profesionály, kterým zabezpečujeme profesionální zázemí a možnost růstu v naší společnosti. Dáváme možnost každému jedinci vyniknout a zaměřit se na oblast, v které se cítí nejlépe.</p><p class=""typography-body-large-text-regular mb-800"">Momentálně hledáme kolegy/kolegyně na pozici:</p><h2 class=""typography-heading-small-text"">Asistent/ka Scrum Mastera</h2><p class=""typography-body-large-text-regular mb-800""><strong>Co vás čeká?</strong></p><ul class=""typography-body-large-text-regular""><li>Sledování a aktualizace úkolů v Jira;</li><li>dohled nad plněním sprintů a základní reporting;</li><li>příprava podkladů pro plánování a stand-upy;</li><li>spolupráce s týmem, připomínání nedokončených úkolů;</li><li>zápisy ze schůzek, organizace úkolů.</li></ul><p class=""typography-body-large-text-regular mb-800""><strong>Co očekáváme?</strong></p><ul class=""typography-body-large-text-regular""><li>Samostatnost, pečlivost a dobré komunikační dovednosti;</li><li>zájem o agilní metodiky a chuť učit se;</li><li>znalost Jira výhodou;</li><li>možnost pracovat 10-20h týdně, dle vzájemné domluvy.</li></ul><p class=""typography-body-large-text-regular mb-800""><strong>Co nabízíme?</strong></p><ul class=""typography-body-large-text-regular""><li>Práci na částečný úvazek (DPČ) v rozsahu cca 10-20 hodin týdně;</li><li>zajímavý výdělek;</li><li>zaškolení a mentoring;</li><li>možnost práce z domova;</li><li>nástup možný ihned.</li></ul></div>"
"Tester/podpora IS — DEK, a.s.",DEK a.s.,https://www.jobs.cz/rpd/2000733464/,False,2025-08-24 00:00:00,,cs,,,jobscz#2000733464,,,,,,,,,,Praha,Praha,,,,,,,,,,,,,,,,,,,Praha,Praha,,,,,,,,,,,,,,,,,,,fulltime,,,,,,,,,,"<div data-jobad=""body"" data-test=""jd-body-richtext"" class=""RichContent mb-1400""><p class=""typography-body-medium-text-regular text-secondary mb-600"">Pracovní nabídka</p><p class=""typography-body-large-text-regular mb-800""><em>Máš zkušenosti s testováním aplikací a chceš se dále rozvíjet? Na této pozici budeš zodpovědný za testování aplikací a analýzu testů, od jejich návrhu až po release. </em></p><p class=""typography-body-large-text-regular mb-800""><em>Čeká tě práce s integračními nástroji jako je Postman, stejně jako spolupráce s vývojáři a uživateli při řešení chyb. K tomu budeš potřebovat analytické myšlení a znalost testovacích metodik.</em></p><p class=""typography-body-large-text-regular mb-800""><strong>Co vás čeká</strong></p><ul class=""typography-body-large-text-regular""><li>Test analýza - od návrhu testů až po release</li><li>Příprava testovacího prostředí a testovacích dat</li><li>Testování aplikací, hledání chyb</li><li>Testování API přes Postman</li><li>Zhodnocení výsledků testů a reporting</li><li>Podílení se na řešení chyb a incidentů</li><li>Řešení tiketů v rámci podpory uživatelů</li><li>Externí testování s uživateli</li><li>Komunikace s vývojáři a dalšími členy týmu projektového manažera</li><li>Práce s MS SQL</li><li>Tvorba diagramů UML</li><li>Tvorba uživatelské nápovědy</li></ul><p class=""typography-body-large-text-regular mb-800""><strong>Jaké znalosti a dovednosti byste měli mít</strong></p><ul class=""typography-body-large-text-regular""><li>Analytické myšlení, samostatnost a velmi dobré komunikační schopnosti</li><li>Znalost metodik testování a zkušenosti s návrhem testovacích scénářů výhodou</li><li>Zkušenost s ticketovacími systémy</li><li>Zkušenost s logovacími nástroji a čtení v logu</li><li>Orientaci v automatizovaném a integračním testování výhodou</li><li>Schopnost pracovat v týmu</li><li>Požadujeme minimálně středoškolské vzdělání s maturitou</li></ul><p class=""typography-body-large-text-regular mb-800""><strong>Co vám můžeme nabídnout</strong></p><ul class=""typography-body-large-text-regular""><li>Pracovní doba na míru: Flexibilní nastavení pracovní doby dle individuální potřeby</li><li>Dovolená a volno: 5 týdnů dovolené a 2 sick days</li><li>Flexibilní pracovní prostředí: Možnost pracovat z domu, firemní kanceláře</li><li>Vzdělávání: Školení, e-learningové programy a jazykové kurzy</li><li>Občerstvení na pracovišti</li><li>Zvýhodněné mobilní tarify</li><li>Benefity na výběr: MultiSport karta, příspěvek na penzijní pojištění a další</li><li>Další zaměstnanecké výhody: Slevy u obchodních partnerů, účast na teambuildingových aktivitách a další zážitky</li><li>Nástupní mzda 35 000 - 50 000 Kč dle zkušeností</li></ul></div>"
