Full-Stack Developer nebo DevSecOps engineer,Národní úřad pro kybernetickou a informační bezpečnost,https://www.jobs.cz/rpd/2000535605/,False,2025-04-11 00:00:00,,cs,,,jobscz#2000535605,,,,,,,,,,Brno,Brno,,,,,,,,,,,,,,,,,,,Brno,Brno,,,,,,,,,,,,,,,,,,,fulltime,,,,,,,,,,"<div data-jobad=""body"" data-test=""jd-body-richtext"" class=""RichContent mb-1400""><p class=""typography-body-medium-text-regular text-secondary mb-600"">Pracovní nabídka</p><p class=""typography-body-large-text-regular mb-800""><em><strong>Pracovní pozice spadají pod Odbor vládní CERT.</strong></em></p><h2 class=""typography-heading-small-text""><strong>Full-Stack Developer</strong></h2><p class=""typography-body-large-text-regular mb-800""><strong>Co vás čeká:</strong></p><p class=""typography-body-large-text-regular mb-800"">Jako full-stack developer budete součástí týmu specialistů, který má na starosti správu infrastruktury a vývoj nástrojů, obojí důležitých pro efektivní fungování Vládního CERT. Mimo to také aktivně participujeme na tvorbě nových metodik a standardů, jsme nápomocni při kontrolách systémů kritické informační infrastruktury a posuzování bezpečnosti cloudových služeb a poskytovatelů nebo se v rámci budování připravenosti zapojujeme do mezinárodních kybernetických cvičení (Locked Shields, Cyber Coalition a další).</p><p class=""typography-body-large-text-regular mb-800"">V současné době pracujeme na rozvoji produktu Portál NÚKIB.</p><p class=""typography-body-large-text-regular mb-800""><strong>Při své práci budete mít možnost se seznámit s celou řadou následujících technologií:</strong></p><ul class=""typography-body-large-text-regular""><li>virtualizační a kontejnerizační platformy,</li><li>nástroje různého typu a zaměření (GitLab, MISP a jiné interní neveřejné technologie),</li><li>programovací jazyky a frameworky (Go, Rust, Python, React a mnoho dalších).</li></ul><p class=""typography-body-large-text-regular mb-800"">Právě proto hledáme stejně nadšené a iniciativní lidi jako jsme my, s ochotou se neustále rozvíjet a se zájmem o kybernetickou bezpečnost a moderní technologie.</p><p class=""typography-body-large-text-regular mb-800""><strong>Kvalifikační předpoklady:</strong></p><ul class=""typography-body-large-text-regular""><li>vysokoškolské vzdělání se zaměřením na IT, pozice vhodná i pro absolventy,</li><li>znalost některého z programovacích nebo skriptovacích jazyků,</li><li>znalost základních síťových a aplikačních protokolů (TCP/IP, DNS, HTTP, SMTP, NTP atd.),</li><li>znalost základních kryptografických prostředků (AES, RSA, ECC atd.),</li><li>znalost základních bezpečnostních protokolů (SSL/TLS, IPsec, DNSSEC atd.),</li><li>znalost základních bezpečnostních principů a nejběžnějších typů útoků na IT systémy a infrastrukturu,</li><li>znalost systémů Unix-based a Windows,</li><li>anglický jazyk na úrovni čtení technické dokumentace,</li><li>flexibilita, kreativita a aktivní přístup k řešení problémů,</li></ul><p class=""typography-body-large-text-regular mb-800""><strong>Výhodou bude, pokud budete umět:</strong></p><ul class=""typography-body-large-text-regular""><li>znalost verzovacího nástroje Git</li><li>znalost principů CI/CD – GitLab</li><li>znalost automatizačních nástrojů – Ansible</li><li>znalost principů a nástrojů pro kontejnerizaci – Docker, Kubernetes, OpenShift</li><li>znalost HTML, CSS, Javascript a Typescript</li><li>znalost programovacího jazyka Go (případně také Python, PHP nebo Rust)</li><li>znalost frameworku React</li></ul><h2></h2><h2 class=""typography-heading-small-text""><strong>DevSecOps engineer</strong></h2><p class=""typography-body-large-text-regular mb-800""><strong>Co vás čeká?</strong></p><p class=""typography-body-large-text-regular mb-800"">Jako DevSecOps engineer budete součástí týmu specialistů, který má na starosti správu infrastruktury a vývoj nástrojů, obojí důležitých pro efektivní fungování Vládního CERT. Mimo to také aktivně participujeme na tvorbě nových metodik a standardů, jsme nápomocni při kontrolách systémů kritické informační infrastruktury a posuzování bezpečnosti cloudových služeb a poskytovatelů nebo se v rámci budování připravenosti zapojujeme do mezinárodních kybernetických cvičení (Locked Shields, Cyber Coalition a další).</p><p class=""typography-body-large-text-regular mb-800"">V současné době pracujeme na rozvoji produktu Portál NÚKIB.</p><p class=""typography-body-large-text-regular mb-800""><strong>Při své práci budete mít možnost se seznámit s celou řadou následujících technologií:</strong></p><ul class=""typography-body-large-text-regular""><li>virtualizační a kontejnerizační platformy,</li><li>nástroje různého typu a zaměření (GitLab, MISP a jiné interní neveřejné technologie),</li><li>programovací jazyky a frameworky (Go, Rust, Python, React a mnoho dalších).</li><li>Právě proto hledáme stejně nadšené a iniciativní lidi jako jsme my, s ochotou se neustále rozvíjet a se zájmem o kybernetickou bezpečnost a moderní technologie.</li></ul><p class=""typography-body-large-text-regular mb-800""><strong>Kvalifikační předpoklady:</strong></p><ul class=""typography-body-large-text-regular""><li>vysokoškolské vzdělání se zaměřením na IT, pozice vhodná i pro absolventy,</li><li>znalost některého z programovacích nebo skriptovacích jazyků,</li><li>znalost základních síťových a aplikačních protokolů (TCP/IP, DNS, HTTP, SMTP, NTP atd.),</li><li>znalost základních kryptografických prostředků (AES, RSA, ECC atd.),</li><li>znalost základních bezpečnostních protokolů (SSL/TLS, IPsec, DNSSEC atd.),</li><li>znalost základních bezpečnostních principů a nejběžnějších typů útoků na IT systémy a infrastrukturu,</li><li>znalost systémů Unix-based a Windows,</li><li>anglický jazyk na úrovni čtení technické dokumentace,</li><li>flexibilita, kreativita a aktivní přístup k řešení problémů,</li></ul><p class=""typography-body-large-text-regular mb-800""><strong>Výhodou:</strong></p><ul class=""typography-body-large-text-regular""><li>znalost verzovacího nástroje Git</li><li>znalost principů CI/CD – GitLab</li><li>znalost automatizačních nástrojů – Ansible (výhodou certifikace RHCE)</li><li>znalost principů a nástrojů pro kontejnerizaci – Nomad, Docker, Kubernetes</li><li>znalost alespoň jednoho z programovacích jazyků: Python, Go, Rust</li><li>znalost Hashicorp produktů: Consul, Terraform, Vault</li><li>znalost operačního systému RHEL (výhodnou certifikace RHCSA)</li><li>zkušenost se síťováním (výhodnou certifikace na úrovni CCNA nebo ekvivalentní)</li><li>zkušenost s virtualizační technologií VMware – vSphere, NSX-T</li></ul><p class=""typography-body-large-text-regular mb-800"">-----------------------------------------------------------------------------------------------</p><p class=""typography-body-large-text-regular mb-800""><strong>Co vám můžeme nabídnout:</strong></p><ul class=""typography-body-large-text-regular""><li>práce v příjemném prostředí,</li><li>možnost rozvoje a vzdělávání se v atraktivní problematice současnosti i budoucnosti,</li><li>inspirativní práce s přístupem k moderním a často zcela unikátním technologiím,</li><li>spolupráce na zajímavých projektech v oblasti kybernetické bezpečnosti,</li><li>25 dní dovolené plus možnost čerpání 6 dní sick days v rámci kalendářního roku,</li><li>stravenkový paušál,</li><li>pružná pracovní doba,</li><li>firemní notebook a mobilní telefon,</li><li>odborná školení a kurzy (možnost nejen v rámci ČR, ale i v zahraničí),</li><li>pravidelné jazykové kurzy přímo na pracovišti,</li><li>možnost účasti na odborných mezinárodních konferencích,</li><li>FKSP (příspěvek na stravování, příspěvek na penzijní připojištění),</li><li>možnost čerpání výhod z kolektivní smlouvy,</li><li>zázemí stabilní státní instituce,</li><li>a spoustu dalších zaměstnaneckých benefitů.</li></ul><p class=""typography-body-large-text-regular mb-800"">Odměňování dle nařízení vlády č. 341/2017 (13. platová třída), nad rámec nařízení vlády o platových poměrech zaměstnanců ve veřejných službách a správě je k platu poskytován zvláštní příplatek a osobní ohodnocení.</p><p class=""typography-body-large-text-regular mb-800"">Součástí přijímacího řízení je provedení bezpečnostního řízení k uchazeči dle zákona č. 412/2005 Sb., v platném znění na stupeň utajení TAJNÉ.</p><p class=""typography-body-large-text-regular mb-800""><strong>Místo výkonu práce:</strong> Brno<br><strong>Termín nástupu: </strong> dohodou</p><p class=""typography-body-large-text-regular mb-800""><strong>Doba trvání pracovního poměru: </strong>1 rok na dobu určitou s následnou možností prodloužení na dobu neurčitou</p><p class=""typography-body-large-text-regular mb-800"">Do motivačního dopisu napište o kterou ze dvou pozic máte zájem, případně o obě pozice.</p><p class=""typography-body-large-text-regular mb-800"">Nesplňujete některý z požadavků, a přesto si myslíte, že byste byli na danou pozici vhodným kandidátem? Pošlete nám tedy svůj životopis spolu s motivačním dopisem a vysvětlením, proč si máme vybrat právě Vás.</p><p class=""typography-body-large-text-regular mb-800""><em><strong>Veškeré materiály prosíme vkládat v úředním jazyce (pokud není uvedeno jinak).</strong></em></p></div>"
Frontend Developer v ARGO22,ARGO22 s.r.o.,https://www.jobs.cz/rpd/2000541138/,False,2025-04-11 00:00:00,,cs,,,jobscz#2000541138,,,,,,,,,,České Budějovice,České Budějovice,,,,,,,,,,,,,,,,,,,České Budějovice,České Budějovice,,,,,,,,,,,,,,,,,,,fulltime,,,,,,,,,,"<div data-jobad=""body"" data-test=""jd-body-richtext"" class=""RichContent mb-1400""><p class=""typography-body-medium-text-regular text-secondary mb-600"">Pracovní nabídka</p><p class=""typography-body-large-text-regular mb-800""><strong>V ARGO22 hledáme posilu do front-end týmu. Pokud Tě baví programování, webové nebo mobilní technologie a největší odměnou je pro Tebe dobře odvedená práce a spokojený uživatel, zkus číst dál a možná Tě naše nabídka zaujme, ať už je Tvoje motivace jakákoliv — nastartování kariéry nebo prostě jen změna.</strong><br> <br><strong>Aby ses dozvěděl/a víc o tom, jak to u nás funguje a co Ti můžeme nabídnout, nejlepší bude se potkat. Můžeme zajít na pivo, na čaj nebo si dát kávu u nás v kanceláři. Pokud nejsi z Českých Budějovic nebo to aktuální situace nedovolí, můžeme si zavolat.</strong></p><h2 class=""typography-heading-small-text"">Kdo jsme</h2><p class=""typography-body-large-text-regular mb-800"">Ve stručnosti o mně. Jsem Kovi, lead vývojář ve front-end týmu. V Argu jsem přes sedm let, vývoji se ale věnuji už více než deset let, když nepočítám školu.</p><p class=""typography-body-large-text-regular mb-800"">Určitě Tě bude zajímat, na jakých projektech bys u nás pracoval/a. Neděláme jednoduché webové prezentace ani generické e-shopy. Drtivá většina našich zakázek jsou řešení na míru v nejrůznějších oblastech (např. fintech, energetika, stavebnictví, sport, pojištění, turismus), ale hlavně si snažíme vybírat produkty, které nám dávají smysl.</p><p class=""typography-body-large-text-regular mb-800"">Zakázky hledáme spíš za hranicemi Český Budějovic i České republiky (máme klienty v Anglii, nebo v USA), přesto ale věříme tomu, že Budějce jsou nejlepší místo na světě. Aby toho nebylo málo, občas vyvíjíme i interní nástroje pro zvýšení efektivity všech v Argu a zároveň se snažíme více zapojit do open-source a vrátit tak něco komunitě vývojářů po celém světě. Většina lidí v týmu jsou vývojáři, máme ale také designéry, business analytiky, projektové manažery, provozní tým a dva kapitány.</p><h2 class=""typography-heading-small-text"">Tvůj tým</h2><p class=""typography-body-large-text-regular mb-800"">Front-end vývojáři na nových projektech jsme celkem čtyři, a Tebe hledáme jako posilu. Spojuje nás například zájem o nejnovější technologie a o UX, ale hlavně zodpovědnost za dobře odvedenou práci. Nemáme rádi, když se věci dělají na půl a často také hledáme nejlepší řešení společně s designéry a analytiky.<br> <br>Procesy v týmu se snažíme stále zlepšovat a optimalizovat a budeme rádi, když nám s tím pomůžeš. Neradi totiž děláme zbytečnou práci a snažíme si ji usnadnit jak jen to jde. Samozřejmostí je analytická fáze vývoje, vzájemná code reviews, studium nových technologií a … mohl bych dál pokračovat.</p><h2 class=""typography-heading-small-text"">Závěrem</h2><p class=""typography-body-large-text-regular mb-800"">Starosti o vlastní rozvoj u nás mít nemusíš. Argo se tě bude snažit podpořit v práci, která Tě baví a jde Ti nejlépe, zároveň vždy vítáme i návrhy pro zlepšení interních procesů. Možnosti vzdělávání jsou prakticky neomezené, od placených kurzů a konferencí po aktivní výuku angličtiny. Občas se naskytne i příležitost vyrazit na nějaký čas do zahraničí.</p><h2 class=""typography-heading-small-text"">Co čekáme od Tebe?</h2><ul class=""typography-body-large-text-regular""><li>Nadšení pro práci a technologie, které používáš</li><li>Zodpovědnost za vlastní výstupy</li><li>Zdravě kritický pohled na to, co děláš a umění nad prací přemýšlet</li><li>Zkušenosti buď z jiné firmy nebo z vlastních projektů při škole, vlastní Github repozitáře výhodou, určitě budeme chtít vidět co už jsi napsal/a</li></ul><h2 class=""typography-heading-small-text"">Co nabízíme my</h2><ul class=""typography-body-large-text-regular""><li>Práci v kolektivu skvělých lidí a hlavně kamarádů</li><li>Kancelář na náměstí v centru Českých Budějovic</li><li>MacBook</li><li>Licence na software</li><li>Sick leaves</li><li>Volná pracovní doba (core hours, jinak vlastní nastavení)</li><li>Dva dny v týdnu home office</li><li>Vlastní stůl a další sdílená pracovní místa (standing desk, fatboy, pohovky)</li><li>Klid na práci (open-space, 2 menší kanceláře, konferenční místnost, relax room, call room)</li><li>Kuchyňka se spotřebiči a občerstvením (káva, čaj, ovoce, zelenina, sladkosti a jiné dobroty)</li><li>Stolní tenis</li><li>Batoh nebo brašnu</li><li>Občas máme i merch, jako jsou mikiny, placky nebo nálepky</li><li>Podle úrovně buď placené lekce angličtiny nebo konverzace s rodilým mluvčím</li><li>Teambuildingy</li><li>V budově je výtah a kuřácký balkon vedle kanceláře</li></ul><p class=""typography-body-large-text-regular mb-800"">Jestli Tě naše nabídka zaujala, ozvi si, budu se těšit!</p><p class=""typography-body-large-text-regular mb-800""><strong>Honza Kovářík<br></strong>Lead Frontend Developer</p></div>"
Vývojář Java – Full Stack - Senior nebo Junior (Brno),"INVENT HR Consulting, s.r.o.",https://www.jobs.cz/rpd/2000535223/,False,2025-04-11 00:00:00,,cs,,,jobscz#2000535223,,,,,,,,,,Brno,,,,,,,,,,,,,,,,,,,,Brno,,,,,,,,,,,,,,,,,,,,fulltime,parttime,,,,,,,,,"<div data-jobad=""body"" data-test=""jd-body-richtext"" class=""RichContent mb-1400""><p class=""typography-body-medium-text-regular text-secondary mb-600"">Pracovní nabídka</p><p class=""typography-body-large-text-regular mb-800"">Chcete pracovat na zajímavých projektech v přátelském kolektivu? Úspěšná technologická firma z oblasti vývoje informačních systémů do bankovnictví a pojišťovnictví hledá do svého týmu v Brně nového kolegu na pozici:</p><p class=""typography-body-large-text-regular mb-800""><strong>VÝVOJÁŘ JAVA – FULL STACK</strong></p><p class=""typography-body-large-text-regular mb-800""><strong>Pracovní náplň:</strong></p><ul class=""typography-body-large-text-regular""><li>programování v jazyce JAVA</li><li>vývoj aplikací pro podporu firemních procesů</li><li>využívání příslušných frameworků a databázových systémů</li><li>možný 100% nebo částečný Home Office, případně docházení do kanceláře (dle dohody a preferencí pracovníka)</li><li>vhodné pro zkušené i juniorní vývojáře - dle praxe kandidátovi přidělíme adekvátní roli ve vývojovém týmu</li><li>možnost ZKRÁCENÉHO ÚVAZKU (minimálně 60% úvazek) - vhodné pro ABSOLVENTY SŠ/VŠ nebo studenty VŠ</li></ul><p class=""typography-body-large-text-regular mb-800""><strong>Požadavky:</strong></p><ul class=""typography-body-large-text-regular""><li>SŠ/VŠ vzdělání</li><li>chuť pracovat na zajímavých projektech s moderními technologiemi</li><li>znalost programovacího jazyka Java a databázových systémů</li><li>alespoň pasivní znalost angličtiny (pro čtení technických textů)</li><li>zapálení pro IT vývoj a ochota učit se novinky z oboru</li></ul><p class=""typography-body-large-text-regular mb-800""><strong>Nabízíme:</strong></p><ul class=""typography-body-large-text-regular""><li>práce na zajímavých projektech</li><li>přátelský kolektiv, příjemné pracovní prostředí</li><li>zázemí stabilní společnosti v oboru</li><li>flexibilní pracovní doba</li><li>kvalitní mzdové ohodnocení + bonusy</li><li>balíček zaměstnaneckých benefitů</li><li>firemní vzdělávání</li><li>možnost seberealizace a odborného růstu</li><li>perspektiva dlouhodobé spolupráce</li><li>možnost ZKRÁCENÉHO ÚVAZKU (minimálně 60% úvazek) - vhodné pro ABSOLVENTY SŠ/VŠ nebo studenty VŠ</li></ul><p class=""typography-body-large-text-regular mb-800""><strong>Místo pracoviště: Brno / Home Office</strong></p><p class=""typography-body-large-text-regular mb-800"">Jestliže Vás zaujala naše nabídka, zašlete svůj strukturovaný životopis pomocí tlačítka ODPOVĚDĚT. Pokud Vás nebudeme kontaktovat v průběhu 14 dnů od přijetí Vašeho životopisu, byla v prvním kole výběrového řízení dána přednost jinému uchazeči. Děkujeme.</p></div>"
Analytik Security Operations Center (SOC),Thein Security s.r.o,https://www.jobs.cz/rpd/1622789154/,False,2025-04-11 00:00:00,,cs,,,jobscz#1622789154,,,,,,,,,,Praha,Praha,,,,,,,,,,,,,,,,,,,Praha,Praha,,,,,,,,,,,,,,,,,,,fulltime,,,,,,,,,,"<div data-jobad=""body"" data-test=""jd-body-richtext"" class=""RichContent mb-1400""><p class=""typography-body-medium-text-regular text-secondary mb-600"">Pracovní nabídka</p><p class=""typography-body-large-text-regular mb-800""><strong>Thein Security</strong> hledá vášnivé jedince, kteří nám pomohou chránit naše zákazníky před kybernetickými hrozbami. Hledáme posily bez ohledu na úroveň zkušeností a vzdělání.</p><p class=""typography-body-large-text-regular mb-800""><strong>Co Vás čeká v Thein Security?</strong></p><ul class=""typography-body-large-text-regular""><li>Základní analýza kybernetických událostí a jejich vyhodnocování</li><li>Sledování aktivity v bezpečnostních nástrojích SIEM a SOAR</li><li>Vytváření a optimalizace pracovních postupů (playbooků)</li><li>Studium a prohlubování Vašich vědomostí</li></ul><p class=""typography-body-large-text-regular mb-800""><strong>Co očekáváme od ideálního kandidáta?</strong></p><ul class=""typography-body-large-text-regular""><li>Analytické myšlení a dovednosti</li><li>Ochotu přispět našemu týmu a podílet se na ochraně našich klientů</li><li>Ochotu pracovat ve směnném provozu</li><li>Znalost technické angličtiny</li></ul><p class=""typography-body-large-text-regular mb-800""><strong>Oceníme, pokud budete mít:</strong></p><ul class=""typography-body-large-text-regular""><li>Praktické zkušenosti s bezpečnostními nástroji (ArcSight, Elastic, QRadar, Microsoft Sentinel, XSOAR, Tenable Nessus, OpenVAS, …)</li><li>Praktické zkušenosti s ticketovacími nástroji (Jira, ServiceNow, …)</li><li>Základní znalost principů fungování IT infrastruktury, operačních systémů Windows/Linux a síťových protokolů</li><li>Základní znalost MITRE ATT&amp;CK framework a bezpečnostních principů (CIA triad)</li><li>Certifikace dokládající Vaše zkušenosti kupř. CompTIA Security+, Blue Team Level 1</li></ul><p class=""typography-body-large-text-regular mb-800""><strong>Co naopak nabízíme my?</strong></p><ul class=""typography-body-large-text-regular""><li>Příležitost odstartovat kariéru v oblasti IT security</li><li>Rozvoj v oboru s možností učit se od dlouholetých profesionálů v oboru cybersecurity</li><li>Přístup ke špičkovým bezpečnostním technologiím</li><li>Příjemné prostředí v moderních prostorách na Pankráci, zaměstnanecké benefity (5 týdnů dovolené, sick days, stravenková karta Sodexo a další)</li></ul><p class=""typography-body-large-text-regular mb-800""><strong>Jestli Vás naše pozice oslovila, dejte nám o sobě vědět a pošlete nám CV nebo odkaz na LinkedIn.</strong></p><p class=""typography-body-large-text-regular mb-800""><strong>Těšíme se!</strong>  </p></div>"
QA Tester pro herní studio,BOHEMIA INTERACTIVE a.s.,https://www.jobs.cz/rpd/2000548736/,False,2025-04-11 00:00:00,,cs,,,jobscz#2000548736,,,,,,,,,,Brno,Brno,,,,,,,,,,,,,,,,,,,Brno,Brno,,,,,,,,,,,,,,,,,,,fulltime,,,,,,,,,,"<div data-jobad=""body"" data-test=""jd-body-richtext"" class=""RichContent mb-1400""><p class=""typography-body-medium-text-regular text-secondary mb-600"">Pracovní nabídka</p><p class=""typography-body-large-text-regular mb-800""><strong>BOHEMIA INTERACTIVE</strong></p><p class=""typography-body-large-text-regular mb-800"">V současnosti největší české herní studio Bohemia Interactive vzniklo v Praze roku 1999. Známé je hlavně díky populární sérii Arma, úspěšnému hardcore survivalu DayZ, free-to-play titulu Vigor či Ylands EDU.</p><p class=""typography-body-large-text-regular mb-800""><strong>Do našeho týmu testerů v Brně hledáme novou posilu. Pokud máš rád/a hry a jsi pečlivý/á a trpělivý/á, hledáme právě tebe!</strong></p><p class=""typography-body-large-text-regular mb-800""><strong>Tvojí náplní bude:</strong></p><ul class=""typography-body-large-text-regular""><li><strong>Testování různých projektů na několika platformách</strong> a následné <strong>reportování nalezených problémů.</strong></li><li>Jedná se o pozici na úrovni regular.</li></ul><p class=""typography-body-large-text-regular mb-800""><strong>Koho hledáme:</strong></p><ul class=""typography-body-large-text-regular""><li>Samostatného člověka, který má zkušenost s <strong>prací na PC</strong>, zkušenost s <strong>hraním na PC a na konzolích</strong> (výhodou) a zkušenost s <strong>testováním software</strong>.</li><li>Člověka, který je trpělivý, flexibilní s ochotou učit se novým věcem.</li><li><strong>Aktivní znalost ČJ</strong> a <strong>aktivní znalost mluvené AJ</strong> (min. B1, protože zhruba třetina kolegů nepochází z ČR).</li><li>Pokud budeš mít zkušenosti s programy JIRA nebo Slack, je to pro tebe výhoda. Pokud ne, rádi tě zaškolíme.</li></ul><p class=""typography-body-large-text-regular mb-800""><strong>Co nabízíme:</strong></p><ul class=""typography-body-large-text-regular""><li>Kancelář v centru Brna, kousek od hlavního nádraží.</li><li>Jsme stabilní firma s mezinárodním prostředím, ale nejsme korporát.</li><li>Máme neformální firemní kulturu a kolektiv lidí zapálených do her.</li><li>Espresso denně tolikrát, kolikrát budeš chtít, stejně jako čaj, ovoce, zelenina.</li><li>Všechny naše hry dostaneš samozřejmě zdarma.</li><li>Nemáme žádný psaný dresscode a parkoviště hned vedle budovy :).</li></ul><p class=""typography-body-large-text-regular mb-800"">Máš-li zájem, zašli nám, prosím, svůj životopis a připoj pár řádků o tom, proč tě tato pozice zaujala a jaký máš vztah ke hrám :)</p><p class=""typography-body-large-text-regular mb-800"">Budeme se těšit!</p></div>"
