Software developer C#,MUBEA - HZP s.r.o.,https://www.jobs.cz/rpd/2000534941/,False,2025-06-07 00:00:00,,cs,,,jobscz#2000534941,,,,,,,,,,Prostějov,Prostějov,,,,,,,,,,,,,,,,,,,Olomouc,Olomouc,,,,,,,,,,,,,,,,,,,fulltime,,,,,,,,,,"<div data-jobad=""body"" data-test=""jd-body-richtext"" class=""RichContent mb-1400""><p class=""typography-body-medium-text-regular text-secondary mb-600"">Pracovní nabídka</p><p class=""typography-body-large-text-regular mb-800""><strong>Co vás čeká:</strong></p><ul class=""typography-body-large-text-regular""><li>Vývoj inovativních a na budoucnost orientovaných řešení v oblasti digitalizace</li><li>Vývoj softwaru v reálném výrobním prostředí</li><li>Organizace sběru dat ze strojů a údržba souvisejících rozhraní</li><li>Implementace vyvinutého softwaru přímo na výrobních pracovištích</li><li>Spolupráce na dalším vývoji již existujících softwarových nástrojů a jejich zdokonalování</li><li>Záznam a koordinace nových požadavků přímo z výrobního závodu</li><li>Školení a podpora uživatelů softwarových nástrojů</li></ul><p class=""typography-body-large-text-regular mb-800""><strong>Jaké znalosti a dovednosti byste měli mít:</strong></p><ul class=""typography-body-large-text-regular""><li>Vzdělání v oblasti informatiky – specializace na vývoj aplikací</li><li>Zkušenosti s programovacími jazyky: C#, JavaScript, HTML</li><li>Dobrá znalost angličtiny pro každodenní komunikaci.</li><li>Zkušenosti s SQL a NoSQL databázemi</li></ul><p class=""typography-body-large-text-regular mb-800""><strong>Výhodou bude, pokud budete umět:</strong></p><ul class=""typography-body-large-text-regular""><li>Zkušenosti s Apache Kafka</li><li>Zkušenosti s Linuxovými systémy</li><li>Zkušenosti s vývojem REST-API</li></ul><p class=""typography-body-large-text-regular mb-800""><strong>Co vám můžeme nabídnout:</strong></p><ul class=""typography-body-large-text-regular""><li>💸13. mzda ve formě půlročních bonusů</li><li>📆flexibilní pracovní doba</li><li>🏡možnost občasné práce z domova</li><li>🏖️5 týdnů dovolené</li><li>🍽️Stravenky nebo dotované stravování</li><li>👷Zaškolení zkušeným kolegou</li><li>🎉Odměny k pracovním jubileím</li><li>🎁Dárky při významných životních událostech</li><li>💙Další zaměstnanecké benefity - sportovní aktivity, zdravotní péče, firemní slevové akce (Alza, DATART, OBI), zvýhodněné volání i pro rodinné příslušníky</li></ul></div>"
Software Development Engineer in Test (Networking & Linux) - Pilsen,Ubiquiti Czech Republic s.r.o.,https://www.jobs.cz/rpd/2000497933/,False,2025-06-07 00:00:00,,en,,,jobscz#2000497933,,,,,,,,,,Plzeň,Plzeň,,,,,,,,,,,,,,,,,,,Plzeň,Plzeň,,,,,,,,,,,,,,,,,,,fulltime,,,,,,,,,,"<div data-jobad=""body"" data-test=""jd-body-richtext"" class=""RichContent mb-1400""><p class=""typography-body-medium-text-regular text-secondary mb-600"">Pracovní nabídka</p><p class=""typography-body-large-text-regular mb-800""><strong>About Ubiquiti</strong></p><p class=""typography-body-large-text-regular mb-800"">At Ubiquiti Inc., we create technology platforms for Businesses, Smart Homes, and Internet Service Providers, driven by our goal to connect everyone, everywhere. To date, Ubiquiti has shipped over 100 million devices worldwide, from ISP networking products to next-generation IT solutions. Our growth is made possible by the dedicated team of hundreds behind the scenes. From software developers and product managers to designers and strategists, Team UI is driven to achieve our common goal: Rethinking IT. At Ubiquiti, you’ll heighten your potential and broaden your horizons - all while shaping the future of connectivity.</p><p class=""typography-body-large-text-regular mb-800""><br><strong>About the role</strong></p><p class=""typography-body-large-text-regular mb-800"">The Automation team in Ubiquiti Pilsen office is looking for a Software Development Engineer in Test (SDET) colleague with a strong background in networking and QA automation. This role involves developing and maintaining end-to-end automated tests for our networking devices, contributing to the robustness and reliability of our products. We are looking for a proactive team player with a solid understanding of computer networks and a passion for automation and quality assurance.</p><p class=""typography-body-large-text-regular mb-800""><strong>Candidates should be prepared to work from our Pilsen office with the possibility to work occasionally from home after onboarding.</strong></p><p class=""typography-body-large-text-regular mb-800""><strong>Key Responsibilities:</strong></p><p class=""typography-body-large-text-regular mb-800"">Day-to-day work with various kind of Network type devices<br>Create, maintain and execute automated test scripts<br>Design and implement network scenarios in our test framework<br>Automation of the testing process</p><p class=""typography-body-large-text-regular mb-800""><strong>Knowledge and experience</strong></p><p class=""typography-body-large-text-regular mb-800""><br><strong>Must have:</strong></p><ul class=""typography-body-large-text-regular""><li>Solid understanding of networking concepts and protocols (L2/L3 network protocols, 802.1Q,…)</li><li>Knowledge of QA (automated / manual) workflow</li><li>Knowledge in programming languages commonly used for test automation</li><li>Attitude: ""What can be automated - should be automated""</li><li>Fluent in English and Czech</li><li>Willingness to learn new things on a regular basis</li></ul><p class=""typography-body-large-text-regular mb-800""><strong>Nice to have:</strong></p><ul class=""typography-body-large-text-regular""><li>Knowledge of Linux / Unix</li><li>Experience in unit / integration testing</li><li>Experience with network device testing and familiarity with related hardware</li><li>Experience with PHP or similar language</li><li>System Administration</li><li>DevOps (CI/CD setup &amp; administration, Terraform scripts)</li></ul><p class=""typography-body-large-text-regular mb-800""><strong>Benefits:</strong></p><ul class=""typography-body-large-text-regular""><li>Kitchen packed with food, snacks &amp; sodas, meal allowance</li><li>Flexible working hours</li><li>Informal startup atmosphere filled with excitement</li><li>Team building activities</li><li>Generous budget to select your work station according to your preferences</li><li>Competitive salary and 5 weeks of vacation per year</li><li>Discretionary bonuses based on individual performance</li><li>The newest web technologies, experimenting with the newest network HW</li><li>Comfortable office in the center of Pilsen with good transport accessibility</li></ul><p class=""typography-body-large-text-regular mb-800""><strong>To apply, please send us your CV in both English and Czech, along with a cover letter.</strong></p><p class=""typography-body-large-text-regular mb-800"">Thank you.</p></div>"
Programátor,XT-Card a.s.,https://www.jobs.cz/rpd/2000573138/,False,2025-06-07 00:00:00,,cs,,,jobscz#2000573138,,,,,,,,,,Ostrava,Ostrava,,,,,,,,,,,,,,,,,,,Ostrava,Ostrava,,,,,,,,,,,,,,,,,,,fulltime,,,,,,,,,,"<div data-jobad=""body"" data-test=""jd-body-richtext"" class=""RichContent mb-1400""><p class=""typography-body-medium-text-regular text-secondary mb-600"">Pracovní nabídka</p><p class=""typography-body-large-text-regular mb-800""><br><strong>Hledáme talentované programátory: Přidej se k nám do Ostravy!</strong></p><p class=""typography-body-large-text-regular mb-800"">Jsi čerstvý absolvent a hledáš příležitost, kde bys mohl(a) naplno využít své dovednosti a rozvíjet se v dynamickém prostředí? Nebo jsi již zkušený programátor, který touží po změně a nové výzvě? SW firma v Ostravě hledá nadšené programátory, kteří se chtějí<br> stát součástí inovativního týmu a podílet se na vývoji aplikací, které posouvají hranice možného.</p><p class=""typography-body-large-text-regular mb-800""><strong>Co budeš dělat:</strong></p><ul class=""typography-body-large-text-regular""><li>Vývoj aplikací: Pracuj na projektech využívajících čipové karty v dopravě nebo dopravní aplikace, které mají reálný dopad.</li><li>Analýza a návrh: Zjišťuj požadavky, tvoř datové modely a navrhuj uživatelské rozhraní.</li><li>Programování: Piš čistý a efektivní kód převážně v C#.</li><li>Dokumentace: Vytvářej srozumitelnou programátorskou dokumentaci, která pomůže tvým kolegům.</li></ul><p class=""typography-body-large-text-regular mb-800""><br><strong>Co od tebe očekáváme:</strong></p><ul class=""typography-body-large-text-regular""><li>IT dovednosti a analytické myšlení: Orientuješ se v oblasti informačních technologií a umíš myslet analyticky.</li><li>Znalost C# a .NET: Máš zkušenosti s .NET Core a .NET Framework.</li><li>Webové technologie: Zvládáš HTML, JavaScript a CSS.</li><li>Databáze: Pracuješ s MS SQL, vytváříš store procedury (T-SQL) a triggery.</li><li>Vzdělání: Máš minimálně středoškolské vzdělání v oblasti IT.</li><li>Osobní kvality: Jsi samostatný/á, zodpovědný/á a pečlivý/á. Bezúhonnost je samozřejmostí.</li></ul><p class=""typography-body-large-text-regular mb-800""><br><strong>Co ti nabízíme:</strong></p><ul class=""typography-body-large-text-regular""><li>Atraktivní ohodnocení: Tvá práce bude náležitě oceněna.</li><li>Kreativní a různorodé projekty: Zapojíš se do zajímavých projektů, které tě budou bavit.</li><li>Pružná pracovní doba: Pracuj tak, jak ti to vyhovuje.</li><li>Příspěvek na penzijní pojištění: Myslíme na tvoji budoucnost.</li><li>Týden dovolené navíc: Odpočinek je důležitý, proto ti dáme více volných dní.</li><li>Moderní kanceláře: Pracuj v nových kancelářích Skelet Smart innovation center v centru Ostravy.</li><li>Home office: Po zaškolení je možná částečná práce z domova, ale není podmínkou.</li><li>Příspěvek na stravu: Firma ti přispívá na stravování.</li></ul><p class=""typography-body-large-text-regular mb-800""><br><strong>Chceš začít svou kariéru ve firmě, kde tvé nápady a dovednosti skutečně ocení? Pošli nám svůj životopis a přidej se k našemu týmu v Ostravě!</strong></p></div>"
QA Engineer,CPL Jobs s.r.o.,https://www.jobs.cz/rpd/2000598442/,False,2025-06-07 00:00:00,,cs,,,jobscz#2000598442,,,,,,,,,,Ostrava,,,,,,,,,,,,,,,,,,,,Ostrava,,,,,,,,,,,,,,,,,,,,fulltime,,,,,,,,,,"<div data-jobad=""body"" data-test=""jd-body-richtext"" class=""RichContent mb-1400""><p class=""typography-body-medium-text-regular text-secondary mb-600"">Pracovní nabídka</p><p class=""typography-body-large-text-regular mb-800""><strong>Možnost spolupráce na IČO nebo HPP</strong></p><p class=""typography-body-large-text-regular mb-800"">Do našeho týmu hledáme pečlivého a samostatného QA inženýra / testera, který nám pomůže zajistit kvalitu inovativních produktů v oblasti umělé inteligence. Hledáme někoho, kdo dokáže testovat staging prostředí před nasazením do produkce, psát automatizované testy a přicházet s návrhy na zlepšení.</p><p class=""typography-body-large-text-regular mb-800""><strong>Co u nás budete dělat:</strong></p><ul class=""typography-body-large-text-regular""><li>Provádět důkladné testování aplikací před nasazením do produkce</li><li>Psát a udržovat automatizované testy (Selenium nebo jiný ekvivalentní nástroj)</li><li>Vytvářet a spravovat testovací scénáře a testovací dokumentaci</li><li>Spolupracovat s vývojovým týmem při hledání, reprodukci a reportování chyb</li><li>Pracovat v rámci agilního vývoje a používat běžné nástroje pro správu projektů a bug tracking</li></ul><p class=""typography-body-large-text-regular mb-800""><strong>Co očekáváme:</strong></p><ul class=""typography-body-large-text-regular""><li>Zkušenosti s testováním softwaru a tvorbou testovacích případů</li><li>Znalost automatizovaného testování – ideálně v Selenium, případně alternativních nástrojích</li><li>Schopnost analyticky přemýšlet a rychle se zorientovat v nových systémech</li><li>Zkušenosti s nástroji pro správu projektů a chyb (např. Jira, TestRail apod.)</li><li>Znalost agilních metodik (Scrum, Kanban)</li><li>Zájem o oblast AI technologií a ochotu učit se nové věci</li><li>Možnost občasné docházky do kanceláře v Ostravě (např. při testování nových release nebo týmové spolupráci)</li></ul><p class=""typography-body-large-text-regular mb-800""><strong>Co nabízíme:</strong></p><ul class=""typography-body-large-text-regular""><li>Spolupráci na inovativních projektech v oblasti generativní umělé inteligence</li><li>Možnost být součástí rychle rostoucího startupu</li><li>Flexibilní pracovní podmínky s kombinací práce z domova a z kanceláře</li><li>Podporu profesního růstu a přístup k nejnovějším technologiím</li><li>Přátelské a otevřené pracovní prostředí</li></ul></div>"
Technická podpora - junior,TELMAX s.r.o.,https://www.jobs.cz/rpd/2000341417/,False,2025-06-07 00:00:00,,cs,,,jobscz#2000341417,,,,,,,,,,Vysoké Mýto,Vysoké Mýto,,,,,,,,,,,,,,,,,,,Pardubice,Pardubice,,,,,,,,,,,,,,,,,,,fulltime,,,,,,,,,,"<div data-jobad=""body"" data-test=""jd-body-richtext"" class=""RichContent mb-1400""><p class=""typography-body-medium-text-regular text-secondary mb-600"">Pracovní nabídka</p><p class=""typography-body-large-text-regular mb-800""><strong>Staňte se součástí našeho týmu! Jsme stabilní a rozvíjející se firma rodinného typu působící téměř 20 let v oblasti odbavování cestujících.</strong></p><p class=""typography-body-large-text-regular mb-800""><strong>Co budete dělat?</strong></p><p class=""typography-body-large-text-regular mb-800"">Poskytovat podporu zákazníkům, implementace a testování v oblasti systémů odbavování cestujících v hromadné přepravě osob.</p><p class=""typography-body-large-text-regular mb-800"">Školit uživatele.</p><p class=""typography-body-large-text-regular mb-800"">Poskytovat poradenskou činnost uživatelům.</p><p class=""typography-body-large-text-regular mb-800"">Analyzovat nové požadavky z provozu (též předané informace od útvaru servisu a obchodu) a sestavuje zadání pro následný vývoj.</p><p class=""typography-body-large-text-regular mb-800"">Testovat nové verze software pro přípravu a zpracování dat v dopravě.</p><p class=""typography-body-large-text-regular mb-800"">Poskytovat odbornou pomoc úseku servisu a výroby.</p><p class=""typography-body-large-text-regular mb-800"">Pozice je vhodná pro absolventy</p><p class=""typography-body-large-text-regular mb-800""><strong>Jaké znalosti a dovednosti požadujeme</strong></p><p class=""typography-body-large-text-regular mb-800"">Znalost práce s PC (textový editor, tabulkový procesor, elektronická pošta, internet)</p><p class=""typography-body-large-text-regular mb-800"">Znalost problematiky HW a SW</p><p class=""typography-body-large-text-regular mb-800""><strong>Výhodou bude</strong></p><p class=""typography-body-large-text-regular mb-800"">Znalost MSSQL - výhodou</p><p class=""typography-body-large-text-regular mb-800"">ŘP skupiny „B“</p><p class=""typography-body-large-text-regular mb-800"">Analytické schopnosti</p><p class=""typography-body-large-text-regular mb-800""><strong>Co vám můžeme nabídnout?</strong></p><p class=""typography-body-large-text-regular mb-800"">Odpovídající mzdové ohodnocení</p><p class=""typography-body-large-text-regular mb-800"">Flexibilní pracovní doba s možností home-office</p><p class=""typography-body-large-text-regular mb-800"">Odborné a jazykové kurzy na pracovišti</p><p class=""typography-body-large-text-regular mb-800"">Přístup k nejmodernějším technologiím a postupům</p><p class=""typography-body-large-text-regular mb-800"">Možnost profesního i kariérního růstu</p><p class=""typography-body-large-text-regular mb-800"">Stanete se součástí inovativního prostředí a mladého kolektivu</p><p class=""typography-body-large-text-regular mb-800"">Firemní notebook, mobilní telefon</p><p class=""typography-body-large-text-regular mb-800"">5 dní sick days</p></div>"
Technický poradce SW,"MEDIAN, s.r.o.",https://www.jobs.cz/rpd/2000596540/,False,2025-06-07 00:00:00,,cs,,,jobscz#2000596540,,,,,,,,,,Praha,,,,,,,,,,,,,,,,,,,,Praha,,,,,,,,,,,,,,,,,,,,fulltime,parttime,,,,,,,,,"<div data-jobad=""body"" data-test=""jd-body-richtext"" class=""RichContent mb-1400""><p class=""typography-body-medium-text-regular text-secondary mb-600"">Pracovní nabídka</p><p class=""typography-body-large-text-regular mb-800"">Do svého týmu klientské podpory, pro unikátní softwary, analýzu dat a plánování, hledáme komunikativního kolegu/kolegyni na pozici:</p><h2 class=""typography-heading-small-text"">Technický poradce SW</h2><p class=""typography-body-large-text-regular mb-800"">Jsi otevřený(á) a rád(a) komunikuješ s druhými? Přicházíš záhadám na kloub a nevyřešené Tě nenechává v klidu? Umíš druhým věci vysvětlit a pomoci jim s problémem? Pokud ano, pak neváhej a přidej se k nám…</p><p class=""typography-body-large-text-regular mb-800""><strong>Tvou pracovní náplní bude:</strong></p><ul class=""typography-body-large-text-regular""><li>komunikace s klienty (a to jak osobně, tak i formou vzdálené podpory)</li><li>řešení technických problémů se SW a službami k němu přidružené</li><li>správa a zajištění plynulého chodu podpory</li><li>testování vyvíjeného software</li><li>zabezpečení telefonické podpory klientů</li><li>v budoucnu školení klientů</li></ul><p class=""typography-body-large-text-regular mb-800""><strong>Co od Tebe očekáváme:</strong></p><ul class=""typography-body-large-text-regular""><li>ochotu se stále učit</li><li>spolehlivost</li><li>dobrou znalost Windows a MS Office</li><li>analytické a logické myšlení</li><li>základy programování (BAT, SQL, PHP, HTML) výhodou</li><li>znalost administrace Windows server výhodou</li><li>znalost práce na SW a HW supportu výhodou</li><li>min. SŠ vzdělání</li></ul><p class=""typography-body-large-text-regular mb-800""><strong>Nabízíme Ti:</strong></p><ul class=""typography-body-large-text-regular""><li>práci v přední české agentuře pro výzkum trhu a vývoj software s dlouholetou tradicí a respektem na trhu</li><li>prostor pro vlastní kreativitu při návrhu řešení a možnost ovlivnění dalšího vývoje produktu</li><li>být součástí unikátního mezinárodního projektu</li><li>možnost dlouhodobě se podílet na rozvoji našich projektů</li><li>pružnou pracovní dobu (výhledově možnost částečné práce z domova)</li><li>příjemné, neformální prostředí a přátelský kolektiv</li><li>další zaměstnanecké benefity jako například stravenky, multisport karta, podporu odborného a jazykového vzdělávání, 3 dny sick days v průběhu roku, po 2 letech ve firmě další týden volna navíc, firemní akce, firemní mobilní tarif, možnost využití zdarma objektu v jižních Čechách, Bratislavě k rekreaci atd.</li></ul><p class=""typography-body-large-text-regular mb-800"">Nebudeme-li Vás kontaktovat do tří týdnů od přijetí Vašeho životopisu, byla v prvním kole výběrového řízení dána přednost jinému kandidátovi.</p></div>"
QA Engineer pro automatizaci,"GRiT, s.r.o.",https://www.jobs.cz/rpd/2000595552/,False,2025-06-07 00:00:00,,cs,,,jobscz#2000595552,,,,,,,,,,Brno,Staré Hobzí,,,,,,,,,,,,,,,,,,,Brno,České Budějovice,,,,,,,,,,,,,,,,,,,fulltime,,,,,,,,,,"<div data-jobad=""body"" data-test=""jd-body-richtext"" class=""RichContent mb-1400""><p class=""typography-body-medium-text-regular text-secondary mb-600"">Pracovní nabídka</p><p class=""typography-body-large-text-regular mb-800""><strong>Hledáme QA Engineera se zaměřením na automatizaci do našeho týmu v Brně💻</strong></p><p class=""typography-body-large-text-regular mb-800"">Náš brněnský QA tým právě prochází změnou, zefektivňuje procesy, rozvíjí automatizaci a čeká ho strukturální proměna. Co je ale jisté, že nám jedna součástka, která by měla být součástí všech těchto změn, chybí. A to nová posila, která s námi bude posouvat automatizované testování pro naše SaaS řešení WMS Lokia pro řízení skladů.</p><p class=""typography-body-large-text-regular mb-800""><strong>Co TĚ u nás čeká: </strong></p><ul class=""typography-body-large-text-regular""><li>Budeš psát automatizované testy a tvořit testovací scénáře.</li><li>Aktivně budeš pracovat ve framework Selenium, kde tvoříme v  Javě.</li><li>Podívat se na stávající procesy novýma očima, přemýšlet, co jak by šlo optimalizovat.</li><li>Denně testovat systém a také jeho mobilní aplikaci, hledat chybičky.</li></ul><p class=""typography-body-large-text-regular mb-800""><strong>Co u TEBE potřebujeme: </strong></p><ul class=""typography-body-large-text-regular""><li>Aktivitu. Nečekat na zadání, pečlivě procházet systém a manuálně testovat.</li><li>Algoritmizace, to je to, co budeš potřebovat.</li><li>Znalost frameworku Selenium. Ten využíváme pro automatizaci.</li><li>Přístup. Když nevím, neumím, přemýšlím, kde to zjistím, jak to udělám. Někdy se tomu říká “chuť se učit a posouvat” 😊</li></ul><p class=""typography-body-large-text-regular mb-800""><strong>Co by se TI mohlo hodit? </strong></p><ul class=""typography-body-large-text-regular""><li>Jako ticketovací systém používáme JIRU (v budoucnu nejspíš s rozšířením xRay) nebo jiného ticketovacího a test management toolu.</li><li>Znalost logistických procesů.</li><li>Pokud ses potkal s TeamCity anebo jiným buildovacím nástrojem.</li><li>SQL a Git - víš, o co jde.</li></ul><p class=""typography-body-large-text-regular mb-800""><strong>Na co se u NÁS můžeš těšit?</strong></p><ul class=""typography-body-large-text-regular""><li>Na fajn tým pod vedením Lukáše, jako vedoucího vývoje a jeho čtyř vývojářů a dvě QA holky 😊</li><li>Nejen v Developmentu panuje příjemná neformální kultura s otevřenou komunikací, a kde si všichni tykáme.</li><li>GRiT je místo, kde můžeš růst, realizovat své vize a dělat práci, která tě opravdu baví.</li><li>Na příjemné kanceláře přímo ve středu města, s výbornou kávou samozřejmě.</li><li>Flexibilní pracovní doba, s možností home office (není to sprosté slovo 😊).</li><li>Balíček benefitů – týden volna navíc, sick days, stravenkový paušál, firemní výuka angličtiny/němčiny, příspěvky na životní nebo penzijní pojištění, benefitní kartu UP (eBenefity), Multisportka, finanční příspěvky při významných životních událostech nebo pracovních výročí.</li><li>Pravidelné firemní akce (jarní teambuilding, vánoční večírek).</li></ul></div>"
