"Data & Automation Analyst (VBA, SQL, Power BI, RPA",ZKW,https://www.linkedin.com/jobs/view/4348701190/?utm_source=juniorguru,False,2025-12-05 00:00:00,,en,,,linkedin#4348701190,,,,,,,,,,Olomouc,,,,,,,,,,,,,,,,,,,,Olomouc,,,,,,,,,,,,,,,,,,,,fulltime,,,,,,,,,,"<strong>Company Description<br></strong> <p>The ZKW Group specializes in innovative, premium lighting systems and electronic modules for the automotive sector. As part of LG Electronics Vehicle Solutions since 2018, ZKW stands as a trusted global partner to leading automotive manufacturers. With over 10,000 employees across 12 worldwide locations, ZKW is dedicated to creating groundbreaking products that improve vehicle appeal, safety, and energy efficiency. The company is committed to advanced technologies and holistic lighting solutions, supporting renowned clients such as BMW, Mercedes-Benz, Volvo, and Audi, among others.<br></p> <strong>Role Description<br></strong> <p>This is a full-time hybrid position based in Olomouc, combining in-office work with opportunities to work from home. The Data &amp; Automation Analyst will focus on developing automated processes and analyzing data using VBA, SQL, Power BI, and RPA tools. Responsibilities include designing data models, performing data analyses, building automation workflows, ensuring accuracy through testing, and creating dashboards to support decision-making across the organization.<br></p> <strong>Qualifications<br></strong> <ul><li>Proficiency in Analytical Skills and Reporting.</li><li>Strong Communication and Collaboration capabilities to work within cross-functional teams.</li><li>Experience in Testing and validating automated workflows and data processes.</li><li>Knowledge of Process Automation and Automation Tools, including VBA, RPA technologies, SQL, and Power BI.</li><li>Detail-oriented with the ability to work methodically and prioritize tasks efficiently.</li><li>Bachelor's degree in Computer Science, Data Analytics, Engineering, or a related field.</li><li>Relevant experience in process automation or data analysis within the automotive or manufacturing industry is an advantage.</li></ul>"
CYBERSECURITY ENGINEER,IBM,https://www.linkedin.com/jobs/view/4325946062/?utm_source=juniorguru,False,2025-12-05 00:00:00,,en,,,linkedin#4325946062,,,,,,,,,,Praha,,,,,,,,,,,,,,,,,,,,Praha,,,,,,,,,,,,,,,,,,,,parttime,,,,,,,,,,"<strong>Introduction<br><br></strong>Curious about the next frontier in cybersecurity where quantum computing meets data protection? Want to understand how IBM is pioneering the transition to quantum-resistant security? You don‘t need a PhD in mathematics, just a passion for cybersecurity and willingness to explore new technologies! Familiarity with cryptographic concepts and network security will help you quickly master post-quantum standards like ML-KEM or ML-DSA, but you can start contributing from day one while learning on the job!<br><br>You will gain expertise in IBM‘s quantum-resistant security solutions. You will explore the fundamentals of quantum threats and quantum-safe cryptography within selected industry sectors, and you will implement basic post-quantum algorithms to solve real-world security challenges.<br><br>We are offering you<br><br><ul><li>Potential job offer</li><li>Mentoring from IBM employee</li><li>Opportunity to get hands-on experience with quantum-safe technologies</li><li>First step to start career in Cybersecurity consulting</li><li>Work in multicultural and multi-language team</li><li>Inclusive and open-minded team where initiative is appreciated, and feedback is considered<br><br></li></ul><strong>Your Role And Responsibilities<br><br></strong><ul><li>Research quantum computing threats to current cryptographic systems and support senior consultants in industry-specific assessments</li><li>Learn fundamentals of post-quantum cryptography and assist in evaluating quantum-resistant security tools under supervision</li><li>Support development of quantum security pilots and contribute to testing quantum-safe implementations in controlled environments</li><li>Support senior team members in cryptographic assessment projects<br><br></li></ul><strong>Required Technical And Professional Expertise<br><br></strong><ul><li>Ambition to learn new things (even challenging ones like post-quantum security ind impacts)</li><li>Symmetric vs Asymmetric encryption understanding (AES, RSA, ECC)</li><li>Identity and access management (IAM) principles</li><li>Understanding of cybersecurity fundamentals (CIA triad, risk management)</li><li>Understanding encryption at rest vs in transit implementation</li><li>Basic Python knowledge (C/C++ or Containers or Linux advance is plus for you)</li><li>Active studies in Cyber security, Software Engineering, or any other IT-related field</li><li>Readiness to participate in integration projects with state-of-the-art IBM technologies</li></ul>"
Student Penetration Tester,Siemens Healthineers,https://www.linkedin.com/jobs/view/4348553469/?utm_source=juniorguru,False,2025-12-05 00:00:00,,en,,,linkedin#4348553469,,,,,,,,,,Žilina,,,,,,,,,,,,,,,,,,,,Žilina,,,,,,,,,,,,,,,,,,,,parttime,,,,,,,,,,"We are looking for student to join us in our daily cybersecurity tasks. Together we will shape cybersecurity for healthcare. You can join our team in Bratislava, Zilina or Kosice.<br><br><strong>Your tasks will be the following:<br><br></strong><ul><li>Execute penetration tests and security assessments on internal and external networks, Windows and Linux environments, cloud (AWS and Azure) architecture, IoT devices, and more under supervision. </li><li>Identify incorrect configurations and security vulnerabilities on Windows and Linux servers. </li><li>Execute manual and automatic testing fuzzing. </li><li>Safely utilize tools, tactics, and procedures used in penetration testing engagements. </li><li>Provide technical guidance for remediation of findings. </li><li>Perform basic web penetration testing tasks (OWASP TG). </li><li>Examine decompiled/source code. <br><br></li></ul><strong>What are we expecting? <br><br></strong><ul><li>Education</li><li>Student</li><li>Language</li><li>English – advanced.</li><li>Professional skills</li><li>Student of the University or student of the Middle school<br><br></li></ul><strong>A good understanding of the following concepts is welcomed:<br><br></strong><ul><li>Windows and Linux access controls, administration and user management.</li><li>Some understanding of Authentication and Authorization models.</li><li>Web server administration concepts.</li><li>Experience with security concepts of databases (MS SQL, Oracle DB, PostgreSQL, MySQL).</li><li>The candidate is expected to have a basic understanding of the following concepts:</li><li>Application development.</li><li>Java/C#/Python/C programming.</li><li>Web penetration testing (OWASP).</li><li>Automatic vulnerability scanners.</li><li>Nice to have</li><li>Work experience in other IT fields (system administrator, network security, cloud security etc.)<br><br></li></ul><strong>Basic salary component (gross) and other remuneration:</strong> The offered remuneration is from 8€ gross / hour. Depending on experience + after incorporation possibility to increase.<br><br><strong>What do we offer:<br><br></strong><ul><li>Long-term part-time job during your studies with the opportunity to gain experience in an international company and try out other positions</li><li>Possibility to work 20 hours a week with flexible working hours</li><li>Possibility of self-realization in an international corporate environment</li><li>Meal vouchers<br><br></li></ul><strong>How we work:<br><br></strong>When you join Siemens Healthineers, you become one in a global team of scientists, clinicians, developers, researchers, professionals, and skilled specialists, who believe in each individual’s potential to contribute with diverse ideas. We are from different backgrounds, cultures, religions, political and/or sexual orientations, and work together, to fight the world’s most threatening diseases and enable access to care, united by one purpose: to pioneer breakthroughs in healthcare. For everyone. Everywhere. Sustainably. Check our Careers Site at https://www.siemens-healthineers.com/sk<br><br>As an equal opportunity employer, we welcome applications from individuals with disabilities."
IT Trainee,IBM,https://www.linkedin.com/jobs/view/4348692426/?utm_source=juniorguru,False,2025-12-05 00:00:00,,en,,,linkedin#4348692426,,,,,,,,,,Bratislava,,,,,,,,,,,,,,,,,,,,Bratislava,,,,,,,,,,,,,,,,,,,,fulltime,,,,,,,,,,"<strong>Introduction<br><br></strong>A career in IBM Consulting is rooted by long-term relationships and close collaboration with clients across the globe. You'll work with visionaries across multiple industries to improve the hybrid cloud and AI journey for the most innovative and valuable companies in the world. Your ability to accelerate impact and make meaningful change for your clients is enabled by our strategic partner ecosystem and our robust technology platforms across the IBM portfolio<br><br><strong>Your Role And Responsibilities<br><br></strong>What you can expect?<br><br><ul><li> You’ll begin your career learning the basics of IBM Slovakia, working alongside experienced experts on client engagements.</li><li> Our aim is to help you move as quickly as possible. Your experience duration will be up to 6 months with a subsequent chance to convert into a regular job.</li><li> Once you have mastered the basics, you’ll develop skills in other IBM processes such as IT solution delivery &amp; design, project management, and methodology, while working with big-name clients where IBM have a significant presence.<br><br></li></ul><strong>You Will Have The Opportunity To<br><br></strong><ul><li> Become part of our diverse and multinational community and collaborate with global and local teams</li><li> Work on real-world-class IT projects for leading companies</li><li> Gain knowledge and develop skills through on-the-job training</li><li> Balance your work with your study and enjoy flexible working<br><br></li></ul><strong>Preferred Education<br><br></strong>Bachelor's Degree<br><br><strong>Required Technical And Professional Expertise<br><br></strong><ul><li> Attitude and interest in an IT Engineer/ Specialist / Consultant career</li><li> Adaptability, Communication, Creative, Problem Solving, Taking Ownership, Teamwork and Collaboration</li><li> Ability to make decisions, take on responsibilities and have the ability to adapt, change and re-prioritize your plans in a dynamic and fast paced environment</li><li> English is a must</li><li> Communicative German is a huge advantage</li><li> Bachelor’s or expected Master degree (Mathematics, Computer science, Information Technology, Engineering)</li></ul>"
WW Data Analytics Intern,Lenovo,https://www.linkedin.com/jobs/view/4206217857/?utm_source=juniorguru,False,2025-12-05 00:00:00,,en,,,linkedin#4206217857,,,,,,,,,,Bratislava,,,,,,,,,,,,,,,,,,,,Bratislava,,,,,,,,,,,,,,,,,,,,parttime,,,,,,,,,,"We are Lenovo. We do what we say. We own what we do. We WOW our customers.<br><br>Lenovo is a US$69 billion revenue global technology powerhouse, ranked #196 in the Fortune Global 500, and serving millions of customers every day in 180 markets. Focused on a bold vision to deliver Smarter Technology for All, Lenovo has built on its success as the world’s largest PC company with a full-stack portfolio of AI-enabled, AI-ready, and AI-optimized devices (PCs, workstations, smartphones, tablets), infrastructure (server, storage, edge, high performance computing and software defined infrastructure), software, solutions, and services. Lenovo’s continued investment in world-changing innovation is building a more equitable, trustworthy, and smarter future for everyone, everywhere. Lenovo is listed on the Hong Kong stock exchange under Lenovo Group Limited (HKSE: 992) (ADR: LNVGY).<br><br>This transformation together with Lenovo’s world-changing innovation is building a more inclusive, trustworthy, and smarter future for everyone, everywhere. To find out more visit www.lenovo.com, and read about the latest news via our StoryHub.<br><br>We are seeking a motivated<strong>Data Analytics Intern</strong>to join our Data Analytics Reporting team. This internship offers hands-on experience in SQL, data analysis, and automation to help drive insightful business decisions. You will assist with developing, optimizing, and automating data reporting processes, supporting our teams mission to enhance data accessibility and efficiency across departments.<br><br><strong>Responsibilities<br><br></strong><ul><li>Design, write, and optimize SQL queries to retrieve, transform, and manipulate data for reporting purposes.</li><li>Develop automated workflows and scripts to streamline data processing and reporting tasks.</li><li>Collaborate with team members to identify opportunities for improving data pipeline efficiency and effectiveness.</li><li>Support the creation of dashboards and reporting tools for real-time analytics using Qlik / Power BI.</li><li>Troubleshoot data issues, ensure data integrity, and document key processes and workflows.</li><li>Contribute to team projects aimed at enhancing data quality, governance, and compliance.<br><br></li></ul><strong>Qualifications<br><br></strong><ul><li>Currently pursuing a degree in Data Analytics, Computer Science, Information Systems, or any related field.</li><li>Fluent English.</li><li>Availability for 20 hours per week.</li><li>Strong understanding of SQL, data structures, and database concepts.</li><li>Proficiency with data visualization and analytics tools (e.g., Qlik, Power BI) is a plus, familiarity with programming or scripting languages (e.g., Python) is a plus.</li><li>Excellent analytical and problem-solving skills, with a keen attention to detail.</li><li>Ability to work independently, prioritize tasks, and manage time effectively.<br><br></li></ul><strong>What Youll Gain<br><br></strong><ul><li>Hands-on experience with SQL, automation, and data analytics in a real-world business setting.</li><li>Exposure to best practices in data reporting, process automation, and workflow optimization.</li><li>Mentorship from industry professionals in data analytics and reporting.</li><li>An opportunity to make meaningful contributions to a data-driven team.<br><br></li></ul><strong>What We Offer<br><br></strong><ul><li>Schedule: 20 hours per week</li><li>Salary: 7.00 EUR per hour</li><li>An open and stimulating environment within one of the most forward thinking IT companies.</li><li>A modern and flexible way of working to combine personal and professional life</li><li>An international team with a high focus on Diversity Inclusion<br><br></li></ul><strong>We are looking forward to discussing this position with you soon!<br><br></strong><em>We are an Equal Opportunity Employer and do not discriminate against any employee or applicant for employment because of race, color, sex, age, religion, sexual orientation, gender identity, national origin, status as a veteran, and basis of disability or any federal, state, or local protected class.</em>"
System Specialist - Virtualization & Automation,Livesport,https://www.linkedin.com/jobs/view/4342159028/?utm_source=juniorguru,False,2025-12-05 00:00:00,,cs,,,linkedin#4342159028,,,,,,,,,,Praha,,,,,,,,,,,,,,,,,,,,Praha,,,,,,,,,,,,,,,,,,,,fulltime,,,,,,,,,,"V Livesportu chceme <strong>dodávat všechna důležitá sportovní data okamžitě, jakmile se stanou.</strong> Stavíme vlastní produkty, vlastní infrastrukturu a fungujeme v měřítku, které je v Česku výjimečné. Abychom to zvládli, <strong>potřebujeme rychlá, spolehlivá a škálovatelná řešení na vlastním on-premise stacku</strong>.<br><br>Jsme tým <strong>šesti zkušených systémových specialistů</strong>, kteří mají v rukou platformu, na níž běží všechny Livesport aplikace. A ty můžeš být jeden z nich. Tvůj každodenní výsledek má přímý dopad na to, jak rychle a spolehlivě se sportovní data dostanou k našim uživatelům. Stavíme <strong>řešení, která jsou efektivní, inovativní a dlouhodobě udržitelná</strong> – a díky nim můžeme být globálním lídrem.<br><br>Co tě u nás čeká?<br><br>Budeš součástí <strong>Infrastrukturního týmu Automation &amp; Virtualization, který má na starosti stabilní provoz, údržbu a rozvoj celé on-premise platformy Livesportu</strong>. To znamená:<br><br><ul><li>Provozuješ Proxmox virtualizaci, servery konfiguruješ Puppetem (který pro kolegy i provozuješ), pracuješ s Ceph clustery, Kubernetes a dalšími open-source technologiemi.</li><li>Staráš se o to, aby platforma byla bezpečná, aktuální, spolehlivá a připravená na růst trafficu.</li><li>Tvoji “zákazníci” budou interní týmy — systémoví administrátoři a vývojáři. Dostaneš od nich požadavky, které přetavíš do funkčních a automatizovaných řešení.</li><li>Kromě provozu řešíš i rozvoj — vymýšlet, jak něco zjednodušit, automatizovat nebo zrychlit.</li><li>Budeš pracovat s vlastním hardwarem v našich datacentrech — žádný cloud.</li><li>Tvůj nejbližší tým komunikuje česky a slovensky, ale budeš spolupracovat i s anglicky mluvícími kolegy.<br><br><br></li></ul>Hledám tebe, protože:<br><br>Potřebujeme specialistu, který <strong>miluje infrastrukturu, virtualizaci, Linux a rozumí si se sítěmi.<br><br></strong><strong>Rozhodně ti nechybí:<br><br></strong><ul><li>Výborná znalost Linuxu (Debian/Ubuntu) – na tom stojí všechno, co děláme.</li><li>Linux networking – potřebuješ chápat, co se pod tím vším děje, abys mohl stavět řešení nad tím.</li><li>Skriptování/programování (Bash, Python) – bez automatizace to nejde.</li><li>Zkušenost s kontejnery – Docker, Podman, cokoliv, co ti dá kontext.</li><li>Základy virtualizace – aby ses hned chytil v Proxmoxu.<br><br><br></li></ul><strong>A potěší nás (ale není to podmínkou), když:<br><br></strong><ul><li>Se orientuješ v cloudovém prostředí (Google, AWS, …),</li><li>Nejsou ti cizí pokročilejší technologie počítačových sítí (LACP, STP, BGP, …)</li><li>Máš zkušenosti s nějakou Linux-based OpenSource virtualizací</li><li>Už sis někdy sáhnul na CEPH Storage</li><li>Umíš něco naprogramovat v Golangu</li><li>Měl jsi ve správě nějaké Kubernetes clustery (deployment, integrace, lifecycle, …)<br><br><br></li></ul>Co ti nabízíme?<br><br><ul><li>🎓Dostatek času na osobní růst a vzdělávání s neomezenými možnostmi, včetně školení a konferencí všude možně po světě - nejen jako účastník.</li><li>💰Roční bonus dle výsledků firmu a mimořádné odměny.</li><li>💻Prvotřídní vybavení, od ergonomických pracovišť s výškově nastavitelnými stoly až po špičkový hardware. Máš možnost volby mezi Mac a Dell. Samozřejmostí je také telefon a tarif s neomezenými daty.</li><li>🌿Kanceláře na Nových Butovicích s parkováním, dvěma fitkama a relaxační zónou s fotbálkem nebo šipkami. Pracujeme v prostředí, které podporuje jak tvou profesionální, tak osobní pohodu.</li><li>🎉Několik akcí ročně - od meetupů, přes pravidelné sportovní turnaje každý měsíc, až po nezapomenutelné vánoční večírky, kde můžeš strávit čas s kolegy i mimo pracovní prostředí.</li><li>🍔Kredit do restaurace v naší budově, aby sis mohl vychutnat vynikající jídlo v pohodě a bez starostí.</li><li>🌴Samozřejmostí je bonus za doporučení kolegy a 25 dnů dovolené.<br><br><br></li></ul>Zaujali jsme tě?<br><br>Pokud <strong>chceš pracovat na skutečně velké platformě, která běží převážně on-premise</strong>, spravovat vlastní hardware v našich datacentrech, řešit <strong>traffic pro stovky milionů uživatelů</strong> po celém světě a používat <strong>moderní open-source technologie</strong>, přidej se k nám.<br><br>Těšíme se na tebe,<br><br>Mirek (Team lead) a Klára (Recruiterka)"
Junior Global Web Producer,ESET,https://www.linkedin.com/jobs/view/4296208555/?utm_source=juniorguru,False,2025-12-05 00:00:00,,en,,,linkedin#4296208555,,,,,,,,,,Bratislava,,,,,,,,,,,,,,,,,,,,Bratislava,,,,,,,,,,,,,,,,,,,,fulltime,,,,,,,,,,"<strong>Summary<br><br></strong>Join ESET’s global team of digital enthusiasts! We’re driving ESET’s online presence from Japan through United Kingdom to USA and Argentina. Become the specialist in Web Production across diverse set of websites, landing pages, and campaigns – globally.<br><br><strong>Job Description<br><br></strong>We’re looking for a motivated web specialist with background in frontend technologies – HTML5, CSS3, JS. You’ll be in touch with our Digital, Development, Marketing, Sales, and Product colleagues and have your say in how web initiatives are created, tested, and launched – globally.<br><br>We need you to have an eye for detail, yet still see the big picture of digital business. To handle creative and agile assignments while think in terms of processes and patterns in the long run. If you’re data-driven, empathic, creative, and your English is fluent, this might be the position for you.<br><br>On top of ESET’s regular employee perks, we offer an engaging, ingenious, and impactful job – globally.<br><br><strong>As our Web Producer you will:<br><br></strong><ul><li> Upload web content using the global content management system (CMS).</li><li> Integrate provided content with web design, templates, and best practices.</li><li> Produce page and element prototypes via prototyping tools, CMS, or HTML/CSS.</li><li> Create landing pages, supports product/campaign launches, and drive large-scale web updates.</li><li> Submit feature requests for CMS, cooperate on their prototyping, specification, and acceptance testing.</li><li> Cooperate with digital specialists and creatives on web production, prototyping, iterations and testing.</li><li> Publish web changelogs, documents content inventory, and CMS functionality to facilitate smooth content adoption globally.</li><li> Work closely with other digital teams to improve web UX, conversion rates, performance, and SEO.<br><br></li></ul><strong>The position is a maternity/parental leave cover.<br><br></strong><strong>Basic wage component (brutto): </strong><strong>from 1700 EUR<br><br></strong>Performance bonus 2 times per year up to 10% of the basic salary paid for the evaluation period (usually 6 months).<br><br>* The final basic wage component can be increased accordingly to individual skills and experience of the selected candidate.<br><br><br><br><strong><br><br>At ESET, diversity, equity, and inclusion (DEI) are integral to our corporate culture. We believe in creating a respectful environment, where everyone feels valued and respected, welcoming applications from individuals of all backgrounds, including race, gender, age, religion, disability, and sexual orientation.</strong>"
Intern - Technical,Siemens,https://www.linkedin.com/jobs/view/4325754961/?utm_source=juniorguru,False,2025-12-05 00:00:00,,sk,,,linkedin#4325754961,,,,,,,,,,Bratislava,,,,,,,,,,,,,,,,,,,,Bratislava,,,,,,,,,,,,,,,,,,,,parttime,,,,,,,,,,"Pracovník zamestnaný na čiastočný úväzok alebo ako dočasná výpomoc pre rozličné<br><br>technické úlohy a činnosti. Vykonáva činnosti, aktivity a úlohy podľa zadania od nadriadeného alebo supervízora. Učí sa a získava príslušnú teóriu a know-how, techniky, metódy, nástroje a procesy v príslušnej oblasti.<br><br>Podporuje ďalších kvalifikovaných pracovníkov v ich úlohách a zodpovednostiach. Zdokonaľuje nadobudnuté teoretické vedomosti, techniky a metódy v praxi"
