Začínající Datový Analytik,Cross Masters s.r.o.,https://www.jobs.cz/rpd/2000541733/,False,2025-04-11 00:00:00,,cs,,,jobscz#2000541733,,,,,,,,,,Praha,Praha,,,,,,,,,,,,,,,,,,,Praha,Praha,,,,,,,,,,,,,,,,,,,fulltime,,,,,,,,,,"<div data-jobad=""body"" data-test=""jd-body-richtext"" class=""RichContent mb-1400""><p class=""typography-body-medium-text-regular text-secondary mb-600"">Pracovní nabídka</p><p class=""typography-body-large-text-regular mb-800"">Hledáme talentovaného a ambiciózního <strong>začínajícího datového analytika</strong>, který má smysl pro projektové řízení a porozumění byznysovým požadavkům v <strong>oblasti webové analytiky a digitálního marketingu</strong>. Pokud se chcete zapojit do týmu datových expertů, kteří spolupracují s inovativními klienty v Čechách i v zahraničí, pak je tato pozice pro vás ideální.</p><p class=""typography-body-large-text-regular mb-800"">Jako člen našeho týmu budete mít příležitost pracovat s nejmodernějšími nástroji pro webovou analytiku a vizualizaci dat, jako například <strong>Google Analytics, Piano Analytics, Google Tag Manager a Power BI, Python, JavaScript</strong>. Kromě práce s produkty třetích stran, budete mít také možnost se podílet na vývoji interních produktů používaných pro webovou analytika být klíčovým kolegou v tomto procesu.</p><h2 class=""typography-heading-small-text"">Hlavní úkoly:</h2><ul class=""typography-body-large-text-regular""><li>Transformace byznysových požadavků na konkrétní požadavky</li><li>Sběr a analýza dat z webových stránek pomocí nástrojů pro webovou analytiku</li><li>Datové analýzy a integrace datových toků</li><li>Vytváření a prezentování zpráv o výsledcích analýz dat</li><li>Podpora projektů v oblasti webové analytiky, komunikace s klienty, plánování aktivit, koordinace ostatních</li></ul><h2 class=""typography-heading-small-text"">Požadavky:</h2><ul class=""typography-body-large-text-regular""><li>Silné organizační a komunikační schopnosti</li><li>Schopnost pracovat samostatně</li><li>Schopnost analyzovat a hledat řešení problémů</li><li>Schopnost přetvořit byznysová zadání do konkrétních požadavků</li><li>Vysokoškolské vzdělání</li><li>Chuť se učit a rozvíjet</li><li>Výborná znalost MS Excel</li><li>Perfektní znalost češtiny</li><li>Angličtina na komunikační úrovni (minimálně B2)</li><li>Docházet osobně do kanceláře minimálně 3x týdně</li></ul><h2 class=""typography-heading-small-text"">Výhodou:</h2><ul class=""typography-body-large-text-regular""><li>Zkušenosti s projektovým managementem</li><li>Ambice řídit projekty od začátku až do konce</li><li>Základní znalosti v oblasti webové analytiky a nástrojů, jako jsou Google Analytics, Adobe Analytics a Piano Analytics, Google Tag Manager atd.</li><li>Základní znalosti programování, jako je HTML, CSS, JavaScript, Python, R, SQL</li><li>Předchozí zkušenost s digitálním marketingem nebo zpracováním dat obecně</li><li>Znalosti z oboru statistiky</li></ul><h2 class=""typography-heading-small-text"">Nabízíme:</h2><ul class=""typography-body-large-text-regular""><li>Příležitost pracovat v rostoucí firmě v oblasti digitálního marketingu</li><li>Práci na různorodých úkolech/projektech</li><li>Možnost se neustále učit a rozvíjet své schopnosti v oblasti datové analytiky</li><li>Flexibilní pracovní dobu včetně možnosti home office</li><li>Možnosti kariérního růstu</li><li>Silný tým seniorních pracovníků, kteří vás dokážou posouvat na vyšší úroveň</li><li>Propracovaný edukační program</li><li>Káva, čaj a mísa ovoce neustále k dispozici</li><li>Kancelář v centru Prahy (Masarykovo nádraží)</li><li>Mladý, ambiciózní kolektiv a přátelské prostředí</li><li>Stabilitu (Firma Cross Masters je na trhu již od roku 2007 a naprostá většina původních zaměstnanců je ve firmě stále.)</li><li>Budget na vybavení svého pracovního místa</li><li>Bonusový systém na základě odváděné práce</li><li>Rostoucí dovolená podle odpracovaných let</li><li>Stravenky</li></ul><h2 class=""typography-heading-small-text"">Nástup:</h2><ul class=""typography-body-large-text-regular""><li>inhed nebo dle dohody co nejdříve</li></ul><p class=""typography-body-large-text-regular mb-800"">Tato pozice nabízí <strong>výzvu a zároveň příležitost rozvíjet své analytické schopnosti a získávat cenné zkušenosti</strong> v oblasti digitálního marketingu. Pokud máte nadšení pro data a jejich analýzu a chcete se stát součástí dynamického týmu odborníků na webovou analytiku a digitální marketing, pak nám pošlete svůj životopis a těšíme se na vaši odpověď.</p></div>"
Vývojář tiskových šablon,NESS Czech,https://www.jobs.cz/rpd/2000563745/,False,2025-04-11 00:00:00,,cs,,,jobscz#2000563745,,,,,,,,,,Praha,,,,,,,,,,,,,,,,,,,,Praha,,,,,,,,,,,,,,,,,,,,fulltime,,,,,,,,,,"<div data-jobad=""body"" data-test=""jd-body-richtext"" class=""RichContent mb-1400""><p class=""typography-body-medium-text-regular text-secondary mb-600"">Pracovní nabídka</p><p class=""typography-body-large-text-regular mb-800"">Jsme Ness Czech, technologická společnost zaměřená na dodávku komplexních IT řešení pro významné klienty napříč různými sektory. Naše týmy pracují na strategických projektech s dlouhodobým dopadem a vysokou technologickou náročností.</p><p class=""typography-body-large-text-regular mb-800"">Aktuálně hledáme nového kolegu do našeho týmu, který je dlouhodobě relokovaný na projekt pro jednoho z největších telekomunikačních operátorů v České republice. Společně se podílíme na vývoji a modernizaci systémů, které zajišťují zákaznickou komunikaci pro miliony uživatelů.</p><h2 class=""typography-heading-small-text"">O co jde?</h2><p class=""typography-body-large-text-regular mb-800"">Hledáme šikovného a samostatného vývojáře, který se připojí k našemu týmu a bude se podílet na tvorbě a migraci tiskových šablon pro zákaznické dokumenty. Pracujeme s nástroji jako GMC Inspire / PrintNet.</p><p class=""typography-body-large-text-regular mb-800"">Tvým hlavním úkolem bude přepis šablon z původního řešení do nového, jejich údržba a další vývoj. Pokud máš <strong>zkušenosti se skriptováním v JavaScriptu a rozumíš HTML a XML</strong>, zbytek tě rádi naučíme!</p><h2 class=""typography-heading-small-text"">Co budeš dělat?</h2><ul class=""typography-body-large-text-regular""><li>Vyvíjet a upravovat tiskové šablony pro automatizované generování dokumentů (např. smlouvy, faktury, výpisy).</li><li>Programovat logiku šablon pomocí JavaScriptu a HTML.</li><li>Pracovat s datovými vstupy ve formátu XML.</li><li>Převádět šablony z původního nástroje (GMC) do nového řešení.</li><li>Úzce spolupracovat s dalšími vývojáři a analytiky.</li></ul><h2 class=""typography-heading-small-text"">Koho hledáme?</h2><ul class=""typography-body-large-text-regular""><li>Máš zkušenost se <strong>skriptováním v JavaScriptu</strong>.</li><li>Rozumíš<strong> základům HTML a XML</strong> (struktura, transformace, validace).</li><li>Jsi schopný/á samostatně pracovat a plánovat si úkoly.</li><li>Zkušenost s nástroji jako GMC Inspire, PrintNet nebo KW Soft / Kadel<strong> je výhodou, ale ne podmínkou!</strong></li><li><strong>(Nice to have)</strong> Umíš používat Linuxový terminál a základy SQL.</li></ul><h2 class=""typography-heading-small-text"">Co Ti v Nessu nabídneme:</h2><ul class=""typography-body-large-text-regular""><li>Přátelské a zároveň profesionální pracovní prostředí, protože lidé si u nás pomáhají a důvěřují.</li><li>Podporu osobního rozvoje (hard-skills, soft-skills, jazykové kurzy) a získávání certifikací.</li><li>Formální i neformální akce (protože se chceme se svými kolegy i bavit) - setkání kompetencí, sportovní závody, teambuildingy nebo akce pro děti a rodiny zaměstnanců.</li></ul><h2 class=""typography-heading-small-text"">Těšit se můžeš i na další benefity:</h2><ul class=""typography-body-large-text-regular""><li>20 dní dovolené + 5 Ness day a čím déle u nás jsi, tím víc jich máš.</li><li>3 Sick day.</li><li>Příspěvek na Multisport kartu.</li><li>Mobilní telefon s neomezeným tarifem a 17 GB dat i pro soukromé účely.</li><li>Partnerské benefity – tyto benefity a slevy můžeš čerpat stále a neomezeně (od sportu, přes kulturu, wellness až po slevu na nové auto).</li><li>Příspěvek na penzijní připojištění.</li><li>Stravenkový paušál.</li><li>Jazykovou výuku.</li><li>Rozvoj Hard a Soft skills.</li></ul><p class=""typography-body-large-text-regular mb-800""><strong>Zaujala tě pozice?</strong><br>Ozvi se nám a pošli CV nebo odkaz na LinkedIn. Rádi si s tebou popovídáme!</p></div>"
QA Tester S W,KAJOT,https://www.jobs.cz/rpd/2000543580/,False,2025-04-11 00:00:00,,cs,,,jobscz#2000543580,,,,,,,,,,Brno,Brno,,,,,,,,,,,,,,,,,,,Brno,Brno,,,,,,,,,,,,,,,,,,,fulltime,,,,,,,,,,"<div data-jobad=""body"" data-test=""jd-body-richtext"" class=""RichContent mb-1400""><p class=""typography-body-medium-text-regular text-secondary mb-600"">Pracovní nabídka</p><p class=""typography-body-large-text-regular mb-800"">Naší motivací je vývoj co nejefektivnějších a nejspolehlivějších softwarových řešení s ohledem na potřeby a přání našich zákazníků. Zaměřujeme se na videoloterijní systémy a výherní hrací přístroje. Vyvíjíme vlastní herní software a provozujeme herny, casina a pokerové kluby.</p><p class=""typography-body-large-text-regular mb-800"">Pokud Tě baví odhalovat chyby a hledat cesty k jejich napravení, jsi náš člověk. Právě totiž obsazujeme pozici <strong>QA Tester SW/HW</strong>.</p><p class=""typography-body-large-text-regular mb-800""><strong>Náplní Tvé práce bude:</strong></p><ul class=""typography-body-large-text-regular""><li>Manuální testování a reportování chyb v interním bug trackeru</li><li>Tvorba a úprava testů a scénářů</li><li>Aktivní zapojení do dokumentace a procesů správy projektů</li><li>Integrace testovaného SW do obslužných aplikací</li><li>Spolupráce s odděleními napříč firmou</li></ul><p class=""typography-body-large-text-regular mb-800""><strong>Jak si Tě představujeme? Jako někoho, komu nechybí:</strong></p><ul class=""typography-body-large-text-regular""><li>SŠ vzdělání s maturitou</li><li>Ideálně alespoň 1 rok praxe v IT</li><li>Analytické myšlení</li><li>Pečlivost, samostatnost a komunikační dovednosti</li><li>Pasivní znalost AJ (porozumění technickému textu)</li></ul><p class=""typography-body-large-text-regular mb-800""><strong>Co se u nás můžeš naučit?</strong></p><ul class=""typography-body-large-text-regular""><li>Skriptování a automatizace testování</li><li>Hlubší porozumění počítačovým technologiím</li><li>Technický rozhled v oblasti gamingu</li><li>Pracovat s produkty Atlassian (Jira + Xray a Confluence)</li></ul><p class=""typography-body-large-text-regular mb-800""><strong>Na co se můžeš těšit?</strong></p><ul class=""typography-body-large-text-regular""><li>Stravenkový paušál</li><li>Pružná pracovní doba</li><li>6 dní „sick day“</li><li>Občerstvení na pracovišti – káva, čaj, ovocné dny</li><li>Bonusový systém Cafeterie</li><li>Dárek k narozeninovému jubileu/k narození dítěte</li><li>Přátelský kolektiv</li></ul><p class=""typography-body-large-text-regular mb-800""><br>Pokud Tě láká testování a máš smysl pro detail, pošli nám svůj životopis a my se Ti co nejdříve ozveme. Těšíme se na viděnou!</p></div>"
Analytik mzdových informačních systémů,PŘEDVÝBĚR.CZ s.r.o.,https://www.jobs.cz/rpd/2000553430/,False,2025-04-11 00:00:00,,cs,,,jobscz#2000553430,,,,,,,,,,Praha,,,,,,,,,,,,,,,,,,,,Praha,,,,,,,,,,,,,,,,,,,,fulltime,,,,,,,,,,"<div data-jobad=""body"" data-test=""jd-body-richtext"" class=""RichContent mb-1400""><p class=""typography-body-medium-text-regular text-secondary mb-600"">Pracovní nabídka</p><p class=""typography-body-large-text-regular mb-800"">Pro našeho klienta společnost, která se zabývá vývojem a implementacemi vlastních mzdových a personálních informačních systémů a outsourcingem mzdové a personální agendy, hledáme vhodné kandidáty na pozici <strong>Analytik mzdových informačních systémů.</strong></p><p class=""typography-body-large-text-regular mb-800"">Budete zodpovědní za přípravu analýz zákonných změn, nových funkcí a zákaznických požadavků mzdových systémů společnosti.</p><h2 class=""typography-heading-small-text"">Hlavní činnosti:</h2><ul class=""typography-body-large-text-regular""><li>Spolupráce na vývoji mzdových informačních systémů společnosti</li><li>Sledování a analýza legislativních zákonů</li><li>Business požadavky zákazníků, konzultace business zadání požadavků do vývoje</li><li>Funkční návrh řešení v IS</li><li>Spolupráce s vývojovým a testovacím týmem</li><li>Koordinace s dalšími IT útvary při řešení požadavků</li><li>Školení uživatelů</li><li>Spolupráce s oddělením podpory</li></ul><h2 class=""typography-heading-small-text"">Co by Vám nemělo chybět:</h2><ul class=""typography-body-large-text-regular""><li>Praxe v oblasti analýzy nebo implementace IS</li><li>Základní znalost MS SQL</li><li>Zájem o oblast vývoje a podpory podnikových systémů a procesů</li><li>Inovativnost a kreativita</li><li>Spolehlivost, odpovědnost a samostatnost</li><li>Znalost předpisů v oblasti mzdové problematiky a ZP</li><li>Zkušenosti se zpracováním mezd</li></ul><h2 class=""typography-heading-small-text""><strong>Co Vám chceme nabídnout:</strong></h2><ul class=""typography-body-large-text-regular""><li>Zázemí české etablované společnosti s vlastním vývojem informačních systémů</li><li>Neformální prostředí a rodinnou firemní atmosféru</li><li>Příjemný pracovní kolektiv a příjemné prostředí</li><li>Odborný i osobní růst</li><li>Férové mzdové ohodnocení a balíček benefitů (6 týdnů dovolené, stravenky, příspěvek na penzijní pojištění, příspěvek na volný čas a další)</li><li>Aktivitu, kvalitu a loajalitu dobře odměníme</li><li>Místo výkonu práce: <strong>Praha – Kamýk</strong></li></ul><p class=""typography-body-large-text-regular mb-800"">Pokud Vás tato nabídka zaujala, zašlete nám Váš strukturovaný životopis. Budeme Vás v nejbližší době kontaktovat.</p><p class=""typography-body-large-text-regular mb-800"">Společnost PŘEDVÝBĚR.CZ s.r.o. si vyhrazuje právo nekontaktovat kandidáty, kteří nebudou splňovat výše uvedené požadavky.</p><p class=""typography-body-large-text-regular mb-800"">Výhodou spolupráce s námi je rychlost! S našimi konzultanty absolvujete pouze telefonický pohovor!</p><p class=""typography-body-large-text-regular mb-800"">Odpovědí na tento inzerát souhlasím, aby společnost PŘEDVÝBĚR.CZ s.r.o., sídlem Na Kozačce 1289/7, Praha 2, zpracovávala mé osobní údaje pro účely zprostředkování práce v souladu se zákonem č. 110/2019 Sb., a to až do odvolání písemnou formou.</p></div>"
Vývojář ERP HELIOS,Gatema IT a.s,https://www.jobs.cz/rpd/2000540696/,False,2025-04-11 00:00:00,,cs,,,jobscz#2000540696,,,,,,,,,,Boskovice,Boskovice,,,,,,,,,,,,,,,,,,,Brno,Brno,,,,,,,,,,,,,,,,,,,fulltime,,,,,,,,,,"<div data-jobad=""body"" data-test=""jd-body-richtext"" class=""RichContent mb-1400""><p class=""typography-body-medium-text-regular text-secondary mb-600"">Pracovní nabídka</p><p class=""typography-body-large-text-regular mb-800""><strong>Vaší náplní práce bude:</strong></p><p class=""typography-body-large-text-regular mb-800"">- vývoj standardu modulu pro výrobu ERP HELIOS Nephrite<br>- programování rozšiřujících funkcí modulu a zakázkové funkcionality pro naše zákazníky z různých odvětví <br>- interní spolupráce s analytiky, konzultanty</p><p class=""typography-body-large-text-regular mb-800""><strong>Očekáváme:</strong></p><p class=""typography-body-large-text-regular mb-800"">- znalost programování v C# , Python (schopnost samostatné práce)<br>- znalost jazyka SQL, nejlépe MS SQL</p><p class=""typography-body-large-text-regular mb-800""><strong>Co Vám nabízíme?</strong></p><p class=""typography-body-large-text-regular mb-800"">- Flexibilní pracovní dobu<br>- Občasnou práci z domu (2+3)<br>- 5 týdnů dovolené<br>- Jazykové kurzy, podporujeme profesní vzdělávání (interní workshopy, odborné kurzy, softskills)<br>- Příspěvek na dojíždění<br>- Stravenkový paušál<br>- Jídelnu v areálu firmy<br>- Kávu a čaj na pracovišti zdarma<br>- Firemní mateřskou školku<br>- Pěkné moderní pracovní prostředí<br>- Firemní akce<br>- Podporu zkušeného týmu</p><p class=""typography-body-large-text-regular mb-800""><strong>Máte-li dotazy k pracovní pozici, neváhejte nás, prosím, kontaktovat.</strong><br><strong>Rádi Vás pozveme na osobní schůzku nebo probereme telefonicky.</strong></p></div>"
Software Tester,Creditinfo CEE a.s.,https://www.jobs.cz/rpd/2000548052/,False,2025-04-11 00:00:00,,en,,,jobscz#2000548052,,,,,,,,,,Praha,Praha,,,,,,,,,,,,,,,,,,,Praha,Praha,,,,,,,,,,,,,,,,,,,fulltime,,,,,,,,,,"<div data-jobad=""body"" data-test=""jd-body-richtext"" class=""RichContent mb-1400""><p class=""typography-body-medium-text-regular text-secondary mb-600"">Pracovní nabídka</p><p class=""typography-body-large-text-regular mb-800"">Location: Prague, Czechia<br>Contract type: Full time, Permanent</p><p class=""typography-body-large-text-regular mb-800"">We are looking for a skilled and curious Software Tester to join our team at Creditinfo CEE. You will dive into newly developed features, analyze, test, and contribute to delivering high-quality products to clients around the world. <br>We're seeking someone who enjoys challenges, has experience with manual and API testing, and is eager to grow in the area of test automation. You’ll collaborate with an agile SCRUM team, have room for initiative, and the opportunity to impact the final product quality. Join an international company developing cutting-edge banking and financial applications, operating in over 25 countries worldwide.</p><h2 class=""typography-heading-small-text"">What you will focus on {do}:</h2><ul class=""typography-body-large-text-regular""><li>Learn about newly developed product features, explore, analyse and test them</li><li>Challenge assumptions / requirements / specifications and test them</li><li>Cooperate with other SCRUM team members in order to deliver products that satisfy client needs</li><li>Own the testing domain in the SCRUM team</li><li>Coach SCRUM team members in testing in order to improve team output</li><li>API and UI testing</li><li>Use different testing techniques based on product and feature analysis which should be a best fitting blend of manual testing and automated testing using tools such as Postman and Playwright</li><li>Comprehensively report bugs found in Azure devops</li><li>Provide test support to product releases</li></ul><h2 class=""typography-heading-small-text"">What you should know:</h2><ul class=""typography-body-large-text-regular""><li>Strong knowledge of manual testing (e.g. Integration, System, Regression, Smoke and Sanity Testing)</li><li>Knowledge of API testing with Postman or other tools</li><li>Knowledge of SQL and XML</li><li>Understanding of automated testing and ability to learn new frameworks</li><li>Strong knowledge of English language (both verbal and written)</li></ul><h2 class=""typography-heading-small-text""><strong>What you should have:</strong></h2><ul class=""typography-body-large-text-regular""><li>Strong attention to detail</li><li>Ability to work individually to achieve shared objectives and drive process change</li><li>Experience working with an in-development team using Agile methodology</li><li>Strong analytical and problem-solving skills paired with the ability to develop creative and efficient solutions</li></ul><h2 class=""typography-heading-small-text"">It will be nice if you have or know:</h2><ul class=""typography-body-large-text-regular""><li>Bachelor’s degree in computer science, Engineering or equivalent area</li></ul></div>"
ERP konzultant,Deufol Česká republika s.r.o.,https://www.jobs.cz/rpd/2000513878/,False,2025-04-11 00:00:00,,cs,,,jobscz#2000513878,,,,,,,,,,Brno,Brno,,,,,,,,,,,,,,,,,,,Brno,Brno,,,,,,,,,,,,,,,,,,,fulltime,,,,,,,,,,"<div data-jobad=""body"" data-test=""jd-body-richtext"" class=""RichContent mb-1400""><p class=""typography-body-medium-text-regular text-secondary mb-600"">Pracovní nabídka</p><p class=""typography-body-large-text-regular mb-800"">Interní IT oddělení firmy vyvíjí ERP, CRM, DMS a CMS systémy pro koncernové pobočky i externí zákazníky s použitím nejmodernějších technologií. Kromě serverových systémů - databází a služeb - realizuje i vývoj klientských aplikací. Ať už v prostředí webu, desktopových aplikací či mobilních zařízení – iOS, Android, Windows mobile.</p><p class=""typography-body-large-text-regular mb-800"">Hledáme kolegy/-ně na pozici <strong>ERP KONZULTANT Business Central (m/ž)</strong></p><p class=""typography-body-large-text-regular mb-800"">Budete pracovat v interním týmu a zapojíte do mezinárodních projektů. Dostanete příležitosti podílet se na tvorbě koncernových řešení, analyzovat je a připravovat funkční specifikace a kontrolovat jejich proveditelnost. Budete implementovat, testovat a dokumentovat nové aplikace. Nedílnou součástí toho všeho je spolupráce s koncovými uživateli a jejich podpora.</p><p class=""typography-body-large-text-regular mb-800""><strong> Co od Vás očekáváme:</strong></p><ul class=""typography-body-large-text-regular""><li>VŠ nebo SŠ informačních technologií nebo technického směru</li><li>znalost ERP Dynamics 365 Business Central</li><li>znalost logistických podnikových procesů</li><li>znalost Microsoft Dynamics NAV výhodou</li><li>základní znalost tvorby SQL dotazů</li><li>zkušenost s přípravou specifikací požadavků</li><li>výborné komunikační a analytické schopnosti</li><li>ochota učit se nové postupy a technologie</li><li>osobní angažovanost, spolehlivost, samostatnost, schopnost týmové práce</li><li>ochota cestovat, ŘP sk.B</li><li>pokročilou komunikativní znalost AJ</li><li>odolnost vůči stresu</li></ul><p class=""typography-body-large-text-regular mb-800""><br> <strong>Nabízíme:</strong></p><ul class=""typography-body-large-text-regular""><li>zázemí silné a stabilní nadnárodní společnosti s globální působností</li><li>spolupráce na mezinárodních projektech (Evropa, US)</li><li>práce na hlavní pracovní poměr</li><li>motivující platový a bonusový systém</li><li>notebook, mobilní telefon, stravenky, jazykové kurzy a technická školení</li><li>možnost home office.</li></ul></div>"
