Trainee Embedded C/C++ Developer IRC274419,GlobalLogic,https://www.globallogic.com/careers/trainee-embedded-c-c-developer-irc274419/,False,2025-10-29 00:00:00,,en,,,,,,,,,,,,,Žilina,,,,,,,,,,,,,,,,,,,,Žilina,,,,,,,,,,,,,,,,,,,,fulltime,,,,,,,,,,"<strong>Description<br><br></strong>We are looking for a <strong>Trainee Embedded C/C++ Developer</strong> who would like to join GlobalLogic and cooperate with one of our strategic partners – a leading global manufacturer in the home appliance sector, recognized as the largest producer of household appliances in Europe. The company operates a diverse portfolio of international and regional brands, offering a wide range of products including washing machines, dishwashers, ovens, and other kitchen and home appliances.<br><br><strong>Ready to start your journey in the IT world? Just apply 🙂<br><br></strong>A little more information: The organization has a strong presence in Central and Eastern Europe, with key engineering and production centers located in Slovakia. These sites focus on the development and manufacturing of components such as drives and pumps for household appliances and play a strategic role in the company’s global supply chain. The company is also part of a larger international technology group with a long-standing reputation for innovation and quality.<br><br>Minimum salary for this position – 900 euros gross per month.<br><br><strong>Requirements<br><br></strong>Must have:<br><br><br><ul><li>Basic knowledge of C/C++ programming</li><li>Familiarity with Linux, Windows, and Embedded environments</li><li>Good command of English (both written and spoken)<br><br><br></li></ul>Nice to Have:<br><br><br><ul><li>Basic understanding of TCP/IP, CAN Bus, and D-Bus</li><li>Experience with Git version control system and Jira</li><li>Knowledge of build processes (dMake → GNU Make)</li><li>Understanding of software development processes (V-Model, Agile)</li><li>Experience working with different embedded systems<br><br><br></li></ul>Nice to Have:<br><br>– Basic knowledge of TCP/IP, CAN Bus, D BUS<br><br>‒ Git version control system, Jira,<br><br>‒ Make process (dMake -&gt; GNU make)<br><br>‒ SW development process (V-model, Agile development)<br><br>‒ Experience with different embedded systems<br><br>Job responsibilities<br><br><br><ul><li>Support in development and maintenance of embedded software in C/C++</li><li>Document work results clearly and accurately</li><li>Collaborate with the team on ongoing tasks and project goals</li><li>Participation in project meetings</li><li>Training and gaining knowledge from a GL mentor<br><br><br></li></ul>What we offer<br><br><strong>Culture of caring.</strong> At GlobalLogic, we prioritize a culture of caring. Across every region and department, at every level, we consistently put people first. From day one, you’ll experience an inclusive culture of acceptance and belonging, where you’ll have the chance to build meaningful connections with collaborative teammates, supportive managers, and compassionate leaders.<br><br><strong>Learning and development.</strong> We are committed to your continuous learning and development. You’ll learn and grow daily in an environment with many opportunities to try new things, sharpen your skills, and advance your career at GlobalLogic. With our Career Navigator tool as just one example, GlobalLogic offers a rich array of programs, training curricula, and hands-on opportunities to grow personally and professionally.<br><br><strong>Interesting &amp; meaningful work.</strong> GlobalLogic is known for engineering impact for and with clients around the world. As part of our team, you’ll have the chance to work on projects that matter. Each is a unique opportunity to engage your curiosity and creative problem-solving skills as you help clients reimagine what’s possible and bring new solutions to market. In the process, you’ll have the privilege of working on some of the most cutting-edge and impactful solutions shaping the world today.<br><br><strong>Balance and flexibility. </strong>We believe in the importance of balance and flexibility. With many functional career areas, roles, and work arrangements, you can explore ways of achieving the perfect balance between your work and life. Your life extends beyond the office, and we always do our best to help you integrate and balance the best of work and life, having fun along the way!<br><br><strong>High-trust organization. </strong>We are a high-trust organization where integrity is key. By joining GlobalLogic, you’re placing your trust in a safe, reliable, and ethical global company. Integrity and trust are a cornerstone of our value proposition to our employees and clients. You will find truthfulness, candor, and integrity in everything we do.<br><br><strong>About GlobalLogic<br><br></strong>GlobalLogic, a Hitachi Group Company, is a trusted digital engineering partner to the world’s largest and most forward-thinking companies. Since 2000, we’ve been at the forefront of the digital revolution – helping create some of the most innovative and widely used digital products and experiences. Today we continue to collaborate with clients in transforming businesses and redefining industries through intelligent products, platforms, and services.<br><br>"
Internship Software Engineer,Nokia,https://fa-evmr-saasfaprod1.fa.ocs.oraclecloud.com/hcmUI/CandidateExperience/en/job/25076/?src=SNS-102,False,2025-10-29 00:00:00,,en,,,,,,,,,,,,,Bratislava,,,,,,,,,,,,,,,,,,,,Bratislava,,,,,,,,,,,,,,,,,,,,parttime,,,,,,,,,,"<strong>Job Description<br><br></strong>Are you a university student in your final 3 years of studies? Do you want to gain experience in developing software? Are you looking for an employer who supports your ideas and gives you space and tools to turn them into something useful and beautiful?<br><br>If all answers are “YES”, you are in the right place as we are looking for new team members! As an intern at Nokia, you will become a part of our research and development team (R&amp;D) in Bratislava, Mill office building at Mlynské nivy<br><br><strong>How You Will Contribute And What You Will Learn<br><br></strong>We are looking for our new team member with a background in Engineering and Technology / Information Technology / Telecommunications or with other university degrees from technology studies.<br><br>As part of the team you will:<br><br><ul><li>Develop systems, tools and applications used by developers and testers using C/C++, Python, bash</li><li>Work on a small piece of the large system (codebase), read and understand existing code</li><li>Maintain existing test scripts</li><li>Work in Linux environment</li><li>Work with different versioning systems like GIT/CVS and test automation environment</li><li>Practice your algorithmic knowledge and develop your programming skills</li><li>Use your knowledge of protocols (TCP/IP) and IP Routing<br><br></li></ul><strong>Key Skills And Experience<br><br></strong>You have:<br><br><ul><li>At least intermediate (B2) level of English language knowledge</li><li>Programming languages - C/C++, Python, Bash</li><li>Knowledge of programming algorithms, TCP/IP protocols and IP Routing</li><li>Previous experience with Linux</li><li>Knowledge of GIT/CVS versioning systems and test automation environment<br><br></li></ul>It would be nice if you also had:<br><br><ul><li>Sharp, creative and analytical mind</li><li>Passion to learn new things</li><li>Openness to challenges<br><br></li></ul>What we offer<br><br><ul><li>Flexible working time</li><li>Competitive salary - gr. 7,00 EUR/hour (the final wage per hour can be increased accordingly to the individual skills and experience of the selected candidate)</li><li>Free refreshments &amp; fruits in the workspace</li><li>Office location in Mill, building at Mlynské nivy </li><li>Variety of learning, project &amp; career opportunities</li><li>CSR activities</li><li>Company events &amp; team buildings</li><li>No dress code</li><li>Casual &amp; innovative culture<br><br></li></ul><strong>About Us<br><br></strong><strong> Come create the technology that helps the world act together<br><br></strong>Nokia is committed to innovation and technology leadership across mobile, fixed and cloud networks. Your career here will have a positive impact on people’s lives and will help us build the capabilities needed for a more productive, sustainable, and inclusive world.<br><br>We challenge ourselves to create an inclusive way of working where we are open to new ideas, empowered to take risks and fearless to bring our authentic selves to work<br><br><strong>What we offer<br><br></strong>Nokia offers continuous learning opportunities, well-being programs to support you mentally and physically, opportunities to join and get supported by employee resource groups, mentoring programs and highly diverse teams with an inclusive culture where people thrive and are empowered.<br><br><strong>Nokia is committed to inclusion and is an equal opportunity employer<br><br></strong>Nokia has received the following recognitions for its commitment to inclusion &amp; equality:<br><br><ul><li> One of the World’s Most Ethical Companies by Ethisphere </li><li> Gender-Equality Index by Bloomberg </li><li> Workplace Pride Global Benchmark <br><br></li></ul>At Nokia, we act inclusively and respect the uniqueness of people. Nokia’s employment decisions are made regardless of race, color, national or ethnic origin, religion, gender, sexual orientation, gender identity or expression, age, marital status, disability, protected veteran status or other characteristics protected by law.<br><br>We are committed to a culture of inclusion built upon our core value of respect.<br><br>Join us and be part of a company where you will feel included and empowered to succeed.<br><br><strong>About The Team<br><br></strong>The pandemic has highlighted how important telecoms networks are to society. Nokia’s Network Infrastructure group is at the heart of a revolution to bring more and faster network capacity to people worldwide through our ambition, innovation, and technical expertise."
Intern - Machine Learning Software Engineer,Honeywell,https://ibqbjb.fa.ocs.oraclecloud.com/hcmUI/CandidateExperience/en/job/124875/,False,2025-10-29 00:00:00,,en,,,,,,,,,,,,,Brno,,,,,,,,,,,,,,,,,,,,Brno,,,,,,,,,,,,,,,,,,,,parttime,,,,,,,,,,"<strong>Job Description<br><br></strong>As an Intern Machine Learning Software Engineer here at Honeywell, you will gain hands-on experience and exposure to various engineering support functions. This role will provide you with the opportunity to work on real-world projects, collaborate with experienced professionals, and contribute to the success of our engineering team.<br><br>In this role, you will impact the success of our engineering projects by providing valuable support and insights. Your contributions will help streamline processes, improve productivity, and ensure the delivery of high-quality engineering solutions. This internship will also offer you the chance to develop your technical skills and gain a deeper understanding of the engineering field.<br><br>Honeywell have been innovating for more than 100 years and now we’re creating what’s next. Our programs serve a global community and our hometowns too. We provide resources and financial support to causes around the world and encourage employee volunteerism. We are committed to the highest standard in everything we do!<br><br><strong>Key Responsibilities<br><br></strong><ul><li>Design, develop, and implement software solutions</li><li>Collaborate with cross-functional teams to define system requirements</li><li>Ensure timely completion of software projects</li><li>Conduct code reviews and implement testing procedures<br><br></li></ul><strong>Key Skills And Qualifications<br><br></strong><ul><li>Able to work 20 hours per week.</li><li>Programming languages - Python, (TensorFlow/Keras/PyTorch, OpenCV is an advantage), C/C++,</li><li>Machine learning experience</li><li>Back-end knowledge development</li><li>Strong analytical and problem-solving skills.</li><li>Machine vision / signal processing, front-end experience &amp; Linux knowledge is an advantage<br><br></li></ul><strong>Our Offer<br><br></strong><ul><li>Start your career in globally recognized company by developing future technologies.</li><li>Possibility to accommodate your studies with work commitments.</li><li>Long-term cooperation even after finishing of your studies.</li><li>Market-specific training and ongoing personal and professional development with support of experienced engineers and leaders.</li><li>Semi-flexible working hours.</li><li>As a University Relations program, you can also expect Career Growth and Skill Development: Clear pathways for advancement, regular feedback, mentorship opportunities and access to training and certifications. <br><br></li></ul>We are an equal opportunity employer and value diversity at our company. We do not discriminate based on race, religion, color, national origin, gender, sexual orientation, age, marital status, veteran status, or disability status.<br><br>We will ensure that individuals with disabilities are provided reasonable accommodation to participate in the job application or interview process, to perform crucial job functions, and to receive other benefits and privileges of employment. Please contact us to request accommodation.<br><br><strong>Join us now and become part of our journey - help us make the future!<br><br></strong>#FutureShaper<br><br><strong>About Us<br><br></strong>Honeywell helps organizations solve the world's most complex challenges in automation, the future of aviation and energy transition. As a trusted partner, we provide actionable solutions and innovation through our Aerospace Technologies, Building Automation, Energy and Sustainability Solutions, and Industrial Automation business segments – powered by our Honeywell Forge software – that help make the world smarter, safer and more sustainable.<br><br>"
"Frontend Developer Internship: Red Hat HCC (Brno office, Czech Republic)",Red Hat,https://redhat.wd5.myworkdayjobs.com/jobs/job/Brno\u002d\u002d-Tech-Park-Brno\u002d\u002d-B/Console-HCC-Framework-Intern\u002d\u002dBrno-office\u002d\u002dCzech-Republic-_R-050218?%26%3Fmode=job&%26iis=Job%2BBoard&%26iisn=juniorguru%2BPosting&source=juniorguru,False,2025-10-29 00:00:00,,en,,,,,,,,,,,,,Brno,,,,,,,,,,,,,,,,,,,,Brno,,,,,,,,,,,,,,,,,,,,parttime,,,,,,,,,,"Tired of academic projects? Ready to write code that ships? The Red Hat Console HCC Framework team in Brno is hunting for an enthusiastic Frontend Development Intern with some experience in website development to join the fight to simplify hybrid cloud management. This isn't just an internship; it's your chance to become a core contributor to major open source projects like Data Driven Forms and PatternFly extensions, immediately putting your name on code used by developers globally. This long-term opportunity is where you move beyond simple components and start learning the deeper principles of modern web architecture.<br><br>Red Hat’s Intern Program is a collaborative effort between the Emerging Talent team and our intern managers. The program is designed to offer a meaningful and well-rounded experience — combining professional development, networking opportunities, social engagement, and impactful work. This is a paid internship based in our Brno office, typically lasting 12 months, with the possibility to extend up to 24 months. Interns work on average 20 hours per week, with flexible working hours, and the expected start date is February 1st.<br><br><strong>What You Will Do<br><br></strong><ul><li>Work with upstream </li><li>Work on open source web UI components in Patternfly project</li><li>Develop and implement web UI screens on console.redhat.com product</li><li>Contribute to open-source project data-driven forms<br><br></li></ul><strong>What You Will Bring<br><br></strong><ul><li>You must be enrolled in a Czech university (Bachelor’s 3rd/4th year or Master’s) for the full internship duration and be able to work full-time within 2 years.</li><li>Working knowledge of written and spoken English</li><li>1+ years of experience programming in JavaScript or TypeScript.</li><li>Basic knowledge of React or Angular</li><li>Familiar with Git version control and GitHub’s PR workflow</li><li>Interest in learning new technologies; problem-solving skills.<br><br></li></ul>Due to the limited number of internship opportunities and the high volume of applications, we may not be able to speak with every candidate. To maximize your chances of moving forward in the process, please ensure your CV clearly outlines your education, relevant projects (link to your GitHub account), and extracurricular activities. Incomplete applications may be excluded from screening. You can find helpful tips and recommendations in this article.<br><br><strong>About Red Hat<br><br></strong>Red Hat is the world’s leading provider of enterprise open source software solutions, using a community-powered approach to deliver high-performing Linux, cloud, container, and Kubernetes technologies. Spread across 40+ countries, our associates work flexibly across work environments, from in-office, to office-flex, to fully remote, depending on the requirements of their role. Red Hatters are encouraged to bring their best ideas, no matter their title or tenure. We're a leader in open source because of our open and inclusive environment. We hire creative, passionate people ready to contribute their ideas, help solve complex problems, and make an impact.<br><br><strong>Inclusion at Red Hat<br><br></strong>Red Hat’s culture is built on the open source principles of transparency, collaboration, and inclusion, where the best ideas can come from anywhere and anyone. When this is realized, it empowers people from different backgrounds, perspectives, and experiences to come together to share ideas, challenge the status quo, and drive innovation. Our aspiration is that everyone experiences this culture with equal opportunity and access, and that all voices are not only heard but also celebrated. We hope you will join our celebration, and we welcome and encourage applicants from all the beautiful dimensions that compose our global village.<br><br><strong>Equal Opportunity Policy (EEO)<br><br></strong>Red Hat is proud to be an equal opportunity workplace and an affirmative action employer. We review applications for employment without regard to their race, color, religion, sex, sexual orientation, gender identity, national origin, ancestry, citizenship, age, veteran status, genetic information, physical or mental disability, medical condition, marital status, or any other basis prohibited by law.<br><br>Red Hat does not seek or accept unsolicited resumes or CVs from recruitment agencies. We are not responsible for, and will not pay, any fees, commissions, or any other payment related to unsolicited resumes or CVs except as required in a written contract between Red Hat and the recruitment agency or party requesting payment of a fee.<br><br>Red Hat supports individuals with disabilities and provides reasonable accommodations to job applicants. If you need assistance completing our online job application, email application-assistance@redhat.com. General inquiries, such as those regarding the status of a job application, will not receive a reply."
Intern - R&D Software,Thermo Fisher Scientific,https://jsv3.recruitics.com/redirect?rx_cid=3436&rx_jobId=R-01331079&rx_url=https%3A%2F%2Fjobs.thermofisher.com%2Fglobal%2Fen%2Fjob%2FR-01331079%2FIntern-R-D-Software%3Frx_ch%3Djobpost%26rx_id%3D8673e033-a399-11f0-a582-51697c650436%26rx_job%3DR-01331079%26rx_medium%3Dpost%26rx_paid%3D0%26rx_r%3Dnone%26rx_source%3Djuniorguru%26rx_ts%3D20251029T204050Z%26rx_vp%3Djuniorgurudirectindex%26utm_medium%3Dpost%26utm_source%3Drecruitics_juniorgurudirectindex&refId=34jd24,False,2025-10-29 00:00:00,,en,,,,,,,,,,,,,Brno,,,,,,,,,,,,,,,,,,,,Brno,,,,,,,,,,,,,,,,,,,,fulltime,,,,,,,,,,"<strong>Work Schedule<br><br></strong>Standard (Mon-Fri)<br><br><strong>Environmental Conditions<br><br></strong>Office<br><br>Join Thermo Fisher Scientific and become a member of a company that values performance, quality and innovation. As part of a successful and growing global organization, you will be encouraged to perform at your best. With revenues of more than $40 billion and the largest investment in R&amp;D in the industry, we give our people the resources and chances to create meaningful contributions to the world!<br><br>The Life Sciences XDB Platform Team delivers and maintain software for electron microscopes supporting drug discovery, structural and plant biology, infectious disease, pathology research... Working with experts in multiple domains, we contribute to the creation and the integration of solutions that help making the world heathier, cleaner and safer!<br><br><strong>How will you make an impact?<br><br></strong>As an intern in the Life Sciences XDB Platform Team, you will help the team to improve the quality of the software, by creating new unit tests and automated integration tests ensuring that the key customer functionalities are maintained and stable.<br><br><strong>Key Responsibilities<br><br></strong><ul><li>Write new unit tests for our critical modules</li><li>Design and code new integration tests to ensure that the applications valued by our customers are not being altered by the development of new features.</li><li>Learn and share! We value exchanging knowledge and while we will be here to guide you and help you grow, we also appreciate new ideas or different opinions.<br><br></li></ul><strong>REQUIREMENTS:<br><br></strong><ul><li>University student (Computer Science)</li><li>Basic knowledge of at least one Object-Oriented Language (C++ and C# are preferred)</li><li>Good level in English both spoken and written.</li><li>Active and creative approach to problem-solving.</li><li>Willingness to continuously learn and share knowledge.</li><li>Teamwork and collaboration with experts in other domains than software.</li><li>Knowledge of modern test writing trends/frameworks and cybersecurity is not required, but can be a plus.<br><br></li></ul><strong>How do we motivate you?<br><br></strong><ul><li>Flexible working schedule so you can easily combine work and studies</li><li>Brand-new Hacker-space room equipped with VR headset, Recording studio for your videos, music or podcasts, Lego Mindstorms, 3D printer, Arduino and much more!</li><li>Learning and development opportunities</li><li>Modern work environment including relax zones, gym, outside playground and massages in the building</li><li>Open and friendly company spirit - we have a company rock band, various sport teams etc.<br><br></li></ul>"
