Intern - Masters Systems Eng,Honeywell,https://www.linkedin.com/jobs/view/4335944939/?utm_medium=jobboard&utm_source=juniorguru,False,2025-12-05 00:00:00,,en,,,linkedin#4335944939,,,,,,,,,,Brno,,,,,,,,,,,,,,,,,,,,Brno,,,,,,,,,,,,,,,,,,,,parttime,,,,,,,,,,"<strong>Job Description<br><br></strong>As an Intern Systems Engineer here at Honeywell, you will have the opportunity to work on cutting-edge projects and gain hands-on experience in systems engineering. You will collaborate with experienced engineers and contribute to the design, development, and implementation of advanced systems and technologies. This internship will provide you with valuable insights into the industry and help you develop the skills needed for a successful career in systems engineering.<br><br>In this role, you will impact the development of innovative systems and technologies that enhance the performance and reliability of our products. Your contributions will support the successful execution of projects and help drive the company's growth and success.<br><br>At <strong>Honeywell</strong>, our people leaders play a critical role in developing and supporting our employees to help them perform at their best and drive change across the company. Help to build a strong, diverse team by recruiting talent, identifying, and developing successors, driving retention and engagement, and fostering an inclusive culture.<br><br><strong>Key Responsibilities<br><br></strong><ul><li>Requirement analysis and decomposition </li><li>Flight Controls, Flight Guidance, Autopilot, Virtual Guidance Panel or Maintenance Systems design</li><li>Model based development </li><li>Systems integration</li><li>Systems validation &amp; verification</li><li>Work with other systems/software engineers during developing and integrating solutions for Honeywell Anthem product as well as for Honeywell customers<br><br></li></ul><strong>Key Skills And Qualifications<br><br></strong><ul><li> Ability to work 20 hours per week.</li><li> Undergoing or having finished a degree in Electrical Engineering/Controls Systems/Mechatronics/Aeronautical Studies</li><li> A good command of English language is mandatory.</li><li> Good hardware knowledge, electronic circuits and connections (skilled in Matlab/Simulink would be a plus)</li><li> Knowledge of programming languages is a benefit (e.g. C, Python).</li><li> Self–starter, motivated, proactive and able to work without supervision.<br><br></li></ul><strong>Our Offer<br><br></strong><ul><li> Start your career in globally recognized company by developing future technologies.</li><li> Possibility to accommodate your studies with work commitments.</li><li> Long-term cooperation even after finishing of your studies.</li><li> Market-specific training and ongoing personal and professional development with support of experienced engineers and leaders.</li><li> Semi-flexible working hours.</li><li> As a University Relations program, you can also expect Career Growth and Skill Development: Clear pathways for advancement, regular feedback, mentorship opportunities and access to training and certifications.<br><br></li></ul>We are an equal opportunity employer and value diversity at our company. We do not discriminate based on race, religion, color, national origin, gender, sexual orientation, age, marital status, veteran status, or disability status.<br><br>We will ensure that individuals with disabilities are provided reasonable accommodation to participate in the job application or interview process, to perform crucial job functions, and to receive other benefits and privileges of employment. Please contact us to request accommodation.<br><br><strong>Join us now and become part of our journey - help us make the future!<br><br></strong>#FutureShaper<br><br><strong>About Us<br><br></strong>Honeywell helps organizations solve the world's most complex challenges in automation, the future of aviation and energy transition. As a trusted partner, we provide actionable solutions and innovation through our Aerospace Technologies, Building Automation, Energy and Sustainability Solutions, and Industrial Automation business segments – powered by our Honeywell Forge software – that help make the world smarter, safer and more sustainable.<br><br>"
Junior Developer (S/4HANAGroup Reporting),SAP,https://www.linkedin.com/jobs/view/4251125183/?utm_campaign=SAP_Linkedin&utm_source=juniorguru,False,2025-12-05 00:00:00,,en,,,linkedin#4251125183,,,,,,,,,,Brno,,,,,,,,,,,,,,,,,,,,Brno,,,,,,,,,,,,,,,,,,,,fulltime,,,,,,,,,,"<strong>We help the world run better <br><br></strong>At SAP, we enable you to bring out your best. Our company culture is focused on collaboration and a shared passion to help the world run better. How? We focus every day on building the foundation for tomorrow and creating a workplace that embraces differences, values flexibility, and is aligned to our purpose-driven and future-focused work. We offer a highly collaborative, caring team environment with a strong focus on learning and development, recognition for your individual contributions, and a variety of benefit options for you to choose from.<br><br><strong>Meet Your Team<br><br></strong>S/4HANA Finance is a central piece of SAP’s flagship product and lies at the core of our vision of the Intelligent Enterprise, which brings together machine and human intelligence across all business functions to deliver value to our customers. S/4HANA Finance is built, in the first place, as a cloud product with quarterly release cycles and is also shipped as an On-Premise version. Line of Business (LoB) Finance is a global development organization responsible for delivering this next generation Finance solution and works closely together with partners and customers to enable superior future-proof business models and finance processes. Within LoB Finance the Group Reporting unit is developing a solution used by large globally active corporations to create consolidated financial results and to publish group related information to the stock market, management and investors. Our development teams are based in Paris, Shanghai, Brno, and Walldorf.<br><br>The Group Reporting solution comprises application parts residing within S/4HANA as well as components built on SAP Cloud Platform. Currently we’re seeking a Junior Developer to further strengthen one of our Brno scrum teams working in the S/4HANA environment applying agile software engineering practices.<br><br><strong>What You'll Do<br><br></strong>Upon joining our development scrum team as Junior Developer (f/m/d) you will be thoroughly trained in all technical, functional and business process related topics, which you require for a smooth start. An experienced colleague from the same team will be your mentor and happy to support you in taking over full responsibility for tasks such as<br><br><ul><li> Design, implement, test (automated and manually) and maintain specific product features, primarily in the S/4HANA backend (ABAP), and adhering to high quality standards required for developing cloud applications</li><li> Analyze and resolve issues identified during tests, upgrades or customer projects</li><li> Contribute to quality assurance, test automation and performance improvements</li><li> Analyze and resolve issues identified during tests, upgrades, or productive customer usage.</li><li> Act as trusted advisor providing expertise to team members, product managers, management and other stakeholders.</li><li> Ramp up your business process, technical and functional domain knowledge in selected areas of financial consolidation and S/4HANA Group Reporting, resp.<br><br></li></ul><strong>What You Bring<br><br></strong>You have graduated in computer science, business informatics, engineering, natural sciences, mathematics or related field. You bring very good analytical and problem-solving skills.<br><br><strong>Required Skills<br><br></strong><ul><li> Proficiency in at least one back-end programming language such as Python, JavaScript (Node.js), Java, C#, PHP, or Go is required</li><li> Quick learning, outstanding analytical and complex problem-solving skills</li><li> Fluency (written &amp; spoken) in English<br><br></li></ul><strong>Preferred Skills<br><br></strong><ul><li> Knowledge in financial reporting, accounting or consolidation</li><li> Experience with ABAP development</li><li> Fiori and UI development skills</li><li> Master / bachelor’s degree in computer science, mathematics, engineering, business administration<br><br></li></ul>or related field<br><br><strong>Bring out your best<br><br></strong>SAP innovations help more than four hundred thousand customers worldwide work together more efficiently and use business insight more effectively. Originally known for leadership in enterprise resource planning (ERP) software, SAP has evolved to become a market leader in end-to-end business application software and related services for database, analytics, intelligent technologies, and experience management. As a cloud company with two hundred million users and more than one hundred thousand employees worldwide, we are purpose-driven and future-focused, with a highly collaborative team ethic and commitment to personal development. Whether connecting global industries, people, or platforms, we help ensure every challenge gets the solution it deserves. At SAP, you can bring out your best.<br><br><strong>We win with inclusion<br><br></strong>SAP’s culture of inclusion, focus on health and well-being, and flexible working models help ensure that everyone – regardless of background – feels included and can run at their best. At SAP, we believe we are made stronger by the unique capabilities and qualities that each person brings to our company, and we invest in our employees to inspire confidence and help everyone realize their full potential. We ultimately believe in unleashing all talent and creating a better and more equitable world.<br><br>SAP is proud to be an equal opportunity workplace and is an affirmative action employer. We are committed to the values of Equal Employment Opportunity and provide accessibility accommodations to applicants with physical and/or mental disabilities. If you are interested in applying for employment with SAP and are in need of accommodation or special assistance to navigate our website or to complete your application, please send an e-mail with your request to Recruiting Operations Team: Careers@sap.com<br><br>For SAP employees: Only permanent roles are eligible for the SAP Employee Referral Program, according to the eligibility rules set in the SAP Referral Policy. Specific conditions may apply for roles in Vocational Training.<br><br><strong>EOE AA M/F/Vet/Disability<br><br></strong>Qualified applicants will receive consideration for employment without regard to their age, race, religion, national origin, ethnicity, age, gender (including pregnancy, childbirth, et al), sexual orientation, gender identity or expression, protected veteran status, or disability.<br><br>Successful candidates might be required to undergo a background verification with an external vendor.<br><br>Requisition ID: 427200 | Work Area: Software-Design and Development | Expected Travel: 0 - 10% | Career Status: Graduate | Employment Type: Regular Full Time | Additional Locations: .<br><br>"
Software Engineer - fresh graduate,Oracle,https://www.linkedin.com/jobs/view/4316234248/?utm_medium=jobboard&utm_source=juniorguru,False,2025-12-05 00:00:00,,en,,,linkedin#4316234248,,,,,,,,,,Praha,,,,,,,,,,,,,,,,,,,,Praha,,,,,,,,,,,,,,,,,,,,fulltime,,,,,,,,,,"<strong>Job Description<br><br></strong><strong>The NetSuite Application Team: <br><br></strong>Do you want to advance your career with the world’s first cloud company? Since 1998, Oracle NetSuite has been on a mission to deliver an agile, unified application suite that gives leaders a complete view into their business. Our team is growing, and we’re looking for people like you to help us make a global impact.<br><br>As the leading cloud business system, NetSuite includes financials, inventory management, HR, professional services automation, commerce, and more. Tens of thousands of customers all over the world trust NetSuite to give their businesses the visibility, agility, and control needed to make data-informed decisions quickly.<br><br>NetSuite is a place where you can build your career and have fun while doing so! We’re invested in our people, our customers, and the community. As part of Oracle, our benefits are exceptional. Joining our passionate team means that you’re ready to take your career to the next level. With priceless learning opportunities, strong support, incredible innovation, and volunteer opportunities, NetSuite is committed to creating a workplace where everyone feels empowered and set up for success.<br><br><strong>The Program:<br><br></strong>This is a rotational program that consists of several weeks of NetSuite specific onboarding followed by two 6-month team assignments on different teams at the Prague office, culminating in a final team placement. This is a hybrid role requiring a certain number of days in the office, as determined by your team. You will receive exposure to different aspects of the product and/or code base. You will have 10 or so knowledge expansion sessions from security to tech writing to growth, any type of technical program position - either via Zoom or in person. You will also receive opportunities to network with leadership in addition to a mentor.<br><br>Our future success depends on hiring world-class, early in career talent who are looking to power next-generation services and solutions. We are hiring bachelor’s and master’s graduates with a diverse set of skills and experiences to work in and across multiple teams within the NetSuite global industry unit. Our program is intended to enhance your overall learning experience, help build your network, and accelerate your chance to create an impact.<br><br><strong>What You’ll Do:<br><br></strong>We are seeking best-in-class<strong> Software Engineer interested in innovative front-end or full-stack web development with a passion for Quality who will join us at Oracle NetSuite in Prague and who is finishing university this academic year, 2025-2026, without any full-time work experience. </strong> You will use your knowledge and creativity to craft and build innovative new systems all the way from requirement definition through design, implementation, testing to deployment and bugfixing. Successful candidates will also be passionate about clean code, quality, and SOLID principles. You will have the opportunity to work on groundbreaking technologies to tackle real-world problems in a collaborative, agile environment.<br><br><strong>What You’ll Bring (Objective Minimum Qualifications):<br><br></strong><ul><li>Computer Science degree (Science, Technology, Engineering, and Math).</li><li>Hybrid working model: minimum 3 days in the office, dependent on the teams committed structure.</li><li>Front-end coding skills: Javascript/ECMAScript; desired TypeScript, React, HTML, CSS.</li><li>Back-end coding skills: mandatory any object-oriented language (e.g. Java, C#, Python, Kotlin); desired any unit testing framework.</li><li>Intimate understanding of modern web applications and database-driven applications such as SQL. Optionally, knowledge or experience with ORM framework.</li><li>Great problem-solving skills and the ability to abstract functional requirements and strong communication abilities in both technical and non-technical contexts.</li><li>Analytical thinker who wants to work in a team environment and develop and grow their skills.</li><li>Embodiment of our Values: Customer First, Collaboration, Innovation, and Integrity.</li><li>Other desired skills: Git; any testing framework or methodology; any Agile methodology<br><br><br></li></ul><em>At Oracle, we don’t just respect differences—we celebrate them. We believe that innovation starts with inclusion and to create the future we need people with diverse backgrounds, perspectives, and abilities. That’s why we’re committed to creating a workplace where all kinds of people can do their best work. It’s when everyone’s voice is heard and valued that we’re inspired to go beyond what’s been done before.</em> <em>https://www.oracle.com/corporate/careers/diversity-inclusion/<br><br></em>Career Level - IC2<br><br><strong>Qualifications<br><br></strong>Career Level - IC2<br><br><strong>About Us<br><br></strong>As a world leader in cloud solutions, Oracle uses tomorrow’s technology to tackle today’s challenges. We’ve partnered with industry-leaders in almost every sector—and continue to thrive after 40+ years of change by operating with integrity.<br><br>We know that true innovation starts when everyone is empowered to contribute. That’s why we’re committed to growing an inclusive workforce that promotes opportunities for all.<br><br>Oracle careers open the door to global opportunities where work-life balance flourishes. We offer competitive benefits based on parity and consistency and support our people with flexible medical, life insurance, and retirement options. We also encourage employees to give back to their communities through our volunteer programs.<br><br>We’re committed to including people with disabilities at all stages of the employment process. If you require accessibility assistance or accommodation for a disability at any point, let us know by emailing accommodation-request_mb@oracle.com or by calling +1 888 404 2494 in the United States.<br><br>Oracle is an Equal Employment Opportunity Employer. All qualified applicants will receive consideration for employment without regard to race, color, religion, sex, national origin, sexual orientation, gender identity, disability and protected veterans’ status, or any other characteristic protected by law. Oracle will consider for employment qualified applicants with arrest and conviction records pursuant to applicable law."
"Embedded Developer - C, Python - Aerospace",Honeywell,https://www.linkedin.com/jobs/view/4298258361/?utm_medium=jobboard&utm_source=juniorguru,False,2025-12-05 00:00:00,,en,,,linkedin#4298258361,,,,,,,,,,Brno,,,,,,,,,,,,,,,,,,,,Brno,,,,,,,,,,,,,,,,,,,,fulltime,,,,,,,,,,"<strong>Job Description<br><br></strong><strong>Are you ready to help us make the future?<br><br></strong>You have the opportunity to become a Junior Software Engineer at Honeywell Aerospace in Brno. In this role, you will work on aircraft control units for electro-mechanical actuator systems, fuel cells, life support systems, and environmental control systems.<br><br>As part of a dedicated team, you will contribute to the development of safety-critical and complex products for various types of aircraft.<br><br>In the Czech Republic, Honeywell has established a center of excellence dedicated to Control Systems. This presents a significant opportunity for you to participate in cutting-edge development projects.<br><br>You will collaborate closely with global Honeywell resources and will be involved in the whole software development life cycle. This includes activities such as requirements development, design, coding, integration, verification, and software certification.<br><br>This is a hybrid role, 3 days in office, 2 from home.<br><br><strong>Responsibilities<br><br></strong><ul><li> Development of real-time embedded software for aircraft controllers (actuation, fuel cells, life support and environmental control systems) using C and C++ languages </li><li> Participation in the following stages of software development: requirements definition, design, coding, testing, and documentation of the software in accordance with aerospace guidelines </li><li> Development of supporting tools <br><br></li></ul><strong>Qualifications<br><br></strong><ul><li> University degree in Engineering field with IT/programming background </li><li> Knowledge of programming in C/C++ and a strong interest in kickstarting your career in embedded development. </li><li> Proficient in the English language, as you will be in regular communication with colleagues in the US and the UK </li><li> Technical writing skills </li><li> Knowledge of embedded systems and communication protocols such as I2C, SPI, etc. <br><br></li></ul><em>Please note that due to export restrictions, we will only be able to take into consideration applicants with an EU or US citizenship.<br><br></em><strong>We value<br><br></strong><ul><li> Knowledge of aerospace environment (university background in aerospace engineering) </li><li> Experience with Python </li><li> Configuration management tools knowledge <br><br></li></ul><strong>We offer<br><br></strong><ul><li>Market-specific training and ongoing personal and professional development with support of experienced leaders</li><li>Extra-week of holiday, semi-flexible working hours</li><li>Benefit portfolio including meal allowance, pension insurance, Benefit Plus Cafeteria program, discounted phone tariff, Multisport card for free or discounted access to sports and leisure facilities, global partnership, and discounts and more<br><br></li></ul>We are an equal opportunity employer and value diversity at our company. We do not discriminate based on race, religion, color, national origin, gender, sexual orientation, age, marital status, veteran status, or disability status.<br><br>We will ensure that individuals with disabilities are provided reasonable accommodation to participate in the job application or interview process, to perform crucial job functions, and to receive other benefits and privileges of employment. Please contact us to request accommodation.<br><br><strong>Join us now and become part of our journey - help us make the future!<br><br></strong>#FutureShaper<br><br><strong>About Us<br><br></strong>Honeywell helps organizations solve the world's most complex challenges in automation, the future of aviation and energy transition. As a trusted partner, we provide actionable solutions and innovation through our Aerospace Technologies, Building Automation, Energy and Sustainability Solutions, and Industrial Automation business segments – powered by our Honeywell Forge software – that help make the world smarter, safer and more sustainable."
IT Trainee with German language,IBM,https://www.linkedin.com/jobs/view/4348662639/?utm_source=juniorguru,False,2025-12-05 00:00:00,,en,,,linkedin#4348662639,,,,,,,,,,Košice,,,,,,,,,,,,,,,,,,,,Košice,,,,,,,,,,,,,,,,,,,,fulltime,,,,,,,,,,"<strong>Introduction<br><br></strong>A career in IBM Consulting is rooted by long-term relationships and close collaboration with clients across the globe. You'll work with visionaries across multiple industries to improve the hybrid cloud and AI journey for the most innovative and valuable companies in the world. Your ability to accelerate impact and make meaningful change for your clients is enabled by our strategic partner ecosystem and our robust technology platforms across the IBM portfolio<br><br><strong>Your Role And Responsibilities<br><br></strong><ul><li>Help with small programming and IT tasks.</li><li>Support the team with daily technical work.</li><li>Write and update simple project documents.</li><li>Communicate in German with the team when needed<br><br></li></ul><strong>Preferred Education<br><br></strong>Bachelor's Degree<br><br><strong>Required Technical And Professional Expertise<br><br></strong>Bachelor’s or expected Master degree (Mathematics, Computer science, Information Technology, Engineering)<br><br><ul><li> Attitude and interest in an IT Engineer/ Specialist / Consultant career</li><li> Adaptability, Communication, Creative, Problem Solving, Taking Ownership, Teamwork and Collaboration</li><li> Ability to make decisions, take on responsibilities and have the ability to adapt, change and re-prioritize your plans in a dynamic and fast paced environment</li><li> German Language is a must</li></ul>"
