.NET Developer – interní systémy,MERKUR CASINO a.s.,https://www.jobs.cz/rpd/2000793743/,False,2025-10-30 00:00:00,,cs,,,jobscz#2000793743,,,,,,,,,,Praha,Praha,,,,,,,,,,,,,,,,,,,Praha,Praha,,,,,,,,,,,,,,,,,,,fulltime,,,,,,,,,,"<div data-jobad=""body"" data-test=""jd-body-richtext"" class=""RichContent mb-1400""><p class=""typography-body-medium-text-regular text-secondary mb-600"">Pracovní nabídka</p><p class=""typography-body-large-text-regular mb-800"">Jsme stabilní mezinárodní společnost působící v České republice od roku 1992. Patříme do silné skupiny MERKUR / Gauselmann, která má dlouhou historii v herním a zábavním průmyslu.</p><p class=""typography-body-large-text-regular mb-800"">Do našeho IT týmu hledáme <strong>.NET developera</strong>, který pomůže budovat interní aplikace a systémy klíčové pro náš provoz a další rozvoj.</p><p class=""typography-body-large-text-regular mb-800""><strong>Co u nás budete dělat?</strong></p><ul class=""typography-body-large-text-regular""><li>Práce s databázemi (Microsoft SQL) a napojení na jiné systémy</li><li>Integrace a zpracování dat (XML, JSON, CSV a další formáty)</li><li>Optimalizace procesů, návrh a realizace řešení</li><li>Vývoj interních Windows a web aplikací pro práci s daty</li><li>Dokumentace a správné verzování kódu (Git)</li></ul><p class=""typography-body-large-text-regular mb-800""><br><strong>Koho hledáme?</strong></p><ul class=""typography-body-large-text-regular""><li>Znalost .NET a C# (preferovaná varianta)</li><li>Oceníme i méně zkušeného vývojáře, pokud umí psát kód podle standardů a pečlivě dokumentovat</li><li>Zkušenost s databázemi (MS SQL) je výhodou</li><li>Dovednost psát čitelný a udržovatelný kód</li><li>Ochotu spolupracovat, sdílet znalosti a pracovat v týmu</li><li>Angličtinu na úrovni čtení dokumentace, běžná komunikace výhodou</li></ul><p class=""typography-body-large-text-regular mb-800""><br><strong>Co nabízíme?</strong></p><ul class=""typography-body-large-text-regular""><li>Možnost být u startu nových projektů a mít reálný vliv</li><li>Prostor pro vlastní nápady a profesní růst</li><li>Přátelský kolektiv a podporu vedení</li><li>Stabilní zázemí mezinárodní skupiny</li><li>Benefitní cafeterii Edenred (využití benefitů dle vlastní preference)</li><li>MultiSport kartu s příspěvkem zaměstnavatele</li><li>Příspěvek na stravování formou stravenkového paušálu</li></ul><p class=""typography-body-large-text-regular mb-800"">Předpokládaný nástup možný ihned nebo dle domluvy</p><p class=""typography-body-large-text-regular mb-800"">Dočetli jste až sem? Líbí? Zaujali jsme? Zašlete nám svůj životopis na uvedený e-mail.</p><p class=""typography-body-large-text-regular mb-800"">Těšíme se na Vás!</p></div>"
Junior/Medior Tester,EI SERVICES s.r.o.,https://www.jobs.cz/rpd/2000763836/,False,2025-10-30 00:00:00,,cs,,,jobscz#2000763836,,,,,,,,,,Praha,,,,,,,,,,,,,,,,,,,,Praha,,,,,,,,,,,,,,,,,,,,fulltime,,,,,,,,,,"<div data-jobad=""body"" data-test=""jd-body-richtext"" class=""RichContent mb-1400""><p class=""typography-body-medium-text-regular text-secondary mb-600"">Pracovní nabídka</p><p class=""typography-body-large-text-regular mb-800"">Hledáme junior/medior testera, který se stane součástí týmu zodpovědného za testování našeho inovativního produktu PlasmaStream https://plasmastream.eu/.</p><p class=""typography-body-large-text-regular mb-800""><strong>Co budeš dělat?</strong></p><p class=""typography-body-large-text-regular mb-800"">Psát test cases a provádět manuální testování našich aplikací.<br>Identifikovat a hlásit chyby, navrhovat zlepšení a kontrolovat opravy.<br>Přemýšlet nad testováním a zajišťovat, že produkt bude plně odpovídat požadavkům a specifikacím.<br>Aktivně se podílet na analýze a předvídání možných problémů v aplikacích.<br>Udržovat přehled o testovaných funkcionalitách a dokumentovat výsledky testů.<br>Pracovat v úzké spolupráci s vývojovým a produktovým týmem, abyste zajistili, že všechny chyby budou včas opraveny.</p><p class=""typography-body-large-text-regular mb-800""><strong>Co očekáváme?</strong></p><p class=""typography-body-large-text-regular mb-800"">Zkušenost s psaním test cases a manuálním testováním aplikací.<br>Samostatnost a schopnost převzít odpovědnost za kvalitu testování.<br>Ochotu přemýšlet nad projektem a testováním, hledat potenciální problémy a přicházet s nápady na zlepšení.<br>Vysoké nároky na pravidelnou a důslednou dokumentaci výsledků testování.<br>Zkušenosti s bug tracking systémy (např. JIRA) a komunikativní znalost angličtiny.<br>Pečlivost, zodpovědný přístup k práci.</p><p class=""typography-body-large-text-regular mb-800""><strong>Co nabízíme?</strong></p><p class=""typography-body-large-text-regular mb-800"">Práci na vývoji špičkového a inovativního produktu.<br>Možnost profesního růstu a zlepšení tvých testovacích dovedností.<br>Flexibilní pracovní dobu a možnost práce na dálku.<br>Odpovídající finanční ohodnocení.<br>Příležitost podílet se na zajímavých a náročných projektech.<br>Místo výkonu práce: Praha 5, Anděl.</p><p class=""typography-body-large-text-regular mb-800""><strong>Zaujala tě tato příležitost?</strong></p><p class=""typography-body-large-text-regular mb-800"">Těšíme se na tvoji odpověď! Staň se součástí týmu, který se stará o kvalitní a inovativní produkty pro naše klienty.</p></div>"
Asistent online projektů,"Junák - český skaut, z. s.",https://www.jobs.cz/rpd/2000806905/,False,2025-10-30 00:00:00,,cs,,,jobscz#2000806905,,,,,,,,,,Nova Praha,Praha,,,,,,,,,,,,,,,,,,,Ukrajina,Praha,,,,,,,,,,,,,,,,,,,parttime,,,,,,,,,,"<div data-jobad=""body"" data-test=""jd-body-richtext"" class=""RichContent mb-1400""><p class=""typography-body-medium-text-regular text-secondary mb-600"">Pracovní nabídka</p><p class=""typography-body-large-text-regular mb-800""><strong>Staň se součástí týmu, který spravuje a rozvíjí online nástroje pro skauty!</strong></p><p class=""typography-body-large-text-regular mb-800"">Zajímáš se o webové aplikace a IT? Chceš svou prací podpořit tisíce skautů, kteří využívají online systémy pro organizaci akcí, správu jednotek a další činnosti? Hledáme spolehlivého a komunikativního člověka, který se stane Asistentem*kou online projektů a pomůže s technickou podporou uživatelů, testováním aplikací a základní správou webových platforem.</p><p class=""typography-body-large-text-regular mb-800"">Pokud se nebojíš IT technologií, máš chuť se učit nové věci a láká tě práce, která má smysl, čti dál!</p><p class=""typography-body-large-text-regular mb-800"">Co tě čeká?<br>🔹 Správa a podpora webových projektů (Skautské závody, Databáze základen a kurzů, Skautský rezervační systém, hosting LEBEDA)<br>🔹 Komunikace s uživateli a podpora jejich práce s webovými aplikacemi<br>🔹 Testování připravovaných verzí aplikací a analýza chyb<br>🔹 Správa hostingů, DNS záznamů a základní podpora WordPress webů<br>🔹 Pomoc jednotkám s Google Workspace for Nonprofits<br>🔹 Psaní propagačních článků k online projektům<br>🔹 Účast na tematických poradách a spolupráce s koordinátorem online projektů</p><p class=""typography-body-large-text-regular mb-800"">Co od tebe očekáváme?<br>✅ Uživatelskou znalost MS Office a Google Workspace<br>✅ Základní orientaci v SQL, HTML, CSS a výhodou znalost Gitu</p><p class=""typography-body-large-text-regular mb-800"">✅ Zkušenost se správou webů postavených na populárních redakčních systémech<br>✅ Znalost fungování webových aplikací a testování webů či her (výhodou)</p><p class=""typography-body-large-text-regular mb-800"">✅ Schopnost samostatně řešit úkoly a určovat priority<br>✅ Spolehlivou komunikaci a ochotu učit se nové věci<br>✅ Časovou flexibilitu a odolnost vůči stresu<br>✅ Znalost technické angličtiny</p><p class=""typography-body-large-text-regular mb-800""><strong>Co nabízíme?</strong><br>Hlavní pracovní poměr na 0,5–0,6 úvazku<br>Nástup nejlépe ihned nebo dle dohody<br>Práci, která má smysl a kde budeš moct zúročit své (nejen skautské) dovednosti a znalosti<br>Získáš přehled o dění v celém hnutí a neunikne ti žádná novinka z “ústředí”<br>Podporu při zaučení, průběžná školení a možnost dalšího vzdělávání<br>Možnost hybridního způsobu práce - dle domluvy, ale alespoň jednou týdně je nutná přítomnost v kanceláři v centru Prahy.<br>Řada zaměstnaneckých benefitů: cafeterie, káva a čaj na pracovišti, sick days, 5 týdnů dovolené a další týden na “skautování” a možnost vlastního rozvržení pracovní doby</p><p class=""typography-body-large-text-regular mb-800"">Zaujala tě tato nabídka? Do 26.10. 2025 nám pošli nám svůj životopis a motivační dopis. Těšíme se na tebe!</p><p class=""typography-body-large-text-regular mb-800""><br><br></p></div>"
Process Automation Engineer,FABORY Czech s.r.o.,https://www.jobs.cz/rpd/2000839244/,False,2025-10-30 00:00:00,,en,,,jobscz#2000839244,,,,,,,,,,Šlapanice,Šlapanice,,,,,,,,,,,,,,,,,,,Brno,Brno,,,,,,,,,,,,,,,,,,,fulltime,,,,,,,,,,"<div data-jobad=""body"" data-test=""jd-body-richtext"" class=""RichContent mb-1400""><p class=""typography-body-medium-text-regular text-secondary mb-600"">Pracovní nabídka</p><p class=""typography-body-large-text-regular mb-800"">We are <strong>FABORY</strong> – a European specialist in fasteners.</p><p class=""typography-body-large-text-regular mb-800"">The mission of our Automation Team is to simplify and automate internal processes across the company, so our colleagues can focus on what we do best: keeping things together.</p><p class=""typography-body-large-text-regular mb-800"">We’re looking for a technically skilled <strong>Process Automation Engineer</strong> to join our team and help us drive digital efficiency through smart process automation and modern AI-powered tools.</p><h2 class=""typography-heading-small-text""><br><strong>What You’ll Do</strong></h2><ul class=""typography-body-large-text-regular""><li>Design, develop, and maintain process automation solutions (e.g., RPA, API integrations, scripts, Power Platform solutions, etc.)</li><li>Implement and support automation for business, logistics, and administrative teams</li><li>Build simple web apps or user interfaces to make automation tools easily accessible</li><li>Optimize performance and cost of automation solutions</li><li>Ensure security, reliability, and scalability of automation processes</li><li>Collaborate with international teams across departments</li><li>Maintain documentation, train end users, and share knowledge</li></ul><h2 class=""typography-heading-small-text""><br><strong>Ideally, You Have Some Experience With</strong></h2><ul class=""typography-body-large-text-regular""><li>Hands-on experience with RPA tools (e.g., Power Automate, UiPath, Make, n8n, Zapier, etc.)</li><li>Basic programming or scripting skills (e.g., Python, JavaScript, VBA)</li><li>Experience with REST API integrations and working with data (e.g., JSON, Excel, SQL)</li><li>Familiarity with cloud ecosystems (Microsoft 365, Azure, SharePoint, Power Apps)</li><li>Advantage: experience with AI/ML tools (e.g., ChatGPT API, Azure AI Services)</li><li>Good command of English, both spoken and written</li></ul><h2 class=""typography-heading-small-text""><br><strong>Who You Are</strong></h2><ul class=""typography-body-large-text-regular""><li>A proactive problem-solver with a genuine interest in new technologies</li><li>A team player who enjoys cross-department collaboration</li><li>Someone who can translate business requirements into technical solutions</li></ul><h2 class=""typography-heading-small-text""><br><strong>What We Offer</strong></h2><ul class=""typography-body-large-text-regular""><li>5 weeks of vacation and 3 sick days</li><li>Hybrid work model (3+2)</li><li>Meal allowance and contributions to pension/life insurance and leisure activities</li><li>Annual salary review and Annual performance-based bonus</li><li>Opportunities for training and professional certifications</li><li>Company and team events</li><li>Dog-friendly office, free coffee, tea, and refreshment</li></ul></div>"
AI Junior Developer,TES VSETIN a.s.,https://www.jobs.cz/rpd/2000839021/,False,2025-10-30 00:00:00,,cs,,,jobscz#2000839021,,,,,,,,,,Vsetín,Vsetín,,,,,,,,,,,,,,,,,,,Zlín,Zlín,,,,,,,,,,,,,,,,,,,fulltime,,,,,,,,,,"<div data-jobad=""body"" data-test=""jd-body-richtext"" class=""RichContent mb-1400""><p class=""typography-body-medium-text-regular text-secondary mb-600"">Pracovní nabídka</p><p class=""typography-body-large-text-regular mb-800"">Baví tě programování a láká tě umělá inteligence? Hledáš první nebo druhou vývojářskou práci, kde dostaneš prostor růst, experimentovat a tvořit smysluplné věci? Přidej se do našeho AI týmu v TES VSETIN a.s. a pomoz nám zavádět AI a automatizaci napříč firmou.</p><h2 class=""typography-heading-small-text"">🚀 Co tě u nás čeká</h2><ul class=""typography-body-large-text-regular""><li>Vývoj jednoduchých HTML/CSS/JS aplikací a skriptů v Pythonu nebo TypeScriptu</li><li>Automatizace procesů pomocí nástrojů jako n8n, ChatGPT Agents nebo vlastního kódu</li><li>Tvorba a testování interních AI nástrojů (např. chatbotů, interních automatizací)</li><li>Spolupráce s týmy napříč firmou – hledání míst, kde AI pomůže nejvíc</li><li>Učení se a hraní si s novými nástroji: Gemini, Codex, Cursor, Windsurfr, OpenAI API</li></ul><h2 class=""typography-heading-small-text"">🧠 Co od tebe čekáme</h2><ul class=""typography-body-large-text-regular""><li>Základní znalost programování v Pythonu a/nebo JavaScript/TypeScriptu</li><li>Schopnost vytvořit jednoduchou webovou aplikaci (HTML, CSS)</li><li>Základy práce se servery a orientace v prostředí API</li><li>Práce ve VS Code (rozšíření jako Gemini, Codex výhodou)</li><li>Chuť učit se nové AI nástroje a aktivně přispívat v týmu</li></ul><p class=""typography-body-large-text-regular mb-800""><em>Pozice je ideální pro absolventy a juniory – důležitá je chuť se učit a pracovat v týmu.</em></p><h2 class=""typography-heading-small-text"">🎁 Co nabízíme</h2><ul class=""typography-body-large-text-regular""><li>HPP s možností hybridní spolupráce – začátek ve Vsetíně, později i částečný home-office</li><li>Podpora v růstu – školení, mentoring, učení se na reálných projektech</li><li>Otevřená a přátelská firemní kultura – nápady vítány!</li><li>Zázemí stabilní firmy s technologickým elánem a 100+ letou historií</li></ul><h2 class=""typography-heading-small-text"">✉️ Zaujali jsme tě?</h2><p class=""typography-body-large-text-regular mb-800"">Pošli nám svůj životopis, krátký motivační text (co tě na AI baví) a pokud máš, připoj ukázku projektu nebo co jsi dělal na škole popř. s AI. Ozveme se ti co nejdřív!</p></div>"
(JUNIOR) SERVICENOW DEVELOPER (ITOM / CMDB),BENTELER Business Services CZ,https://www.jobs.cz/rpd/2000779113/,False,2025-10-30 00:00:00,,en,,,jobscz#2000779113,,,,,,,,,,Praha,Praha,,,,,,,,,,,,,,,,,,,Praha,Praha,,,,,,,,,,,,,,,,,,,fulltime,,,,,,,,,,"<div data-jobad=""body"" data-test=""jd-body-richtext"" class=""RichContent mb-1400""><p class=""typography-body-medium-text-regular text-secondary mb-600"">Pracovní nabídka</p><p class=""typography-body-large-text-regular mb-800"">Ready to dive into ServiceNow? We're looking for someone to join us as a ServiceNow ITOM and CMDB Specialist! You'll work closely with others to understand what's needed and then make it happen in ServiceNow. From setting up ITOM to keeping the CMDB in top shape, you'll be the go-to person. Plus, you'll get to work with a great team and learn even more about servers and networks along the way!</p><p class=""typography-body-large-text-regular mb-800""><br><strong>Your chance</strong></p><ul class=""typography-body-large-text-regular""><li>Collaboration with stakeholders to understand requirements and translate them into technical specifications for ServiceNow ITOM and CMDB</li><li>Design, develop and configure ITOM and CMDB including Discovery, Service Mapping and Event Management</li><li>Configure and maintain CMDB data model, ensuring accurate and up-to-date configuration item information</li><li>Integration of ServiceNow with other IT Operational platforms using APIs</li><li>Collaboration with cross-functional IT teams to define and implement ITOM and CMDB best practices, ensuring alignment with ITIL processes</li><li>Provision of ongoing support and maintenance for ServiceNow applications, troubleshooting issues and implementing fixes or enhancements</li><li>Collaboration with other ServiceNow developers and administrators within a virtual team</li></ul><p class=""typography-body-large-text-regular mb-800""><strong>Your personality</strong></p><ul class=""typography-body-large-text-regular""><li>Education: Bachelor's degree in computer science, information technology, or a related field.</li><li>Experience: Basic understanding of the ServiceNow platform and some hands-on experience with ServiceNow development.</li></ul><p class=""typography-body-large-text-regular mb-800""><strong>Skills:</strong></p><ul class=""typography-body-large-text-regular""><li>ServiceNow CMDB and ITOM: Familiarity with CMDB and ITOM functions like Discovery, Service Mapping, and Event Management.</li><li>Development and Configuration: Basic skills in ServiceNow development and configuration, including workflows, business rules, UI policies, and scripting.</li><li>Integration: Some experience with ServiceNow integration using APIs and web services.</li><li>ITIL Processes: Basic understanding of ITIL processes and best practices related to ITOM and CMDB.</li><li>Problem-Solving: Ability to troubleshoot technical issues with guidance.</li><li>Communication: Good communication and interpersonal skills, with the ability to collaborate effectively with stakeholders and technical teams.</li><li>Technical Background: Basic knowledge of server and network architecture is a plus.</li><li>Language: English language proficiency at least at B2 level.</li></ul><p class=""typography-body-large-text-regular mb-800""><strong>What do we offer</strong></p><ul class=""typography-body-large-text-regular""><li>13. wage</li><li>5 weeks of holiday per year</li><li>Sick days</li><li>Home Office / surcharge for home office</li><li>Electronic meal vouchers (200 Kč/per day)</li><li>Monthly contribution to cafeteria</li><li>Language courses, possibility of further education</li><li>Bonus for loyalty</li><li>International working environment</li><li>Discounted mobile tariffs for you and your family &amp; friends (up to 6 phone numbers can be connected)</li><li>Favourable location</li></ul></div>"
Frontend Developer,"MoroSystems, s.r.o.",https://www.jobs.cz/rpd/2000539035/,False,2025-10-30 00:00:00,,sk,,,jobscz#2000539035,,,,,,,,,,Brno,Brno,,,,,,,,,,,,,,,,,,,Brno,Brno,,,,,,,,,,,,,,,,,,,fulltime,,,,,,,,,,"<div data-jobad=""body"" data-test=""jd-body-richtext"" class=""RichContent mb-1400""><p class=""typography-body-medium-text-regular text-secondary mb-600"">Pracovní nabídka</p><p class=""typography-body-large-text-regular mb-800"">Ať už ti vyhovuje práce na dlouhodobém projektu nebo spíš preferuješ variabilitu, máme ti co nabídnout. Momentálně se věnujeme hlavně <strong>vývoji řešení na zakázku pro různé typy klientů</strong>, nadnárodní korporace i české startupy, ale umíme zákazníkům pomoci i s jejich nestandardními požadavky. Důležité je, aby nám fungovala vzájemná spolupráce.</p><h2 class=""typography-heading-small-text"">S JAKÝMI TECHNOLOGIEMI SE U NÁS POTKÁŠ?</h2><p class=""typography-body-large-text-regular mb-800""><strong>Kromě JS/TypeScriptu/Reactu jsou to standardně</strong>:</p><ul class=""typography-body-large-text-regular""><li>Redux + Redux toolkit pro správu stavu</li><li>RTK query</li><li>Eslint pro analýzu kódu</li><li>Webpack, Vite a NPM pro build aplikace a správu balíčků</li><li>Storybook pro prezentaci komponent a dokumentaci</li><li>Styled components, Tailwind pro stylování</li><li>Next.js pro projekty, kde je potřeba SSR</li><li>Jest, Vitest na testování</li><li>GCP, Azure, AWS, Kubernetes, Terraform, Pulumi, Docker pro cloudové appky a obecně DevOps přístup</li><li>GitLab pro continuous integration/continuous delivery</li><li>Používáme taky kompletní stack Atlassian nástrojů – Jira, Confluence a další.</li></ul><p class=""typography-body-large-text-regular mb-800"">Není důležité, abys znal/a perfektně všechny zmíněné technologie. Základem pro nás je, že máš <strong>komerční zkušenosti s vývojem v React/TypeScriptu</strong>, jsi samostatný/á, <strong>sleduješ nové technologie</strong> a trendy a třeba nám přineseš i nový pohled na věc. Zásadní je tvá chuť věci posouvat, zlepšovat se a odvádět kvalitní práci - k tomu rozhodně dostaneš prostor.</p><p class=""typography-body-large-text-regular mb-800"">Mohlo by tě lákat, že u nás budeš moct ovlivnit směřování v téhle oblasti – <strong>budeš mít možnost být součástí debat o tom, jak React budeme psát.</strong></p><h2 class=""typography-heading-small-text"">LÍBIT SE TI U NÁS BUDE, POKUD TI VYHOVUJE</h2><ul class=""typography-body-large-text-regular""><li><strong>Pracovat ve firmě se silnou vizí</strong> – chceme, aby se náš způsob spolupráce stal zcela novým standardem, který bude chtít aplikovat každá firma na světě.</li><li><strong>Komunikovat otevřeně</strong> – máš nápad na zlepšení? Řekni ho klidně Tomovi (CEO) třeba u kafe v kuchyňce.</li><li><strong>Učit se od ostatních</strong> – učíme se navzájem a učí se od nás i ostatní. Nové znalosti, novinky z projektů či konferencí sdílíme napříč firmou, přednášíme na MeetUpech, natáčíme podcasty, píšeme články…</li><li><strong>Sdílet své koníčky a objevovat nové</strong> – standardně pořádáme sportovní turnaje, hackathony, deskovky, jezdíme na kole, chodíme po horách, trénujeme na Spartan race… a tím seznam nekončí.</li><li><strong>Mít možnost výběru – Lenovo nebo Mac</strong>; macOS, Windows nebo Linux, IDEA, Eclipse nebo NetBeans... – je to na tobě.</li><li><strong>Mít flexibilní pracovní dobu</strong> – potřebuješ skončit dřív nebo si ráno hodinu (nebo čtyři) přispat? Pokud nemáš žádné meetingy a nečeká na tebe zákazník, tak proč ne?</li><li>Pracovat z home-office – aktuálně si naše týmy zvykly na hybridní styl práce; do kanceláře sice chodíme rádi, ale pokud občas potřebuješ pracovat z domu, nebude to problém.</li></ul><h2 class=""typography-heading-small-text"">JAKÉ TO JE V BRNĚNSKÉ KANCELÁŘI?</h2><ul class=""typography-body-large-text-regular""><li>Máš raději tikka masala, vege ramen nebo českou klasiku? Všechny druhy meníček jsou od nás pár minut pěšky.</li><li>Kanceláře 4 minuty od České mají terasu s výhledem přímo do Tyršových sadů. Meeting si můžeš dát klidně v parku.</li><li>V kuchyňce s prvotřídním kávovarem nechybí každé ráno čerstvé ovoce a zelenina. Společné grilovačky jsou na (tý)denním pořádku celé léto.</li><li>Skvělá kombinace talentovaných, kreativních a vtipných kolegů. Vše pochopíš až uvidíš fotky z akcí, naše výtvory na chytré zdi nebo sérii memes na Slacku.</li></ul><h2 class=""typography-heading-small-text"">MÁŠ POCIT, ŽE BY NÁM TO SPOLEČNĚ MOHLO FUNGOVAT?</h2><p class=""typography-body-large-text-regular mb-800"">Ozvi se, rádi si o tom popovídáme. Pro začátek nám bude stačit tvé CV nebo LinkedIn profil. Těšíme se na setkání!</p></div>"
