Incident handler,Národní úřad pro kybernetickou a informační bezpečnost,https://www.jobs.cz/rpd/2000746382/?utm_source=juniorguru,False,2025-12-13 00:00:00,,cs,,,jobscz#2000746382,,,,,,,,,,Brno,Brno,,,,,,,,,,,,,,,,,,,Brno,Brno,,,,,,,,,,,,,,,,,,,fulltime,,,,,,,,,,"<div data-jobad=""body"" data-test=""jd-body-richtext"" class=""RichContent mb-1400""><p class=""typography-body-medium-text-regular text-secondary mb-600"">Pracovní nabídka</p><p class=""typography-body-large-text-regular mb-800""><strong>Pracovní pozice spadá pod Odbor vládní CERT - Oddělení reaktivní</strong></p><p class=""typography-body-large-text-regular mb-800"">Baví Vás řešení problémů v IT? Dokážete spolupracovat v týmu, nebo takový tým řešící incident vést? Máte neustále aktuální přehled o tom, co se děje v kybernetické bezpečnosti a chtěli byste pomáhat organizacím, které jsou kritické pro chod státu? Potom hledáme právě vás!</p><p class=""typography-body-large-text-regular mb-800"">„Naše oddělení je prvním kontaktním bodem v případě nahlášení kybernetického bezpečnostního incidentu. Tím pádem bude na Vás zjistit, co se stalo a incident vyřešit za pomocí vlastních znalostí, či ve spolupráci s kolegy s užšími specializacemi. Krom toho se též zasadíte například při sdílení sesbíraného threat intel s národními i mezinárodními partnery nebo v rámci vyhodnocování zranitelností a reakci na ně, či v dalších neméně potřebné agendě.“ – vedoucí reaktivního oddělení</p><p class=""typography-body-large-text-regular mb-800""><strong>Co bude vaší hlavní pracovní náplní:</strong></p><ul class=""typography-body-large-text-regular""><li>řešení kybernetických bezpečnostních incidentů nahlášených povinnými osobami dle ZkB,</li><li>komunikace s národními a mezinárodními partnery z veřejné, soukromé i akademické sféry, navazování vzájemných vztahů,</li><li>vyhodnocení a sdílení informací o incidentech,</li><li>vytěžování veřejně dostupných informačních zdrojů a automatizace tohoto procesu, hlubší analýza a korelace dat,</li><li>další vzdělávání ve zmíněných oblastech,</li></ul><p class=""typography-body-large-text-regular mb-800""><strong>Kvalifikační předpoklady:</strong></p><ul class=""typography-body-large-text-regular""><li>vysokoškolské vzdělání v oboru IT,</li><li>znalost síťových protokolů, především TCP/IP rodiny 4 a 6,</li><li>znalost aplikačních protokolů (DNS, HTTP, SMTP, NTP atd.),</li><li>znalost základních bezpečnostních protokolů (S/MIME, SSL/TLS, IPsec, DNSSEC atd.),</li><li>znalost konceptu systémů IDS, IPS a firewall,</li><li>znalost nejběžnějších typů útoků na IT systémy,</li><li>znalost systémů Unix-based a Windows,</li><li><strong>znalost českého jazyka na nadstandardní úrovni (slovem i písmem)</strong>,</li><li>znalost anglického jazyka na úrovni B2.</li></ul><p class=""typography-body-large-text-regular mb-800""><strong>Výhodou je mít:</strong></p><ul class=""typography-body-large-text-regular""><li>zkušenosti s incident handlingem,</li><li>dovednosti v oblasti reportingu a analytického psaní</li><li>pokročilá znalost Unix-based nebo Windows systémů,</li><li>předchozí práce s ticketovacími systémy,</li><li>znalost principů a metod CTI (cyber threat intelligence),</li><li>silné analytické myšlení.</li></ul><p class=""typography-body-large-text-regular mb-800""><strong>Nabízíme:</strong></p><ul class=""typography-body-large-text-regular""><li>práci v příjemném prostředí,</li><li>inspirativní práce s přístupem k moderním a často zcela unikátním technologiím,</li><li>možnost realizovat se v oboru či disciplíně přidružené k incident handlingu, která Vás zajímá (malware, forenzika, analýza síťového provozu atd…)</li><li>možnost spolupráce na zajímavých projektech v oblasti kybernetické bezpečnosti,</li><li>25 dní dovolené plus možnost čerpání 6 dní sick days v rámci kalendářního roku,</li><li>stravenkový paušál,</li><li>služební notebooky a mobilní telefon</li><li>odborná školení a kurzy (možnost nejen v rámci ČR, ale i v zahraničí),</li><li>pravidelné jazykové kurzy přímo na pracovišti,</li><li>možnost účasti na odborných mezinárodních konferencích,</li><li>FKSP (příspěvek na penzijní připojištění atd.),</li><li>možnost čerpání výhod z kolektivní smlouvy</li><li>pracovní a platové podmínky v souladu se zákoníkem práce a nařízením vlády č. 341/2017 Sb. (13. platová třída – v závislosti na délce praxe v daném oboru a se započítáním zvláštního příplatku minimálně 35 810 až 49 770 Kč; po zapracování, navýšení o osobní ohodnocení dle získaných zkušeností.</li><li>a spoustu dalších zaměstnaneckých benefitů.</li></ul><p class=""typography-body-large-text-regular mb-800"">Součástí přijímacího řízení je provedení bezpečnostního řízení k uchazeči dle zákona č. 412/2005 Sb., v platném znění na stupeň utajení TAJNÉ.</p><p class=""typography-body-large-text-regular mb-800"">Pracoviště: Brno</p><p class=""typography-body-large-text-regular mb-800""><strong>Termín nástupu:</strong> dohodou</p><p class=""typography-body-large-text-regular mb-800""><strong>Doba trvání pracovního poměru: </strong>1 rok na dobu určitou s následnou možností prodloužení na dobu neurčitou</p><p class=""typography-body-large-text-regular mb-800"">Pokud Vás pracovní pozice zaujala, pošlete nám svůj životopis a motivační dopis s vysvětlením, proč se na danou pozici hodíte. Pokud některý z požadavků nesplňujete, ale myslíte si, že by pro Vás byla tato pracovní pozice to pravé, napište nám, proč bychom si přesto měli vybrat právě Vás.</p><p class=""typography-body-large-text-regular mb-800""><em><strong>Veškeré materiály prosíme vkládat v úředním jazyce (pokud není uvedeno jinak) a uvádějte svoje státní občanství.</strong></em></p></div>"
Vývojář webových a databázových aplikací (i pro absolventy),24U s.r.o.,https://www.jobs.cz/rpd/2000906789/?utm_source=juniorguru,False,2025-12-13 00:00:00,,cs,,,jobscz#2000906789,,,,,,,,,,Praha,,,,,,,,,,,,,,,,,,,,Praha,,,,,,,,,,,,,,,,,,,,fulltime,,,,,,,,,,"<div data-jobad=""body"" data-test=""jd-body-richtext"" class=""RichContent mb-1400""><p class=""typography-body-medium-text-regular text-secondary mb-600"">Pracovní nabídka</p><p class=""typography-body-large-text-regular mb-800""><strong>Rád píšeš kód, ale bavilo by tě také vytvářet uživatelská rozhraní jako při vývoji webů, aby práce nebyla stereotypní?</strong> Chceš pracovat v menším kolektivu, ale týmový duch ti nechybí? Rádi tě u nás přivítáme…</p><p class=""typography-body-large-text-regular mb-800""><strong>Neděláme nudné databáze, vytváříme integrace softwaru s hardwarem, propojujeme databáze s mobilními zařízeními jako jsou i iPady, iPhony</strong>, nebo i s jinými softwarovými službami…</p><p class=""typography-body-large-text-regular mb-800"">Baví tě pracovat s MS Access? Práce s FileMakerem je podobná. Umíš HTML, CSS, PHP? FileMaker zvládneš také. Část kolegů dříve dělala právě weby.</p><p class=""typography-body-large-text-regular mb-800"">Hledáme tebe, pokud tě baví vývoj na rozmanitých projektech a máš týmového ducha. Pokud nechceš dělat pouze backend, ale baví tě vytvářet uživatelské rozhraní jako na webu, určitě tě práce se <strong>softwarem FileMaker</strong> bude bavit. Jedná se o databázový software vyvíjený firmou Claris, která je vlastněna společností Apple. Zatím je více rozšířený v USA a v Evropě na západ od nás.</p><p class=""typography-body-large-text-regular mb-800""><strong>Pomáháme zákazníkům z celého světa</strong> a z nejrůznějších odvětví, tedy i pro nás je práce stále zajímavá. Přidej se k nám! Rozmanitost naší práce můžeš vidět na našem webu https://www.24usoftware.com.</p><h2 class=""typography-heading-small-text"">Vývojář “neobyčejných” webových a databázových aplikací (vhodné i pro absolventy)</h2><p class=""typography-body-large-text-regular mb-800""><strong>Název organizace:</strong> 24U s.r.o. - www.24usoftware.com</p><p class=""typography-body-large-text-regular mb-800""><strong>Pracoviště:</strong> Praha 4 - Michle</p><p class=""typography-body-large-text-regular mb-800""><strong>Nástup:</strong> ihned</p><p class=""typography-body-large-text-regular mb-800""><strong>Náplň práce:</strong></p><ul class=""typography-body-large-text-regular""><li>Vývoj a aktualizace databázových a webových aplikací na míru</li><li>Aplikace zejména pro menší a střední firmy</li><li>Práce s přední světovou platformou pro inovace - FileMaker (https://24usoftware.com/filemaker)</li><li>Postupně se naučíš integrovat SW služby a HW do databázových a webových řešení.</li><li>V budoucnu tě případně čeká komunikace s klienty a podpora zákazníkům, kterým se pravidelně snažíme ulehčit jejich práci</li></ul><p class=""typography-body-large-text-regular mb-800""><strong>Nabízíme:</strong></p><ul class=""typography-body-large-text-regular""><li>Zajímavou tvůrčí práci na rozmanitých projektech</li><li>Práci na plný pracovní úvazek (po - pá)</li><li>Možnost získání mezinárodního certifikátu odbornosti</li><li>Dlouhodobou spolupráci v zaměstnaneckém poměru</li><li>Zázemí stabilní společnosti s možností dalšího rozvoje</li><li>Práci s nejnovějšími technologiemi od firmy Apple, Bose atd.</li><li>Práce na projektech českých i zahraničních zákazníků</li></ul><p class=""typography-body-large-text-regular mb-800""><strong>Benefity:</strong></p><ul class=""typography-body-large-text-regular""><li>Sleva na prodávané výrobky/služby</li><li>Služební MacBook</li><li>Stravenky/příspěvek na stravování</li><li>Vzdělávací kurzy, školení</li><li>Káva/čaj k dispozici na pracovišti</li><li>Příspěvek na sport/kulturu/volný čas</li><li>Příspěvek na vzdělání</li><li>Možnost občasné práce z domova</li><li>Firemní akce</li><li>Možnost si napracovat hodiny</li><li>Vyhrazený čas na vlastní inovace</li></ul><p class=""typography-body-large-text-regular mb-800""><strong>Požadujeme:</strong></p><ul class=""typography-body-large-text-regular""><li>Obecnou znalost relačních databází a základů programování</li><li>Ochotu učit se a rozvíjet sám sebe</li><li>Základní znalost angličtiny</li><li>Analytické a logické myšlení</li><li>Aktivní přístup, snahu komunikovat</li></ul><p class=""typography-body-large-text-regular mb-800""><strong>Čím na nás zapůsobíš? Bohužel, jen rekvalifikační kurz nestačí:</strong></p><ul class=""typography-body-large-text-regular""><li>Zkušenostmi s Apple zařízeními</li><li>Znalostí SQL</li><li>Znalostí webových služeb (REST)</li><li>Znalostí některých dalších věcí, se kterými se u nás také můžeš setkat (Python, HTML, JavaScript, CSS, PHP, bash)</li></ul><p class=""typography-body-large-text-regular mb-800"">Pokud se chceš stát součástí týmu pracujícího na <strong>zajímavých tuzemských i zahraničních projektech, pošli nám </strong>svůj strukturovaný životopis s krátkým průvodním dopisem o svých zkušenostech nebo zájmech souvisejících s databázemi.</p><p class=""typography-body-large-text-regular mb-800"">S pozdravem a přáním pěkného dne</p><p class=""typography-body-large-text-regular mb-800"">Ondřej Chaloupka</p><p class=""typography-body-large-text-regular mb-800""><br>24U s.r.o.</p><p class=""typography-body-large-text-regular mb-800"">Telefon : +420 224 910 892</p><p class=""typography-body-large-text-regular mb-800"">web: www.24usoftware.com</p></div>"
Zpracovatel GIS,PŘEDVÝBĚR.CZ a.s.,https://www.jobs.cz/rpd/2000859176/?utm_source=juniorguru,False,2025-12-13 00:00:00,,cs,,,jobscz#2000859176,,,,,,,,,,Brno,,,,,,,,,,,,,,,,,,,,Brno,,,,,,,,,,,,,,,,,,,,fulltime,,,,,,,,,,"<div data-jobad=""body"" data-test=""jd-body-richtext"" class=""RichContent mb-1400""><p class=""typography-body-medium-text-regular text-secondary mb-600"">Pracovní nabídka</p><p class=""typography-body-large-text-regular mb-800"">Pro našeho klienta, který se zabývá geodetickými a GIS řešeními, hledáme nového kolegu/kolegyni na pozici <strong>Zpracovatel GIS</strong>.</p><p class=""typography-body-large-text-regular mb-800"">Pozice je vhodná i pro absolventy.</p><h2 class=""typography-heading-small-text"">Náplň práce:</h2><ul class=""typography-body-large-text-regular""><li>Zpracování dat a jejich následná integrace do geografického informačního systému (GIS)</li></ul><h2 class=""typography-heading-small-text"">Očekáváme:</h2><ul class=""typography-body-large-text-regular""><li>SŠ nebo VŠ v oboru elektro nebo geografie</li><li>Výhodou praxe v GINIUSu</li><li>Výhodou zkušenost s GISem v oblasti plynárenství nebo vodárenství (případně jiná technická infrastruktura)</li><li>PC dovednosti (MS Office)</li></ul><h2 class=""typography-heading-small-text"">Nabízíme:</h2><ul class=""typography-body-large-text-regular""><li>Formu spolupráce na HPP</li><li>Finanční ohodnocení 30 000 - 45 000 Kč</li><li>Možnost navýšení mzdy po zapracování</li><li>Prémie</li><li>Pružnou pracovní dobu</li><li>Dovolenou navíc</li><li>Stravenkový paušál</li><li>Příspěvek na dovolenou a kulturu</li><li>Multisport kartu</li><li>Teambuildingové akce</li><li>Firemní masáže</li><li>Náborový příspěvek</li><li>Možnost přivýdělku nad rámec pracovní smlouvy</li><li>Mobilní telefon</li><li>Místo výkonu práce: <strong>Brno – Královo Pole</strong></li></ul><p class=""typography-body-large-text-regular mb-800"">Pokud Vás tato nabídka zaujala, zašlete nám Váš strukturovaný životopis. Budeme Vás v nejbližší době kontaktovat.</p><p class=""typography-body-large-text-regular mb-800"">Společnost PŘEDVÝBĚR.CZ a.s. si vyhrazuje právo nekontaktovat kandidáty, kteří nebudou splňovat výše uvedené požadavky.<br> <br> Výhodou spolupráce s námi je rychlost! S našimi konzultanty absolvujete pouze telefonický pohovor!</p><p class=""typography-body-large-text-regular mb-800"">Odpovědí na tento inzerát souhlasím, aby společnost PŘEDVÝBĚR.CZ a.s., sídlem Na Kozačce 1289/7, Praha 2, zpracovávala mé osobní údaje pro účely zprostředkování práce v souladu se zákonem č. 110/2019 Sb., a to až do odvolání písemnou formou.</p></div>"
Webový vývojář - vhodné i pro absolventy,24U s.r.o.,https://www.jobs.cz/rpd/2000906786/?utm_source=juniorguru,False,2025-12-13 00:00:00,,cs,,,jobscz#2000906786,,,,,,,,,,Praha,,,,,,,,,,,,,,,,,,,,Praha,,,,,,,,,,,,,,,,,,,,fulltime,,,,,,,,,,"<div data-jobad=""body"" data-test=""jd-body-richtext"" class=""RichContent mb-1400""><p class=""typography-body-medium-text-regular text-secondary mb-600"">Pracovní nabídka</p><p class=""typography-body-large-text-regular mb-800""><strong>Baví tě vývoj webových aplikací, rád pracuješ na různorodých projektech a láká tě menší tým s přátelskou atmosférou?</strong></p><p class=""typography-body-large-text-regular mb-800"">Hledáme zodpovědného a tvůrčího vývojáře, kterého weby opravdu baví – ať už jde o úpravy stávajících řešení nebo vývoj nových. U nás se nebudeš omezovat jen na backend – tvoříme i propracovaná uživatelská rozhraní, která běží v prohlížeči a jsou propojená s databázovým systémem FileMaker od společnosti Claris (součást Apple). Ten je v Česku méně známý, ale má velký potenciál, a my jej efektivně využíváme v kombinaci s webovými technologiemi.</p><p class=""typography-body-large-text-regular mb-800"">Spolupracujeme s klienty z celého světa a z různých oborů – od školství přes logistiku až po průmysl – takže tě čeká pestrá práce a spousta zajímavých výzev. Pokud máš základy, všechno ostatní se postupně doučíš. Důležité je nadšení, chuť učit se novým věcem a týmový duch. Chceš dělat weby, které nejen dobře vypadají, ale i něco umí a zákazníkům přinášejí skutečný užitek?</p><p class=""typography-body-large-text-regular mb-800""><strong>Ozvi se nám – rádi tě přivítáme v týmu.</strong></p><p class=""typography-body-large-text-regular mb-800"">Rozmanitost našich projektů můžeš poznat blíže na https://www.24usoftware.com.</p><h2 class=""typography-heading-small-text""><strong>Webový vývojář (vhodné i pro absolventy)</strong></h2><p class=""typography-body-large-text-regular mb-800""><strong>Název organizace:</strong> 24U s.r.o. - www.24uSoftware.com</p><p class=""typography-body-large-text-regular mb-800""><strong>Pracoviště:</strong> Praha 4 - Michle</p><p class=""typography-body-large-text-regular mb-800""><strong>Nástup:</strong> ihned</p><p class=""typography-body-large-text-regular mb-800""><strong>Náplň práce:</strong></p><ul class=""typography-body-large-text-regular""><li>Vytváření a aktualizace rozmanitých webových stránek a aplikací.</li><li>Spolupráce na webových projektech s ostatními kolegy v malém týmu.</li><li>Postupně se naučíš jak propojit webové aplikace a databázová řešení, nasazovat aplikace na servery a také servery udržovat.</li><li>V budoucnu tě případně čeká komunikace s klienty a podpora zákazníkům, kterým se pravidelně snažíme ulehčit jejich práci.</li></ul><p class=""typography-body-large-text-regular mb-800""><strong>Nabízíme:</strong></p><ul class=""typography-body-large-text-regular""><li>Zajímavou tvůrčí práci na rozmanitých projektech.</li><li>Práci na plný pracovní úvazek (po – pá).</li><li>Dlouhodobou spolupráci v zaměstnaneckém poměru.</li><li>Zázemí stabilní společnosti s možností dalšího rozvoje.</li><li>Práci na projektech českých i zahraničních zákazníků.</li><li>Práci s nejnovějšími technologiemi.</li><li>Místo výkonu práce: Praha 4.</li></ul><p class=""typography-body-large-text-regular mb-800""><strong>Benefity:</strong></p><ul class=""typography-body-large-text-regular""><li>Sleva na prodávané výrobky/služby.</li><li>Služební MacBook.</li><li>Stravenky/příspěvek na stravování.</li><li>Vzdělávací kurzy, školení.</li><li>Káva/čaj k dispozici na pracovišti.</li><li>Příspěvek na sport/kulturu/volný čas.</li><li>Příspěvek na vzdělání.</li><li>Možnost občasné práce z domova.</li><li>Firemní akce.</li><li>Možnost si napracovat hodiny.</li><li>Vyhrazený čas na vlastní inovace.</li></ul><p class=""typography-body-large-text-regular mb-800""><strong>Požadujeme:</strong></p><ul class=""typography-body-large-text-regular""><li>Obecnou znalost relačních databází a základů programování.</li><li>Základní znalost HTML, CSS, PHP a MySQL.</li><li>Základní znalost JavaScriptu.</li><li>Základní znalost relačních databází.</li><li>Aktivní přístup, snahu komunikovat.</li><li>Ochotu učit se a rozvíjet sám sebe.</li><li>Základní znalost angličtiny.</li><li>Analytické a logické myšlení.</li></ul><p class=""typography-body-large-text-regular mb-800""><strong>Čím na nás zapůsobíte:</strong></p><ul class=""typography-body-large-text-regular""><li>Znalostí principů objektového programování.</li><li>Znalostí práce s NPM balíčky, buildovacími nástroji typu Webpack.</li><li>Znalostí SASS nebo LESS preprocesorů.</li><li>Znalostí fungování a nastavení webového serveru (Linux + Apache).</li><li>Znalostí práce s git repozitáři.</li><li>Povědomím o zabezpečení webových aplikací.</li><li>Znalostí některých dalších věcí, se kterými se u nás také můžeš setkat (Python, React, Nette).</li></ul><p class=""typography-body-large-text-regular mb-800"">Pokud Tě naše nabídka zaujala a chceš se stát součástí týmu pracujícího na zajímavých projektech, zašli nám svůj strukturovaný životopis s krátkým průvodním dopisem o svých zkušenostech nebo zájmech o webové technologie.</p><p class=""typography-body-large-text-regular mb-800"">Vhodné i pro absolventy, se zkušenostmi s výše uvedenými technologiemi.</p><p class=""typography-body-large-text-regular mb-800"">Jen vážní zájemci. Hledáme kolegy pro dlouhodobou spolupráci. Výběrové řízení je vícekolové.</p><p class=""typography-body-large-text-regular mb-800"">S pozdravem a přáním pěkného dne</p><p class=""typography-body-large-text-regular mb-800"">Ondřej Chaloupka</p><p class=""typography-body-large-text-regular mb-800""><br>24U s.r.o.</p><p class=""typography-body-large-text-regular mb-800"">Telefon : +420 224 910 892</p><p class=""typography-body-large-text-regular mb-800"">web: www.24u.cz</p></div>"
Vývojář skriptů – Crash Eval Tool,IXPERTA s.r.o.,https://www.jobs.cz/rpd/2000793641/?utm_source=juniorguru,False,2025-12-13 00:00:00,,cs,,,jobscz#2000793641,,,,,,,,,,Mladá Boleslav,Mladá Boleslav,,,,,,,,,,,,,,,,,,,Praha,Praha,,,,,,,,,,,,,,,,,,,parttime,,,,,,,,,,"<div data-jobad=""body"" data-test=""jd-body-richtext"" class=""RichContent mb-1400""><p class=""typography-body-medium-text-regular text-secondary mb-600"">Pracovní nabídka</p><p class=""typography-body-large-text-regular mb-800""><strong>O čem je projekt?</strong><br>Hledáme kolegu/kolegyni, který/á převezme rozvoj a údržbu klíčového nástroje Crash Eval Tool. Ten automatizuje vyhodnocování dat z nárazových zkoušek a převádí surová crash-testová data do srozumitelných reportů, které rozhodují o bezpečnosti vozů.</p><p class=""typography-body-large-text-regular mb-800""><strong>Co budete dělat?</strong></p><ul class=""typography-body-large-text-regular""><li>Vývoj a skriptování (NI DIAdem &amp; VBS): Programování nových funkcí ve VBScriptu, zapracování metodik pro různé předpisy (IIHS, FMVSS apod.), automatizace reportů (PDF, PPTX) a zajištění správné transformace dat.</li><li>Údržba a podpora aplikace: Aktualizace algoritmů dle Euro NCAP/ECE, řešení uživatelských tiketů (JIRA), podpora inženýrů při nestandardních testech a průběžná údržba dokumentace (Confluence).</li><li>Integrace a práce s daty: Export finálních dat do MDMCrash a nastavení automatického vykreslování grafů včetně integrace fotek a videí do výstupních šablon.</li></ul><p class=""typography-body-large-text-regular mb-800""><br><strong>Požadavky: </strong></p><ul class=""typography-body-large-text-regular""><li>Schopnost psát skripty ve Visual Basic Script (VBS) – základní dovednost pro tuto roli.</li><li>Schopnost komunikovat a dokumentovat česky i anglicky.</li><li>Logické myšlení a schopnost převádět fyzikální veličiny a legislativní vzorce do kódu.</li><li>Výhodou znalost aplikace NI DIAdem, zkušenost s vyhodnocováním nárazových zkoušek, znalost GIT a orientace v předpisech (Euro NCAP, ECE, IIHS) a zkušenost s Atlassian JIRA a Confluence.</li></ul><p class=""typography-body-large-text-regular mb-800""><strong>Nabízíme:</strong></p><ul class=""typography-body-large-text-regular""><li>Práci z domova s pouze jedním pravidelným setkáním měsíčně v Mladé Boleslavi.</li><li>Možnost podílet se na vývoji nástroje, který přímo ovlivňuje bezpečnost vozidel.</li><li>Přístup k unikátním datům z nárazových zkoušek a práci s moderními technologiemi.</li><li>Těšit se můžete i na příjemné benefity.</li></ul><p class=""typography-body-large-text-regular mb-800"">NAB-1659</p></div>"
