title,company_name,url,remote,first_seen_at,last_seen_at,lang,juniority_score,source,external_ids_0,external_ids_1,external_ids_2,external_ids_3,external_ids_4,external_ids_5,external_ids_6,external_ids_7,external_ids_8,external_ids_9,locations_0_name,locations_1_name,locations_2_name,locations_3_name,locations_4_name,locations_5_name,locations_6_name,locations_7_name,locations_8_name,locations_9_name,locations_10_name,locations_11_name,locations_12_name,locations_13_name,locations_14_name,locations_15_name,locations_16_name,locations_17_name,locations_18_name,locations_19_name,locations_0_region,locations_1_region,locations_2_region,locations_3_region,locations_4_region,locations_5_region,locations_6_region,locations_7_region,locations_8_region,locations_9_region,locations_10_region,locations_11_region,locations_12_region,locations_13_region,locations_14_region,locations_15_region,locations_16_region,locations_17_region,locations_18_region,locations_19_region,employment_types_0,employment_types_1,employment_types_2,employment_types_3,employment_types_4,employment_types_5,employment_types_6,employment_types_7,employment_types_8,employment_types_9,description_html
Vývojář JAVA,ORTEX spol. s r.o.,https://www.jobs.cz/rpd/2000904968/?utm_source=juniorguru,False,2025-12-13 00:00:00,,cs,,,jobscz#2000904968,,,,,,,,,,Hradec Králové,Hradec Králové,,,,,,,,,,,,,,,,,,,Hradec Králové,Hradec Králové,,,,,,,,,,,,,,,,,,,fulltime,,,,,,,,,,"<div data-jobad=""body"" data-test=""jd-body-richtext"" class=""RichContent mb-1400""><p class=""typography-body-medium-text-regular text-secondary mb-600"">Pracovní nabídka</p><p class=""typography-body-large-text-regular mb-800""><strong>ORTEX hledá nové kolegy pro rozšíření svého týmu v oblasti tvorby moderních business aplikací. Nejsme korporát, spíše rodinná firma, kde najdete smysl a osobní přístup.</strong></p><h2 class=""typography-heading-small-text"">Vývojář Java</h2><p class=""typography-body-large-text-regular mb-800"">Hledáme posilu do týmu, který vyvíjí originální řešení pro automatizaci procesů obchodu, výroby, financí i řízení lidských zdrojů.</p><h2 class=""typography-heading-small-text"">Co budete dělat:</h2><ul class=""typography-body-large-text-regular""><li>Vývoj a podpora podnikových informačních systémů. Využíváme převážně jazyk Java.</li><li>Návrh řešení konkrétních úloh na základě vstupů od analytiků a požadavků zákazníků.</li><li>Vývoj, optimalizaci kódu, dokumentaci.</li><li>Testování výsledků své práce, hledání a odstraňování chyb.</li><li>Podpora konzultantů, řešení složitějších problémů zákazníků.</li></ul><h2 class=""typography-heading-small-text"">Co od vás očekáváme nebo co se budete muset naučit?</h2><ul class=""typography-body-large-text-regular""><li>Praktickou znalost některého objektového programovacího jazyka (Java, C#, …) a SQL.</li><li>Vzdělání SŠ nebo VŠ.</li><li>Analytické myšlení, houževnatost a vytrvalost, iniciativu.</li><li>Schopnost práce v týmu, dodržování standardů, best practices.</li><li>Java, Hibernate, Enterprise Architect, DB: ORACLE, MS SQL Server.</li><li>Vítána je také alespoň dílčí znalost podnikových procesů.</li><li>Schopnost práce v týmu, tvorba a dodržování standardů, best practices.</li><li>Soulad s firemními hodnotami otevřené přátelské komunikace, spolehlivé a aktivní spolupráce.</li></ul><h2 class=""typography-heading-small-text"">Co nabízíme?</h2><ul class=""typography-body-large-text-regular""><li>Hlavní pracovní poměr – 40tihodinový týdenní úvazek. Možno ale začít i částečným úvazkem od 50%.</li><li>Příležitost ke startu kariéry i k odbornému rozvoji.</li><li>Získání praktických zkušeností od seniorních kolegů i zpětné vazby od zákazníků z řady oborů, z celé České republiky.</li><li>Přátelské, stabilní prostředí a smysluplná činnost pro reálné zákazníky.</li><li>Přístup k aktuálním technologiím a systémům – používáme nejmodernější informační technologie (Microsoft Office 365, CRM, cloud, sociální sítě, AI nástroje), využíváme benefity Microsoft partnerství.</li><li>Rostoucí platové ohodnocení na základě výsledků a přínosů pro firmu a zákazníky.</li><li>Pracoviště v centru Hradce Králové s pružnou pracovní dobou.</li><li>5 týdnů dovolené, stravenková karta, možnost home office.</li><li>Školení a certifikace, kurz angličtiny v pracovní době.</li></ul></div>"
Backend Developer,"MoroSystems, s.r.o.",https://www.jobs.cz/rpd/2000479393/?utm_source=juniorguru,False,2025-12-13 00:00:00,,cs,,,jobscz#2000479393,,,,,,,,,,Hradec Králové,Hradec Králové,,,,,,,,,,,,,,,,,,,Hradec Králové,Hradec Králové,,,,,,,,,,,,,,,,,,,fulltime,,,,,,,,,,"<div data-jobad=""body"" data-test=""jd-body-richtext"" class=""RichContent mb-1400""><p class=""typography-body-medium-text-regular text-secondary mb-600"">Pracovní nabídka</p><p class=""typography-body-large-text-regular mb-800"">Ať už ti vyhovuje práce na dlouhodobém projektu nebo spíš preferuješ variabilitu, máme ti co nabídnout. Momentálně se věnujeme hlavně <strong>vývoji řešení na zakázku</strong> pro různé typy klientů, <strong>nadnárodní korporace</strong> i <strong>české startupy,</strong> ale umíme zákazníkům pomoci i s jejich <strong>nestandardními požadavky</strong>. Důležité je, aby nám fungovala <strong>vzájemná spolupráce</strong>. Primárně se potkáváme v kancelářích (Brno, Hradec nebo Praha), ale pokud potřebuješ, můžeš občas pracovat i z domu.</p><p class=""typography-body-large-text-regular mb-800"">V současné chvíli rozjíždíme také menší projekty, které jsou různorodé a kde budeš moci zastřešit různé pozice,<strong> stereotyp ti rozhodně nehrozí</strong>. Může tě čekat <strong>občasné vedení týmu</strong>, na jiném projektu můžeš <strong>psát kód</strong>, na dalším budeš zase zodpovědný za <strong>rozjezd projektu</strong> jako takového. Pokud chceš být u těchto zajímavých projektů s námi, pak jsi tady správně!</p><h2 class=""typography-heading-small-text""><strong>S JAKÝMI TECHNOLOGIEMI SE U NÁS POTKÁŠ?</strong></h2><p class=""typography-body-large-text-regular mb-800"">Pracujeme s technologiemi, které opravdu dobře známe, zároveň sledujeme trendy a technologický stack tak stavíme na míru projektu. Jsme experti na jazyk Java/Kotlin, všechny jeho možnosti a prostředky. Potkáš se hlavně s následujícím:</p><ul class=""typography-body-large-text-regular""><li><strong>Java, Kotlin, Spring a Spring Boot, Hibernate, MyBatis nebo jOOQ, Rest, JUnit/Kotest, WebFlux, Liquibase a Swagger</strong> pro vývoj.</li><li><strong>Gradle a Maven</strong> k buildování.</li><li><strong>GIT a GitLab</strong> pro verzování a code review.</li><li><strong>GitLab Pipelines</strong> pro CI/CD.</li><li><strong>Detekt nebo Sonar</strong> pro statickou analýzu kódu.</li><li>Z databází nejčastěji <strong>PostgreSQL, ale taky Oracle, MySQL, MS SQL nebo MongoDB.</strong></li><li>Potkáš se u nás s cloud řešeními jako je <strong>AWS, Microsoft Azure a Google Cloud</strong>, včetně podpůrných nástrojů (<strong>Kubernetes, Pulumi, Terraform</strong>). Na kontejnerizaci máme <strong>Docker</strong>. Používáme taky stack <strong>Atlassian nástrojů</strong> – Jira a Confluence a další, což nám dost usnadňuje práci. Baví nás <strong>agilní přístup a spolupráce</strong> s kolegy i zákazníkem.</li></ul><p class=""typography-body-large-text-regular mb-800"">Pokud bys chtěl/a nahlédnout i do frontendového světa, najdeš u nás hlavně React, Redux + Immutable.js, Redux-form, Redux-saga/RTK Query, Reselect, Eslint</p><p class=""typography-body-large-text-regular mb-800""><strong>Vůbec nevadí, pokud jsi s některou z technologií nepracoval/a</strong>. Základem pro nás je, že máš komerční zkušenosti s vývojem v <strong>Javě/Kotlinu</strong>, jsi samostatný/á, nevadí ti <strong>občasné cestování</strong> a jsi otevřený pro <strong>práci u zákazníka</strong>. Oceníme, pokud sleduješ nové technologie a trendy a třeba nám přineseš i nový pohled na věc. Zásadní je tvá <strong>chuť věci posouvat, zlepšovat se a odvádět kvalitní práci – k tomu rozhodně dostaneš prostor.</strong></p><h2 class=""typography-heading-small-text""><strong>LÍBIT SE TI U NÁS BUDE, POKUD TI VYHOVUJE</strong></h2><ul class=""typography-body-large-text-regular""><li><strong>Pracovat ve firmě se silnou vizí</strong> – chceme, aby se náš způsob spolupráce stal zcela novým standardem, který bude chtít aplikovat každá firma na světě.</li><li><strong>Komunikovat otevřeně</strong> – máš nápad na zlepšení? Řekni ho klidně Tomovi (CEO) třeba u kafe v kuchyňce.</li><li><strong>Učit se od ostatních</strong> – učíme se navzájem a učí se od nás i ostatní. Nové znalosti, novinky z projektů či konferencí sdílíme napříč firmou, přednášíme na MeetUpech, natáčíme podcasty, píšeme články…</li><li><strong>Sdílet své koníčky</strong> a objevovat nové – standardně pořádáme turnaje v badmintonu nebo Buláncích, hackathony, deskovky, běháme pro Světlušku, jezdíme na kole, chodíme po horách, trénujeme na Spartan race… a tím seznam nekončí.</li><li><strong>Mít možnost výběru – Lenovo nebo Mac</strong>; macOS, Windows nebo Linux, IDEA, Eclipse nebo NetBeans... – je to na tobě.</li><li><strong>Mít flexibilní pracovní dobu</strong> – potřebuješ skončit dřív nebo si ráno hodinu (nebo čtyři) přispat? Pokud nemáš žádné meetingy a nečeká na tebe zákazník, tak proč ne?</li><li>Pracovat z home-office – rádi se potkáváme v kancelářích, ale pokud občas potřebuješ pracovat z domu, nebude to problém.</li></ul><h2 class=""typography-heading-small-text""><br><strong>JAKÉ TO JE V HRADECKÉ KANCELÁŘI?<br></strong></h2><ul class=""typography-body-large-text-regular""><li>Office v centru Hradce má opravdu rodinnou atmosféru. Je nás tu asi 40 a většina lidí tu s námi je hezkých pár let.</li><li>Pákový kávovar a kvalitní káva, kterou měníme na kód, je samozřejmostí.</li><li>Letní grilovačky pořádáme na dvorku u kanceláře.</li><li>Sednou ti kolegové a chcete se potkávat i mimo kancelář? Možností je spousta! Jarní návštěva pivovaru, na podzim Svatomartinská husa, squashový turnaj, společné běžecké závody/štafety, Spartan Race, zářijová chalupa s rodinami, kde se dlabou dýně nebo střílí ze vzduchovky. A v prosinci chodí Mikuláš!</li><li>Těšit se můžeš na talentované, kreativní a vtipné kolegy. Vše pochopíš, až uvidíš fotky z akcí, naše výtvory na chytré zdi nebo sérii memes na Slacku.</li></ul><h2 class=""typography-heading-small-text""><strong>MÁŠ POCIT, ŽE BY NÁM TO SPOLEČNĚ MOHLO FUNGOVAT?</strong></h2><p class=""typography-body-large-text-regular mb-800"">Ozvi se, rádi si o tom popovídáme. Pro začátek nám bude stačit tvé CV nebo LinkedIn profil. Těšíme se na setkání!</p></div>"
Backend Developer,"MoroSystems, s.r.o.",https://www.jobs.cz/rpd/2000514712/?utm_source=juniorguru,False,2025-12-13 00:00:00,,cs,,,jobscz#2000514712,,,,,,,,,,Brno,Brno,,,,,,,,,,,,,,,,,,,Brno,Brno,,,,,,,,,,,,,,,,,,,fulltime,,,,,,,,,,"<div data-jobad=""body"" data-test=""jd-body-richtext"" class=""RichContent mb-1400""><p class=""typography-body-medium-text-regular text-secondary mb-600"">Pracovní nabídka</p><p class=""typography-body-large-text-regular mb-800"">Ať už ti vyhovuje práce na dlouhodobém projektu nebo spíš preferuješ variabilitu, máme ti co nabídnout. Momentálně se věnujeme hlavně <strong>vývoji řešení na zakázku</strong> pro různé typy klientů, <strong>nadnárodní korporace</strong> i <strong>české startupy,</strong> ale umíme zákazníkům pomoci i s jejich <strong>nestandardními požadavky</strong>. Důležité je, aby nám fungovala <strong>vzájemná spolupráce</strong>. Primárně se potkáváme v kancelářích (Brno, Hradec nebo Praha), ale pokud potřebuješ, můžeš občas pracovat i z domu.</p><p class=""typography-body-large-text-regular mb-800"">V současné chvíli rozjíždíme také menší projekty, které jsou různorodé a kde budeš moci zastřešit různé pozice,<strong> stereotyp ti rozhodně nehrozí</strong>. Může tě čekat <strong>občasné vedení týmu</strong>, na jiném projektu můžeš <strong>psát kód</strong>, na dalším budeš zase zodpovědný za <strong>rozjezd projektu</strong> jako takového. Pokud chceš být u těchto zajímavých projektů s námi, pak jsi tady správně!</p><h2 class=""typography-heading-small-text""><strong>S JAKÝMI TECHNOLOGIEMI SE U NÁS POTKÁŠ?</strong></h2><p class=""typography-body-large-text-regular mb-800"">Pracujeme s technologiemi, které opravdu dobře známe, zároveň sledujeme trendy a technologický stack tak stavíme na míru projektu. Jsme experti na jazyk Java/Kotlin, všechny jeho možnosti a prostředky. Potkáš se hlavně s následujícím:</p><ul class=""typography-body-large-text-regular""><li><strong>Java, Kotlin, Spring a Spring Boot, Hibernate, MyBatis nebo jOOQ, Rest, JUnit/Kotest, WebFlux, Liquibase a Swagger</strong> pro vývoj.</li><li><strong>Gradle a Maven</strong> k buildování.</li><li><strong>GIT a GitLab</strong> pro verzování a code review.</li><li><strong>GitLab Pipelines</strong> pro CI/CD.</li><li><strong>Detekt nebo Sonar</strong> pro statickou analýzu kódu.</li><li>Z databází nejčastěji <strong>PostgreSQL, ale taky Oracle, MySQL, MS SQL nebo MongoDB.</strong></li><li>Potkáš se u nás s cloud řešeními jako je <strong>AWS, Microsoft Azure a Google Cloud</strong>, včetně podpůrných nástrojů (<strong>Kubernetes, Pulumi, Terraform</strong>). Na kontejnerizaci máme <strong>Docker</strong>. Používáme taky stack <strong>Atlassian nástrojů</strong> – Jira a Confluence a další, což nám dost usnadňuje práci. Baví nás <strong>agilní přístup a spolupráce</strong> s kolegy i zákazníkem.</li></ul><p class=""typography-body-large-text-regular mb-800"">Pokud bys chtěl/a nahlédnout i do frontendového světa, najdeš u nás hlavně React, Redux + Immutable.js, Redux-form, Redux-saga/RTK Query, Reselect, Eslint</p><p class=""typography-body-large-text-regular mb-800""><strong>Vůbec nevadí, pokud jsi s některou z technologií nepracoval/a</strong>. Základem pro nás je, že máš komerční zkušenosti s vývojem v <strong>Javě/Kotlinu</strong>, jsi samostatný/á, nevadí ti <strong>občasné cestování</strong> a jsi otevřený pro <strong>práci u zákazníka</strong>. Oceníme, pokud sleduješ nové technologie a trendy a třeba nám přineseš i nový pohled na věc. Zásadní je tvá <strong>chuť věci posouvat, zlepšovat se a odvádět kvalitní práci – k tomu rozhodně dostaneš prostor.</strong></p><h2 class=""typography-heading-small-text""><strong>LÍBIT SE TI U NÁS BUDE, POKUD TI VYHOVUJE</strong></h2><ul class=""typography-body-large-text-regular""><li><strong>Pracovat ve firmě se silnou vizí</strong> – chceme, aby se náš způsob spolupráce stal zcela novým standardem, který bude chtít aplikovat každá firma na světě.</li><li><strong>Komunikovat otevřeně</strong> – máš nápad na zlepšení? Řekni ho klidně Tomovi (CEO) třeba u kafe v kuchyňce.</li><li><strong>Učit se od ostatních</strong> – učíme se navzájem a učí se od nás i ostatní. Nové znalosti, novinky z projektů či konferencí sdílíme napříč firmou, přednášíme na MeetUpech, natáčíme podcasty, píšeme články…</li><li><strong>Sdílet své koníčky</strong> a objevovat nové – standardně pořádáme turnaje v badmintonu nebo Buláncích, hackathony, deskovky, běháme pro Světlušku, jezdíme na kole, chodíme po horách, trénujeme na Spartan race… a tím seznam nekončí.</li><li><strong>Mít možnost výběru – Lenovo nebo Mac</strong>; macOS, Windows nebo Linux, IDEA, Eclipse nebo NetBeans... – je to na tobě.</li><li><strong>Mít flexibilní pracovní dobu</strong> – potřebuješ skončit dřív nebo si ráno hodinu (nebo čtyři) přispat? Pokud nemáš žádné meetingy a nečeká na tebe zákazník, tak proč ne?</li><li>Pracovat z home-office – rádi se potkáváme v kancelářích, ale pokud občas potřebuješ pracovat z domu, nebude to problém.</li></ul><h2 class=""typography-heading-small-text""><br><strong>JAKÉ TO JE V BRNĚNSKÉ KANCELÁŘI?</strong></h2><ul class=""typography-body-large-text-regular""><li>Máš raději tikka masala, vege ramen nebo českou klasiku? Všechny druhy meníček jsou od nás pár minut pěšky.</li><li>Kanceláře 4 minuty od České mají terasu s výhledem přímo do Tyršových sadů. Meeting si můžeš dát klidně v parku.</li><li>V kuchyňce s prvotřídním kávovarem nechybí každé ráno čerstvé ovoce a zelenina. Společné grilovačky jsou na (tý)denním pořádku celé léto.</li><li>Skvělá kombinace talentovaných, kreativních a vtipných kolegů. Vše pochopíš až uvidíš fotky z akcí, naše výtvory na chytré zdi nebo sérii memes na Slacku.</li></ul><h2 class=""typography-heading-small-text""><strong>MÁŠ POCIT, ŽE BY NÁM TO SPOLEČNĚ MOHLO FUNGOVAT?</strong></h2><p class=""typography-body-large-text-regular mb-800"">Ozvi se, rádi si o tom popovídáme. Pro začátek nám bude stačit tvé CV nebo LinkedIn profil. Těšíme se na setkání!</p></div>"
"Tvoř nástroje, které denně vydělávají — Full-stack ve FAPI",FAPI Business s.r.o.,https://www.jobs.cz/rpd/2000876148/?utm_source=juniorguru,False,2025-12-13 00:00:00,,cs,,,jobscz#2000876148,,,,,,,,,,Ostrava,Ostrava,,,,,,,,,,,,,,,,,,,Ostrava,Ostrava,,,,,,,,,,,,,,,,,,,fulltime,,,,,,,,,,"<div data-jobad=""body"" data-test=""jd-body-richtext"" class=""RichContent mb-1400""><p class=""typography-body-medium-text-regular text-secondary mb-600"">Pracovní nabídka</p><h2 class=""typography-heading-small-text"">Baví tě Vibe coding?</h2><p class=""typography-body-large-text-regular mb-800""><strong>Tahle práce Tě pak bude hodně bavit.</strong></p><p class=""typography-body-large-text-regular mb-800"">Dobrý den, jmenuji se Jiří Slischka a snažím se najít jednoho super člověka. Možná právě Tebe.</p><p class=""typography-body-large-text-regular mb-800"">Do našeho týmu hledáme Programátora, který se nebojí sáhnout si na dno svých zkušeností. Pracovat nad limity všech ostatních i za cenu tohoto, že zjistí že to neudělali dobře. Dostane zpětnou vazbu a naučí se víc než kdekoliv jinde.</p><p class=""typography-body-large-text-regular mb-800"">Jsme nejpouživanější československý prodejní nástroj pro info podnikatele. Existujeme více jak 10 let. Pracujeme pro naše zákazníky, kterých je více jak 3 000. Pomáháme vytvořit jejich prodejní systém co nejlépe aby se dařilo jim a díky tomu také nám. Každý měsíc zpracujeme platby za desítky milionů korun. Tvá práce bude zdokonalovat a vylepšovat jak naší codebase tak naší infrastrukturu a další nástroje týkající se efektivity naší práce, podpory a dalších. Nemusíš umět hned všechno, časem se to u nás naučíš a získáš zkušenosti, které můžou vést až k práci na mezinárodních projektech.</p><h2 class=""typography-heading-small-text"">Co Tě čeká:</h2><ul class=""typography-body-large-text-regular""><li>Primárně vývoj aplikace FAPI.</li><li>Práce v malém týmu, který vedu přímo já.</li></ul><h2 class=""typography-heading-small-text"">Co Ti za to dáme:</h2><ul class=""typography-body-large-text-regular""><li>Garantovaný nástupní plat 35 000 Kč + i když se programování začínáš teprve učit.</li><li>Během následujích měsíců můžou svou výplatu klidně zdvojnásobit.</li><li>Svobodu, důvěru a podporu zkušeného týmu.</li></ul><h2 class=""typography-heading-small-text"">Koho hledáme:</h2><ul class=""typography-body-large-text-regular""><li>Máš alespoň základní zkušenosti s programováním, ať je to v jakémkoliv jazyce.</li><li>Programování a vývoj tě zajímá a chceš se stát špičkovým programátorem.</li><li>Jsi samostatný, pečlivý a umíš si řídit svůj čas.</li></ul><p class=""typography-body-large-text-regular mb-800""><strong>Nebojte, Vaši žádost nebudeme brát jako závaznou. Dokud se nepřihlásíte přes náš web. Více informací dostanete po přihlášení.</strong></p></div>"
