IT Support / Aplikační podpora & E-commerce,Swiss Automotive Group CZ,https://www.linkedin.com/jobs/view/4349671999/?utm_source=juniorguru,False,2025-12-12 00:00:00,,cs,,,linkedin#4349671999,,,,,,,,,,Hostivice,,,,,,,,,,,,,,,,,,,,Praha,,,,,,,,,,,,,,,,,,,,fulltime,,,,,,,,,,"<p>Společnost<strong>&nbsp;SAG CZ s.r.o</strong>. vyhlašuje výběrové řízení na pozici&nbsp;<strong>IT Support / Aplikační podpora &amp; E-commerce.&nbsp;</strong>Staň se součástí IT týmu v inovativní společnosti Swiss Automotive Group CZ s.r.o. (dále jen SAG), která se specializuje na dodávky autodílů na českém trhu. Se sortimentem více než 1 800 000 položek je SAG jedním z evropských lídrů na trhu s náhradními díly pro osobní a užitkové vozy i motocykly. Našimi prioritami jsou nadstandardní péče, kvalitní služby a snadná dostupnost.</p><p><br></p><p><strong>Co vás na této pozici čeká</strong></p><ul><li>Poskytování uživatelské a aplikační IT podpory (Dynamics 365)</li><li>Analýza a realizace IT požadavků, návrh a implementace technických řešení</li><li>Správa Windows Server prostředí, Active Directory, GPO, DHCP, DNS, tiskových serverů</li><li>Monitoring infrastruktury (NAGIOS), správa požadavků v JIRA</li><li>Správa mobilních zařízení, skenerů a tiskáren (SOTI)</li><li>Zajištění IT bezpečnosti a patch managementu</li><li>Spolupráce na rozvoji IT systémů, tvorbě dokumentace a řízení dodavatelů</li><li>Dohled nad plynulým chodem infrastruktury a řešením incidentů</li><li>Podpora e-commerce manažera – technická a datová asistence při správě e-shopu</li><li>Pomoc s integrací systémů e-shopu s Dynamics 365, přenosy dat a správou produktů</li><li>Spolupráce na analýze provozu e-shopu a řešení souvisejících IT požadavků</li></ul><p><br></p><p><strong>Co byste měli znát a umět</strong></p><ul><li>Dobrou znalost prostředí Windows Server, Active Directory, GPO, DHCP, DNS</li><li>Znalost sítí LAN/WAN</li><li>Základní znalost Linux výhodou</li><li>Orientaci v monitorovacích a ticketovacích nástrojích (NAGIOS, JIRA)</li><li>Přehled o bezpečnostních standardech IT a patch managementu</li><li>Základní orientaci v e-commerce prostředí (správa e-shopu, datové feedy, CMS výhodou)</li><li>Schopnost samostatně navrhovat řešení dle zadání</li><li>Řidičský průkaz skupiny B</li><li>Anglický jazyk na úrovni B2 (porozumění dokumentaci, základní komunikace)</li></ul><p><br></p><p><strong>Jak si vás představujeme</strong></p><ul><li>Máte středoškolské vzdělání s maturitou (ideálně v oboru IT nebo elektro)</li><li>Jste pečlivý a týmový hráč, který umí pracovat s daty i lidmi</li><li>Baví vás kombinace IT a online prostředí (e-shop, aplikace, integrace)</li><li>Dokážete komunikovat s uživateli, kolegy i dodavateli</li><li>Rád/a se učíte novým věcem a sledujete technologický vývoj</li></ul><p><br></p><p><strong>Co nabízíme</strong></p><ul><li>Rozmanitou práci v oblasti IT a e-commerce</li><li>Možnost profesního růstu – technický směr (IT administrace) i obchodní (e-commerce)</li><li>Stabilní tým a přátelské prostředí</li><li>Odpovídající finanční ohodnocení podle zkušeností</li><li>Stravenkový paušál</li><li>Multisport kartu</li><li>SHELL kartu</li><li>5 týdnů dovolené</li><li>Možnost práce z domova</li></ul><p><br></p>"
Developer Associate in SAP Multi-Bank Connectivity,SAP,https://www.linkedin.com/jobs/view/4323538823/?utm_campaign=SAP_Linkedin&utm_source=juniorguru,False,2025-12-12 00:00:00,,en,,,linkedin#4323538823,,,,,,,,,,Brno,,,,,,,,,,,,,,,,,,,,Brno,,,,,,,,,,,,,,,,,,,,fulltime,,,,,,,,,,"<strong>We help the world run better<br><br></strong>At SAP, we keep it simple: you bring your best to us, and we'll bring out the best in you. We're builders touching over 20 industries and 80% of global commerce, and we need your unique talents to help shape what's next. The work is challenging – but it matters. You'll find a place where you can be yourself, prioritize your wellbeing, and truly belong. What's in it for you? Constant learning, skill growth, great benefits, and a team that wants you to grow and succeed.<br><br><strong>What You’ll Build<br><br></strong>In this role, you'll drive the development and optimization of the SAP Multi-Bank Connectivity (MBC) solution. MBC is a specialized integration platform that connects SAP ERP customers with their banks to streamline banking operations. Your focus will be on enhancing third-party integrations, optimizing current processes, and ensuring the robustness of the system. You'll work on various development projects, including API integrations, to improve the overall user experience and drive business results. Your contributions will directly impact the reliability and efficiency of banking operations, enabling real-time services and data transactions.<br><br><strong>What You Bring<br><br></strong><ul><li>Technical Skills: Experience with JavaScript/Node.js. Familiarity with multi-tenant SaaS applications and event-driven architectures.</li><li>Any experience with the Cloud Application Programming Model (CAP), SAP BTP, Cloud Foundry, CI/CD pipelines, Deploy with Confidence (DwC) or ABAP is a plus.</li><li>Analytical Abilities: Excellent analytical skills to understand and interpret API specifications and third-party system integrations.</li><li>Implementation: Proven ability to implement Fiori UIs and backend logic.</li><li>Documentation: Excellent documentation skills for creating operational guides.</li><li>Customer Focus: Ability to provide customer support and maintenance.</li><li>Mindset: An agile mindset, thriving in a fast-paced environment and shipping code frequently. Collaborative and team-oriented, with strong communication skills.<br><br></li></ul><strong>Where you belong<br><br></strong>Join a global, agile team with developers in Ireland, Germany, Czech Republic, India, and China. Our culture values quality, security, and compliance, with regular audits to maintain SAP product standards. Thrive in an environment that encourages continuous learning and delivering impactful solutions. Experience the flexibility of shaping your work arrangement to suit your needs.<br><br><strong>Our Benefits<br><br></strong><ul><li>You will get initial training on technical and business topics </li><li>SAP will provide continuous training to increase your qualification </li><li>Flexible working hours and home office option </li><li>SAP will fully refund salary for sick days (12 per year) and sick leaves (up to one month) </li><li>5 weeks of vacation per year </li><li>Meal vouchers, fully paid by company </li><li>Company car and company phone according to the company car policy </li><li>Contribution to sport/culture/leisure </li><li>Yearly bonuses, employee stock purchase plans </li><li>Contributions to the pension/life insurance <br><br></li></ul>#SAPLabsBrno #S4DevBrno<br><br><strong>Bring out your best<br><br></strong>SAP innovations help more than four hundred thousand customers worldwide work together more efficiently and use business insight more effectively. Originally known for leadership in enterprise resource planning (ERP) software, SAP has evolved to become a market leader in end-to-end business application software and related services for database, analytics, intelligent technologies, and experience management. As a cloud company with two hundred million users and more than one hundred thousand employees worldwide, we are purpose-driven and future-focused, with a highly collaborative team ethic and commitment to personal development. Whether connecting global industries, people, or platforms, we help ensure every challenge gets the solution it deserves. At SAP, you can bring out your best.<br><br><strong>We win with inclusion<br><br></strong>SAP’s culture of inclusion, focus on health and well-being, and flexible working models help ensure that everyone – regardless of background – feels included and can run at their best. At SAP, we believe we are made stronger by the unique capabilities and qualities that each person brings to our company, and we invest in our employees to inspire confidence and help everyone realize their full potential. We ultimately believe in unleashing all talent and creating a better world.<br><br>SAP is committed to the values of Equal Employment Opportunity and provides accessibility accommodations to applicants with physical and/or mental disabilities. If you are interested in applying for employment with SAP and are in need of accommodation or special assistance to navigate our website or to complete your application, please send an e-mail with your request to Recruiting Operations Team: Careers@sap.com.<br><br>For SAP employees: Only permanent roles are eligible for the SAP Employee Referral Program, according to the eligibility rules set in the SAP Referral Policy. Specific conditions may apply for roles in Vocational Training.<br><br>Qualified applicants will receive consideration for employment without regard to their age, race, religion, national origin, ethnicity, gender (including pregnancy, childbirth, et al), sexual orientation, gender identity or expression, protected veteran status, or disability, in compliance with applicable federal, state, and local legal requirements.<br><br>Successful candidates might be required to undergo a background verification with an external vendor.<br><br><strong>AI Usage in the Recruitment Process<br><br></strong>For information on the responsible use of AI in our recruitment process, please refer to our Guidelines for Ethical Usage of AI in the Recruiting Process.<br><br>Please note that any violation of these guidelines may result in disqualification from the hiring process.<br><br>Requisition ID: 441301 | Work Area: Software-Design and Development | Expected Travel: 0 - 10% | Career Status: Graduate | Employment Type: Regular Full Time | Additional Locations:<br><br>"
Intern – Global Real Estate Data Analyst,Honeywell,https://www.linkedin.com/jobs/view/4343522210/?utm_medium=jobboard&utm_source=juniorguru,False,2025-12-12 00:00:00,,en,,,linkedin#4343522210,,,,,,,,,,Praha,,,,,,,,,,,,,,,,,,,,Praha,,,,,,,,,,,,,,,,,,,,parttime,,,,,,,,,,"<strong>Job Description<br><br></strong>We have an opportunity to join our Real Estate team in Prague. Join a world-class global real estate organization that strives to drive change across a diverse real estate portfolio, through pro-active portfolio management. The real estate organization consists of an extremely strong team with a mandate from the Corporation; a solid foundation in place that includes industry-leading processes and tools; and an incomparable real estate analytics platform.<br><br>This role is part of our University Relations program, designed to help students and recent graduates launch their careers with hands-on experience, mentorship, and opportunities for growth within Honeywell.<br><br>We have been innovating for more than 100 years and now we’re creating what’s next. Our programs serve a global community and our hometowns too. We provide resources and financial support to causes around the world and encourage employee volunteerism. We are committed to the highest standard in everything we do!<br><br><strong>Responsibilities<br><br></strong><ul><li>Assist in gathering and compiling data related to the leases database, property management data. </li><li>Conduct quantitative analyses to identify risks to the Honeywell operations.</li><li>Collaborate with Real Estate Managers to prepare reports and presentations, effectively communicating findings to stakeholders in English. </li><li>Stay updated on industry trends, market changes, and emerging technologies impacting the real estate sector.</li><li>Prepare reports and presentations to communicate findings and recommendations<br><br></li></ul><strong>Qualifications<br><br></strong><ul><li>University student currently pursuing a degree in Finance, Real Estate, Economics, Data Analytics, Civil Engineering or another related field. Interest in commercial real estate industry</li><li>Strong analytical and problem-solving skills, with a keen attention to detail.</li><li>Proficiency in Microsoft Excel; familiarity with PowerBI and other data analysis tools (e.g., SQL, Python, R) is a plus.</li><li>Excellent written and verbal communication skills in English.</li><li>Ability to work collaboratively in a team environment and meet deadlines.</li><li>Strong attention to detail and organizational skills. Ability to work effectively in a cross-functional team environment.<br><br></li></ul><strong>Our offer<br><br></strong><ul><li>Hands-on experience in international company working with international team. </li><li>Opportunity to develop data analysis and visualization skills.</li><li>If you are passionate about data and eager to learn more about real estate and portfolio – asset management, we encourage you to apply for this exciting internship opportunity at Honeywell</li><li>Clear pathways for advancement, regular feedback, and mentorship opportunities from experienced professionals in the field</li><li>Access to online training and certifications.</li><li>Flexible working arrangements and support for combining work with education.<br><br></li></ul>We are an equal opportunity employer and value diversity at our company. We do not discriminate based on race, religion, color, national origin, gender, sexual orientation, age, marital status, veteran status, or disability status.<br><br>We will ensure that individuals with disabilities are provided reasonable accommodation to participate in the job application or interview process, to perform crucial job functions, and to receive other benefits and privileges of employment. Please contact us to request accommodation.<br><br><strong>Join us now and become part of our journey - help us make the future!<br><br></strong>#TheFutureIsWhatWeMakeIt<br><br>#Futureshaper<br><br><strong>About Us<br><br></strong>Honeywell helps organizations solve the world's most complex challenges in automation, the future of aviation and energy transition. As a trusted partner, we provide actionable solutions and innovation through our Aerospace Technologies, Building Automation, Energy and Sustainability Solutions, and Industrial Automation business segments – powered by our Honeywell Forge software – that help make the world smarter, safer and more sustainable."
Programátor,Nesos a.s.,https://www.linkedin.com/jobs/view/4349753739/?utm_source=juniorguru,False,2025-12-12 00:00:00,,cs,,,linkedin#4349753739,,,,,,,,,,Plzeň,,,,,,,,,,,,,,,,,,,,Plzeň,,,,,,,,,,,,,,,,,,,,fulltime,,,,,,,,,,"<p>Hledáš zajímavou a kreativní práci? Ovládáš SQL a baví tě programování? Přidej se k nám a podílej se na vývoji a úpravách informačního systému HELIOS INUVIO.</p><p><strong>nesos hledá PROGRAMÁTORA</strong>!</p><p>NÁPLŇ PRÁCE:</p><p>&nbsp;&nbsp;&nbsp;&nbsp;&nbsp;&nbsp;&nbsp;&nbsp;&nbsp;&nbsp;&nbsp;&nbsp;•&nbsp;&nbsp;&nbsp;&nbsp;&nbsp;&nbsp;&nbsp;&nbsp;&nbsp;&nbsp;Programování úprav informačního systému Helios Inuvio</p><p>&nbsp;&nbsp;&nbsp;&nbsp;&nbsp;&nbsp;&nbsp;&nbsp;&nbsp;&nbsp;&nbsp;&nbsp;•&nbsp;&nbsp;&nbsp;&nbsp;&nbsp;&nbsp;&nbsp;&nbsp;&nbsp;&nbsp;Práce s relačními databázemi (MS SQL)</p><p>&nbsp;&nbsp;&nbsp;&nbsp;&nbsp;&nbsp;&nbsp;&nbsp;&nbsp;&nbsp;&nbsp;&nbsp;•&nbsp;&nbsp;&nbsp;&nbsp;&nbsp;&nbsp;&nbsp;&nbsp;&nbsp;&nbsp;Spolupráce s týmem vývojářů a konzultantů</p><p>&nbsp;&nbsp;&nbsp;&nbsp;&nbsp;&nbsp;&nbsp;&nbsp;&nbsp;&nbsp;&nbsp;&nbsp;•&nbsp;&nbsp;&nbsp;&nbsp;&nbsp;&nbsp;&nbsp;&nbsp;&nbsp;&nbsp;Vývoj nových řešení a rozvoj stávajících</p><p>POŽADUJEME:</p><p>&nbsp;&nbsp;&nbsp;&nbsp;&nbsp;&nbsp;&nbsp;&nbsp;&nbsp;&nbsp;&nbsp;&nbsp;•&nbsp;&nbsp;&nbsp;&nbsp;&nbsp;&nbsp;&nbsp;&nbsp;&nbsp;&nbsp;Znalost MS SQL</p><p>&nbsp;&nbsp;&nbsp;&nbsp;&nbsp;&nbsp;&nbsp;&nbsp;&nbsp;&nbsp;&nbsp;&nbsp;•&nbsp;&nbsp;&nbsp;&nbsp;&nbsp;&nbsp;&nbsp;&nbsp;&nbsp;&nbsp;Základní znalost anglického jazyka</p><p>&nbsp;&nbsp;&nbsp;&nbsp;&nbsp;&nbsp;&nbsp;&nbsp;&nbsp;&nbsp;&nbsp;&nbsp;•&nbsp;&nbsp;&nbsp;&nbsp;&nbsp;&nbsp;&nbsp;&nbsp;&nbsp;&nbsp;Týmovost, profesionální přístup</p><p>VÝHODOU:</p><p>&nbsp;&nbsp;&nbsp;&nbsp;&nbsp;&nbsp;&nbsp;&nbsp;&nbsp;&nbsp;&nbsp;&nbsp;•&nbsp;&nbsp;&nbsp;&nbsp;&nbsp;&nbsp;&nbsp;&nbsp;&nbsp;&nbsp;Zkušenost s programovacím jazykem Delphi</p><p>&nbsp;&nbsp;&nbsp;&nbsp;&nbsp;&nbsp;&nbsp;&nbsp;&nbsp;&nbsp;&nbsp;&nbsp;•&nbsp;&nbsp;&nbsp;&nbsp;&nbsp;&nbsp;&nbsp;&nbsp;&nbsp;&nbsp;Schopnost přicházet s novými nápady</p><p>NABÍZÍME:</p><p>&nbsp;&nbsp;&nbsp;&nbsp;&nbsp;&nbsp;&nbsp;&nbsp;&nbsp;&nbsp;&nbsp;&nbsp;•&nbsp;&nbsp;&nbsp;&nbsp;&nbsp;&nbsp;&nbsp;&nbsp;&nbsp;&nbsp;Přátelský tým zkušených kolegů</p><p>&nbsp;&nbsp;&nbsp;&nbsp;&nbsp;&nbsp;&nbsp;&nbsp;&nbsp;&nbsp;&nbsp;&nbsp;•&nbsp;&nbsp;&nbsp;&nbsp;&nbsp;&nbsp;&nbsp;&nbsp;&nbsp;&nbsp;5 týdnů dovolené</p><p>&nbsp;&nbsp;&nbsp;&nbsp;&nbsp;&nbsp;&nbsp;&nbsp;&nbsp;&nbsp;&nbsp;&nbsp;•&nbsp;&nbsp;&nbsp;&nbsp;&nbsp;&nbsp;&nbsp;&nbsp;&nbsp;&nbsp;Flexibilní pracovní dobu</p><p>&nbsp;&nbsp;&nbsp;&nbsp;&nbsp;&nbsp;&nbsp;&nbsp;&nbsp;&nbsp;&nbsp;&nbsp;•&nbsp;&nbsp;&nbsp;&nbsp;&nbsp;&nbsp;&nbsp;&nbsp;&nbsp;&nbsp;Možnost home office</p><p>&nbsp;&nbsp;&nbsp;&nbsp;&nbsp;&nbsp;&nbsp;&nbsp;&nbsp;&nbsp;&nbsp;&nbsp;•&nbsp;&nbsp;&nbsp;&nbsp;&nbsp;&nbsp;&nbsp;&nbsp;&nbsp;&nbsp;Výuka jazyků (anglický i německý jazyk)</p><p>&nbsp;&nbsp;&nbsp;&nbsp;&nbsp;&nbsp;&nbsp;&nbsp;&nbsp;&nbsp;&nbsp;&nbsp;•&nbsp;&nbsp;&nbsp;&nbsp;&nbsp;&nbsp;&nbsp;&nbsp;&nbsp;&nbsp;Stravenkový paušál, mobilní telefon, notebook</p><p>INFORMACE O POZICI:</p><p>&nbsp;&nbsp;&nbsp;&nbsp;&nbsp;&nbsp;&nbsp;&nbsp;&nbsp;&nbsp;&nbsp;&nbsp;•&nbsp;&nbsp;&nbsp;&nbsp;&nbsp;&nbsp;&nbsp;&nbsp;&nbsp;&nbsp;Práce na plný úvazek</p><p>&nbsp;&nbsp;&nbsp;&nbsp;&nbsp;&nbsp;&nbsp;&nbsp;&nbsp;&nbsp;&nbsp;&nbsp;•&nbsp;&nbsp;&nbsp;&nbsp;&nbsp;&nbsp;&nbsp;&nbsp;&nbsp;&nbsp;Pracovní smlouva na dobu neurčitou</p><p><br></p><p>📍 Místo pracoviště:</p><p>Mikulášské náměstí 526/18, Plzeň</p><p><br></p><p>✉️ Kontaktuj nás!</p><p>obchod@nesos.cz</p><p>tel: +420 603 453 075</p><p><br></p><p><br></p>"
Junior/Medior IT správce / technik (on-site),Lázně Bělohrad a.s.,https://www.linkedin.com/jobs/view/4349793878/?utm_source=juniorguru,False,2025-12-12 00:00:00,,cs,,,linkedin#4349793878,,,,,,,,,,Lázně Bělohrad,,,,,,,,,,,,,,,,,,,,Hradec Králové,,,,,,,,,,,,,,,,,,,,fulltime,,,,,,,,,,"<p><span>Hledáme prakticky orientovaného IT administrátora, který převezme každodenní provoz IT infrastruktury, uživatelskou podporu a základní správu systémů. Pozice je klíčová pro běžný chod organizace.</span></p><p><br></p><p><strong>CO BUDE NÁPLNÍ VAŠÍ PRÁCE:</strong></p><p><strong>Správa pracovních stanic a hardware</strong></p><ul><li>Diagnostika a řešení problémů s počítači, notebooky, tiskárnami a periferiemi</li><li>Instalace a konfigurace Windows zařízení</li><li>Evidence a životní cyklus IT vybavení (převzetí, výměny, likvidace)</li></ul><p><strong>Uživatelská podpora (1st / 2nd level)</strong></p><ul><li>Denní podpora uživatelů na místě i vzdáleně</li><li>Řešení běžných softwarových a přístupových problémů</li><li>Zaučování uživatelů, základní IT školení</li></ul><p><strong>Správa sítí</strong></p><ul><li>Základní správa síťové infrastruktury</li><li>Konfigurace a dohled nad VLAN</li><li>Údržba metalických i optických rozvodů</li><li>Správa aktivních prvků (switche, routery, access pointy)</li></ul><p><strong>Správa uživatelských účtů a kancelářského prostředí</strong></p><ul><li>Administrace Microsoft 365 (Office, SharePoint, Teams, Copilot)</li><li>Správa uživatelů v Active Directory</li><li>Nastavování přístupových práv</li></ul><p><strong>Spolupráce na IT projektech</strong></p><ul><li>Podpora nasazování nových systémů (např. nemocniční software, interní aplikace)</li><li>Spolupráce s externími dodavateli</li><li>Základní dokumentace postupů a řešení</li></ul><p><br></p><p><strong>JAKÉ ZNALOSTI A ZKUŠENOSTI OČEKÁVÁME?</strong></p><ul><li>Dobrou znalost Windows prostředí (workstation level)</li><li>Základní orientaci v sítích (TCP/IP, VLAN)</li><li>Zkušenost se správou uživatelů v AD</li><li>Znalost Microsoft 365</li><li>Technické myšlení, schopnost samostatně řešit problémy</li><li>Ochotu pracovat převážně on-site a mít pro uživatele porozumění</li></ul><p><strong>Výhodou (ne podmínkou)</strong></p><ul><li>Zkušenost s issue tracking systémem (Jira, YouTrack apod.)</li><li>Základní orientace v: datových strukturách pro přenos dat jako JSON, principech webových aplikací, cloudu a REST API</li><li>Zkušenost se správou managed zařízení (MDM, Intune apod.)</li></ul><p><br></p><p><strong>NA CO SE U NÁS MŮŽETE TĚŠIT?</strong></p><ul><li>Výkonnostní odměna (1 500 Kč/měsíc).</li><li>U vybraných pozic náborový příspěvek.</li><li>Zvýhodněné mobilní tarify.</li><li>Dovolená navíc (po 3 letech působení ve firmě).</li><li>Příspěvek na penzijní připojištění (u PP na dobu neurčitou).</li><li>Zdarma zhodnocují účet UniCredit Bank a další výhody.</li><li>Makro karta (nákupy pro fyzické osoby s řadou výhod).</li><li>Referral program (odměna za doporučení).</li><li>Odměna za pracovní jubilea.</li><li>Zaměstnanecké stravování.</li><li>Program osobního rozvoje a další odborné vzdělání.</li><li>Volnočasové aktivity – volný vstup do bazénu, fitcentra, na minigolf a tenisové kurty.</li><li>Vybrané produkty v podnikové prodejně za zaměstnanecké ceny.</li></ul><p><strong>A dále nabízíme:</strong></p><ul><li>Příjemné pracovní prostředí a zázemí stabilní společnosti.</li><li>Podpora relokace – ubytování, školka, škola.</li><li>Parkování zdarma.</li><li>Firemní akce pro zaměstnance.</li></ul><p><br></p><p><strong>Nástup:</strong>&nbsp;možný ihned.&nbsp;</p><p><strong>Pracoviště</strong>: Lázně Bělohrad</p><p><strong>Personální oddělení</strong>:&nbsp;jobs@belohrad.cz&nbsp;| 739 662 774 | 493 767 364</p><p><br></p>"
