Developer (CRM/Creatio),Škola Populo,https://www.jobs.cz/rpd/2000732017/,False,2025-08-24 00:00:00,,cs,,,jobscz#2000732017,,,,,,,,,,Olomouc,Olomouc,,,,,,,,,,,,,,,,,,,Olomouc,Olomouc,,,,,,,,,,,,,,,,,,,fulltime,parttime,,,,,,,,,"<div data-jobad=""body"" data-test=""jd-body-richtext"" class=""RichContent mb-1400""><p class=""typography-body-medium-text-regular text-secondary mb-600"">Pracovní nabídka</p><p class=""typography-body-large-text-regular mb-800""><strong>Do našeho tech týmu hledáme schopného developera se zájmem o moderní low-code technologie a systémový vývoj. Nabízíme příležitost podílet se na správě a rozvoji CRM platformy Creatio, která hraje klíčovou roli v našich interních procesech. Hledáme kolegu, který dokáže spojit analytické myšlení s praktickým přístupem k návrhu a implementaci systémových řešení. Čeká vás rozmanitá pracovní náplň, možnost odborného růstu a aktivní zapojení do projektů, které mají reálný dopad.</strong></p><p class=""typography-body-large-text-regular mb-800""><br><strong>Náplň práce:</strong></p><ul class=""typography-body-large-text-regular""><li>Technická údržba a rozvoj CRM systému Creatio.</li><li>Konfigurace aplikace pomocí low-code nástrojů (tvorba objektů, polí, business rules, oprávnění, procesy).</li><li>Návrh, konfigurace a implementace obchodních procesů v BPM enginu Creatio.</li><li>Úpravy a vývoj uživatelského rozhraní pomocí Freedom UI Designeru.</li><li>Programování doplňkové logiky v JavaScriptu a C# dle potřeby (např. script tasks, rozšíření metod Creatio).</li><li>Práce s databází – základní SQL dotazy a joiny.</li><li>Integrace Creatia s dalšími systémy přes REST API / OData.</li><li>Analýza uživatelských požadavků, návrh řešení a jejich realizace.</li><li>Spolupráce se zadavateli, testování a uživatelská podpora při nasazování nových funkcionalit.</li></ul><p class=""typography-body-large-text-regular mb-800""><strong>Požadujeme:</strong></p><ul class=""typography-body-large-text-regular""><li>Schopnost číst a psát jednoduchý kód v JavaScriptu.</li><li>Základy SQL (dotazy, joiny, práce s daty).</li><li>Orientace v principech programování a ochota učit se nové technologie (C#, Creatio framework).</li><li>Schopnost logicky analyzovat požadavky a převést je do řešení.</li><li>Zodpovědnost, systematický přístup a schopnost komunikovat s uživateli i zadavateli.</li></ul><p class=""typography-body-large-text-regular mb-800""><strong>Výhodou:</strong></p><ul class=""typography-body-large-text-regular""><li>Zkušenosti s libovolnou low-code/no-code platformou (např. Power Apps, Mendix, OutSystems).</li><li>Znalost BPMN a práce s procesními modely.</li><li>Zkušenosti s integracemi systémů pomocí API.</li><li>Praxe přímo s Creatio.</li></ul><p class=""typography-body-large-text-regular mb-800""><strong>Nabízíme:</strong></p><ul class=""typography-body-large-text-regular""><li>Možnost podílet se na vývoji a rozvoji CRM systému Creatio.</li><li>Práci s moderními low-code technologiemi i klasickým kódem (JavaScript, C#).</li><li>Pestrou pracovní náplň s přesahem do analýzy, návrhu řešení a integrací.</li><li>Prostor pro odborný růst a rozšiřování znalostí.</li><li>Flexibilní pracovní dobu.</li><li>Přátelský kolektiv a otevřenou firemní kulturu.</li></ul></div>"
Junior Javascript Developer,NESS Czech,https://www.jobs.cz/rpd/2000731971/,False,2025-08-24 00:00:00,,cs,,,jobscz#2000731971,,,,,,,,,,Praha,Praha,,,,,,,,,,,,,,,,,,,Praha,Praha,,,,,,,,,,,,,,,,,,,fulltime,,,,,,,,,,"<div data-jobad=""body"" data-test=""jd-body-richtext"" class=""RichContent mb-1400""><p class=""typography-body-medium-text-regular text-secondary mb-600"">Pracovní nabídka</p><p class=""typography-body-large-text-regular mb-800"">Do našeho týmu v <strong>Ness Czech</strong>, který je dlouhodobě zapojen do projektu pro jednoho z největších telekomunikačních operátorů v České republice, aktuálně hledáme zkušeného vývojáře/ku, který by se rád podílel na rozvoji a modernizaci systémů pro zákaznickou komunikaci.</p><h2 class=""typography-heading-small-text"">O co jde?</h2><p class=""typography-body-large-text-regular mb-800"">Projekt se zaměřuje na <strong>vývoj a migraci tiskových šablon</strong>, které generují klíčové dokumenty pro miliony zákazníků – například smlouvy, faktury nebo přehledy služeb. Pracujeme s nástroji GMC Inspire a PrintNet, ale zkušenosti s nimi nejsou podmínkou – rádi Tě do těchto technologií zaškolíme.</p><p class=""typography-body-large-text-regular mb-800"">Tvým hlavním úkolem bude převod stávajících šablon z původního řešení do nového systému, jejich údržba a další vývoj. Pokud máš zkušenost se skriptováním v <strong>JavaScriptu</strong> a dobře se orientuješ v<strong> HTML</strong> a <strong>XML</strong>, rádi Ti nabídneme prostředí, kde můžeš své dovednosti dále rozvíjet.</p><h2 class=""typography-heading-small-text"">Co budeš dělat?</h2><ul class=""typography-body-large-text-regular""><li>Vývoj, údržba a migrace tiskových šablon pro zákaznické dokumenty (např. smlouvy, výpisy, faktury).</li><li>Přepis stávajících šablon do moderního řešení a jejich další rozvoj.</li><li>Programování logiky šablon pomocí JavaScriptu a HTML.</li><li>Práce s daty ve formátu XML – struktura, validace, transformace.</li><li>Spolupráce s týmem vývojářů a analytiků v rámci projektového týmu.</li></ul><h2 class=""typography-heading-small-text"">Koho hledáme?</h2><ul class=""typography-body-large-text-regular""><li>Máš praktické zkušenosti se skriptováním v JavaScriptu.</li><li>Rozumíš základům HTML a XML, včetně datových struktur a transformací.</li><li>Jsi zvyklý pracovat samostatně a efektivně si plánovat práci.</li><li>Zkušenost s nástroji jako GMC Inspire, PrintNet nebo KW Soft / Kadel je vítaná, ale není nutná.</li><li>(Nice to have) orientace v prostředí Linuxového terminálu a základní znalost SQL.</li></ul><h2 class=""typography-heading-small-text"">Co Ti v Nessu nabídneme:</h2><ul class=""typography-body-large-text-regular""><li>Přátelské a zároveň profesionální pracovní prostředí, protože lidé si u nás pomáhají a důvěřují.</li><li>Podporu osobního rozvoje (hard-skills, soft-skills, jazykové kurzy) a získávání certifikací.</li><li>Formální i neformální akce (protože se chceme se svými kolegy i bavit) - setkání kompetencí, sportovní závody, teambuildingy nebo akce pro děti a rodiny zaměstnanců.</li></ul><h2 class=""typography-heading-small-text"">Těšit se můžeš i na další benefity:</h2><ul class=""typography-body-large-text-regular""><li>20 dní dovolené + 5 Ness day a čím déle u nás jsi, tím víc jich máš.</li><li>3 Sick day.</li><li>Příspěvek na Multisport kartu.</li><li>Mobilní telefon s neomezeným tarifem a 25 GB dat i pro soukromé účely.</li><li>Partnerské benefity – tyto benefity a slevy můžeš čerpat stále a neomezeně (od sportu, přes kulturu, wellness až po slevu na nové auto).</li><li>Příspěvek na penzijní připojištění.</li><li>Stravenkový paušál.</li><li>Jazykovou výuku.</li><li>Rozvoj Hard a Soft skills.</li></ul></div>"
Zajímá Tě kyber bezpečnost? Doplňujeme tým o nové CYBER SECURITY OPERATORy,NEXT GENERATION SECURITY SOLUTIONS s.r.o.,https://www.jobs.cz/rpd/2000706830/,False,2025-08-24 00:00:00,,cs,,,jobscz#2000706830,,,,,,,,,,Praha,Praha,,,,,,,,,,,,,,,,,,,Praha,Praha,,,,,,,,,,,,,,,,,,,fulltime,,,,,,,,,,"<div data-jobad=""body"" data-test=""jd-body-richtext"" class=""RichContent mb-1400""><p class=""typography-body-medium-text-regular text-secondary mb-600"">Pracovní nabídka</p><p class=""typography-body-large-text-regular mb-800""><strong>Jsme tým NESTOR Security Operations Centre a řešíme zabezpečení dat a systémů našich zákazníků v oblasti kybernetické bezpečnosti.</strong></p><p class=""typography-body-large-text-regular mb-800""><strong>Naši zákazníci jsou především z oblasti státní sféry, ale také z komerčního sektoru. </strong><br><strong>Vytváříme a optimalizujeme metodiky detekce a řešení kybernetických událostí k potřebám zákazníků tak, abychom dokázali zajistit nejlepší způsob ochrany v oblasti kybernetické bezpečnosti.</strong></p><p class=""typography-body-large-text-regular mb-800"">Posilujeme tým Nestor Security Operations Centre v oddělení IT Security a aktuálně rozšiřujeme tým a máme volná místa pro uchazeče na pozice</p><h2 class=""typography-heading-small-text"">SPECIALISTA BEZPEČNOSTI / CYBER SECURITY OPERATOR</h2><p class=""typography-body-large-text-regular mb-800""><strong>* Tato pozice je vhodná JAK pro absolventy středních škol IT zaměření, TAK pro zkušené matadory v oblasti analýzy bezpečnostních incidentů - ty po zaškolení posuneme na seniornější pozici.</strong></p><p class=""typography-body-large-text-regular mb-800""><strong>* Pozici Vám dle míry Vašich znalostí a zkušeností ušijeme na míru!</strong></p><p class=""typography-body-large-text-regular mb-800""><strong>Co Vás čeká na této pozici?</strong></p><ul class=""typography-body-large-text-regular""><li>Aktivní <strong>monitoring a řešení bezpečnostních událostí</strong> v SIEM</li><li>Aktivní <strong>spolupráce s analytiky</strong> při šetření bezpečnostních událostí a incidentů</li><li>Příprava podkladů pro <strong>reporting</strong> z bezpečnostních nástrojů</li><li><strong>Sledování trendů</strong> v oblasti kybernetické bezpečnosti</li><li><strong>Testování</strong> nových pravidel pro detekci kybernetických hrozeb</li></ul><p class=""typography-body-large-text-regular mb-800""><strong>Co umí ideální uchazeč/ka?</strong></p><ul class=""typography-body-large-text-regular""><li>Má (ideálně) <strong>technické vzdělání</strong> se zaměřením na informační technologie - velkou výhodou je praxe v oboru (i při studiu)</li><li>Má základní znalost v informačních technologií a prokazatelný <strong>zájem o oblast kybernetické bezpečnosti</strong></li><li>Má základní znalosti Windows server, OS Win, OS Linux/UNIX, Firewall, TCP/IP, LAN/WAN</li><li>Je <strong>týmovým hráčem</strong></li><li>Zvládne <strong>efektivně komunikovat</strong></li><li>Porozumí technické angličtině (v níž jsou komplet výukové materiály) - na <strong>angličtině můžete zamakat v rámci firemní výuky</strong>. <br>Nebo vám přispějeme na výuku jiného jazyka.</li><li>Na této pozici to zvládnete i bez řidičáku</li></ul><p class=""typography-body-large-text-regular mb-800""><strong>Co Vám nabízíme na této pozici?</strong></p><ul class=""typography-body-large-text-regular""><li>Příjemné kanceláře v širším centru Prahy</li><li><strong>Zázemí stabilní české společnosti</strong> s množstvím rozmanitých zákazníků</li><li>Práce v přátelském týmu v rámci oddělení</li><li>Pomoc zkušených kolegů nejen v rámci technické a bezpečnostní divize</li><li><strong>Neustálý profesní rozvoj</strong> - během prvních 2 let se budete pyšnit několika <strong>certifikacemi renomovaných vendorů (IBM, Comptia Security+</strong> aj.)</li><li><strong>Zapojení do zajímavých a různorodých projektů</strong></li><li>Balíček <strong>zaměstnaneckých benefitů</strong></li><li>Férovou mzdu, <strong>ocenění práce nad rámec</strong></li><li>Nástup ihned nebo dohodou</li></ul><p class=""typography-body-large-text-regular mb-800"">Pokud Vás naše nabídka zaujala, prosíme o zaslání Vašeho strukturovaného životopisu <strong>v českém jazyce (podmínkou)</strong> prostřednictvím odpovědního formuláře.</p><p class=""typography-body-large-text-regular mb-800"">Vámi zaslané podklady zpracujeme a ozveme se Vám co nejdříve.</p></div>"
JavaScript vývojář – junior/senior,"LinuxBox.cz, s.r.o.",https://www.jobs.cz/rpd/2000697903/,False,2025-08-24 00:00:00,,cs,,,jobscz#2000697903,,,,,,,,,,Ostrava,,,,,,,,,,,,,,,,,,,,Ostrava,,,,,,,,,,,,,,,,,,,,fulltime,parttime,,,,,,,,,"<div data-jobad=""body"" data-test=""jd-body-richtext"" class=""RichContent mb-1400""><p class=""typography-body-medium-text-regular text-secondary mb-600"">Pracovní nabídka</p><p class=""typography-body-large-text-regular mb-800"">Naše společnost vyvíjí projekty pro call centra a cloudová řešení na platformě Vue.js/NodeJS. Kdo na nás spoléhá, si můžeš dohledat v našich referencích https://www.linuxbox.cz/reference/zakaznici/ Mj. T-Mobile a Vodafone nám svěřují své VIP zákazníky. Během našeho 25letého působení jsme si vybudovali know-how v mnoha oblastech ICT.<br><br>Do našeho týmu hledáme nového kolegu, který posílí náš tým vývojářů, přičemž hledáme jak vývojáře juniora (možnost zaučení, získání praxe) tak i seniora (podílení se i na určování směru vývoje, seberealizace).</p><h2 class=""typography-heading-small-text"">Co tě čeká</h2><ul class=""typography-body-large-text-regular""><li>analýza, návrh a vývoj klíčových částí aplikací</li><li>vývoj frontendu v Vue.js</li><li>vývoj backendu v NodeJS, PostgreSQL</li><li>práce na projektech pro T-Mobile a Vodafone</li><li>spoluúčast na technickém rozvoji produktů společnosti</li></ul><h2 class=""typography-heading-small-text"">Co očekáváme od tebe</h2><ul class=""typography-body-large-text-regular""><li>slušnou znalost programování v JavaScript</li><li>alespoň základní znalost SQL</li><li>chuť na sobě pracovat, zkoumat nové technologie a postupy</li><li>angličtina na úrovní čtení dokumentace</li></ul><h2 class=""typography-heading-small-text"">Oceníme (nebo tě doučíme)</h2><ul class=""typography-body-large-text-regular""><li>zkušenosti s Linuxem</li><li>znalost skriptovacího jazyka Python</li></ul><h2 class=""typography-heading-small-text"">Nabízíme ti</h2><ul class=""typography-body-large-text-regular""><li>férové jednání, u nás sliby platí</li><li>nadstandardně přátelský kolektiv</li><li>vedoucího spíše v roli kolegy než šéfa</li><li>neustálou podporu - na řešení úkolů nejsi sám</li><li>práci pro spokojené zákazníky, jež nás dále doporučují</li><li>ovlivňování rozvoje firmy a poskytovaných služeb</li><li>místo v normálním kanclu, žádný open space</li><li>kolárnu a sprchu</li><li>5 týdnů dovolené</li><li>3 dny zdravotní volno – sick days</li><li>stravenkový paušál 137Kč</li><li>příspěvek na sport/volný čas – MultiSport karta</li><li>po zapracování možnost práce na homeoffice</li><li>po zapracování pracovní smlouvu na dobu neurčitou</li><li>a další zaměstnanecké benefity – detaily viz https://www.linuxbox.cz/o-nas/kariera-volne-pozice/</li></ul><p class=""typography-body-large-text-regular mb-800""><strong>Působnost:</strong> Ostrava</p><p class=""typography-body-large-text-regular mb-800""><strong>Termín nástupu:</strong> dle dohody, možno ihned</p><p class=""typography-body-large-text-regular mb-800""><strong>Ještě váháš ?</strong> … nemusíme začít klasickým pohovorem, třeba jen zavolej nebo se k nám přijď nezávazně podívat, a zeptat se svých budoucích kolegů či nadřízeného, co tě zajímá.</p><p class=""typography-body-large-text-regular mb-800""><strong>Neváháš ?</strong> ... pošli nám svůj strukturovaný životopis, vždy každému odpovíme.</p></div>"
Vývojář .NET,NEXT DATA s.r.o.,https://www.jobs.cz/rpd/2000697599/,False,2025-08-24 00:00:00,,cs,,,jobscz#2000697599,,,,,,,,,,Uherské Hradiště,Uherské Hradiště,,,,,,,,,,,,,,,,,,,Zlín,Zlín,,,,,,,,,,,,,,,,,,,fulltime,,,,,,,,,,"<div data-jobad=""body"" data-test=""jd-body-richtext"" class=""RichContent mb-1400""><p class=""typography-body-medium-text-regular text-secondary mb-600"">Pracovní nabídka</p><p class=""typography-body-large-text-regular mb-800""><strong>Budeš u nás spokojený/á, pokud bys chtěl(a):</strong></p><ul class=""typography-body-large-text-regular""><li>pracovat se C# .NET, ASP.NET a implementovat HTML(5), CSS, jQuery, JavaScript,</li><li>mít volnost při výběru aktivit, kterým se budeš věnovat,</li><li>být součástí super kolektivu s přívětivým, lidským vedením.</li></ul><p class=""typography-body-large-text-regular mb-800""><strong>My budeme naopak rádi, pokud:</strong></p><ul class=""typography-body-large-text-regular""><li>máš zkušenosti s vývojem webových aplikací v ASP.NET</li><li>jsi pracoval s kódováním kaskádových stylů (CSS), bootstrap</li><li>komunikuješ anglickým jazykem na úrovní čtení technické dokumentace</li><li>máš znalost Visual Studia, Visual Code</li></ul><p class=""typography-body-large-text-regular mb-800""><strong>Co ti můžeme nabídnout:</strong></p><ul class=""typography-body-large-text-regular""><li>nadstandartní platové ohodnocení,</li><li>práce v klidném a příjemném prostředí blízko centra města,</li><li>support všech současných kolegů, důkladné zaškolení,</li><li>příležitost k seberealizaci a uplatnění vlastních nápadů,</li><li>možnost růst v rámci firmy,</li><li>stravenky a další benefity,</li><li>občerstvení na pracovišti,</li><li>flexibilní začátek/konec pracovní doby,</li><li>vzdělávací kurzy, školení,</li><li>místo výkonu práce Uherské Hradiště, po dohodě možnost práce i na dálku.</li></ul></div>"
Junior vývojář .NET – začněte u nás psát svůj příběh,Be a Future s.r.o.,https://www.jobs.cz/rpd/2000717713/,False,2025-08-24 00:00:00,,cs,,,jobscz#2000717713,,,,,,,,,,Ostrava,Ostrava,,,,,,,,,,,,,,,,,,,Ostrava,Ostrava,,,,,,,,,,,,,,,,,,,fulltime,,,,,,,,,,"<div data-jobad=""body"" data-test=""jd-body-richtext"" class=""RichContent mb-1400""><p class=""typography-body-medium-text-regular text-secondary mb-600"">Pracovní nabídka</p><p class=""typography-body-large-text-regular mb-800""><strong> Hledáme parťáka do vývoje</strong> – klidně rovnou po škole, <strong>hlavně ať umí kódit a chce růst!</strong></p><p class=""typography-body-large-text-regular mb-800""><br>Do našeho vývojového týmu v <strong>Be a Future</strong> hledáme <strong>juniorního vývojáře</strong>, který se chce ponořit do světa <strong>.NET technologií</strong>, psát čistý kód v C# a nebojí se databází. 🤠 U nás budete pracovat na projektech, které mají reálný dopad. To zní dobře, že? Tak čtěte dál!</p><p class=""typography-body-large-text-regular mb-800""><br><strong>Kdo jsme?</strong> 🔎  <br>Jsme technologický systémový integrátor zaměřený na klienty z oblasti kritické infrastruktury státu. Našim zákazníkům poskytujeme prémiové služby při řešení netriviálních problémů. Pomáháme s udržením vysoké úrovně bezpečnosti v naší zemi. 🇨🇿  </p><p class=""typography-body-large-text-regular mb-800""><br>Našimi pilíři jsou rychlost, pružnost, kvalita, otevřenost a služba zákazníkovi. 🤝🏼 Podle toho se chováme k našim zákazníkům i k sobě navzájem. Snažíme se dělat IT jinak. Společně. Slušné chování, respekt a týmová práce jsou pro nás důležité hodnoty. A aby naše spolupráce fungovala, musí být tyto hodnoty důležité i pro vás. </p><p class=""typography-body-large-text-regular mb-800""><br><strong>Co vás u nás čeká? 😎 </strong></p><ul class=""typography-body-large-text-regular""><li>Ranní <strong>standupy</strong> – rychlý sync s týmem na denní bázi. 🤜🏼🤛🏼 </li><li>Vývoj aplikací převážně v <strong>.NET Core + C#</strong>. </li><li>Práce s relačními <strong>databázemi</strong> (MS SQL, Oracle, MySQL) i NoSQL. </li><li>Docker, Kubernetes, Git – nic z toho vám není cizí? <strong>Super</strong>! </li><li>Minimum zbytečných meetingů – <strong>kódění na max</strong>. 📈 </li><li>Práce na projektech, které už jsou zaběhnuté, ale <strong>nuda to rozhodně nebude</strong>. 😇 </li></ul><p class=""typography-body-large-text-regular mb-800""><strong>Koho právě teď hledáme?🔭 </strong></p><ul class=""typography-body-large-text-regular""><li>Někoho, kdo zná kód – ideálně má školu nebo kurzy, kde se naučil(a) .NET a C#. </li><li>Kandidáta, kterého <strong>baví technologie a chce se učit nové věci</strong>. </li><li>Je <strong>týmový</strong> <strong>hráč</strong>, ale zvládne pracovat i <strong>samostatně</strong> – někdy to jinak nejde. 🚀 </li><li>Juniora, který má super <strong>češtinu</strong>, a <strong>angličtina</strong>? Pokud umíte číst technickou dokumentaci v angličtině, tak jste u nás za vodou. 🇨🇿🇬🇧 </li><li>A jak je to s <strong>lokalitou</strong>? Primárně hledáme někoho z <strong>Ostravy</strong> či <strong>okolí</strong>, protože se občas potkáváme buď v Ostravě, nebo v Praze. Takže je to na domluvě. <strong>Sedí vám to?</strong>📍 </li></ul><p class=""typography-body-large-text-regular mb-800""><strong>A co nabízíme na oplátku my?   </strong><br><br></p><ul class=""typography-body-large-text-regular""><li>Notebook a mobil. 💻📱   </li><li>Příjemné pracovní prostředí plné kolegů, od kterých se budete moct učit. </li><li>Stravenky i příspěvek na sport či kulturu (např. Multisport karta). 🏋🏼🍔   </li><li>5 týdnů placené dovolené. 🏖   </li><li>Sick Days. 🤒   </li><li>Pravidelné společné akce. ☕   </li></ul><p class=""typography-body-large-text-regular mb-800""><br>Chcete se dozvědět víc? Pošlete CV a potkáme se spolu na pohovoru, kde si řekneme víc!</p></div>"
Data Analyst / Risk Management Consultant,Quantitative Consulting s.r.o.,https://www.jobs.cz/rpd/2000702949/,False,2025-08-24 00:00:00,,cs,,,jobscz#2000702949,,,,,,,,,,Nova Praha,Praha,,,,,,,,,,,,,,,,,,,Ukrajina,Praha,,,,,,,,,,,,,,,,,,,fulltime,parttime,,,,,,,,,"<div data-jobad=""body"" data-test=""jd-body-richtext"" class=""RichContent mb-1400""><p class=""typography-body-medium-text-regular text-secondary mb-600"">Pracovní nabídka</p><p class=""typography-body-large-text-regular mb-800"">Quantitative Consulting je poradenská společnost s 15letou historií. Specializujeme se na vývoj a validaci modelů úvěrového, tržního a operačního rizika pro banky a finanční instituce. Spolupracujeme s významnými hráči na trhu a naše projekty jsou tak velmi různorodé. Na základě dosaženého vzdělání, zkušeností a schopností je u nás možné zastávat buď juniorní roli datového analytika nebo seniorní konzultantskou pozici.</p><p class=""typography-body-large-text-regular mb-800""><strong>Jaká je pracovní náplň?</strong></p><ul class=""typography-body-large-text-regular""><li>Analýza dat týkajících se úvěrového, tržního a operačního rizika – čištění a vyhodnocování dat pomocí statistických a programovacích nástrojů (Python, R, SAS, Matlab, VBA, MS Excel)</li><li>Výpočty a modelování rizikových ukazatelů podle platných metodik a regulací</li><li>Vývoj a validace modelů</li><li>Příprava reportů a prezentací výsledků analýz pro interní účely i externí klienty</li><li>Podpora implementace řešení v rámci klientských projektů – testování, validace a ladění modelů a analytických nástrojů</li><li>Komunikace s klienty ohledně požadavků, výsledků a doporučení (převážně v anglickém jazyce)</li><li>Spolupráce s týmem zkušených kolegů a účast na projektech v českém i mezinárodním prostředí</li></ul><p class=""typography-body-large-text-regular mb-800""><strong>Co požadujeme?</strong></p><ul class=""typography-body-large-text-regular""><li>Vysokoškolské vzdělání v oboru matematiky, statistiky, financí, ekonomie nebo fyziky (nebo jeho probíhající absolvování)</li><li>Znalost matematické statistiky</li><li>Analytické myšlení</li><li>Zkušenost s některým z programovacích jazyků/nástrojů: Python, R, SAS, Matlab, VBA, MS Excel</li><li>Výhodou základní povědomí úvěrového rizika (např. IFRS9, Basel) nebo tržního rizika (např. IRRBB)</li><li>Předchozí zkušenost výhodou, ale ne podmínkou</li><li>Schopnost efektivní komunikace v anglickém jazyce</li></ul><p class=""typography-body-large-text-regular mb-800""><strong>Co můžeme nabídnout?</strong></p><ul class=""typography-body-large-text-regular""><li>Rozmanitou pracovní náplň na českých i zahraničních projektech</li><li>Získání zkušeností v oblasti řízení rizik v bankách a finančních institucích</li><li>Spolupráci s odborníky v oboru</li><li>Možnost home office s flexibilní pracovní dobou</li><li>Částečný nebo plný pracovní úvazek</li><li>Přátelské prostředí a zázemí stabilní firmy sídlící v centru Prahy</li><li>Nástup možný ihned</li></ul></div>"
