title,company_name,url,remote,first_seen_at,last_seen_at,lang,juniority_score,source,external_ids_0,external_ids_1,external_ids_2,external_ids_3,external_ids_4,external_ids_5,external_ids_6,external_ids_7,external_ids_8,external_ids_9,locations_0_name,locations_1_name,locations_2_name,locations_3_name,locations_4_name,locations_5_name,locations_6_name,locations_7_name,locations_8_name,locations_9_name,locations_10_name,locations_11_name,locations_12_name,locations_13_name,locations_14_name,locations_15_name,locations_16_name,locations_17_name,locations_18_name,locations_19_name,locations_0_region,locations_1_region,locations_2_region,locations_3_region,locations_4_region,locations_5_region,locations_6_region,locations_7_region,locations_8_region,locations_9_region,locations_10_region,locations_11_region,locations_12_region,locations_13_region,locations_14_region,locations_15_region,locations_16_region,locations_17_region,locations_18_region,locations_19_region,employment_types_0,employment_types_1,employment_types_2,employment_types_3,employment_types_4,employment_types_5,employment_types_6,employment_types_7,employment_types_8,employment_types_9,description_html
Software Developer in Test,Apple,https://www.jobs.cz/rpd/2000563958/,False,2025-04-11 00:00:00,,en,,,jobscz#2000563958,,,,,,,,,,Praha,,,,,,,,,,,,,,,,,,,,Praha,,,,,,,,,,,,,,,,,,,,fulltime,,,,,,,,,,"<div data-jobad=""body"" data-test=""jd-body-richtext"" class=""RichContent mb-1400""><p class=""typography-body-medium-text-regular text-secondary mb-600"">Pracovní nabídka</p><p class=""typography-body-large-text-regular mb-800"">Join the team responsible for ensuring the highest quality for technologies at the heart of products known to surprise and delight our customers. The Core Brightness Quality Engineering team is responsible for validating the ambient light sensor and customer facing display features such as Auto-Brightness, Night Shift, True Tone Display and many more across iPhone, iPad, Watch, Mac, and Apple Vision Pro.<br>This is a highly entrepreneurial team, always looking for innovative ways to improve status quo and solve difficult problems in new and better ways. You will work in fast paced environment, interacting directly with development teams within the organization as well as cross-functional teams. The Core Brightness Quality Engineering team is looking for skilled test engineer who can design and develop test automation and lead the charge on quality for sensors and display across all OS’s. The nature of the position requires excellent communication skills, strong technical and debugging skills, and a drive to make a difference. Cross-functional collaboration and strong team spirit is key to this role.</p><p class=""typography-body-large-text-regular mb-800"">As a Software Developer in Test, you will work closely with software design and development teams to understand core technologies, and utilize the information to develop and influence quality strategies. You will design, develop, and own automated tests for validating the ambient light sensor driver and display features across all Apple products. You will help debug test failures and investigate issues spanning across hardware and software interaction layers to ensure new products and future software releases are delivered at the highest quality.</p><p class=""typography-body-large-text-regular mb-800"">- Design, develop, and own automated tests for new and existing display features.<br>- Investigate and analyze issues spanning across the hardware and software interaction layers.<br>- Work closely with software development team and project management to ensure quality releases<br>- Ability to think creatively, problem solve, and innovate.<br>- Excellent communication skills</p><p class=""typography-body-large-text-regular mb-800""><strong>Qualifications: </strong></p><ul class=""typography-body-large-text-regular""><li>Strong programming skills in Python and Bash.</li><li>Strong understanding of software test and validation methodologies.</li><li>Experience with Git and codebase management.</li><li>Strong passion for quality assurance in software, including experience in finding, investigating and fixing bugs</li></ul><p class=""typography-body-large-text-regular mb-800""><strong>Preferred Qualifications:</strong></p><ul class=""typography-body-large-text-regular""><li>Knowledge of display technologies.</li><li>Programming experience in C, Swift or Objective-C and familiar with databases.</li><li>Knowledge of automated build and test systems.</li><li>Working knowledge of UNIX-like operating systems.</li></ul></div>"
SW Developer (vhodné i pro juniory!),IMI CCI Czech Republic,https://www.jobs.cz/rpd/2000563069/,False,2025-04-11 00:00:00,,cs,,,jobscz#2000563069,,,,,,,,,,Šlapanice,Šlapanice,,,,,,,,,,,,,,,,,,,Brno,Brno,,,,,,,,,,,,,,,,,,,fulltime,parttime,,,,,,,,,"<div data-jobad=""body"" data-test=""jd-body-richtext"" class=""RichContent mb-1400""><p class=""typography-body-medium-text-regular text-secondary mb-600"">Pracovní nabídka</p><h2 class=""typography-heading-small-text"">Koho hledáme:</h2><p class=""typography-body-large-text-regular mb-800"">Jsi nadšený/á do programování a hledáš příležitost, kde bys mohl/a růst a učit se? Přidej se k nám jako SW Developer! 🌟</p><p class=""typography-body-large-text-regular mb-800"">Jsme mezinárodní společnost, která se zabývá vývojem špičkových tlakových ventilů, a v současné chvíli hledáme nového kolegu/kolegyni do týmu vývojářů. <strong>Tvým úkolem bude tvorba části kódu webové aplikace</strong>. Nemusíš mít mnoho zkušeností, stačí základní znalost programování a chuť učit se novým věcem.</p><p class=""typography-body-large-text-regular mb-800"">A pokud jsi v oboru nováček, nemusíš mít obavy – dostaneš přiděleného mentora, který ti bude nápomocen a poskytovat technickou podporu. U nás můžeš růst společně s týmem zkušených vývojářů.</p><p class=""typography-body-large-text-regular mb-800""><strong>Zjisti, jestli je tahle pozice právě pro tebe a podpoř nás svými programovacími skilly! 🚀</strong></p><h2></h2><h2 class=""typography-heading-small-text"">Vaše úkoly budou zahrnovat především:</h2><ul class=""typography-body-large-text-regular""><li><strong>Tvorbu částí kódu webové aplikace</strong> - programování a vývoj specifických funkcionalit webové aplikace, která podporuje naše konstrukční procesy.</li><li><strong>Vývoj a údržba webové aplikace</strong> - aktivní zapojení do celého životního cyklu webové aplikace, od návrhu po implementaci a údržbu; práce s databázemi a optimalizace kódu.</li><li><strong>Návrh a implementace funkcionalit</strong> – úzká spolupráce s týmem na návrhu nových funkcí a jejich následné implementaci do webové aplikace.</li><li><strong>Transfer a optimalizace výpočtů z Excelu do webového prostředí</strong> - převod a optimalizace existujících výpočtů z Excelu do webové aplikace, aby byly snadno přístupné a použitelné.</li><li><strong>Testování a ladění aplikace</strong> - provádění důkladného testování a ladění webové aplikace, aby byla zajištěna její spolehlivost a bezchybnost.</li></ul><h2 class=""typography-heading-small-text"">Požadujeme:</h2><ul class=""typography-body-large-text-regular""><li>Důležitá je pro nás alespoň základní znalost programování v <strong>Pythonu</strong>, znalost <strong>Django</strong> výhodou!</li><li>Uvítáme znalost <strong>HTML, CSS, JavaScript.</strong></li><li><strong>Vlastní zápal, nadšení a drive učit se nové věci a zdokonalovat se</strong> (dokážeme ocenit nové podněty a vlastní iniciativu, poskytujeme prostor pro následnou realizaci a týmový support v zádech)</li><li>Schopnost pracovat <strong>samostatně i v týmu</strong>.</li><li>Plynulou znalost <strong>psané i mluvené angličtiny</strong> pro každodenní komunikaci, většina programů pro práci jsou také v angličtině.</li></ul><h2 class=""typography-heading-small-text"">Nabízíme:</h2><ul class=""typography-body-large-text-regular""><li><strong>Osobní rozvoj a profesní růst</strong> – vážíme si šikovných kolegů/kolegyň a hledáme příležitosti k individuálnímu růstu, který podporujeme formou dalšího vzdělávání</li><li><strong>Zajímavou a pestrou práci</strong>, možnost účasti na mezinárodních projektech</li><li><strong>Přátelské a podporující pracovní prostředí</strong> – na pracovišti v Brně máme tým vývojářů a primárně nadšenců pod vedením Tomáše Potměšila.</li><li><strong>Bonusy</strong> nad rámec základní mzdy ve formě čtvrtletních a ročních odměn</li><li>Zázemí silné <strong>nadnárodní společnosti IMI</strong></li><li><strong>Flexibilní</strong> pracovní dobu, možnost pravidelných <strong>home office</strong>.</li><li><strong>Příjemné bonusy </strong>- dotované stravování na pracovišti, ovoce nebo zmrzlina k obědu zdarma, příspěvky na volnočasové aktivity, Multisportku a třeba i sportovní den pro zaměstnance, pravidelný teambuilding, turnaje ve squashi, bowlingu či badmintonu.</li><li>Kanceláře máme v <strong>CTPark Brno South</strong>, parkovací místo před okny nebo zastřešená kolárna.</li></ul><p class=""typography-body-large-text-regular mb-800"">Připojíte se k Tomášovi a jeho týmu vývojářů?</p><p class=""typography-body-large-text-regular mb-800"">Pokud vás tato výzva zaujala, zašlete nám své CV a budeme se těšit na osobní setkání u nás v IMI CCI Brno!</p></div>"
Junior Data Scientist - media & advertising,"Omnicom Media Group, s.r.o.",https://www.jobs.cz/rpd/2000557202/,False,2025-04-11 00:00:00,,cs,,,jobscz#2000557202,,,,,,,,,,Praha,Praha,,,,,,,,,,,,,,,,,,,Praha,Praha,,,,,,,,,,,,,,,,,,,fulltime,,,,,,,,,,"<div data-jobad=""body"" data-test=""jd-body-richtext"" class=""RichContent mb-1400""><p class=""typography-body-medium-text-regular text-secondary mb-600"">Pracovní nabídka</p><p class=""typography-body-large-text-regular mb-800"">Do našeho týmu hledáme dalšího nadšence, který nám pomůže se stále větším počtem projektů. Člověka, který si rád hraje s daty a zajímá ho mediální chování populace. A který se rád směje a nevadí mu tykání. Protože u nás si na nic nehrajeme.</p><h2 class=""typography-heading-small-text"">Co u nás budeš dělat?</h2><ul class=""typography-body-large-text-regular""><li>Připravovat analýzy a vyhodnocovat dopad reklamních aktivit v různých odvětvích a produktových kategoriích na základě obsáhlých mediálních dat</li><li>Používat nástroje jako R, Shiny a Python pro zpracování dat, vytvářet bayesovské ekonometrické modely a vizualizovat jejich výsledky</li><li>Spolupracovat na vývoji inovativních nástrojů podporujících plánování a řízení mediálních kampaní klientů</li><li>Zdokonalovat svoje prezentační a komunikační dovednosti i znalost různých analytických metod</li></ul><h2 class=""typography-heading-small-text"">Co bys měl/a umět a znát?</h2><ul class=""typography-body-large-text-regular""><li>Analyticky myslet a logicky uvažovat, hledat a nacházet souvislosti v datech a umět je vhodným způsobem interpretovat</li><li>Programovat v jazyce R a/nebo Python</li><li>Mít zkušenosti se základními ekonometrickými metodami, predikcemi časových řad, případně s pokročilými datovými vizualizacemi</li><li>Rozumět, a hlavně psát anglicky (komunikace především písemnou formou)</li><li>Znalost principů bayesovské statistiky je určitě výhodou, ale taky oceníme, pokud máš zkušenosti s Google Analytics nebo BI řešeními (Tableau, QlikView, QlikSense, Power BI)</li><li>VŠ (nebo SŠ s min. dvouletou praxí)</li></ul><h2 class=""typography-heading-small-text"">Co za to?</h2><p class=""typography-body-large-text-regular mb-800"">Žádná nuda a rutina. Budeš se podílet na zcela unikátních projektech pro velké domácí klienty (Škoda Auto, KFC, KB, Mall CZ, Rohlik, Calzedonia, TV Prima, …), nebo spolupracovat s kolegy z Londýna.</p><p class=""typography-body-large-text-regular mb-800"">Hezké a neformální kanceláře, do které to budeš mít z metra jenom minutu. Čekají na tebe každý den vychlazené džusy, nealko pivo a čerstvé ovoce.</p><p class=""typography-body-large-text-regular mb-800"">Dva týdny celoagenturního volna navíc nad rámec klasické dovolené – takže když státní svátek připadá na čtvrtek, zůstáváme všichni doma i v pátek a užíváme si prodloužený víkend. Také můžeš pracovat částečně z Home Office.</p><p class=""typography-body-large-text-regular mb-800"">Taky se vzděláváme, jezdíme na teambuildingy, platíme soukromé hovory, o notebooku nemluvě. Občas společně posnídáme nebo oslavíme narozeniny. Pro lepší představu o našem firemním životě se podívej na náš Instagramový nebo LinkedIn profil (OMG Research, Omnicom Media Group Czech), nejvíce fotek a dalších informací pak najdeš na www.welcometothejungle.com/cs (Omnicom Media Group) a na Atmoskopu.</p><p class=""typography-body-large-text-regular mb-800""><br> Líbíme se ti? Ozvi se nám prostřednictvím tohoto portálu a přilož CV/odkaz na LinkedIn.</p></div>"
Technický poradce SW,"MEDIAN, s.r.o.",https://www.jobs.cz/rpd/2000545614/,False,2025-04-11 00:00:00,,cs,,,jobscz#2000545614,,,,,,,,,,Praha,,,,,,,,,,,,,,,,,,,,Praha,,,,,,,,,,,,,,,,,,,,fulltime,parttime,,,,,,,,,"<div data-jobad=""body"" data-test=""jd-body-richtext"" class=""RichContent mb-1400""><p class=""typography-body-medium-text-regular text-secondary mb-600"">Pracovní nabídka</p><p class=""typography-body-large-text-regular mb-800"">Do svého týmu klientské podpory, pro unikátní softwary, analýzu dat a plánování, hledáme komunikativního kolegu/kolegyni na pozici:</p><h2 class=""typography-heading-small-text"">Technický poradce SW</h2><p class=""typography-body-large-text-regular mb-800"">Jsi otevřený(á) a rád(a) komunikuješ s druhými? Přicházíš záhadám na kloub a nevyřešené Tě nenechává v klidu? Umíš druhým věci vysvětlit a pomoci jim s problémem? Pokud ano, pak neváhej a přidej se k nám…</p><p class=""typography-body-large-text-regular mb-800""><strong>Tvou pracovní náplní bude:</strong></p><ul class=""typography-body-large-text-regular""><li>komunikace s klienty (a to jak osobně, tak i formou vzdálené podpory)</li><li>řešení technických problémů se SW a službami k němu přidružené</li><li>správa a zajištění plynulého chodu podpory</li><li>testování vyvíjeného software</li><li>zabezpečení telefonické podpory klientů</li><li>v budoucnu školení klientů</li></ul><p class=""typography-body-large-text-regular mb-800""><strong>Co od Tebe očekáváme:</strong></p><ul class=""typography-body-large-text-regular""><li>ochotu se stále učit</li><li>spolehlivost</li><li>dobrou znalost Windows a MS Office</li><li>analytické a logické myšlení</li><li>základy programování (BAT, SQL, PHP, HTML) výhodou</li><li>znalost administrace Windows server výhodou</li><li>znalost práce na SW a HW supportu výhodou</li><li>min. SŠ vzdělání</li></ul><p class=""typography-body-large-text-regular mb-800""><strong>Nabízíme Ti:</strong></p><ul class=""typography-body-large-text-regular""><li>práci v přední české agentuře pro výzkum trhu a vývoj software s dlouholetou tradicí a respektem na trhu</li><li>prostor pro vlastní kreativitu při návrhu řešení a možnost ovlivnění dalšího vývoje produktu</li><li>být součástí unikátního mezinárodního projektu</li><li>možnost dlouhodobě se podílet na rozvoji našich projektů</li><li>pružnou pracovní dobu (výhledově možnost částečné práce z domova)</li><li>příjemné, neformální prostředí a přátelský kolektiv</li><li>další zaměstnanecké benefity jako například stravenky, multisport karta, podporu odborného a jazykového vzdělávání, 3 dny sick days v průběhu roku, po 2 letech ve firmě další týden volna navíc, firemní akce, firemní mobilní tarif, možnost využití zdarma objektu v jižních Čechách, Bratislavě k rekreaci atd.</li></ul><p class=""typography-body-large-text-regular mb-800"">Nebudeme-li Vás kontaktovat do tří týdnů od přijetí Vašeho životopisu, byla v prvním kole výběrového řízení dána přednost jinému kandidátovi.</p></div>"
Angular Developer no-code platformy Tabidoo,Tabidoo s.r.o.,https://www.jobs.cz/rpd/2000551822/,False,2025-04-11 00:00:00,,cs,,,jobscz#2000551822,,,,,,,,,,Praha,Praha,,,,,,,,,,,,,,,,,,,Praha,Praha,,,,,,,,,,,,,,,,,,,fulltime,,,,,,,,,,"<div data-jobad=""body"" data-test=""jd-body-richtext"" class=""RichContent mb-1400""><p class=""typography-body-medium-text-regular text-secondary mb-600"">Pracovní nabídka</p><p class=""typography-body-large-text-regular mb-800"">Jsme Tabidoo - inovativní a rychle se rozvíjející startup v oblasti SaaSových služeb. Jsme parta nadšenců, která zákazníkům přináší skvělou a jednoduchou aplikaci se širokým spektrem využití. Uživatelé si díky ní mohou vytvořit libovolný evidenční software bez dalších programátorských zásahů. Naši službu chceme neustále posunovat technologicky vpřed a proto nyní potřebujeme tebe, aby sis vzal/-a na starost vývoj dalších funkcionalit naší no-code platformy.</p><p class=""typography-body-large-text-regular mb-800"">Hledáme nového člena/-ku do našeho týmu na pozici Angular Developer.</p><p class=""typography-body-large-text-regular mb-800""><strong>Co bude náplní tvé práce: </strong></p><ul class=""typography-body-large-text-regular""><li>vyvíjet nové a zlepšovat stávající funkcionality no-code modulární webové aplikace,</li><li>spolupracovat s backend vývojáři na integraci REST API,</li><li>psát unit a e2e testy pro zajištění kvality kódu,</li><li>podílet se na návrhu architektury a designu aplikace,</li><li>pracovat v agilním týmu a aktivně přispívat k rozvoji produktu,</li><li>pomáhat zákazníkům se skriptováním.</li></ul><p class=""typography-body-large-text-regular mb-800""><strong>Hledáme zrovna tebe, pokud: </strong></p><ul class=""typography-body-large-text-regular""><li>máš za sebou už několik Angular projektů,</li><li>rád/-a se učíš nové věci a chceš se neustále posouvat dál,</li><li>jsi parťák/-čka, na kterého/-ou se mohou kolegové spolehnout,</li><li>kvalita kódu je pro tebe životní nutností,</li><li>jsi zvyklý/-á pracovat v týmu a společně nalézat funkční řešení.</li></ul><p class=""typography-body-large-text-regular mb-800""><strong>Vůbec nás neurazí, když:</strong></p><ul class=""typography-body-large-text-regular""><li>máš zkušenosti s cloudovými technologiemi (AWS, Azure, GCP),</li><li>nebojíš se podívat i na backend,</li><li>domluvíš se anglicky.</li></ul><p class=""typography-body-large-text-regular mb-800""><strong>Na co se u nás můžeš těšit:</strong></p><ul class=""typography-body-large-text-regular""><li>vyvíjíme vlastní produkt. Nebudou ti tak šlapat na paty přísné deadliny zákazníků. Do produkce tak budeš předávat funkcionality až ve chvíli, kdy si za nimi můžeš opravdu stát.</li><li>Pracujeme s moderními technologiemi (K8s, Angular, Node.js, Cypress, MongoDB, RabbitMQ, C#, ),</li><li>máme technicky i uživatelsky zajímavý produkt, na který můžeš být hrdý/-á,</li><li>práci v moderním startupu s neformální firemní kulturou a přátelskými vztahy,</li><li>otevřený prostor pro tvůj rozvoj a zdokonalování se v oblasti technologií,</li><li>příjemné pracovní prostředí - pracujeme v krásných nových prostorách v karlínském Fóru,</li><li>pondělní snídaně a neomezený přísun kofeinu po celý zbytek týdne,</li><li>po zaučení možnost home-office</li><li>50% příspěvek na Multisport kartu, abychom podpořili tvou aktivní regeneraci</li><li>5 dní dovolené navíc po odpracovaném roce, protože si vážíme dlouhodobé spolupráce</li></ul><p class=""typography-body-large-text-regular mb-800"">Více o nás a našem produktu se můžeš dozvědět zde. Na této pozici budeš spolupracovat s Michalem (https://cz.linkedin.com/in/cumpelik), který ti bude potřebnou oporou.</p><p class=""typography-body-large-text-regular mb-800""><br>Těšíme se na tebe!</p></div>"
