title,company_name,url,remote,first_seen_at,last_seen_at,lang,juniority_score,source,external_ids_0,external_ids_1,external_ids_2,external_ids_3,external_ids_4,external_ids_5,external_ids_6,external_ids_7,external_ids_8,external_ids_9,locations_0_name,locations_1_name,locations_2_name,locations_3_name,locations_4_name,locations_5_name,locations_6_name,locations_7_name,locations_8_name,locations_9_name,locations_10_name,locations_11_name,locations_12_name,locations_13_name,locations_14_name,locations_15_name,locations_16_name,locations_17_name,locations_18_name,locations_19_name,locations_0_region,locations_1_region,locations_2_region,locations_3_region,locations_4_region,locations_5_region,locations_6_region,locations_7_region,locations_8_region,locations_9_region,locations_10_region,locations_11_region,locations_12_region,locations_13_region,locations_14_region,locations_15_region,locations_16_region,locations_17_region,locations_18_region,locations_19_region,employment_types_0,employment_types_1,employment_types_2,employment_types_3,employment_types_4,employment_types_5,employment_types_6,employment_types_7,employment_types_8,employment_types_9,description_html
IT Consultant - Junior/Senior,AIMTEC a.s.,https://www.jobs.cz/rpd/2001069503/?utm_source=juniorguru,False,2026-03-20 00:00:00,,cs,,,jobscz#2001069503,,,,,,,,,,Plzeň,Plzeň,,,,,,,,,,,,,,,,,,,Plzeň,Plzeň,,,,,,,,,,,,,,,,,,,fulltime,parttime,,,,,,,,,"<div data-jobad=""body"" data-test=""jd-body-richtext"" class=""RichContent mb-1400""><p class=""typography-body-medium-text-regular text-secondary mb-600"">Pracovní nabídka</p><h2 class=""typography-heading-small-text"">Máte zkušenosti s IT systémy, procesy, technickými řešeními, nebo je to zkrátka jen oblast, která vás láká? Baví vás hledat souvislosti, navrhovat zlepšení a komunikovat? U nás se můžete podílet na projektech v oblasti automatizace, digitalizace a inovací v prostředí moderního průmyslu.</h2><h2 class=""typography-heading-small-text"">V Aimtecu pomáháme firmám zefektivňovat jejich procesy od výroby a logistiky až po komunikaci mezi systémy a partnery. Realizujeme projekty pro významné zákazníky po celém světě zejména ve výrobních firmách. Využíváme vlastní informační systém Aimtec DCIx i další moderní technologie, díky kterým propojujeme data, procesy a lidi.</h2><h2></h2><h2 class=""typography-heading-small-text""><strong>Hledáme právě vás, pokud</strong>…</h2><ul class=""typography-body-large-text-regular""><li>Máte vzdělání technického směru nebo relevantní zkušenosti v oblasti IT - ať už jste na začátku kariéry, nebo za sebou máte roky praxe, zkusíme najít roli přímo pro vás.</li><li>Umíte naslouchat druhým, porozumět procesům v širších souvislostech a hledat cesty, jak je zlepšovat.</li><li>Domluvíte se anglicky, a to jak v písemné, tak i mluvené formě.</li><li>Není vám cizí práce s databázemi, případně rovnou ovládáte SQL.</li><li>Chcete se dále profesně rozvíjet a postupně přebírat odpovědnost odpovídající svým zkušenostem.</li></ul><h2 class=""typography-heading-small-text""><strong>Jste takoví? Nebo si to o sobě myslíte. Prima. Ozvěte se nám, a když to vyjde…</strong></h2><ul class=""typography-body-large-text-regular""><li>Využijete své znalosti a budete mít možnost se vzdělávat i nadále. Rozvíjet se budete ve znalostech trendů Průmyslu 4.0 i ve vedení projektů. Vaše práce vás tak bude bavit i po letech.</li><li>Stanete se uznávaným expertem v oblasti digitalizace.</li><li>Využijete jazykové znalosti.</li><li>Budete součástí přátelského týmu. Dostanete maximální podporu, vybavení a zázemí, abyste se mohli soustředit na svoji expertizu. Jsme férová firma a fair play očekáváme i od vás.</li></ul><h2></h2><h2 class=""typography-heading-small-text""><strong>Dobrou práci umíme ocenit</strong></h2><p class=""typography-body-large-text-regular mb-800"">Svých lidí si vážíme a i na mzdě je to vidět. Proč nenapíšeme rovnou částku? O přesné výši mzdy se budeme bavit velice konkrétně, ale až osobně. Odměna za výkon, zkušenosti, samostatnost nebo přístup se liší člověk od člověka. I benefity si určíte tak trochu sami. Prostě se pobavíme o tom, co je pro Vás důležité.</p><p class=""typography-body-large-text-regular mb-800"">Zajímá vás více? Ozvěte se mi! Pokud nemáte zpracovaný životopis, stačí poslat odkaz na LinkedIn. Ráda s vámi následně proberu veškeré podrobnosti.</p><p class=""typography-body-large-text-regular mb-800"">www.kariera.aimtecglobal.com/it-konzultant-logistika/</p><p class=""typography-body-large-text-regular mb-800"">www.kariera.aimtecglobal.com/konzultant-int/</p><p class=""typography-body-large-text-regular mb-800"">www.aimtecglobal.com</p></div>"
Data Analyst,Heimstaden s.r.o.,https://www.jobs.cz/rpd/2001109646/?utm_source=juniorguru,False,2026-03-20 00:00:00,,cs,,,jobscz#2001109646,,,,,,,,,,Ostrava,Ostrava,,,,,,,,,,,,,,,,,,,Ostrava,Ostrava,,,,,,,,,,,,,,,,,,,fulltime,,,,,,,,,,"<div data-jobad=""body"" data-test=""jd-body-richtext"" class=""RichContent mb-1400""><p class=""typography-body-medium-text-regular text-secondary mb-600"">Pracovní nabídka</p><p class=""typography-body-large-text-regular mb-800"">Do našeho týmu hledáme analyticky smýšlejícího kolegu nebo kolegyni na pozici <strong>Data Analyst</strong>, který/á nám pomůže proměňovat komplexní data v srozumitelné a využitelné informace. Na této pozici budete pracovat s různorodými daty a podílet se na analýzách a reportingu, které podporují rozhodování napříč organizací. Pozice je vhodná i pro absolventy nebo kandidáty na začátku kariéry, kteří chtějí rozvíjet své analytické schopnosti v dynamickém prostředí.</p><h2 class=""typography-heading-small-text"">Co Vás na pozici čeká:</h2><ul class=""typography-body-large-text-regular""><li>Analýza různorodých dat s cílem identifikovat trendy, neefektivity a příležitosti ke zlepšení procesů</li><li>Podpora analýz výkonnosti portfolia a dalších business oblastí</li><li>Tvorba a správa reportů, dashboardů a datových přehledů v BI nástrojích</li><li>Práce s většími datovými soubory v Excelu a analytických nástrojích (např. Python nebo BI software)</li><li>Spolupráce na projektech napříč odděleními zaměřených na zefektivnění procesů</li><li>Propojování a interpretace dat z různých zdrojů a jejich převod do přehledných výstupů pro management</li><li>Kontrola kvality dat a podpora zlepšování procesů sběru a reportingu dat</li><li>Příprava ad-hoc analýz a podkladů pro rozhodování managementu</li></ul><h2 class=""typography-heading-small-text"">Co od Vás požadujeme:</h2><ul class=""typography-body-large-text-regular""><li>Vysokoškolské vzdělání v oboru ekonomie, finance, datová analýza, business analytika nebo podobném oboru (pozice je vhodná i pro čerstvé absolventy)</li><li>Pokročilou znalost MS Excel</li><li>Pokročilou znalost SQL pro práci s daty a jejich analýzu</li><li>Zkušenost s Pythonem nebo BI nástrojem (např. Power BI, Tableau nebo jiný)</li><li>Angličtinu minimálně na úrovni B2, plynulou češtinu/slovenštinu</li><li>Silné analytické myšlení a zájem pracovat s daty</li><li>Schopnost pracovat s komplexními daty a převádět je do srozumitelných výstupů</li><li>Dobré komunikační schopnosti a schopnost spolupracovat napříč týmy</li></ul><h2 class=""typography-heading-small-text"">Co Vám můžeme nabídnout:</h2><ul class=""typography-body-large-text-regular""><li>Práci v moderních kancelářích ve skandinávském stylu v centru Ostravy (pozice on-site s možností ad-hoc homeoffice)</li><li>Pružnou pracovní dobu (pevné jádro 9-14)</li><li>Týden dovolené nad rámec zákoníku práce (25 dní)</li><li>Roční výkonnostní odměnu</li><li>Elektronické stravenky</li><li>Cafeterie</li><li>Multisport karta za zvýhodněnou cenu</li><li>Množství týmových i celofiremních akcí, atd.</li></ul><p class=""typography-body-large-text-regular mb-800"">Pokud Vás baví práce s daty a chcete se podílet na projektech, které pomáhají zefektivňovat fungování firmy, zašlete nám prosím svůj životopis.</p></div>"
IT Specialist – for High-Performance Computing,"Ústav organické chemie a biochemie AV ČR, v. v. i.",https://www.jobs.cz/rpd/2001097332/?utm_source=juniorguru,False,2026-03-20 00:00:00,,en,,,jobscz#2001097332,,,,,,,,,,Praha,Praha,,,,,,,,,,,,,,,,,,,Praha,Praha,,,,,,,,,,,,,,,,,,,fulltime,,,,,,,,,,"<div data-jobad=""body"" data-test=""jd-body-richtext"" class=""RichContent mb-1400""><p class=""typography-body-medium-text-regular text-secondary mb-600"">Pracovní nabídka</p><p class=""typography-body-large-text-regular mb-800""><strong>IT Specialist – Cryogenic Electron Microscopy (cryo-EM) Core Facility</strong></p><p class=""typography-body-large-text-regular mb-800"">IOCB Prague is a world-leading scientific institution dedicated to chemical and biological research. We place a strong emphasis on translating basic research findings into practical applications.</p><p class=""typography-body-large-text-regular mb-800"">The Cryogenic Electron Microscopy (cryo-EM) Core Facility studies the 3D structure of proteins and their complexes. The team provides expertise in cryo-EM data collection and analysis. In collaboration with the High-Performance Computing group (HPCg), we offer an advanced environment for cryo-EM data processing on a local parallel computing cluster featuring approximately 400 CPU nodes, 90 GPU nodes, and 3 PB of storage space.</p><p class=""typography-body-large-text-regular mb-800"">The successful candidate will be a key member of the cryo-EM Core Facility, working closely with HPCg and the IOCB IT department (ITS). The primary responsibility is to deploy, configure, test, and maintain cryo-EM software on local hardware. In collaboration with HPCg and ITS, the candidate will help design deployment strategies, oversee software administration and monitoring, contribute to automated cryo-EM pipelines, maintain documentation, participate in operational meetings, provide usage statistics, and report on ongoing developments.</p><p class=""typography-body-large-text-regular mb-800"">This position offers a stimulating environment alongside top-tier research scientists, access to advanced computing hardware, and hands-on experience with HPC infrastructure. The successful candidate will have opportunities for professional development within the HPC ecosystem, all within a flexible and motivating workplace at a globally recognized research institution.</p><p class=""typography-body-large-text-regular mb-800""><strong>Responsibilities:</strong></p><ul class=""typography-body-large-text-regular""><li>Install, configure, test, and maintain software, with a focus on cryo-EM data analysis tools</li><li>Administer and monitor software systems to ensure optimal performance</li><li>Prepare, maintain, and update software documentation</li><li>Adapt the software environment to meet the evolving needs of scientific users</li><li>Continuously improve and optimize the cryo-EM software environment for research workflows</li></ul><p class=""typography-body-large-text-regular mb-800""><strong>Required:</strong></p><ul class=""typography-body-large-text-regular""><li>Advanced proficiency in Linux (current distribution: Rocky Linux 9)</li><li>Strong experience in software installation, including package managers, compiling from source, and applying minor patches</li><li>Familiarity with high-performance computing (HPC) infrastructures, including compilers, MPI, and HPC tools (training on our specific cluster will be provided)</li><li>Ability to maintain and support complex research software environments</li><li>Proficiency in scripting and programming, particularly Bash and Python</li><li>Excellent communication skills and ability to work effectively with end users</li><li>Fluency in technical English, both written and spoken</li></ul><p class=""typography-body-large-text-regular mb-800""><strong>Desirable:</strong></p><ul class=""typography-body-large-text-regular""><li>Experience with one or more of the following tools: Spack, EasyBuild, CMake, OpenMPI, Ansible, Nextflow</li><li>Experience providing support in scientific computing environments</li><li>Familiarity with infrastructure automation and monitoring tools (e.g., Ansible, Pika)</li><li>Methodical and detail-oriented approach, with a strong willingness to adapt, learn continuously, and drive innovation</li></ul><p class=""typography-body-large-text-regular mb-800""><strong>We Offer:</strong></p><ul class=""typography-body-large-text-regular""><li>Competitive salary and financial remuneration</li><li>Support for professional training and development</li><li>Five weeks of vacation plus four sick days per year</li><li>Comprehensive health insurance and full benefits package, including contributions to supplementary pension insurance and sports, culture, and leisure activities</li><li>Meal subsidies</li><li>Financial support for parents with young children</li></ul><p class=""typography-body-large-text-regular mb-800""><strong>Additional Information:</strong></p><ul class=""typography-body-large-text-regular""><li>Full-time position</li><li>Fixed-term contract for 1 year, with anticipated extension</li><li>Position available immediately</li></ul><p class=""typography-body-large-text-regular mb-800""><strong>Applications should include:</strong></p><ul class=""typography-body-large-text-regular""><li>Cover letter (max. one page) describing motivation, interests, and experience</li><li>Curriculum vitae</li><li>Contact information for at least two references</li></ul></div>"
PHP Developer - Internal Platforms,Daktela s.r.o.,https://www.jobs.cz/rpd/2001018497/?utm_source=juniorguru,False,2026-03-20 00:00:00,,cs,,,jobscz#2001018497,,,,,,,,,,Praha,Praha,,,,,,,,,,,,,,,,,,,Praha,Praha,,,,,,,,,,,,,,,,,,,fulltime,,,,,,,,,,"<div data-jobad=""body"" data-test=""jd-body-richtext"" class=""RichContent mb-1400""><p class=""typography-body-medium-text-regular text-secondary mb-600"">Pracovní nabídka</p><p class=""typography-body-large-text-regular mb-800"">V Daktele se přidáš k <strong>rychle rostoucí evropské SaaS společnosti</strong>, která inovuje a posouvá svět zákaznické péče. Budeš se podílet na budování jedné z předních CCaaS platforem, kterou využívá více než 1 600 zákazníků po celém světě k poskytování špičkové zákaznické podpory. Jak rosteme, vytváříme nové příležitosti pro talentované lidi, kteří se chtějí profesně posouvat a hledají výzvy.</p><h2 class=""typography-heading-small-text"">Proč Daktela?</h2><ul class=""typography-body-large-text-regular""><li>Úspěšná a neustále rostoucí globální společnost s množstvím příležitostí.</li><li>Skvělý a inovativní produkt.</li><li>Rychlé a agilní prostředí, ve kterém máš možnosti věci opravdu ovlivnit.</li><li>Spousta příležitostí k růstu.</li><li>Skvělá firemní kultura.</li><li>Férové ohodnocení, atraktivní balíček benefitů a firemní akce a aktivity.</li></ul><h2 class=""typography-heading-small-text"">Co budeš mít na starosti?</h2><p class=""typography-body-large-text-regular mb-800"">Aktuálně hledáme Moderního PHP vývojáře, který nám pomůže s rozvojem a údržbou informačního systému sloužícího celé firmě. Nehledáme superhrdinu, ale přemýšlivého člověka, který chce věci zjednodušovat, efektivně využívat AI a hledat cesty, jak ušetřit práci sobě i kolegům pomocí chytrých optimalizací.</p><p class=""typography-body-large-text-regular mb-800""><strong>Budeš:</strong></p><ul class=""typography-body-large-text-regular""><li>Nejen psát kódy, ale aktivně hledat cesty, jak věci zrychlit a zjedosušit.</li><li>Chytře využívat AI nástroje pro zrychlení vývoje, refactoring a generování testů (při zachování best-practices a bezpečnosti).</li><li>Vyvíjet interní nástroje a skripty, které zefektivňují firemní procesy - pokud vidíš, že někdo dělá něco zbytečně ručně, dostaneš prostor to zautomatizovat.</li><li>Vyvíjet a a udržovat informační systémy napsaného v CakePHP se silně využívaným moderními Symfony balíčky s frontendem v Bootstrapu.</li><li>Hledat úzké hrdla v procesech a proaktivně navrhovat technické řešení, která firmě ušetří čas nebo peníze.</li><li>Pracovat s Git v každodenním vývoji, code reviews a plánování sprintů.</li><li>Spolupracovat s ostatními týmy napříč firmou (Sales, Infra, Management).</li></ul><h2 class=""typography-heading-small-text"">Co by ti nemělo chybět?</h2><ul class=""typography-body-large-text-regular""><li>Ochota učit se, zodpovědnost a týmový přístup (dobrá nálada a iniciativa jsou nutností).</li><li>Nadšení pro AI-assisted development: Vnímáš AI jako „parťáka“, který ti uvolní ruce od rutiny, ale zároveň chápeš rizika a víš, že finální zodpovědnost za bezpečný a funkční kód máš ty (žádné bezhlavé kopírování).</li><li>Zkušenost s vývojem v PHP a s MVC frameworky (my používáme CakePHP se Symfony balíčky).</li><li>Znalost návrhových vzorů (Adapter, Composite, Mediator, Strategy atd.).</li><li>Dobrá znalost SQL a práce s databázemi.</li><li>Základní znalost prostředí Linuxu</li><li>Zkušenosti s REST API a XML</li><li>Zkušenosti s Gitem.</li><li>Zkušenost se statickou analýzou (PHPStan) - výhodou.</li><li>Angličtina na komunikativní úrovni (psaná i mluvená).</li><li>Čeština nebo slovenština na úrovni C2.</li><li>Pokud přecházíš z jiného jazyka (C#, Java, Ruby atd.), není to překážkou.</li></ul><h2 class=""typography-heading-small-text"">Co dělá tuto pozici zajímavou?</h2><ul class=""typography-body-large-text-regular""><li>Práci v přátelském a otevřeném týmu, kde se tvoje nápady opravdu počítají.</li><li>Svobodu při řešení úkolů – můžeš navrhovat, zkoušet nové přístupy a rozhodovat o technickém řešení.</li><li>Získáš praktické zkušenosti v moderním PHP ekosystému (CakePHP, MVC, Bootstrap) a prohloubíš si znalosti SQL, REST API a práce s XML.</li><li>Pracujeme s moderními nástroji, podporujeme kreativní využití Copilotu/GPT tam, kde to dává smysl.</li><li>Spolupráci napříč firmou – uvidíš, jak tvá práce ovlivňuje byznys a reálné procesy.</li></ul><h2 class=""typography-heading-small-text"">Co u nás získáš?</h2><ul class=""typography-body-large-text-regular""><li>Dvakrát ročně vyplácíme bonusy podle zisku společnosti</li><li>Nové moderní kanceláře v OC Flora</li><li>Hybridní pracovní prostředí (home office)</li><li>5 týdnů dovolené</li><li>Sick days, příspěvek na stravování a karta Multisport</li></ul></div>"
Junior C++ Developer,MEDKONSULT medical technology s.r.o.,https://www.jobs.cz/rpd/2001082660/?utm_source=juniorguru,False,2026-03-20 00:00:00,,cs,,,jobscz#2001082660,,,,,,,,,,Olomouc,Olomouc,,,,,,,,,,,,,,,,,,,Olomouc,Olomouc,,,,,,,,,,,,,,,,,,,fulltime,,,,,,,,,,"<div data-jobad=""body"" data-test=""jd-body-richtext"" class=""RichContent mb-1400""><p class=""typography-body-medium-text-regular text-secondary mb-600"">Pracovní nabídka</p><p class=""typography-body-large-text-regular mb-800""><strong>Junior C++ Developer</strong></p><p class=""typography-body-large-text-regular mb-800"">Lékařské přístroje · Olomouc · full-time</p><p class=""typography-body-large-text-regular mb-800""><strong>Kód, který je vidět ve skutečném světě</strong></p><p class=""typography-body-large-text-regular mb-800"">Možná tě nenapadlo, že C++ a lékařský přístroj mají tolik společného s tím, co tě baví.</p><p class=""typography-body-large-text-regular mb-800"">Naše aplikace je technologicky velmi všestranná. Pracujeme s backendovými i frontendovými částmi systému, s grafickou akcelerací, kterou můžeš znát z vývoje her ve 2D prostředí, s databázemi, věnujeme se více vláknovému programování, nebo programujeme přímo hardware či pracujeme s nízko-úrovňovou komunikací. Každý u nás najde to, co ho nejvíce baví.</p><p class=""typography-body-large-text-regular mb-800""><strong>Co tě čeká</strong></p><p class=""typography-body-large-text-regular mb-800"">Od prvního dne budeš pracovat na reálném produktu — ne na cvičných úlohách. Budeš mít přiděleného mentora, zkušeného vývojáře, který ti pomůže zorientovat se a na koho se můžeš kdykoli obrátit. Chyby jsou součástí učení — nikdo za ně nehubuje, důležité je z nich těžit.</p><p class=""typography-body-large-text-regular mb-800""><strong>Konkrétně budeš</strong></p><ul class=""typography-body-large-text-regular""><li>Vyvíjet části desktopových aplikací pro lékařské přístroje v C++</li><li>Postupně se zapojovat do vývoje interaktivních prostředí, kde záleží na odezvě, plynulosti a uživatelském zážitku</li><li>Učit se pracovat s vícevláknovým programováním v reálném produktu</li><li>Spolupracovat s kolegy na návrhu a ladění SW modulů</li><li>Poznávat, jak kód komunikuje přímo s hardwarem — senzory, přístroje, embedded systémy</li></ul><p class=""typography-body-large-text-regular mb-800""><strong>Co potřebujeme</strong></p><p class=""typography-body-large-text-regular mb-800"">Nezajímá nás, jestli máš titul nebo roky praxe. Zajímá nás, jestli tě to baví a jestli máš chuť se učit. Konkrétně hledáme:</p><ul class=""typography-body-large-text-regular""><li>Základy C nebo C++ — stačí ze školy, kurzu nebo vlastních projektů</li><li>Chuť pochopit věci do hloubky, ne jen aby to nějak fungovalo</li><li>Zájem o to, jak věci fungují pod pokličkou — HW, systémy, výkon</li><li>Schopnost komunikovat a nebát se říct, když něčemu nerozumíš</li></ul><p class=""typography-body-large-text-regular mb-800""><strong>Co tě posune dopředu</strong></p><p class=""typography-body-large-text-regular mb-800"">Bonusy, které nás potěší — ale nejsou podmínkou:</p><ul class=""typography-body-large-text-regular""><li>Vlastní projekty v C++ — hra, utilita, robot, cokoli na čem sis to zkoušel</li><li>Zkušenost s prostředím kde záleží na výkonu a odezvě (hry, simulace, embedded, robotika…)</li><li>Základy SQL nebo práce s databázemi</li><li>Zájem o medicínu nebo HW systémy</li></ul><p class=""typography-body-large-text-regular mb-800""><strong>Co nabízíme</strong></p><ul class=""typography-body-large-text-regular""><li>Mentora od prvního dne — vývojáře, který tě provede onboardingem i dalším růstem</li><li>Reálnou práci s dopadem — kód, který pomáhá pacientům a lékařům, ne jen interní nástroje</li><li>Prostředí, kde se nebojíte ptát a kde chyba není průšvih, ale příležitost</li><li>Přátelský tým v Olomouci, kde nejsi číslo</li></ul><p class=""typography-body-large-text-regular mb-800""><strong>Jak se přihlásit</strong></p><p class=""typography-body-large-text-regular mb-800"">Pošli nám životopis a něco, cos naprogramoval — klidně školní projekt, rozdělanou hru, skript nebo odkaz na GitHub. Chceme vidět, jak přemýšlíš, ne dokonalý kód. Pokud ještě nic takového nemáš, napiš nám pár vět o tom, co tě na programování baví a kam chceš růst.</p></div>"
